[32m[I 2023-08-31 16:46:28,835][0m Trial 55 finished with value: 0.10063419544950444 and parameters: {'b': 1.25, 'fc': 1.6, 'scale_min': 0.8, 'scale_max': 22, 'n_scales': 135, 'drop': 0.6765369752110467, 'optimizer': 'Adam', 'lr': 0.0010563101235690111, 'weight_decay': 0.014879698892901744, 'batch_size': 32, 'epochs': 100}. Best is trial 33 with value: 0.05809502500168821.[0m
trial 55, loss train mean 0.07, score train mean 0.46, loss val mean 0.10, score val mean 0.38



End Time   : Do 31. Aug 16:46:31 CEST 2023
Duration   : 12962.967012406 seconds

Start Time : Do 31. Aug 16:46:36 CEST 2023
Job ID: 1152641
Node: cc1g07
Partition: gpu_normal_stud
CPU cores: 16
Memory: 98304
GPUs: 0
Python environment: khoa                  *  /home/phamanh/anaconda3/envs/khoa
Current work directory: /home/phamanh/Schreibtisch/bachelorarbeit/im_CNN

device: cuda


https://app.neptune.ai/ba-final/cwt-1/e/CWT1-370
Shutting down background jobs, please wait a moment...
Done!
Waiting for the remaining 7 operations to synchronize with Neptune. Do not kill this process.
All 7 operations synced, thanks for waiting!
Explore the metadata in the Neptune app:
https://app.neptune.ai/ba-final/cwt-1/e/CWT1-370/metadata
[32m[I 2023-08-31 18:36:27,559][0m Trial 56 pruned. [0m

End Time   : Do 31. Aug 18:36:32 CEST 2023
Duration   : 6595.626079480 seconds

Start Time : Fr 1. Sep 02:20:26 CEST 2023
Job ID: 1153630
Node: cc1g06
Partition: gpu_normal_stud
CPU cores: 16
Memory: 98304
GPUs: 0
Python environment: khoa                  *  /home/phamanh/anaconda3/envs/khoa
Current work directory: /home/phamanh/Schreibtisch/bachelorarbeit/im_CNN

device: cuda


https://app.neptune.ai/ba-final/cwt-1/e/CWT1-371
Split 0, loss train 0.08, score train 0.45, loss val 0.06 score val 0.54
Shutting down background jobs, please wait a moment...
Done!
Waiting for the remaining 10 operations to synchronize with Neptune. Do not kill this process.
All 10 operations synced, thanks for waiting!
Explore the metadata in the Neptune app:
https://app.neptune.ai/ba-final/cwt-1/e/CWT1-371/metadata
https://app.neptune.ai/ba-final/cwt-1/e/CWT1-372
Split 1, loss train 0.08, score train 0.42, loss val 0.10 score val 0.42
Shutting down background jobs, please wait a moment...
Done!
Waiting for the remaining 14 operations to synchronize with Neptune. Do not kill this process.
All 14 operations synced, thanks for waiting!
Explore the metadata in the Neptune app:
https://app.neptune.ai/ba-final/cwt-1/e/CWT1-372/metadata
https://app.neptune.ai/ba-final/cwt-1/e/CWT1-373
Split 2, loss train 0.09, score train 0.43, loss val 0.12 score val 0.35
Shutting down background jobs, please wait a moment...
Done!
Waiting for the remaining 10 operations to synchronize with Neptune. Do not kill this process.
All 10 operations synced, thanks for waiting!
Explore the metadata in the Neptune app:
https://app.neptune.ai/ba-final/cwt-1/e/CWT1-373/metadata
https://app.neptune.ai/ba-final/cwt-1/e/CWT1-374
Split 3, loss train 0.09, score train 0.42, loss val 0.14 score val 0.20
Shutting down background jobs, please wait a moment...
Done!
Waiting for the remaining 10 operations to synchronize with Neptune. Do not kill this process.
All 10 operations synced, thanks for waiting!
Explore the metadata in the Neptune app:
https://app.neptune.ai/ba-final/cwt-1/e/CWT1-374/metadata
https://app.neptune.ai/ba-final/cwt-1/e/CWT1-375
Split 4, loss train 0.09, score train 0.42, loss val 0.07 score val 0.52
Shutting down background jobs, please wait a moment...
Done!
Waiting for the remaining 10 operations to synchronize with Neptune. Do not kill this process.
All 10 operations synced, thanks for waiting!
Explore the metadata in the Neptune app:
https://app.neptune.ai/ba-final/cwt-1/e/CWT1-375/metadata
[32m[I 2023-09-01 05:39:01,244][0m Trial 57 finished with value: 0.09842891896024662 and parameters: {'b': 1.4500000000000002, 'fc': 1.2000000000000002, 'scale_min': 0.6, 'scale_max': 32, 'n_scales': 115, 'drop': 0.6765369752110467, 'optimizer': 'Adam', 'lr': 0.0012657487777411316, 'weight_decay': 0.025686032730785808, 'batch_size': 32, 'epochs': 100}. Best is trial 33 with value: 0.05809502500168821.[0m
trial 57, loss train mean 0.08, score train mean 0.43, loss val mean 0.10, score val mean 0.41



End Time   : Fr 1. Sep 05:39:03 CEST 2023
Duration   : 11917.072652096 seconds

Start Time : Fr 1. Sep 05:39:04 CEST 2023
Job ID: 1153631
Node: cc1g06
Partition: gpu_normal_stud
CPU cores: 16
Memory: 98304
GPUs: 0
Python environment: khoa                  *  /home/phamanh/anaconda3/envs/khoa
Current work directory: /home/phamanh/Schreibtisch/bachelorarbeit/im_CNN

device: cuda


https://app.neptune.ai/ba-final/cwt-1/e/CWT1-376
Shutting down background jobs, please wait a moment...
Done!
Waiting for the remaining 3 operations to synchronize with Neptune. Do not kill this process.
All 3 operations synced, thanks for waiting!
Explore the metadata in the Neptune app:
https://app.neptune.ai/ba-final/cwt-1/e/CWT1-376/metadata
[32m[I 2023-09-01 06:52:25,412][0m Trial 58 pruned. [0m

End Time   : Fr 1. Sep 06:52:29 CEST 2023
Duration   : 4404.511586854 seconds

Start Time : Fr 1. Sep 06:52:32 CEST 2023
Job ID: 1153632
Node: cc1g06
Partition: gpu_normal_stud
CPU cores: 16
Memory: 98304
GPUs: 0
Python environment: khoa                  *  /home/phamanh/anaconda3/envs/khoa
Current work directory: /home/phamanh/Schreibtisch/bachelorarbeit/im_CNN

device: cuda


https://app.neptune.ai/ba-final/cwt-1/e/CWT1-377
Split 0, loss train 0.06, score train 0.48, loss val 0.06 score val 0.46
Shutting down background jobs, please wait a moment...
Done!
Waiting for the remaining 14 operations to synchronize with Neptune. Do not kill this process.
All 14 operations synced, thanks for waiting!
Explore the metadata in the Neptune app:
https://app.neptune.ai/ba-final/cwt-1/e/CWT1-377/metadata
https://app.neptune.ai/ba-final/cwt-1/e/CWT1-378
Split 1, loss train 0.06, score train 0.47, loss val 0.13 score val 0.38
Shutting down background jobs, please wait a moment...
Done!
Waiting for the remaining 10 operations to synchronize with Neptune. Do not kill this process.
All 10 operations synced, thanks for waiting!
Explore the metadata in the Neptune app:
https://app.neptune.ai/ba-final/cwt-1/e/CWT1-378/metadata
https://app.neptune.ai/ba-final/cwt-1/e/CWT1-379
Split 2, loss train 0.07, score train 0.46, loss val 0.06 score val 0.49
Shutting down background jobs, please wait a moment...
Done!
Waiting for the remaining 10 operations to synchronize with Neptune. Do not kill this process.
All 10 operations synced, thanks for waiting!
Explore the metadata in the Neptune app:
https://app.neptune.ai/ba-final/cwt-1/e/CWT1-379/metadata
https://app.neptune.ai/ba-final/cwt-1/e/CWT1-380
Split 3, loss train 0.06, score train 0.47, loss val 0.10 score val 0.49
Shutting down background jobs, please wait a moment...
Done!
Waiting for the remaining 10 operations to synchronize with Neptune. Do not kill this process.
All 10 operations synced, thanks for waiting!
Explore the metadata in the Neptune app:
https://app.neptune.ai/ba-final/cwt-1/e/CWT1-380/metadata
https://app.neptune.ai/ba-final/cwt-1/e/CWT1-381
Split 4, loss train 0.06, score train 0.48, loss val 0.06 score val 0.57
Shutting down background jobs, please wait a moment...
Done!
Waiting for the remaining 10 operations to synchronize with Neptune. Do not kill this process.
All 10 operations synced, thanks for waiting!
Explore the metadata in the Neptune app:
https://app.neptune.ai/ba-final/cwt-1/e/CWT1-381/metadata
[32m[I 2023-09-01 10:19:12,391][0m Trial 59 finished with value: 0.08293452973061419 and parameters: {'b': 3.3, 'fc': 1.6, 'scale_min': 1.0, 'scale_max': 22, 'n_scales': 120, 'drop': 0.5988948131759668, 'optimizer': 'Adam', 'lr': 0.0007851150148131389, 'weight_decay': 0.009757410982149205, 'batch_size': 32, 'epochs': 100}. Best is trial 33 with value: 0.05809502500168821.[0m
trial 59, loss train mean 0.06, score train mean 0.47, loss val mean 0.08, score val mean 0.47



End Time   : Fr 1. Sep 10:19:14 CEST 2023
Duration   : 12401.925195518 seconds

Start Time : Fr 1. Sep 10:19:35 CEST 2023
Job ID: 1153633
Node: cc1g06
Partition: gpu_normal_stud
CPU cores: 16
Memory: 98304
GPUs: 0
Python environment: khoa                  *  /home/phamanh/anaconda3/envs/khoa
Current work directory: /home/phamanh/Schreibtisch/bachelorarbeit/im_CNN

device: cuda


https://app.neptune.ai/ba-final/cwt-1/e/CWT1-382
Split 0, loss train 0.07, score train 0.45, loss val 0.15 score val 0.18
Shutting down background jobs, please wait a moment...
Done!
Waiting for the remaining 10 operations to synchronize with Neptune. Do not kill this process.
All 10 operations synced, thanks for waiting!
Explore the metadata in the Neptune app:
https://app.neptune.ai/ba-final/cwt-1/e/CWT1-382/metadata
https://app.neptune.ai/ba-final/cwt-1/e/CWT1-383
Split 1, loss train 0.07, score train 0.45, loss val 0.23 score val 0.22
Shutting down background jobs, please wait a moment...
Done!
Waiting for the remaining 10 operations to synchronize with Neptune. Do not kill this process.
All 10 operations synced, thanks for waiting!
Explore the metadata in the Neptune app:
https://app.neptune.ai/ba-final/cwt-1/e/CWT1-383/metadata
https://app.neptune.ai/ba-final/cwt-1/e/CWT1-384
Split 2, loss train 0.08, score train 0.43, loss val 0.07 score val 0.44
Shutting down background jobs, please wait a moment...
Done!
Waiting for the remaining 10 operations to synchronize with Neptune. Do not kill this process.
All 10 operations synced, thanks for waiting!
Explore the metadata in the Neptune app:
https://app.neptune.ai/ba-final/cwt-1/e/CWT1-384/metadata
https://app.neptune.ai/ba-final/cwt-1/e/CWT1-385
Split 3, loss train 0.07, score train 0.44, loss val 0.06 score val 0.52
Shutting down background jobs, please wait a moment...
Done!
Waiting for the remaining 10 operations to synchronize with Neptune. Do not kill this process.
All 10 operations synced, thanks for waiting!
Explore the metadata in the Neptune app:
https://app.neptune.ai/ba-final/cwt-1/e/CWT1-385/metadata
https://app.neptune.ai/ba-final/cwt-1/e/CWT1-386
Split 4, loss train 0.08, score train 0.44, loss val 0.19 score val 0.33
Shutting down background jobs, please wait a moment...
Done!
Waiting for the remaining 14 operations to synchronize with Neptune. Do not kill this process.
All 14 operations synced, thanks for waiting!
Explore the metadata in the Neptune app:
https://app.neptune.ai/ba-final/cwt-1/e/CWT1-386/metadata
[32m[I 2023-09-01 14:01:08,902][0m Trial 60 finished with value: 0.13990161774006296 and parameters: {'b': 2.25, 'fc': 1.5, 'scale_min': 2.9000000000000004, 'scale_max': 26, 'n_scales': 135, 'drop': 0.7392485199426873, 'optimizer': 'Adam', 'lr': 0.0012657487777411316, 'weight_decay': 0.012655770413003446, 'batch_size': 32, 'epochs': 100}. Best is trial 33 with value: 0.05809502500168821.[0m
trial 60, loss train mean 0.07, score train mean 0.44, loss val mean 0.14, score val mean 0.34



End Time   : Fr 1. Sep 14:01:11 CEST 2023
Duration   : 13295.712448937 seconds

Start Time : Fr 1. Sep 14:01:15 CEST 2023
Job ID: 1153634
Node: cc1g06
Partition: gpu_normal_stud
CPU cores: 16
Memory: 98304
GPUs: 0
Python environment: khoa                  *  /home/phamanh/anaconda3/envs/khoa
Current work directory: /home/phamanh/Schreibtisch/bachelorarbeit/im_CNN

device: cuda


https://app.neptune.ai/ba-final/cwt-1/e/CWT1-387
Split 0, loss train 0.06, score train 0.48, loss val 0.05 score val 0.50
Shutting down background jobs, please wait a moment...
Done!
Waiting for the remaining 10 operations to synchronize with Neptune. Do not kill this process.
All 10 operations synced, thanks for waiting!
Explore the metadata in the Neptune app:
https://app.neptune.ai/ba-final/cwt-1/e/CWT1-387/metadata
https://app.neptune.ai/ba-final/cwt-1/e/CWT1-388
Split 1, loss train 0.07, score train 0.46, loss val 0.09 score val 0.43
Shutting down background jobs, please wait a moment...
Done!
Waiting for the remaining 10 operations to synchronize with Neptune. Do not kill this process.
All 10 operations synced, thanks for waiting!
Explore the metadata in the Neptune app:
https://app.neptune.ai/ba-final/cwt-1/e/CWT1-388/metadata
https://app.neptune.ai/ba-final/cwt-1/e/CWT1-389
Split 2, loss train 0.07, score train 0.46, loss val 0.09 score val 0.46
Shutting down background jobs, please wait a moment...
Done!
Waiting for the remaining 14 operations to synchronize with Neptune. Do not kill this process.
All 14 operations synced, thanks for waiting!
Explore the metadata in the Neptune app:
https://app.neptune.ai/ba-final/cwt-1/e/CWT1-389/metadata
https://app.neptune.ai/ba-final/cwt-1/e/CWT1-390
Split 3, loss train 0.07, score train 0.46, loss val 0.09 score val 0.52
Shutting down background jobs, please wait a moment...
Done!
Waiting for the remaining 10 operations to synchronize with Neptune. Do not kill this process.
All 10 operations synced, thanks for waiting!
Explore the metadata in the Neptune app:
https://app.neptune.ai/ba-final/cwt-1/e/CWT1-390/metadata
https://app.neptune.ai/ba-final/cwt-1/e/CWT1-391
Split 4, loss train 0.07, score train 0.48, loss val 0.09 score val 0.40
Shutting down background jobs, please wait a moment...
Done!
Waiting for the remaining 10 operations to synchronize with Neptune. Do not kill this process.
All 10 operations synced, thanks for waiting!
Explore the metadata in the Neptune app:
https://app.neptune.ai/ba-final/cwt-1/e/CWT1-391/metadata
[32m[I 2023-09-01 17:12:14,753][0m Trial 61 finished with value: 0.07953825301312385 and parameters: {'b': 1.8, 'fc': 2.1500000000000004, 'scale_min': 0.8, 'scale_max': 12, 'n_scales': 105, 'drop': 0.5188230305930881, 'optimizer': 'Adam', 'lr': 0.0006049728468671311, 'weight_decay': 0.019234221167688147, 'batch_size': 32, 'epochs': 100}. Best is trial 33 with value: 0.05809502500168821.[0m
trial 61, loss train mean 0.07, score train mean 0.47, loss val mean 0.08, score val mean 0.46



End Time   : Fr 1. Sep 17:12:16 CEST 2023
Duration   : 11461.268596232 seconds

Start Time : Fr 1. Sep 17:18:12 CEST 2023
Job ID: 1153635
Node: cc1g05
Partition: gpu_normal_stud
CPU cores: 16
Memory: 98304
GPUs: 0
Python environment: khoa                  *  /home/phamanh/anaconda3/envs/khoa
Current work directory: /home/phamanh/Schreibtisch/bachelorarbeit/im_CNN

device: cuda


https://app.neptune.ai/ba-final/cwt-1/e/CWT1-392
Shutting down background jobs, please wait a moment...
Done!
Waiting for the remaining 3 operations to synchronize with Neptune. Do not kill this process.
All 3 operations synced, thanks for waiting!
Explore the metadata in the Neptune app:
https://app.neptune.ai/ba-final/cwt-1/e/CWT1-392/metadata
[32m[I 2023-09-01 19:41:17,483][0m Trial 62 pruned. [0m

End Time   : Fr 1. Sep 19:41:20 CEST 2023
Duration   : 8588.689355233 seconds

Start Time : Fr 1. Sep 19:41:25 CEST 2023
Job ID: 1153636
Node: cc1g05
Partition: gpu_normal_stud
CPU cores: 16
Memory: 98304
GPUs: 0
Python environment: khoa                  *  /home/phamanh/anaconda3/envs/khoa
Current work directory: /home/phamanh/Schreibtisch/bachelorarbeit/im_CNN

device: cuda


https://app.neptune.ai/ba-final/cwt-1/e/CWT1-393
Split 0, loss train 0.07, score train 0.46, loss val 0.10 score val 0.44
Shutting down background jobs, please wait a moment...
Done!
Waiting for the remaining 10 operations to synchronize with Neptune. Do not kill this process.
All 10 operations synced, thanks for waiting!
Explore the metadata in the Neptune app:
https://app.neptune.ai/ba-final/cwt-1/e/CWT1-393/metadata
https://app.neptune.ai/ba-final/cwt-1/e/CWT1-394
Split 1, loss train 0.07, score train 0.47, loss val 0.07 score val 0.52
Shutting down background jobs, please wait a moment...
Done!
Waiting for the remaining 14 operations to synchronize with Neptune. Do not kill this process.
All 14 operations synced, thanks for waiting!
Explore the metadata in the Neptune app:
https://app.neptune.ai/ba-final/cwt-1/e/CWT1-394/metadata
https://app.neptune.ai/ba-final/cwt-1/e/CWT1-395
Split 2, loss train 0.07, score train 0.45, loss val 0.07 score val 0.28
Shutting down background jobs, please wait a moment...
Done!
Waiting for the remaining 10 operations to synchronize with Neptune. Do not kill this process.
All 10 operations synced, thanks for waiting!
Explore the metadata in the Neptune app:
https://app.neptune.ai/ba-final/cwt-1/e/CWT1-395/metadata
https://app.neptune.ai/ba-final/cwt-1/e/CWT1-396
Split 3, loss train 0.07, score train 0.45, loss val 0.07 score val 0.49
Shutting down background jobs, please wait a moment...
Done!
Waiting for the remaining 14 operations to synchronize with Neptune. Do not kill this process.
All 14 operations synced, thanks for waiting!
Explore the metadata in the Neptune app:
https://app.neptune.ai/ba-final/cwt-1/e/CWT1-396/metadata
https://app.neptune.ai/ba-final/cwt-1/e/CWT1-397
Split 4, loss train 0.07, score train 0.46, loss val 0.07 score val 0.50
Shutting down background jobs, please wait a moment...
Done!
Waiting for the remaining 10 operations to synchronize with Neptune. Do not kill this process.
All 10 operations synced, thanks for waiting!
Explore the metadata in the Neptune app:
https://app.neptune.ai/ba-final/cwt-1/e/CWT1-397/metadata
[32m[I 2023-09-01 23:54:35,242][0m Trial 63 finished with value: 0.07648268050335824 and parameters: {'b': 3.0, 'fc': 2.25, 'scale_min': 1.4, 'scale_max': 18, 'n_scales': 235, 'drop': 0.793631464104538, 'optimizer': 'Adam', 'lr': 0.0010054187619853356, 'weight_decay': 0.008594127474011781, 'batch_size': 32, 'epochs': 100}. Best is trial 33 with value: 0.05809502500168821.[0m
trial 63, loss train mean 0.07, score train mean 0.46, loss val mean 0.08, score val mean 0.44



End Time   : Fr 1. Sep 23:54:36 CEST 2023
Duration   : 15191.659377129 seconds

Start Time : Sa 2. Sep 00:01:29 CEST 2023
Job ID: 1153637
Node: cc1g03
Partition: gpu_normal_stud
CPU cores: 16
Memory: 98304
GPUs: 0
Python environment: khoa                  *  /home/phamanh/anaconda3/envs/khoa
Current work directory: /home/phamanh/Schreibtisch/bachelorarbeit/im_CNN

device: cuda


https://app.neptune.ai/ba-final/cwt-1/e/CWT1-398
Shutting down background jobs, please wait a moment...
Done!
Waiting for the remaining 7 operations to synchronize with Neptune. Do not kill this process.
All 7 operations synced, thanks for waiting!
Explore the metadata in the Neptune app:
https://app.neptune.ai/ba-final/cwt-1/e/CWT1-398/metadata
[32m[I 2023-09-02 06:26:34,925][0m Trial 64 pruned. [0m

End Time   : Sa 2. Sep 06:26:38 CEST 2023
Duration   : 23109.442545027 seconds

Start Time : Sa 2. Sep 06:26:40 CEST 2023
Job ID: 1153638
Node: cc1g03
Partition: gpu_normal_stud
CPU cores: 16
Memory: 98304
GPUs: 0
Python environment: khoa                  *  /home/phamanh/anaconda3/envs/khoa
Current work directory: /home/phamanh/Schreibtisch/bachelorarbeit/im_CNN

device: cuda


https://app.neptune.ai/ba-final/cwt-1/e/CWT1-399
Split 0, loss train 0.06, score train 0.48, loss val 0.06 score val 0.49
Shutting down background jobs, please wait a moment...
Done!
Waiting for the remaining 10 operations to synchronize with Neptune. Do not kill this process.
All 10 operations synced, thanks for waiting!
Explore the metadata in the Neptune app:
https://app.neptune.ai/ba-final/cwt-1/e/CWT1-399/metadata
https://app.neptune.ai/ba-final/cwt-1/e/CWT1-400
Split 1, loss train 0.06, score train 0.48, loss val 0.10 score val 0.35
Shutting down background jobs, please wait a moment...
Done!
Waiting for the remaining 10 operations to synchronize with Neptune. Do not kill this process.
All 10 operations synced, thanks for waiting!
Explore the metadata in the Neptune app:
https://app.neptune.ai/ba-final/cwt-1/e/CWT1-400/metadata
https://app.neptune.ai/ba-final/cwt-1/e/CWT1-401
Split 2, loss train 0.06, score train 0.47, loss val 0.05 score val 0.56
Shutting down background jobs, please wait a moment...
Done!
Waiting for the remaining 14 operations to synchronize with Neptune. Do not kill this process.
All 14 operations synced, thanks for waiting!
Explore the metadata in the Neptune app:
https://app.neptune.ai/ba-final/cwt-1/e/CWT1-401/metadata
https://app.neptune.ai/ba-final/cwt-1/e/CWT1-402
Split 3, loss train 0.06, score train 0.47, loss val 0.10 score val 0.30
Shutting down background jobs, please wait a moment...
Done!
Waiting for the remaining 10 operations to synchronize with Neptune. Do not kill this process.
All 10 operations synced, thanks for waiting!
Explore the metadata in the Neptune app:
https://app.neptune.ai/ba-final/cwt-1/e/CWT1-402/metadata
https://app.neptune.ai/ba-final/cwt-1/e/CWT1-403
Split 4, loss train 0.06, score train 0.49, loss val 0.08 score val 0.24
Shutting down background jobs, please wait a moment...
Done!
Waiting for the remaining 10 operations to synchronize with Neptune. Do not kill this process.
All 10 operations synced, thanks for waiting!
Explore the metadata in the Neptune app:
https://app.neptune.ai/ba-final/cwt-1/e/CWT1-403/metadata
