[32m[I 2023-08-23 20:46:16,310][0m Trial 6 finished with value: 0.17573857205979368 and parameters: {'b': 3.1500000000000004, 'fc': 2.05, 'scale_min': 1.6, 'scale_max': 42, 'n_scales': 170, 'drop': 0.5241908601441085, 'optimizer': 'SGD', 'lr': 0.003077401349489438, 'weight_decay': 0.0005867534868260941, 'batch_size': 32, 'epochs': 100}. Best is trial 0 with value: 0.17573857205979368.[0m
trial 6, loss train mean 0.06, score train mean 0.50, loss val mean 0.18, score val mean 0.36



End Time   : Mi 23. Aug 20:46:17 CEST 2023
Duration   : 15447.366188740 seconds

Start Time : Mi 23. Aug 20:46:19 CEST 2023
Job ID: 1147290
Node: cc1g03
Partition: gpu_normal_stud
CPU cores: 16
Memory: 71680
GPUs: 0
Python environment: khoa                  *  /home/phamanh/anaconda3/envs/khoa
Current work directory: /home/phamanh/Schreibtisch/bachelorarbeit/im_CNN

device: cuda


https://app.neptune.ai/ba-final/cwt-1/e/CWT1-175
Split 0, loss train 0.06, score train 0.51, loss val 0.13 score val 0.30
Shutting down background jobs, please wait a moment...
Done!
Waiting for the remaining 10 operations to synchronize with Neptune. Do not kill this process.
All 10 operations synced, thanks for waiting!
Explore the metadata in the Neptune app:
https://app.neptune.ai/ba-final/cwt-1/e/CWT1-175/metadata
https://app.neptune.ai/ba-final/cwt-1/e/CWT1-176
Split 1, loss train 0.06, score train 0.51, loss val 0.21 score val 0.31
Shutting down background jobs, please wait a moment...
Done!
Waiting for the remaining 10 operations to synchronize with Neptune. Do not kill this process.
All 10 operations synced, thanks for waiting!
Explore the metadata in the Neptune app:
https://app.neptune.ai/ba-final/cwt-1/e/CWT1-176/metadata
https://app.neptune.ai/ba-final/cwt-1/e/CWT1-177
Split 2, loss train 0.06, score train 0.49, loss val 0.20 score val 0.43
Shutting down background jobs, please wait a moment...
Done!
Waiting for the remaining 14 operations to synchronize with Neptune. Do not kill this process.
All 14 operations synced, thanks for waiting!
Explore the metadata in the Neptune app:
https://app.neptune.ai/ba-final/cwt-1/e/CWT1-177/metadata
https://app.neptune.ai/ba-final/cwt-1/e/CWT1-178
Split 3, loss train 0.06, score train 0.49, loss val 0.15 score val 0.21
Shutting down background jobs, please wait a moment...
Done!
Waiting for the remaining 14 operations to synchronize with Neptune. Do not kill this process.
All 14 operations synced, thanks for waiting!
Explore the metadata in the Neptune app:
https://app.neptune.ai/ba-final/cwt-1/e/CWT1-178/metadata
https://app.neptune.ai/ba-final/cwt-1/e/CWT1-179
Split 4, loss train 0.06, score train 0.50, loss val 0.18 score val 0.56
Shutting down background jobs, please wait a moment...
Done!
Waiting for the remaining 10 operations to synchronize with Neptune. Do not kill this process.
All 10 operations synced, thanks for waiting!
Explore the metadata in the Neptune app:
https://app.neptune.ai/ba-final/cwt-1/e/CWT1-179/metadata
[32m[I 2023-08-24 01:25:45,694][0m Trial 7 finished with value: 0.17573857205979368 and parameters: {'b': 3.1500000000000004, 'fc': 2.05, 'scale_min': 1.6, 'scale_max': 42, 'n_scales': 170, 'drop': 0.5241908601441085, 'optimizer': 'SGD', 'lr': 0.003077401349489438, 'weight_decay': 0.0005867534868260941, 'batch_size': 32, 'epochs': 100}. Best is trial 0 with value: 0.17573857205979368.[0m
trial 7, loss train mean 0.06, score train mean 0.50, loss val mean 0.18, score val mean 0.36



End Time   : Do 24. Aug 01:25:47 CEST 2023
Duration   : 16768.328760340 seconds

Start Time : Do 24. Aug 01:25:49 CEST 2023
Job ID: 1147291
Node: cc1g03
Partition: gpu_normal_stud
CPU cores: 16
Memory: 71680
GPUs: 0
Python environment: khoa                  *  /home/phamanh/anaconda3/envs/khoa
Current work directory: /home/phamanh/Schreibtisch/bachelorarbeit/im_CNN

device: cuda


https://app.neptune.ai/ba-final/cwt-1/e/CWT1-180
Split 0, loss train 0.06, score train 0.51, loss val 0.13 score val 0.30
Shutting down background jobs, please wait a moment...
Done!
Waiting for the remaining 10 operations to synchronize with Neptune. Do not kill this process.
All 10 operations synced, thanks for waiting!
Explore the metadata in the Neptune app:
https://app.neptune.ai/ba-final/cwt-1/e/CWT1-180/metadata
https://app.neptune.ai/ba-final/cwt-1/e/CWT1-181
Split 1, loss train 0.06, score train 0.51, loss val 0.21 score val 0.31
Shutting down background jobs, please wait a moment...
Done!
Waiting for the remaining 10 operations to synchronize with Neptune. Do not kill this process.
All 10 operations synced, thanks for waiting!
Explore the metadata in the Neptune app:
https://app.neptune.ai/ba-final/cwt-1/e/CWT1-181/metadata
https://app.neptune.ai/ba-final/cwt-1/e/CWT1-182
Split 2, loss train 0.06, score train 0.49, loss val 0.20 score val 0.43
Shutting down background jobs, please wait a moment...
Done!
Waiting for the remaining 10 operations to synchronize with Neptune. Do not kill this process.
All 10 operations synced, thanks for waiting!
Explore the metadata in the Neptune app:
https://app.neptune.ai/ba-final/cwt-1/e/CWT1-182/metadata
https://app.neptune.ai/ba-final/cwt-1/e/CWT1-183
Split 3, loss train 0.06, score train 0.49, loss val 0.15 score val 0.21
Shutting down background jobs, please wait a moment...
Done!
Waiting for the remaining 10 operations to synchronize with Neptune. Do not kill this process.
All 10 operations synced, thanks for waiting!
Explore the metadata in the Neptune app:
https://app.neptune.ai/ba-final/cwt-1/e/CWT1-183/metadata
https://app.neptune.ai/ba-final/cwt-1/e/CWT1-184
Split 4, loss train 0.06, score train 0.50, loss val 0.18 score val 0.56
Shutting down background jobs, please wait a moment...
Done!
Waiting for the remaining 14 operations to synchronize with Neptune. Do not kill this process.
All 14 operations synced, thanks for waiting!
Explore the metadata in the Neptune app:
https://app.neptune.ai/ba-final/cwt-1/e/CWT1-184/metadata
[32m[I 2023-08-24 05:30:37,560][0m Trial 8 finished with value: 0.17573857205979368 and parameters: {'b': 3.1500000000000004, 'fc': 2.05, 'scale_min': 1.6, 'scale_max': 42, 'n_scales': 170, 'drop': 0.5241908601441085, 'optimizer': 'SGD', 'lr': 0.003077401349489438, 'weight_decay': 0.0005867534868260941, 'batch_size': 32, 'epochs': 100}. Best is trial 0 with value: 0.17573857205979368.[0m
trial 8, loss train mean 0.06, score train mean 0.50, loss val mean 0.18, score val mean 0.36



End Time   : Do 24. Aug 05:30:39 CEST 2023
Duration   : 14690.226751528 seconds

Start Time : Do 24. Aug 05:31:04 CEST 2023
Job ID: 1147292
Node: cc1g06
Partition: gpu_normal_stud
CPU cores: 16
Memory: 71680
GPUs: 0
Python environment: khoa                  *  /home/phamanh/anaconda3/envs/khoa
Current work directory: /home/phamanh/Schreibtisch/bachelorarbeit/im_CNN

device: cuda


https://app.neptune.ai/ba-final/cwt-1/e/CWT1-185
Split 0, loss train 0.06, score train 0.51, loss val 0.13 score val 0.30
Shutting down background jobs, please wait a moment...
Done!
Waiting for the remaining 10 operations to synchronize with Neptune. Do not kill this process.
All 10 operations synced, thanks for waiting!
Explore the metadata in the Neptune app:
https://app.neptune.ai/ba-final/cwt-1/e/CWT1-185/metadata
https://app.neptune.ai/ba-final/cwt-1/e/CWT1-186
Split 1, loss train 0.06, score train 0.51, loss val 0.21 score val 0.31
Shutting down background jobs, please wait a moment...
Done!
Waiting for the remaining 14 operations to synchronize with Neptune. Do not kill this process.
All 14 operations synced, thanks for waiting!
Explore the metadata in the Neptune app:
https://app.neptune.ai/ba-final/cwt-1/e/CWT1-186/metadata
https://app.neptune.ai/ba-final/cwt-1/e/CWT1-187
Split 2, loss train 0.06, score train 0.49, loss val 0.20 score val 0.43
Shutting down background jobs, please wait a moment...
Done!
Waiting for the remaining 10 operations to synchronize with Neptune. Do not kill this process.
All 10 operations synced, thanks for waiting!
Explore the metadata in the Neptune app:
https://app.neptune.ai/ba-final/cwt-1/e/CWT1-187/metadata
https://app.neptune.ai/ba-final/cwt-1/e/CWT1-188
Split 3, loss train 0.06, score train 0.49, loss val 0.15 score val 0.21
Shutting down background jobs, please wait a moment...
Done!
Waiting for the remaining 10 operations to synchronize with Neptune. Do not kill this process.
All 10 operations synced, thanks for waiting!
Explore the metadata in the Neptune app:
https://app.neptune.ai/ba-final/cwt-1/e/CWT1-188/metadata
https://app.neptune.ai/ba-final/cwt-1/e/CWT1-189
Split 4, loss train 0.06, score train 0.50, loss val 0.18 score val 0.56
Shutting down background jobs, please wait a moment...
Done!
Waiting for the remaining 10 operations to synchronize with Neptune. Do not kill this process.
All 10 operations synced, thanks for waiting!
Explore the metadata in the Neptune app:
https://app.neptune.ai/ba-final/cwt-1/e/CWT1-189/metadata
[32m[I 2023-08-24 09:41:46,633][0m Trial 9 finished with value: 0.17573857205979368 and parameters: {'b': 3.1500000000000004, 'fc': 2.05, 'scale_min': 1.6, 'scale_max': 42, 'n_scales': 170, 'drop': 0.5241908601441085, 'optimizer': 'SGD', 'lr': 0.003077401349489438, 'weight_decay': 0.0005867534868260941, 'batch_size': 32, 'epochs': 100}. Best is trial 0 with value: 0.17573857205979368.[0m
trial 9, loss train mean 0.06, score train mean 0.50, loss val mean 0.18, score val mean 0.36



End Time   : Do 24. Aug 09:41:48 CEST 2023
Duration   : 15044.416329973 seconds

Start Time : Do 24. Aug 09:45:04 CEST 2023
Job ID: 1148340
Node: cc1g02
Partition: gpu_normal_stud
CPU cores: 16
Memory: 71680
GPUs: 0
Python environment: khoa                  *  /home/phamanh/anaconda3/envs/khoa
Current work directory: /home/phamanh/Schreibtisch/bachelorarbeit/im_CNN

device: cuda


https://app.neptune.ai/ba-final/cwt-1/e/CWT1-190
Split 0, loss train 0.10, score train 0.39, loss val 1.82 score val 0.03
Shutting down background jobs, please wait a moment...
Done!
Waiting for the remaining 14 operations to synchronize with Neptune. Do not kill this process.
All 14 operations synced, thanks for waiting!
Explore the metadata in the Neptune app:
https://app.neptune.ai/ba-final/cwt-1/e/CWT1-190/metadata
https://app.neptune.ai/ba-final/cwt-1/e/CWT1-191
Split 1, loss train 0.10, score train 0.39, loss val 0.68 score val 0.06
Shutting down background jobs, please wait a moment...
Done!
Waiting for the remaining 10 operations to synchronize with Neptune. Do not kill this process.
All 10 operations synced, thanks for waiting!
Explore the metadata in the Neptune app:
https://app.neptune.ai/ba-final/cwt-1/e/CWT1-191/metadata
https://app.neptune.ai/ba-final/cwt-1/e/CWT1-192
Split 2, loss train 0.10, score train 0.37, loss val 0.49 score val 0.06
Shutting down background jobs, please wait a moment...
Done!
Waiting for the remaining 10 operations to synchronize with Neptune. Do not kill this process.
All 10 operations synced, thanks for waiting!
Explore the metadata in the Neptune app:
https://app.neptune.ai/ba-final/cwt-1/e/CWT1-192/metadata
https://app.neptune.ai/ba-final/cwt-1/e/CWT1-193
Split 3, loss train 0.10, score train 0.38, loss val 0.21 score val 0.17
Shutting down background jobs, please wait a moment...
Done!
Waiting for the remaining 14 operations to synchronize with Neptune. Do not kill this process.
All 14 operations synced, thanks for waiting!
Explore the metadata in the Neptune app:
https://app.neptune.ai/ba-final/cwt-1/e/CWT1-193/metadata
https://app.neptune.ai/ba-final/cwt-1/e/CWT1-194
Split 4, loss train 0.10, score train 0.39, loss val 0.18 score val 0.19
Shutting down background jobs, please wait a moment...
Done!
Waiting for the remaining 10 operations to synchronize with Neptune. Do not kill this process.
All 10 operations synced, thanks for waiting!
Explore the metadata in the Neptune app:
https://app.neptune.ai/ba-final/cwt-1/e/CWT1-194/metadata
[32m[I 2023-08-24 14:44:59,419][0m Trial 10 finished with value: 0.6762550394585791 and parameters: {'b': 4.55, 'fc': 0.75, 'scale_min': 3.6, 'scale_max': 18, 'n_scales': 260, 'drop': 0.20131820585891538, 'optimizer': 'Adam', 'lr': 0.030417347566973008, 'weight_decay': 3.5257921801498026e-05, 'batch_size': 32, 'epochs': 100}. Best is trial 0 with value: 0.17573857205979368.[0m
trial 10, loss train mean 0.10, score train mean 0.38, loss val mean 0.68, score val mean 0.10



End Time   : Do 24. Aug 14:45:01 CEST 2023
Duration   : 17996.936283659 seconds

Start Time : Do 24. Aug 14:45:09 CEST 2023
Job ID: 1148341
Node: cc1g02
Partition: gpu_normal_stud
CPU cores: 16
Memory: 71680
GPUs: 0
Python environment: khoa                  *  /home/phamanh/anaconda3/envs/khoa
Current work directory: /home/phamanh/Schreibtisch/bachelorarbeit/im_CNN

device: cuda


https://app.neptune.ai/ba-final/cwt-1/e/CWT1-195
Split 0, loss train 0.06, score train 0.48, loss val 0.07 score val 0.44
Shutting down background jobs, please wait a moment...
Done!
Waiting for the remaining 10 operations to synchronize with Neptune. Do not kill this process.
All 10 operations synced, thanks for waiting!
Explore the metadata in the Neptune app:
https://app.neptune.ai/ba-final/cwt-1/e/CWT1-195/metadata
https://app.neptune.ai/ba-final/cwt-1/e/CWT1-196
Split 1, loss train 0.07, score train 0.46, loss val 0.05 score val 0.53
Shutting down background jobs, please wait a moment...
Done!
Waiting for the remaining 14 operations to synchronize with Neptune. Do not kill this process.
All 14 operations synced, thanks for waiting!
Explore the metadata in the Neptune app:
https://app.neptune.ai/ba-final/cwt-1/e/CWT1-196/metadata
https://app.neptune.ai/ba-final/cwt-1/e/CWT1-197
Split 2, loss train 0.07, score train 0.46, loss val 0.08 score val 0.50
Shutting down background jobs, please wait a moment...
Done!
Waiting for the remaining 10 operations to synchronize with Neptune. Do not kill this process.
All 10 operations synced, thanks for waiting!
Explore the metadata in the Neptune app:
https://app.neptune.ai/ba-final/cwt-1/e/CWT1-197/metadata
https://app.neptune.ai/ba-final/cwt-1/e/CWT1-198
Split 3, loss train 0.07, score train 0.46, loss val 0.09 score val 0.27
Shutting down background jobs, please wait a moment...
Done!
Waiting for the remaining 10 operations to synchronize with Neptune. Do not kill this process.
All 10 operations synced, thanks for waiting!
Explore the metadata in the Neptune app:
https://app.neptune.ai/ba-final/cwt-1/e/CWT1-198/metadata
https://app.neptune.ai/ba-final/cwt-1/e/CWT1-199
Split 4, loss train 0.07, score train 0.46, loss val 0.05 score val 0.42
Shutting down background jobs, please wait a moment...
Done!
Waiting for the remaining 10 operations to synchronize with Neptune. Do not kill this process.
All 10 operations synced, thanks for waiting!
Explore the metadata in the Neptune app:
https://app.neptune.ai/ba-final/cwt-1/e/CWT1-199/metadata
[32m[I 2023-08-24 18:31:31,080][0m Trial 11 finished with value: 0.06880267021503854 and parameters: {'b': 1.8, 'fc': 1.4500000000000002, 'scale_min': 0.5, 'scale_max': 32, 'n_scales': 115, 'drop': 0.785857685591905, 'optimizer': 'Adam', 'lr': 0.0005353659970620736, 'weight_decay': 0.012306494595945499, 'batch_size': 32, 'epochs': 100}. Best is trial 11 with value: 0.06880267021503854.[0m
trial 11, loss train mean 0.07, score train mean 0.46, loss val mean 0.07, score val mean 0.43



End Time   : Do 24. Aug 18:31:33 CEST 2023
Duration   : 13584.566490658 seconds

Start Time : Do 24. Aug 18:31:35 CEST 2023
Job ID: 1148342
Node: cc1g02
Partition: gpu_normal_stud
CPU cores: 16
Memory: 71680
GPUs: 0
Python environment: khoa                  *  /home/phamanh/anaconda3/envs/khoa
Current work directory: /home/phamanh/Schreibtisch/bachelorarbeit/im_CNN

device: cuda


https://app.neptune.ai/ba-final/cwt-1/e/CWT1-200
Split 0, loss train 0.08, score train 0.45, loss val 0.07 score val 0.54
Shutting down background jobs, please wait a moment...
Done!
Waiting for the remaining 10 operations to synchronize with Neptune. Do not kill this process.
All 10 operations synced, thanks for waiting!
Explore the metadata in the Neptune app:
https://app.neptune.ai/ba-final/cwt-1/e/CWT1-200/metadata
https://app.neptune.ai/ba-final/cwt-1/e/CWT1-201
Split 1, loss train 0.08, score train 0.44, loss val 0.08 score val 0.45
Shutting down background jobs, please wait a moment...
Done!
Waiting for the remaining 10 operations to synchronize with Neptune. Do not kill this process.
All 10 operations synced, thanks for waiting!
Explore the metadata in the Neptune app:
https://app.neptune.ai/ba-final/cwt-1/e/CWT1-201/metadata
https://app.neptune.ai/ba-final/cwt-1/e/CWT1-202
Split 2, loss train 0.08, score train 0.43, loss val 0.07 score val 0.37
Shutting down background jobs, please wait a moment...
Done!
Waiting for the remaining 10 operations to synchronize with Neptune. Do not kill this process.
All 10 operations synced, thanks for waiting!
Explore the metadata in the Neptune app:
https://app.neptune.ai/ba-final/cwt-1/e/CWT1-202/metadata
https://app.neptune.ai/ba-final/cwt-1/e/CWT1-203
Split 3, loss train 0.08, score train 0.44, loss val 0.07 score val 0.42
Shutting down background jobs, please wait a moment...
Done!
Waiting for the remaining 10 operations to synchronize with Neptune. Do not kill this process.
All 10 operations synced, thanks for waiting!
Explore the metadata in the Neptune app:
https://app.neptune.ai/ba-final/cwt-1/e/CWT1-203/metadata
https://app.neptune.ai/ba-final/cwt-1/e/CWT1-204
Split 4, loss train 0.08, score train 0.45, loss val 0.05 score val 0.53
Shutting down background jobs, please wait a moment...
Done!
Waiting for the remaining 10 operations to synchronize with Neptune. Do not kill this process.
All 10 operations synced, thanks for waiting!
Explore the metadata in the Neptune app:
https://app.neptune.ai/ba-final/cwt-1/e/CWT1-204/metadata
[32m[I 2023-08-24 22:00:01,408][0m Trial 12 finished with value: 0.06865511853644188 and parameters: {'b': 1.3, 'fc': 1.4500000000000002, 'scale_min': 0.5, 'scale_max': 32, 'n_scales': 110, 'drop': 0.785857685591905, 'optimizer': 'Adam', 'lr': 0.0005115776583645488, 'weight_decay': 0.0434657268366915, 'batch_size': 32, 'epochs': 100}. Best is trial 12 with value: 0.06865511853644188.[0m
trial 12, loss train mean 0.08, score train mean 0.44, loss val mean 0.07, score val mean 0.46



End Time   : Do 24. Aug 22:00:03 CEST 2023
Duration   : 12508.785779663 seconds

Start Time : Do 24. Aug 22:00:05 CEST 2023
Job ID: 1148343
Node: cc1g02
Partition: gpu_normal_stud
CPU cores: 16
Memory: 71680
GPUs: 0
Python environment: khoa                  *  /home/phamanh/anaconda3/envs/khoa
Current work directory: /home/phamanh/Schreibtisch/bachelorarbeit/im_CNN

device: cuda


https://app.neptune.ai/ba-final/cwt-1/e/CWT1-205
Split 0, loss train 0.09, score train 0.43, loss val 0.10 score val 0.30
Shutting down background jobs, please wait a moment...
Done!
Waiting for the remaining 14 operations to synchronize with Neptune. Do not kill this process.
All 14 operations synced, thanks for waiting!
Explore the metadata in the Neptune app:
https://app.neptune.ai/ba-final/cwt-1/e/CWT1-205/metadata
https://app.neptune.ai/ba-final/cwt-1/e/CWT1-206
Split 1, loss train 0.09, score train 0.44, loss val 0.09 score val 0.49
Shutting down background jobs, please wait a moment...
Done!
Waiting for the remaining 14 operations to synchronize with Neptune. Do not kill this process.
All 14 operations synced, thanks for waiting!
Explore the metadata in the Neptune app:
https://app.neptune.ai/ba-final/cwt-1/e/CWT1-206/metadata
https://app.neptune.ai/ba-final/cwt-1/e/CWT1-207
Split 2, loss train 0.09, score train 0.41, loss val 0.09 score val 0.49
Shutting down background jobs, please wait a moment...
Done!
Waiting for the remaining 10 operations to synchronize with Neptune. Do not kill this process.
All 10 operations synced, thanks for waiting!
Explore the metadata in the Neptune app:
https://app.neptune.ai/ba-final/cwt-1/e/CWT1-207/metadata
https://app.neptune.ai/ba-final/cwt-1/e/CWT1-208
Split 3, loss train 0.09, score train 0.44, loss val 0.17 score val 0.21
Shutting down background jobs, please wait a moment...
Done!
Waiting for the remaining 10 operations to synchronize with Neptune. Do not kill this process.
All 10 operations synced, thanks for waiting!
Explore the metadata in the Neptune app:
https://app.neptune.ai/ba-final/cwt-1/e/CWT1-208/metadata
https://app.neptune.ai/ba-final/cwt-1/e/CWT1-209
Split 4, loss train 0.09, score train 0.44, loss val 0.10 score val 0.37
Shutting down background jobs, please wait a moment...
Done!
Waiting for the remaining 10 operations to synchronize with Neptune. Do not kill this process.
All 10 operations synced, thanks for waiting!
Explore the metadata in the Neptune app:
https://app.neptune.ai/ba-final/cwt-1/e/CWT1-209/metadata
