[32m[I 2023-09-10 11:00:17,851][0m Trial 101 finished with value: 0.0513936423240824 and parameters: {'b': 4.15, 'fc': 2.45, 'scale_min': 1.8, 'scale_max': 12, 'n_scales': 175, 'drop': 0.31996980966809396, 'optimizer': 'Adam', 'lr': 0.0006990136225640938, 'weight_decay': 0.0015717659165878292, 'batch_size': 32, 'epochs': 100}. Best is trial 85 with value: 0.04277383215883945.[0m
trial 101, loss train mean 0.05, score train mean 0.50, loss val mean 0.05, score val mean 0.54



End Time   : So 10. Sep 11:00:19 CEST 2023
Duration   : 12504.963039277 seconds

Start Time : So 10. Sep 11:00:21 CEST 2023
Job ID: 1158920
Node: cc1g04
Partition: gpu_normal_stud
CPU cores: 16
Memory: 98304
GPUs: 0
Python environment: khoa                  *  /home/phamanh/anaconda3/envs/khoa
Current work directory: /home/phamanh/Schreibtisch/bachelorarbeit/im_CNN

device: cuda


Study statistics: 
  Number of finished trials:  100
  Number of pruned trials:  20
  Number of complete trials:  80
  Value:  0.04277383215883945
  Params: 
    b: 2.05
    batch_size: 32
    drop: 0.3006541491680656
    epochs: 100
    fc: 2.4000000000000004
    lr: 0.0005748378494523119
    n_scales: 195
    optimizer: Adam
    scale_max: 40
    scale_min: 0.9
    weight_decay: 0.003280294721647609
final test best model
https://app.neptune.ai/ba-final/cwt-1/e/CWT1-572
/home/phamanh/Schreibtisch/bachelorarbeit/im_CNN/cwt_cv.py:730: NeptuneUnsupportedType: You're attempting to log a type that is not directly supported by Neptune (<class 'list'>).
        Convert the value to a supported type, such as a string or float, or use stringify_unsupported(obj)
        for dictionaries or collections that contain unsupported values.
        For more, see https://docs.neptune.ai/help/value_of_unsupported_type
  run["fix_parameters"] = fix_parameters
================================================================================
Layer (type:depth-idx)                                  Param #
================================================================================
EfficientNet                                            --
├─Sequential: 1-1                                       --
│    └─Conv2dNormActivation: 2-1                        --
│    │    └─Conv2d: 3-1                                 576
│    │    └─BatchNorm2d: 3-2                            64
│    │    └─SiLU: 3-3                                   --
│    └─Sequential: 2-2                                  --
│    │    └─MBConv: 3-4                                 1,448
│    └─Sequential: 2-3                                  --
│    │    └─MBConv: 3-5                                 6,004
│    │    └─MBConv: 3-6                                 10,710
│    └─Sequential: 2-4                                  --
│    │    └─MBConv: 3-7                                 15,350
│    │    └─MBConv: 3-8                                 31,290
│    └─Sequential: 2-5                                  --
│    │    └─MBConv: 3-9                                 37,130
│    │    └─MBConv: 3-10                                102,900
│    │    └─MBConv: 3-11                                102,900
│    └─Sequential: 2-6                                  --
│    │    └─MBConv: 3-12                                126,004
│    │    └─MBConv: 3-13                                208,572
│    │    └─MBConv: 3-14                                208,572
│    └─Sequential: 2-7                                  --
│    │    └─MBConv: 3-15                                262,492
│    │    └─MBConv: 3-16                                587,952
│    │    └─MBConv: 3-17                                587,952
│    │    └─MBConv: 3-18                                587,952
│    └─Sequential: 2-8                                  --
│    │    └─MBConv: 3-19                                717,232
│    └─Conv2dNormActivation: 2-9                        --
│    │    └─Conv2d: 3-20                                409,600
│    │    └─BatchNorm2d: 3-21                           2,560
│    │    └─SiLU: 3-22                                  --
├─AdaptiveAvgPool2d: 1-2                                --
├─Sequential: 1-3                                       --
│    └─Dropout: 2-10                                    --
│    └─Linear: 2-11                                     1,281
================================================================================
Total params: 4,008,541
Trainable params: 4,008,541
Non-trainable params: 0
================================================================================
Warning: string series 'monitoring/dd1950e2/stdout' value was longer than 1000 characters and was truncated. This warning is printed only once per series.
Warning: string 'structure' value was longer than 16384 characters and was truncated. This warning is printed only once.
epoch 0, loss train 0.19, loss test 5.83, score train 0.32, score test 0.28, score final 0.16
epoch 1, loss train 0.11, loss test 0.33, score train 0.41, score test 0.33, score final 0.08
epoch 2, loss train 0.09, loss test 0.23, score train 0.44, score test 0.29, score final 0.17
epoch 3, loss train 0.07, loss test 0.26, score train 0.46, score test 0.29, score final 0.03
epoch 4, loss train 0.06, loss test 0.21, score train 0.49, score test 0.29, score final 0.03
epoch 5, loss train 0.06, loss test 0.75, score train 0.49, score test 0.29, score final 0.02
epoch 6, loss train 0.06, loss test 0.21, score train 0.48, score test 0.29, score final 0.09
epoch 7, loss train 0.06, loss test 0.22, score train 0.50, score test 0.27, score final 0.03
epoch 8, loss train 0.05, loss test 0.21, score train 0.51, score test 0.26, score final 0.05
epoch 9, loss train 0.05, loss test 0.20, score train 0.54, score test 0.29, score final 0.13
epoch 10, loss train 0.04, loss test 0.21, score train 0.55, score test 0.29, score final 0.03
epoch 11, loss train 0.04, loss test 0.24, score train 0.56, score test 0.24, score final 0.19
epoch 12, loss train 0.04, loss test 0.21, score train 0.56, score test 0.26, score final 0.04
epoch 13, loss train 0.04, loss test 0.20, score train 0.57, score test 0.27, score final 0.07
epoch 14, loss train 0.03, loss test 0.23, score train 0.60, score test 0.24, score final 0.11
epoch 15, loss train 0.04, loss test 0.25, score train 0.57, score test 0.21, score final 0.17
epoch 16, loss train 0.04, loss test 0.19, score train 0.57, score test 0.27, score final 0.04
epoch 17, loss train 0.03, loss test 0.22, score train 0.59, score test 0.24, score final 0.06
epoch 18, loss train 0.03, loss test 0.21, score train 0.60, score test 0.25, score final 0.17
epoch 19, loss train 0.03, loss test 0.22, score train 0.59, score test 0.24, score final 0.04
epoch 20, loss train 0.03, loss test 0.24, score train 0.62, score test 0.21, score final 0.08
epoch 21, loss train 0.03, loss test 0.20, score train 0.62, score test 0.26, score final 0.04
epoch 22, loss train 0.03, loss test 0.23, score train 0.61, score test 0.23, score final 0.12
epoch 23, loss train 0.03, loss test 0.22, score train 0.62, score test 0.23, score final 0.05
epoch 24, loss train 0.03, loss test 0.21, score train 0.62, score test 0.25, score final 0.04
epoch 25, loss train 0.03, loss test 0.21, score train 0.63, score test 0.24, score final 0.11
epoch 26, loss train 0.03, loss test 0.23, score train 0.63, score test 0.23, score final 0.14
epoch 27, loss train 0.03, loss test 0.22, score train 0.61, score test 0.23, score final 0.26
epoch 28, loss train 0.03, loss test 0.25, score train 0.64, score test 0.21, score final 0.16
epoch 29, loss train 0.03, loss test 0.24, score train 0.62, score test 0.21, score final 0.29
epoch 30, loss train 0.03, loss test 0.22, score train 0.64, score test 0.24, score final 0.11
epoch 31, loss train 0.02, loss test 0.22, score train 0.65, score test 0.23, score final 0.07
epoch 32, loss train 0.02, loss test 0.24, score train 0.65, score test 0.22, score final 0.16
epoch 33, loss train 0.02, loss test 0.23, score train 0.67, score test 0.23, score final 0.15
epoch 34, loss train 0.02, loss test 0.22, score train 0.66, score test 0.24, score final 0.10
epoch 35, loss train 0.02, loss test 0.22, score train 0.66, score test 0.24, score final 0.04
epoch 36, loss train 0.02, loss test 0.22, score train 0.66, score test 0.22, score final 0.05
epoch 37, loss train 0.02, loss test 0.25, score train 0.67, score test 0.21, score final 0.06
epoch 38, loss train 0.02, loss test 0.24, score train 0.67, score test 0.23, score final 0.28
epoch 39, loss train 0.02, loss test 0.23, score train 0.67, score test 0.23, score final 0.06
epoch 40, loss train 0.02, loss test 0.23, score train 0.68, score test 0.23, score final 0.14
epoch 41, loss train 0.02, loss test 0.23, score train 0.68, score test 0.23, score final 0.11
epoch 42, loss train 0.02, loss test 0.23, score train 0.66, score test 0.23, score final 0.04
epoch 43, loss train 0.02, loss test 0.22, score train 0.67, score test 0.24, score final 0.05
epoch 44, loss train 0.02, loss test 0.23, score train 0.67, score test 0.23, score final 0.04
epoch 45, loss train 0.02, loss test 0.23, score train 0.67, score test 0.22, score final 0.08
epoch 46, loss train 0.02, loss test 0.21, score train 0.67, score test 0.24, score final 0.04
epoch 47, loss train 0.02, loss test 0.22, score train 0.67, score test 0.24, score final 0.10
epoch 48, loss train 0.02, loss test 0.21, score train 0.68, score test 0.24, score final 0.05
epoch 49, loss train 0.02, loss test 0.23, score train 0.65, score test 0.22, score final 0.09
epoch 50, loss train 0.02, loss test 0.23, score train 0.68, score test 0.24, score final 0.06
epoch 51, loss train 0.03, loss test 0.23, score train 0.63, score test 0.24, score final 0.06
epoch 52, loss train 0.02, loss test 0.24, score train 0.67, score test 0.22, score final 0.13
epoch 53, loss train 0.02, loss test 0.24, score train 0.68, score test 0.24, score final 0.07
epoch 54, loss train 0.02, loss test 0.22, score train 0.68, score test 0.24, score final 0.17
epoch 55, loss train 0.02, loss test 0.23, score train 0.69, score test 0.22, score final 0.13
epoch 56, loss train 0.02, loss test 0.22, score train 0.70, score test 0.24, score final 0.06
epoch 57, loss train 0.02, loss test 0.23, score train 0.71, score test 0.25, score final 0.12
epoch 58, loss train 0.02, loss test 0.21, score train 0.70, score test 0.25, score final 0.05
epoch 59, loss train 0.02, loss test 0.23, score train 0.70, score test 0.23, score final 0.13
epoch 60, loss train 0.02, loss test 0.22, score train 0.71, score test 0.23, score final 0.18
epoch 61, loss train 0.02, loss test 0.22, score train 0.70, score test 0.23, score final 0.12
epoch 62, loss train 0.02, loss test 0.22, score train 0.68, score test 0.24, score final 0.18
epoch 63, loss train 0.02, loss test 0.22, score train 0.70, score test 0.25, score final 0.15
epoch 64, loss train 0.02, loss test 0.20, score train 0.71, score test 0.26, score final 0.03
epoch 65, loss train 0.02, loss test 0.23, score train 0.71, score test 0.24, score final 0.07
epoch 66, loss train 0.02, loss test 0.23, score train 0.72, score test 0.24, score final 0.20
epoch 67, loss train 0.02, loss test 0.22, score train 0.71, score test 0.26, score final 0.11
epoch 68, loss train 0.02, loss test 0.23, score train 0.71, score test 0.23, score final 0.14
epoch 69, loss train 0.02, loss test 0.22, score train 0.72, score test 0.25, score final 0.06
epoch 70, loss train 0.02, loss test 0.22, score train 0.72, score test 0.24, score final 0.11
epoch 71, loss train 0.02, loss test 0.23, score train 0.72, score test 0.24, score final 0.05
epoch 72, loss train 0.02, loss test 0.22, score train 0.71, score test 0.25, score final 0.06
epoch 73, loss train 0.02, loss test 0.21, score train 0.73, score test 0.26, score final 0.04
epoch 74, loss train 0.02, loss test 0.19, score train 0.73, score test 0.27, score final 0.03
epoch 75, loss train 0.02, loss test 0.21, score train 0.73, score test 0.27, score final 0.03
epoch 76, loss train 0.02, loss test 0.21, score train 0.72, score test 0.26, score final 0.02
epoch 77, loss train 0.02, loss test 0.22, score train 0.71, score test 0.25, score final 0.04
epoch 78, loss train 0.02, loss test 0.22, score train 0.72, score test 0.24, score final 0.03
epoch 79, loss train 0.02, loss test 0.22, score train 0.69, score test 0.26, score final 0.03
epoch 80, loss train 0.02, loss test 0.22, score train 0.68, score test 0.24, score final 0.04
epoch 81, loss train 0.02, loss test 0.23, score train 0.72, score test 0.23, score final 0.03
epoch 82, loss train 0.02, loss test 0.20, score train 0.72, score test 0.27, score final 0.03
epoch 83, loss train 0.02, loss test 0.21, score train 0.73, score test 0.24, score final 0.03
epoch 84, loss train 0.01, loss test 0.21, score train 0.74, score test 0.25, score final 0.03
epoch 85, loss train 0.02, loss test 0.22, score train 0.72, score test 0.25, score final 0.04
epoch 86, loss train 0.02, loss test 0.22, score train 0.72, score test 0.23, score final 0.09
epoch 87, loss train 0.02, loss test 0.21, score train 0.69, score test 0.27, score final 0.04
epoch 88, loss train 0.02, loss test 0.22, score train 0.69, score test 0.26, score final 0.04
epoch 89, loss train 0.02, loss test 0.21, score train 0.71, score test 0.26, score final 0.12
epoch 90, loss train 0.02, loss test 0.20, score train 0.71, score test 0.28, score final 0.03
epoch 91, loss train 0.02, loss test 0.21, score train 0.73, score test 0.26, score final 0.06
epoch 92, loss train 0.02, loss test 0.21, score train 0.70, score test 0.27, score final 0.05
epoch 93, loss train 0.02, loss test 0.22, score train 0.71, score test 0.25, score final 0.11
epoch 94, loss train 0.02, loss test 0.21, score train 0.72, score test 0.26, score final 0.03
epoch 95, loss train 0.01, loss test 0.20, score train 0.74, score test 0.28, score final 0.05
epoch 96, loss train 0.01, loss test 0.20, score train 0.75, score test 0.27, score final 0.03
epoch 97, loss train 0.02, loss test 0.20, score train 0.73, score test 0.27, score final 0.03
epoch 98, loss train 0.02, loss test 0.21, score train 0.73, score test 0.26, score final 0.12
epoch 99, loss train 0.01, loss test 0.21, score train 0.74, score test 0.25, score final 0.03
Shutting down background jobs, please wait a moment...
Done!
Waiting for the remaining 15 operations to synchronize with Neptune. Do not kill this process.
All 15 operations synced, thanks for waiting!
Explore the metadata in the Neptune app:
https://app.neptune.ai/ba-final/cwt-1/e/CWT1-572/metadata
https://app.neptune.ai/ba-final/cwt-1/e/CWT1-573
================================================================================
Layer (type:depth-idx)                                  Param #
================================================================================
EfficientNet                                            --
├─Sequential: 1-1                                       --
│    └─Conv2dNormActivation: 2-1                        --
│    │    └─Conv2d: 3-1                                 576
│    │    └─BatchNorm2d: 3-2                            64
│    │    └─SiLU: 3-3                                   --
│    └─Sequential: 2-2                                  --
│    │    └─MBConv: 3-4                                 1,448
│    └─Sequential: 2-3                                  --
│    │    └─MBConv: 3-5                                 6,004
│    │    └─MBConv: 3-6                                 10,710
│    └─Sequential: 2-4                                  --
│    │    └─MBConv: 3-7                                 15,350
│    │    └─MBConv: 3-8                                 31,290
│    └─Sequential: 2-5                                  --
│    │    └─MBConv: 3-9                                 37,130
│    │    └─MBConv: 3-10                                102,900
│    │    └─MBConv: 3-11                                102,900
│    └─Sequential: 2-6                                  --
│    │    └─MBConv: 3-12                                126,004
│    │    └─MBConv: 3-13                                208,572
│    │    └─MBConv: 3-14                                208,572
│    └─Sequential: 2-7                                  --
│    │    └─MBConv: 3-15                                262,492
│    │    └─MBConv: 3-16                                587,952
│    │    └─MBConv: 3-17                                587,952
│    │    └─MBConv: 3-18                                587,952
│    └─Sequential: 2-8                                  --
│    │    └─MBConv: 3-19                                717,232
│    └─Conv2dNormActivation: 2-9                        --
│    │    └─Conv2d: 3-20                                409,600
│    │    └─BatchNorm2d: 3-21                           2,560
│    │    └─SiLU: 3-22                                  --
├─AdaptiveAvgPool2d: 1-2                                --
├─Sequential: 1-3                                       --
│    └─Dropout: 2-10                                    --
│    └─Linear: 2-11                                     1,281
================================================================================
Total params: 4,008,541
Trainable params: 4,008,541
Non-trainable params: 0
================================================================================
Warning: string series 'monitoring/dd1950e2/stdout' value was longer than 1000 characters and was truncated. This warning is printed only once per series.
Warning: string 'structure' value was longer than 16384 characters and was truncated. This warning is printed only once.
slurmstepd: error: *** JOB 1158920 ON cc1g04 CANCELLED AT 2023-09-11T11:00:25 DUE TO TIME LIMIT ***

Start Time : Mo 11. Sep 21:51:11 CEST 2023
Job ID: 1163010
Node: cc1g01
Partition: gpu_normal_stud
CPU cores: 16
Memory: 98304
GPUs: 0
Python environment: khoa                  *  /home/phamanh/anaconda3/envs/khoa
Current work directory: /home/phamanh/Schreibtisch/bachelorarbeit/im_CNN

device: cuda


Study statistics: 
  Number of finished trials:  100
  Number of pruned trials:  20
  Number of complete trials:  80
  Value:  0.04277383215883945
  Params: 
    b: 2.05
    batch_size: 32
    drop: 0.3006541491680656
    epochs: 100
    fc: 2.4000000000000004
    lr: 0.0005748378494523119
    n_scales: 195
    optimizer: Adam
    scale_max: 40
    scale_min: 0.9
    weight_decay: 0.003280294721647609
final test best model
https://app.neptune.ai/ba-final/cwt-1/e/CWT1-574
================================================================================
Layer (type:depth-idx)                                  Param #
================================================================================
EfficientNet                                            --
├─Sequential: 1-1                                       --
│    └─Conv2dNormActivation: 2-1                        --
│    │    └─Conv2d: 3-1                                 576
│    │    └─BatchNorm2d: 3-2                            64
│    │    └─SiLU: 3-3                                   --
│    └─Sequential: 2-2                                  --
│    │    └─MBConv: 3-4                                 1,448
│    └─Sequential: 2-3                                  --
│    │    └─MBConv: 3-5                                 6,004
│    │    └─MBConv: 3-6                                 10,710
│    └─Sequential: 2-4                                  --
│    │    └─MBConv: 3-7                                 15,350
│    │    └─MBConv: 3-8                                 31,290
│    └─Sequential: 2-5                                  --
│    │    └─MBConv: 3-9                                 37,130
│    │    └─MBConv: 3-10                                102,900
│    │    └─MBConv: 3-11                                102,900
│    └─Sequential: 2-6                                  --
│    │    └─MBConv: 3-12                                126,004
│    │    └─MBConv: 3-13                                208,572
│    │    └─MBConv: 3-14                                208,572
│    └─Sequential: 2-7                                  --
│    │    └─MBConv: 3-15                                262,492
│    │    └─MBConv: 3-16                                587,952
│    │    └─MBConv: 3-17                                587,952
│    │    └─MBConv: 3-18                                587,952
│    └─Sequential: 2-8                                  --
│    │    └─MBConv: 3-19                                717,232
│    └─Conv2dNormActivation: 2-9                        --
│    │    └─Conv2d: 3-20                                409,600
│    │    └─BatchNorm2d: 3-21                           2,560
│    │    └─SiLU: 3-22                                  --
├─AdaptiveAvgPool2d: 1-2                                --
├─Sequential: 1-3                                       --
│    └─Dropout: 2-10                                    --
│    └─Linear: 2-11                                     1,281
================================================================================
Total params: 4,008,541
Trainable params: 4,008,541
Non-trainable params: 0
================================================================================
Warning: string series 'monitoring/fda670c0/stdout' value was longer than 1000 characters and was truncated. This warning is printed only once per series.
Warning: string 'structure' value was longer than 16384 characters and was truncated. This warning is printed only once.
slurmstepd: error: *** JOB 1163010 ON cc1g01 CANCELLED AT 2023-09-12T21:51:32 DUE TO TIME LIMIT ***

Start Time : Di 12. Sep 22:04:22 CEST 2023
Job ID: 1163758
Node: cc1g01
Partition: gpu_long_stud
CPU cores: 16
Memory: 98304
GPUs: 0
Python environment: khoa                  *  /home/phamanh/anaconda3/envs/khoa
Current work directory: /home/phamanh/Schreibtisch/bachelorarbeit/im_CNN

device: cuda


Study statistics: 
  Number of fin