[32m[I 2023-08-30 00:00:49,717][0m Trial 45 finished with value: 0.07380342483520508 and parameters: {'b': 1.6500000000000001, 'fc': 1.0, 'scale_min': 0.7, 'scale_max': 12, 'n_scales': 140, 'drop': 0.7918055326829276, 'optimizer': 'Adam', 'lr': 0.0008154980390257482, 'weight_decay': 0.018723000876368162, 'batch_size': 32, 'epochs': 100}. Best is trial 33 with value: 0.05809502500168821.[0m
trial 45, loss train mean 0.08, score train mean 0.45, loss val mean 0.07, score val mean 0.49



End Time   : Mi 30. Aug 00:00:51 CEST 2023
Duration   : 12330.816905513 seconds

Start Time : Mi 30. Aug 00:01:01 CEST 2023
Job ID: 1151120
Node: erebos
Partition: gpu_normal_stud
CPU cores: 16
Memory: 98304
GPUs: 0
Python environment: khoa                  *  /home/phamanh/anaconda3/envs/khoa
Current work directory: /home/phamanh/Schreibtisch/bachelorarbeit/im_CNN

device: cuda


https://app.neptune.ai/ba-final/cwt-1/e/CWT1-336
Split 0, loss train 0.06, score train 0.48, loss val 0.09 score val 0.38
Shutting down background jobs, please wait a moment...
Done!
Waiting for the remaining 10 operations to synchronize with Neptune. Do not kill this process.
All 10 operations synced, thanks for waiting!
Explore the metadata in the Neptune app:
https://app.neptune.ai/ba-final/cwt-1/e/CWT1-336/metadata
https://app.neptune.ai/ba-final/cwt-1/e/CWT1-337
Split 1, loss train 0.07, score train 0.47, loss val 0.08 score val 0.43
Shutting down background jobs, please wait a moment...
Done!
Waiting for the remaining 10 operations to synchronize with Neptune. Do not kill this process.
All 10 operations synced, thanks for waiting!
Explore the metadata in the Neptune app:
https://app.neptune.ai/ba-final/cwt-1/e/CWT1-337/metadata
https://app.neptune.ai/ba-final/cwt-1/e/CWT1-338
Split 2, loss train 0.07, score train 0.46, loss val 0.06 score val 0.48
Shutting down background jobs, please wait a moment...
Done!
Waiting for the remaining 10 operations to synchronize with Neptune. Do not kill this process.
All 10 operations synced, thanks for waiting!
Explore the metadata in the Neptune app:
https://app.neptune.ai/ba-final/cwt-1/e/CWT1-338/metadata
https://app.neptune.ai/ba-final/cwt-1/e/CWT1-339
Split 3, loss train 0.07, score train 0.46, loss val 0.06 score val 0.45
Shutting down background jobs, please wait a moment...
Done!
Waiting for the remaining 10 operations to synchronize with Neptune. Do not kill this process.
All 10 operations synced, thanks for waiting!
Explore the metadata in the Neptune app:
https://app.neptune.ai/ba-final/cwt-1/e/CWT1-339/metadata
https://app.neptune.ai/ba-final/cwt-1/e/CWT1-340
Split 4, loss train 0.06, score train 0.48, loss val 0.08 score val 0.47
Shutting down background jobs, please wait a moment...
Done!
Waiting for the remaining 10 operations to synchronize with Neptune. Do not kill this process.
All 10 operations synced, thanks for waiting!
Explore the metadata in the Neptune app:
https://app.neptune.ai/ba-final/cwt-1/e/CWT1-340/metadata
[32m[I 2023-08-30 04:13:42,889][0m Trial 46 finished with value: 0.0729583151797031 and parameters: {'b': 1.25, 'fc': 1.35, 'scale_min': 1.8, 'scale_max': 22, 'n_scales': 185, 'drop': 0.7003394939734647, 'optimizer': 'Adam', 'lr': 0.0006213109964467952, 'weight_decay': 0.010903589468321023, 'batch_size': 32, 'epochs': 100}. Best is trial 33 with value: 0.05809502500168821.[0m
trial 46, loss train mean 0.06, score train mean 0.47, loss val mean 0.07, score val mean 0.44



End Time   : Mi 30. Aug 04:13:44 CEST 2023
Duration   : 15163.560307718 seconds

Start Time : Mi 30. Aug 15:25:59 CEST 2023
Job ID: 1152632
Node: erebos
Partition: gpu_normal_stud
CPU cores: 16
Memory: 98304
GPUs: 0
Python environment: khoa                  *  /home/phamanh/anaconda3/envs/khoa
Current work directory: /home/phamanh/Schreibtisch/bachelorarbeit/im_CNN

device: cuda


https://app.neptune.ai/ba-final/cwt-1/e/CWT1-341
Shutting down background jobs, please wait a moment...
Done!
Waiting for the remaining 7 operations to synchronize with Neptune. Do not kill this process.
All 7 operations synced, thanks for waiting!
Explore the metadata in the Neptune app:
https://app.neptune.ai/ba-final/cwt-1/e/CWT1-341/metadata
[32m[I 2023-08-30 16:54:35,188][0m Trial 47 pruned. [0m

End Time   : Mi 30. Aug 16:54:38 CEST 2023
Duration   : 5318.909775671 seconds

Start Time : Mi 30. Aug 16:54:42 CEST 2023
Job ID: 1152633
Node: cc1g06
Partition: gpu_normal_stud
CPU cores: 16
Memory: 98304
GPUs: 0
Python environment: khoa                  *  /home/phamanh/anaconda3/envs/khoa
Current work directory: /home/phamanh/Schreibtisch/bachelorarbeit/im_CNN

device: cuda


https://app.neptune.ai/ba-final/cwt-1/e/CWT1-342
Shutting down background jobs, please wait a moment...
Done!
Waiting for the remaining 7 operations to synchronize with Neptune. Do not kill this process.
All 7 operations synced, thanks for waiting!
Explore the metadata in the Neptune app:
https://app.neptune.ai/ba-final/cwt-1/e/CWT1-342/metadata
[32m[I 2023-08-30 18:06:29,920][0m Trial 48 pruned. [0m

End Time   : Mi 30. Aug 18:06:34 CEST 2023
Duration   : 4311.450410589 seconds

Start Time : Mi 30. Aug 18:52:25 CEST 2023
Job ID: 1152634
Node: cc1g01
Partition: gpu_normal_stud
CPU cores: 16
Memory: 98304
GPUs: 0
Python environment: khoa                  *  /home/phamanh/anaconda3/envs/khoa
Current work directory: /home/phamanh/Schreibtisch/bachelorarbeit/im_CNN

device: cuda


https://app.neptune.ai/ba-final/cwt-1/e/CWT1-343
Shutting down background jobs, please wait a moment...
Done!
Waiting for the remaining 3 operations to synchronize with Neptune. Do not kill this process.
All 3 operations synced, thanks for waiting!
Explore the metadata in the Neptune app:
https://app.neptune.ai/ba-final/cwt-1/e/CWT1-343/metadata
[32m[I 2023-08-30 20:17:08,672][0m Trial 49 pruned. [0m

End Time   : Mi 30. Aug 20:17:12 CEST 2023
Duration   : 5086.880055598 seconds

Start Time : Mi 30. Aug 20:17:15 CEST 2023
Job ID: 1152635
Node: cc1g07
Partition: gpu_normal_stud
CPU cores: 16
Memory: 98304
GPUs: 0
Python environment: khoa                  *  /home/phamanh/anaconda3/envs/khoa
Current work directory: /home/phamanh/Schreibtisch/bachelorarbeit/im_CNN

device: cuda


https://app.neptune.ai/ba-final/cwt-1/e/CWT1-344
Split 0, loss train 0.07, score train 0.46, loss val 0.06 score val 0.51
Shutting down background jobs, please wait a moment...
Done!
Waiting for the remaining 10 operations to synchronize with Neptune. Do not kill this process.
All 10 operations synced, thanks for waiting!
Explore the metadata in the Neptune app:
https://app.neptune.ai/ba-final/cwt-1/e/CWT1-344/metadata
https://app.neptune.ai/ba-final/cwt-1/e/CWT1-345
Split 1, loss train 0.07, score train 0.45, loss val 0.05 score val 0.55
Shutting down background jobs, please wait a moment...
Done!
Waiting for the remaining 10 operations to synchronize with Neptune. Do not kill this process.
All 10 operations synced, thanks for waiting!
Explore the metadata in the Neptune app:
https://app.neptune.ai/ba-final/cwt-1/e/CWT1-345/metadata
https://app.neptune.ai/ba-final/cwt-1/e/CWT1-346
Split 2, loss train 0.08, score train 0.44, loss val 0.10 score val 0.45
Shutting down background jobs, please wait a moment...
Done!
Waiting for the remaining 10 operations to synchronize with Neptune. Do not kill this process.
All 10 operations synced, thanks for waiting!
Explore the metadata in the Neptune app:
https://app.neptune.ai/ba-final/cwt-1/e/CWT1-346/metadata
https://app.neptune.ai/ba-final/cwt-1/e/CWT1-347
Split 3, loss train 0.08, score train 0.45, loss val 0.06 score val 0.58
Shutting down background jobs, please wait a moment...
Done!
Waiting for the remaining 10 operations to synchronize with Neptune. Do not kill this process.
All 10 operations synced, thanks for waiting!
Explore the metadata in the Neptune app:
https://app.neptune.ai/ba-final/cwt-1/e/CWT1-347/metadata
https://app.neptune.ai/ba-final/cwt-1/e/CWT1-348
Split 4, loss train 0.07, score train 0.45, loss val 0.09 score val 0.45
Shutting down background jobs, please wait a moment...
Done!
Waiting for the remaining 14 operations to synchronize with Neptune. Do not kill this process.
All 14 operations synced, thanks for waiting!
Explore the metadata in the Neptune app:
https://app.neptune.ai/ba-final/cwt-1/e/CWT1-348/metadata
[32m[I 2023-08-30 23:53:24,435][0m Trial 50 finished with value: 0.0738188236317736 and parameters: {'b': 2.1, 'fc': 1.7000000000000002, 'scale_min': 1.1, 'scale_max': 14, 'n_scales': 160, 'drop': 0.7313414572522497, 'optimizer': 'Adam', 'lr': 0.0012680107658782013, 'weight_decay': 0.010903589468321023, 'batch_size': 32, 'epochs': 100}. Best is trial 33 with value: 0.05809502500168821.[0m
trial 50, loss train mean 0.07, score train mean 0.45, loss val mean 0.07, score val mean 0.51



End Time   : Mi 30. Aug 23:53:26 CEST 2023
Duration   : 12971.204133441 seconds

Start Time : Mi 30. Aug 23:53:28 CEST 2023
Job ID: 1152636
Node: cc1g07
Partition: gpu_normal_stud
CPU cores: 16
Memory: 98304
GPUs: 0
Python environment: khoa                  *  /home/phamanh/anaconda3/envs/khoa
Current work directory: /home/phamanh/Schreibtisch/bachelorarbeit/im_CNN

device: cuda


https://app.neptune.ai/ba-final/cwt-1/e/CWT1-349
Shutting down background jobs, please wait a moment...
Done!
Waiting for the remaining 3 operations to synchronize with Neptune. Do not kill this process.
All 3 operations synced, thanks for waiting!
Explore the metadata in the Neptune app:
https://app.neptune.ai/ba-final/cwt-1/e/CWT1-349/metadata
[32m[I 2023-08-31 01:28:33,194][0m Trial 51 pruned. [0m

End Time   : Do 31. Aug 01:28:37 CEST 2023
Duration   : 5709.239508032 seconds

Start Time : Do 31. Aug 01:28:41 CEST 2023
Job ID: 1152637
Node: cc1g07
Partition: gpu_normal_stud
CPU cores: 16
Memory: 98304
GPUs: 0
Python environment: khoa                  *  /home/phamanh/anaconda3/envs/khoa
Current work directory: /home/phamanh/Schreibtisch/bachelorarbeit/im_CNN

device: cuda


https://app.neptune.ai/ba-final/cwt-1/e/CWT1-350
Split 0, loss train 0.06, score train 0.48, loss val 0.09 score val 0.51
Shutting down background jobs, please wait a moment...
Done!
Waiting for the remaining 10 operations to synchronize with Neptune. Do not kill this process.
All 10 operations synced, thanks for waiting!
Explore the metadata in the Neptune app:
https://app.neptune.ai/ba-final/cwt-1/e/CWT1-350/metadata
https://app.neptune.ai/ba-final/cwt-1/e/CWT1-351
Split 1, loss train 0.06, score train 0.47, loss val 0.08 score val 0.52
Shutting down background jobs, please wait a moment...
Done!
Waiting for the remaining 10 operations to synchronize with Neptune. Do not kill this process.
All 10 operations synced, thanks for waiting!
Explore the metadata in the Neptune app:
https://app.neptune.ai/ba-final/cwt-1/e/CWT1-351/metadata
https://app.neptune.ai/ba-final/cwt-1/e/CWT1-352
Split 2, loss train 0.06, score train 0.46, loss val 0.07 score val 0.35
Shutting down background jobs, please wait a moment...
Done!
Waiting for the remaining 10 operations to synchronize with Neptune. Do not kill this process.
All 10 operations synced, thanks for waiting!
Explore the metadata in the Neptune app:
https://app.neptune.ai/ba-final/cwt-1/e/CWT1-352/metadata
https://app.neptune.ai/ba-final/cwt-1/e/CWT1-353
Split 3, loss train 0.06, score train 0.47, loss val 0.06 score val 0.45
Shutting down background jobs, please wait a moment...
Done!
Waiting for the remaining 10 operations to synchronize with Neptune. Do not kill this process.
All 10 operations synced, thanks for waiting!
Explore the metadata in the Neptune app:
https://app.neptune.ai/ba-final/cwt-1/e/CWT1-353/metadata
https://app.neptune.ai/ba-final/cwt-1/e/CWT1-354
Split 4, loss train 0.06, score train 0.48, loss val 0.10 score val 0.17
Shutting down background jobs, please wait a moment...
Done!
Waiting for the remaining 9 operations to synchronize with Neptune. Do not kill this process.
All 9 operations synced, thanks for waiting!
Explore the metadata in the Neptune app:
https://app.neptune.ai/ba-final/cwt-1/e/CWT1-354/metadata
[32m[I 2023-08-31 06:16:05,714][0m Trial 52 finished with value: 0.07965352281611016 and parameters: {'b': 0.9500000000000001, 'fc': 1.5, 'scale_min': 0.5, 'scale_max': 18, 'n_scales': 280, 'drop': 0.5494486258367032, 'optimizer': 'Adam', 'lr': 0.0006213109964467952, 'weight_decay': 0.007405973164083966, 'batch_size': 32, 'epochs': 100}. Best is trial 33 with value: 0.05809502500168821.[0m
trial 52, loss train mean 0.06, score train mean 0.47, loss val mean 0.08, score val mean 0.40



End Time   : Do 31. Aug 06:16:08 CEST 2023
Duration   : 17246.984801876 seconds

Start Time : Do 31. Aug 06:16:09 CEST 2023
Job ID: 1152638
Node: cc1g07
Partition: gpu_normal_stud
CPU cores: 16
Memory: 98304
GPUs: 0
Python environment: khoa                  *  /home/phamanh/anaconda3/envs/khoa
Current work directory: /home/phamanh/Schreibtisch/bachelorarbeit/im_CNN

device: cuda


https://app.neptune.ai/ba-final/cwt-1/e/CWT1-355
Split 0, loss train 0.06, score train 0.48, loss val 0.14 score val 0.36
Shutting down background jobs, please wait a moment...
Done!
Waiting for the remaining 14 operations to synchronize with Neptune. Do not kill this process.
All 14 operations synced, thanks for waiting!
Explore the metadata in the Neptune app:
https://app.neptune.ai/ba-final/cwt-1/e/CWT1-355/metadata
https://app.neptune.ai/ba-final/cwt-1/e/CWT1-356
Split 1, loss train 0.07, score train 0.47, loss val 0.09 score val 0.38
Shutting down background jobs, please wait a moment...
Done!
Waiting for the remaining 14 operations to synchronize with Neptune. Do not kill this process.
All 14 operations synced, thanks for waiting!
Explore the metadata in the Neptune app:
https://app.neptune.ai/ba-final/cwt-1/e/CWT1-356/metadata
https://app.neptune.ai/ba-final/cwt-1/e/CWT1-357
Split 2, loss train 0.07, score train 0.45, loss val 0.06 score val 0.55
Shutting down background jobs, please wait a moment...
Done!
Waiting for the remaining 14 operations to synchronize with Neptune. Do not kill this process.
All 14 operations synced, thanks for waiting!
Explore the metadata in the Neptune app:
https://app.neptune.ai/ba-final/cwt-1/e/CWT1-357/metadata
https://app.neptune.ai/ba-final/cwt-1/e/CWT1-358
Split 3, loss train 0.07, score train 0.46, loss val 0.12 score val 0.16
Shutting down background jobs, please wait a moment...
Done!
Waiting for the remaining 10 operations to synchronize with Neptune. Do not kill this process.
All 10 operations synced, thanks for waiting!
Explore the metadata in the Neptune app:
https://app.neptune.ai/ba-final/cwt-1/e/CWT1-358/metadata
https://app.neptune.ai/ba-final/cwt-1/e/CWT1-359
Split 4, loss train 0.07, score train 0.46, loss val 0.06 score val 0.59
Shutting down background jobs, please wait a moment...
Done!
Waiting for the remaining 14 operations to synchronize with Neptune. Do not kill this process.
All 14 operations synced, thanks for waiting!
Explore the metadata in the Neptune app:
https://app.neptune.ai/ba-final/cwt-1/e/CWT1-359/metadata
[32m[I 2023-08-31 09:54:57,913][0m Trial 53 finished with value: 0.09153113060809195 and parameters: {'b': 1.25, 'fc': 1.7000000000000002, 'scale_min': 1.0, 'scale_max': 32, 'n_scales': 120, 'drop': 0.49145171346147526, 'optimizer': 'Adam', 'lr': 0.0006249266930841765, 'weight_decay': 0.014879698892901744, 'batch_size': 32, 'epochs': 100}. Best is trial 33 with value: 0.05809502500168821.[0m
trial 53, loss train mean 0.07, score train mean 0.46, loss val mean 0.09, score val mean 0.41



End Time   : Do 31. Aug 09:55:00 CEST 2023
Duration   : 13130.709843635 seconds

Start Time : Do 31. Aug 09:55:01 CEST 2023
Job ID: 1152639
Node: cc1g07
Partition: gpu_normal_stud
CPU cores: 16
Memory: 98304
GPUs: 0
Python environment: khoa                  *  /home/phamanh/anaconda3/envs/khoa
Current work directory: /home/phamanh/Schreibtisch/bachelorarbeit/im_CNN

device: cuda


https://app.neptune.ai/ba-final/cwt-1/e/CWT1-360
Experiencing connection interruptions. Will try to reestablish communication with Neptune. Internal exception was: RequestsFutureAdapterTimeout
Communication with Neptune restored!
Split 0, loss train 0.08, score train 0.45, loss val 0.06 score val 0.46
Shutting down background jobs, please wait a moment...
Done!
Waiting for the remaining 10 operations to synchronize with Neptune. Do not kill this process.
All 10 operations synced, thanks for waiting!
Explore the metadata in the Neptune app:
https://app.neptune.ai/ba-final/cwt-1/e/CWT1-360/metadata
https://app.neptune.ai/ba-final/cwt-1/e/CWT1-361
Split 1, loss train 0.07, score train 0.45, loss val 0.06 score val 0.51
Shutting down background jobs, please wait a moment...
Done!
Waiting for the remaining 14 operations to synchronize with Neptune. Do not kill this process.
All 14 operations synced, thanks for waiting!
Explore the metadata in the Neptune app:
https://app.neptune.ai/ba-final/cwt-1/e/CWT1-361/metadata
https://app.neptune.ai/ba-final/cwt-1/e/CWT1-362
Split 2, loss train 0.08, score train 0.44, loss val 0.09 score val 0.41
Shutting down background jobs, please wait a moment...
Done!
Waiting for the remaining 14 operations to synchronize with Neptune. Do not kill this process.
All 14 operations synced, thanks for waiting!
Explore the metadata in the Neptune app:
https://app.neptune.ai/ba-final/cwt-1/e/CWT1-362/metadata
https://app.neptune.ai/ba-final/cwt-1/e/CWT1-363
Split 3, loss train 0.08, score train 0.44, loss val 0.07 score val 0.45
Shutting down background jobs, please wait a moment...
Done!
Waiting for the remaining 14 operations to synchronize with Neptune. Do not kill this process.
All 14 operations synced, thanks for waiting!
Explore the metadata in the Neptune app:
https://app.neptune.ai/ba-final/cwt-1/e/CWT1-363/metadata
https://app.neptune.ai/ba-final/cwt-1/e/CWT1-364
Split 4, loss train 0.08, score train 0.45, loss val 0.07 score val 0.47
Shutting down background jobs, please wait a moment...
Done!
Waiting for the remaining 10 operations to synchronize with Neptune. Do not kill this process.
All 10 operations synced, thanks for waiting!
Explore the metadata in the Neptune app:
https://app.neptune.ai/ba-final/cwt-1/e/CWT1-364/metadata
[32m[I 2023-08-31 13:10:17,691][0m Trial 54 finished with value: 0.07172256429144677 and parameters: {'b': 1.4500000000000002, 'fc': 2.1500000000000004, 'scale_min': 1.0, 'scale_max': 16, 'n_scales': 110, 'drop': 0.793631464104538, 'optimizer': 'Adam', 'lr': 0.0007851150148131389, 'weight_decay': 0.02109239820744681, 'batch_size': 32, 'epochs': 100}. Best is trial 33 with value: 0.05809502500168821.[0m
trial 54, loss train mean 0.08, score train mean 0.45, loss val mean 0.07, score val mean 0.46



End Time   : Do 31. Aug 13:10:20 CEST 2023
Duration   : 11718.338979125 seconds

Start Time : Do 31. Aug 13:10:28 CEST 2023
Job ID: 1152640
Node: cc1g07
Partition: gpu_normal_stud
CPU cores: 16
Memory: 98304
GPUs: 0
Python environment: khoa                  *  /home/phamanh/anaconda3/envs/khoa
Current work directory: /home/phamanh/Schreibtisch/bachelorarbeit/im_CNN

device: cuda


https://app.neptune.ai/ba-final/cwt-1/e/CWT1-365
Split 0, loss train 0.07, score train 0.47, loss val 0.15 score val 0.24
Shutting down background jobs, please wait a moment...
Done!
Waiting for the remaining 36 operations to synchronize with Neptune. Do not kill this process.
Still waiting for the remaining 36 operations (0.00% done). Please wait.
All 36 operations synced, thanks for waiting!
Explore the metadata in the Neptune app:
https://app.neptune.ai/ba-final/cwt-1/e/CWT1-365/metadata
https://app.neptune.ai/ba-final/cwt-1/e/CWT1-366
Split 1, loss train 0.07, score train 0.46, loss val 0.08 score val 0.44
Shutting down background jobs, please wait a moment...
Done!
Waiting for the remaining 14 operations to synchronize with Neptune. Do not kill this process.
All 14 operations synced, thanks for waiting!
Explore the metadata in the Neptune app:
https://app.neptune.ai/ba-final/cwt-1/e/CWT1-366/metadata
https://app.neptune.ai/ba-final/cwt-1/e/CWT1-367
Split 2, loss train 0.08, score train 0.44, loss val 0.07 score val 0.53
Shutting down background jobs, please wait a moment...
Done!
Waiting for the remaining 10 operations to synchronize with Neptune. Do not kill this process.
All 10 operations synced, thanks for waiting!
Explore the metadata in the Neptune app:
https://app.neptune.ai/ba-final/cwt-1/e/CWT1-367/metadata
https://app.neptune.ai/ba-final/cwt-1/e/CWT1-368
Split 3, loss train 0.07, score train 0.46, loss val 0.14 score val 0.17
Shutting down background jobs, please wait a moment...
Done!
Waiting for the remaining 14 operations to synchronize with Neptune. Do not kill this process.
All 14 operations synced, thanks for waiting!
Explore the metadata in the Neptune app:
https://app.neptune.ai/ba-final/cwt-1/e/CWT1-368/metadata
https://app.neptune.ai/ba-final/cwt-1/e/CWT1-369
Split 4, loss train 0.07, score train 0.46, loss val 0.06 score val 0.54
Shutting down background jobs, please wait a moment...
Done!
Waiting for the remaining 14 operations to synchronize with Neptune. Do not kill this process.
All 14 operations synced, thanks for waiting!
Explore the metadata in the Neptune app:
https://app.neptune.ai/ba-final/cwt-1/e/CWT1-369/metadata
