[32m[I 2023-09-04 08:41:03,534][0m Trial 73 finished with value: 0.0556401790456569 and parameters: {'b': 2.25, 'fc': 1.9000000000000001, 'scale_min': 0.9, 'scale_max': 40, 'n_scales': 195, 'drop': 0.26870252407408896, 'optimizer': 'Adam', 'lr': 0.0009539960584734508, 'weight_decay': 0.004391300872771227, 'batch_size': 32, 'epochs': 100}. Best is trial 73 with value: 0.0556401790456569.[0m
trial 73, loss train mean 0.06, score train mean 0.48, loss val mean 0.06, score val mean 0.47



End Time   : Mo 4. Sep 08:41:05 CEST 2023
Duration   : 15736.807399228 seconds

Start Time : Mo 4. Sep 08:41:07 CEST 2023
Job ID: 1154446
Node: cc1g03
Partition: gpu_normal_stud
CPU cores: 16
Memory: 98304
GPUs: 0
Python environment: khoa                  *  /home/phamanh/anaconda3/envs/khoa
Current work directory: /home/phamanh/Schreibtisch/bachelorarbeit/im_CNN

device: cuda


https://app.neptune.ai/ba-final/cwt-1/e/CWT1-436
Split 0, loss train 0.06, score train 0.48, loss val 0.08 score val 0.39
Shutting down background jobs, please wait a moment...
Done!
Waiting for the remaining 10 operations to synchronize with Neptune. Do not kill this process.
All 10 operations synced, thanks for waiting!
Explore the metadata in the Neptune app:
https://app.neptune.ai/ba-final/cwt-1/e/CWT1-436/metadata
https://app.neptune.ai/ba-final/cwt-1/e/CWT1-437
Split 1, loss train 0.06, score train 0.48, loss val 0.07 score val 0.52
Shutting down background jobs, please wait a moment...
Done!
Waiting for the remaining 14 operations to synchronize with Neptune. Do not kill this process.
All 14 operations synced, thanks for waiting!
Explore the metadata in the Neptune app:
https://app.neptune.ai/ba-final/cwt-1/e/CWT1-437/metadata
https://app.neptune.ai/ba-final/cwt-1/e/CWT1-438
Split 2, loss train 0.07, score train 0.46, loss val 0.03 score val 0.61
Shutting down background jobs, please wait a moment...
Done!
Waiting for the remaining 10 operations to synchronize with Neptune. Do not kill this process.
All 10 operations synced, thanks for waiting!
Explore the metadata in the Neptune app:
https://app.neptune.ai/ba-final/cwt-1/e/CWT1-438/metadata
https://app.neptune.ai/ba-final/cwt-1/e/CWT1-439
Split 3, loss train 0.06, score train 0.47, loss val 0.06 score val 0.58
Shutting down background jobs, please wait a moment...
Done!
Waiting for the remaining 10 operations to synchronize with Neptune. Do not kill this process.
All 10 operations synced, thanks for waiting!
Explore the metadata in the Neptune app:
https://app.neptune.ai/ba-final/cwt-1/e/CWT1-439/metadata
https://app.neptune.ai/ba-final/cwt-1/e/CWT1-440
Split 4, loss train 0.06, score train 0.48, loss val 0.06 score val 0.53
Shutting down background jobs, please wait a moment...
Done!
Waiting for the remaining 9 operations to synchronize with Neptune. Do not kill this process.
All 9 operations synced, thanks for waiting!
Explore the metadata in the Neptune app:
https://app.neptune.ai/ba-final/cwt-1/e/CWT1-440/metadata
[32m[I 2023-09-04 13:03:53,723][0m Trial 74 finished with value: 0.06106690903927418 and parameters: {'b': 2.35, 'fc': 2.5, 'scale_min': 1.2000000000000002, 'scale_max': 16, 'n_scales': 250, 'drop': 0.26870252407408896, 'optimizer': 'Adam', 'lr': 0.0008311922763560784, 'weight_decay': 0.011554090825408382, 'batch_size': 32, 'epochs': 100}. Best is trial 73 with value: 0.0556401790456569.[0m
trial 74, loss train mean 0.06, score train mean 0.48, loss val mean 0.06, score val mean 0.53



End Time   : Mo 4. Sep 13:03:55 CEST 2023
Duration   : 15768.890787329 seconds

Start Time : Mo 4. Sep 13:04:02 CEST 2023
Job ID: 1154447
Node: cc1g07
Partition: gpu_normal_stud
CPU cores: 16
Memory: 98304
GPUs: 0
Python environment: khoa                  *  /home/phamanh/anaconda3/envs/khoa
Current work directory: /home/phamanh/Schreibtisch/bachelorarbeit/im_CNN

device: cuda


https://app.neptune.ai/ba-final/cwt-1/e/CWT1-441
Split 0, loss train 0.07, score train 0.46, loss val 0.23 score val 0.08
Shutting down background jobs, please wait a moment...
Done!
Waiting for the remaining 10 operations to synchronize with Neptune. Do not kill this process.
All 10 operations synced, thanks for waiting!
Explore the metadata in the Neptune app:
https://app.neptune.ai/ba-final/cwt-1/e/CWT1-441/metadata
https://app.neptune.ai/ba-final/cwt-1/e/CWT1-442
Split 1, loss train 0.08, score train 0.45, loss val 0.16 score val 0.34
Shutting down background jobs, please wait a moment...
Done!
Waiting for the remaining 14 operations to synchronize with Neptune. Do not kill this process.
All 14 operations synced, thanks for waiting!
Explore the metadata in the Neptune app:
https://app.neptune.ai/ba-final/cwt-1/e/CWT1-442/metadata
https://app.neptune.ai/ba-final/cwt-1/e/CWT1-443
Split 2, loss train 0.08, score train 0.45, loss val 0.13 score val 0.20
Shutting down background jobs, please wait a moment...
Done!
Waiting for the remaining 10 operations to synchronize with Neptune. Do not kill this process.
All 10 operations synced, thanks for waiting!
Explore the metadata in the Neptune app:
https://app.neptune.ai/ba-final/cwt-1/e/CWT1-443/metadata
https://app.neptune.ai/ba-final/cwt-1/e/CWT1-444
Split 3, loss train 0.08, score train 0.44, loss val 0.11 score val 0.33
Shutting down background jobs, please wait a moment...
Done!
Waiting for the remaining 14 operations to synchronize with Neptune. Do not kill this process.
All 14 operations synced, thanks for waiting!
Explore the metadata in the Neptune app:
https://app.neptune.ai/ba-final/cwt-1/e/CWT1-444/metadata
https://app.neptune.ai/ba-final/cwt-1/e/CWT1-445
Split 4, loss train 0.08, score train 0.45, loss val 0.06 score val 0.49
Shutting down background jobs, please wait a moment...
Done!
Waiting for the remaining 10 operations to synchronize with Neptune. Do not kill this process.
All 10 operations synced, thanks for waiting!
Explore the metadata in the Neptune app:
https://app.neptune.ai/ba-final/cwt-1/e/CWT1-445/metadata
[32m[I 2023-09-04 18:29:05,096][0m Trial 75 finished with value: 0.13904232978820802 and parameters: {'b': 2.3, 'fc': 2.0, 'scale_min': 1.4, 'scale_max': 48, 'n_scales': 245, 'drop': 0.26870252407408896, 'optimizer': 'Adam', 'lr': 0.0009480543890794245, 'weight_decay': 0.03342679931782235, 'batch_size': 32, 'epochs': 100}. Best is trial 73 with value: 0.0556401790456569.[0m
trial 75, loss train mean 0.08, score train mean 0.45, loss val mean 0.14, score val mean 0.29



End Time   : Mo 4. Sep 18:29:07 CEST 2023
Duration   : 19505.081426030 seconds

Start Time : Mo 4. Sep 18:29:27 CEST 2023
Job ID: 1154448
Node: cc1g07
Partition: gpu_normal_stud
CPU cores: 16
Memory: 98304
GPUs: 0
Python environment: khoa                  *  /home/phamanh/anaconda3/envs/khoa
Current work directory: /home/phamanh/Schreibtisch/bachelorarbeit/im_CNN

device: cuda


https://app.neptune.ai/ba-final/cwt-1/e/CWT1-446
Split 0, loss train 0.06, score train 0.48, loss val 0.11 score val 0.20
Shutting down background jobs, please wait a moment...
Done!
Waiting for the remaining 14 operations to synchronize with Neptune. Do not kill this process.
All 14 operations synced, thanks for waiting!
Explore the metadata in the Neptune app:
https://app.neptune.ai/ba-final/cwt-1/e/CWT1-446/metadata
https://app.neptune.ai/ba-final/cwt-1/e/CWT1-447
Split 1, loss train 0.07, score train 0.46, loss val 0.15 score val 0.37
Shutting down background jobs, please wait a moment...
Done!
Waiting for the remaining 10 operations to synchronize with Neptune. Do not kill this process.
All 10 operations synced, thanks for waiting!
Explore the metadata in the Neptune app:
https://app.neptune.ai/ba-final/cwt-1/e/CWT1-447/metadata
https://app.neptune.ai/ba-final/cwt-1/e/CWT1-448
Split 2, loss train 0.07, score train 0.46, loss val 0.05 score val 0.53
Shutting down background jobs, please wait a moment...
Done!
Waiting for the remaining 10 operations to synchronize with Neptune. Do not kill this process.
All 10 operations synced, thanks for waiting!
Explore the metadata in the Neptune app:
https://app.neptune.ai/ba-final/cwt-1/e/CWT1-448/metadata
https://app.neptune.ai/ba-final/cwt-1/e/CWT1-449
Split 3, loss train 0.07, score train 0.46, loss val 0.06 score val 0.51
Shutting down background jobs, please wait a moment...
Done!
Waiting for the remaining 10 operations to synchronize with Neptune. Do not kill this process.
All 10 operations synced, thanks for waiting!
Explore the metadata in the Neptune app:
https://app.neptune.ai/ba-final/cwt-1/e/CWT1-449/metadata
https://app.neptune.ai/ba-final/cwt-1/e/CWT1-450
Split 4, loss train 0.06, score train 0.47, loss val 0.10 score val 0.45
Shutting down background jobs, please wait a moment...
Done!
Waiting for the remaining 10 operations to synchronize with Neptune. Do not kill this process.
All 10 operations synced, thanks for waiting!
Explore the metadata in the Neptune app:
https://app.neptune.ai/ba-final/cwt-1/e/CWT1-450/metadata
[32m[I 2023-09-04 22:43:17,457][0m Trial 76 finished with value: 0.09337336357603682 and parameters: {'b': 2.7, 'fc': 1.75, 'scale_min': 1.2000000000000002, 'scale_max': 44, 'n_scales': 160, 'drop': 0.2590568275837348, 'optimizer': 'Adam', 'lr': 0.0009480543890794245, 'weight_decay': 0.012068280120259914, 'batch_size': 32, 'epochs': 100}. Best is trial 73 with value: 0.0556401790456569.[0m
trial 76, loss train mean 0.07, score train mean 0.46, loss val mean 0.09, score val mean 0.41



End Time   : Mo 4. Sep 22:43:19 CEST 2023
Duration   : 15232.471892558 seconds

Start Time : Mo 4. Sep 22:56:35 CEST 2023
Job ID: 1156558
Node: cc1g07
Partition: gpu_normal_stud
CPU cores: 16
Memory: 98304
GPUs: 0
Python environment: khoa                  *  /home/phamanh/anaconda3/envs/khoa
Current work directory: /home/phamanh/Schreibtisch/bachelorarbeit/im_CNN

device: cuda


https://app.neptune.ai/ba-final/cwt-1/e/CWT1-451
Split 0, loss train 0.06, score train 0.50, loss val 0.08 score val 0.42
Shutting down background jobs, please wait a moment...
Done!
Waiting for the remaining 10 operations to synchronize with Neptune. Do not kill this process.
All 10 operations synced, thanks for waiting!
Explore the metadata in the Neptune app:
https://app.neptune.ai/ba-final/cwt-1/e/CWT1-451/metadata
https://app.neptune.ai/ba-final/cwt-1/e/CWT1-452
Split 1, loss train 0.06, score train 0.49, loss val 0.07 score val 0.42
Shutting down background jobs, please wait a moment...
Done!
Waiting for the remaining 10 operations to synchronize with Neptune. Do not kill this process.
All 10 operations synced, thanks for waiting!
Explore the metadata in the Neptune app:
https://app.neptune.ai/ba-final/cwt-1/e/CWT1-452/metadata
https://app.neptune.ai/ba-final/cwt-1/e/CWT1-453
Split 2, loss train 0.06, score train 0.47, loss val 0.06 score val 0.57
Shutting down background jobs, please wait a moment...
Done!
Waiting for the remaining 10 operations to synchronize with Neptune. Do not kill this process.
All 10 operations synced, thanks for waiting!
Explore the metadata in the Neptune app:
https://app.neptune.ai/ba-final/cwt-1/e/CWT1-453/metadata
https://app.neptune.ai/ba-final/cwt-1/e/CWT1-454
Split 3, loss train 0.06, score train 0.48, loss val 0.08 score val 0.44
Shutting down background jobs, please wait a moment...
Done!
Waiting for the remaining 10 operations to synchronize with Neptune. Do not kill this process.
All 10 operations synced, thanks for waiting!
Explore the metadata in the Neptune app:
https://app.neptune.ai/ba-final/cwt-1/e/CWT1-454/metadata
https://app.neptune.ai/ba-final/cwt-1/e/CWT1-455
Split 4, loss train 0.06, score train 0.49, loss val 0.06 score val 0.56
Shutting down background jobs, please wait a moment...
Done!
Waiting for the remaining 10 operations to synchronize with Neptune. Do not kill this process.
All 10 operations synced, thanks for waiting!
Explore the metadata in the Neptune app:
https://app.neptune.ai/ba-final/cwt-1/e/CWT1-455/metadata
[32m[I 2023-09-05 03:48:53,669][0m Trial 77 finished with value: 0.07017990071722802 and parameters: {'b': 2.0, 'fc': 0.75, 'scale_min': 0.7, 'scale_max': 38, 'n_scales': 225, 'drop': 0.2590568275837348, 'optimizer': 'Adam', 'lr': 0.000598218859886187, 'weight_decay': 0.005613837383344997, 'batch_size': 32, 'epochs': 100}. Best is trial 73 with value: 0.0556401790456569.[0m
trial 77, loss train mean 0.06, score train mean 0.49, loss val mean 0.07, score val mean 0.48



End Time   : Di 5. Sep 03:48:56 CEST 2023
Duration   : 17541.210516141 seconds

Start Time : Di 5. Sep 03:48:57 CEST 2023
Job ID: 1156559
Node: cc1g07
Partition: gpu_normal_stud
CPU cores: 16
Memory: 98304
GPUs: 0
Python environment: khoa                  *  /home/phamanh/anaconda3/envs/khoa
Current work directory: /home/phamanh/Schreibtisch/bachelorarbeit/im_CNN

device: cuda


https://app.neptune.ai/ba-final/cwt-1/e/CWT1-456
Split 0, loss train 0.07, score train 0.46, loss val 0.09 score val 0.40
Shutting down background jobs, please wait a moment...
Done!
Waiting for the remaining 9 operations to synchronize with Neptune. Do not kill this process.
All 9 operations synced, thanks for waiting!
Explore the metadata in the Neptune app:
https://app.neptune.ai/ba-final/cwt-1/e/CWT1-456/metadata
https://app.neptune.ai/ba-final/cwt-1/e/CWT1-457
Split 1, loss train 0.07, score train 0.46, loss val 0.07 score val 0.50
Shutting down background jobs, please wait a moment...
Done!
Waiting for the remaining 10 operations to synchronize with Neptune. Do not kill this process.
All 10 operations synced, thanks for waiting!
Explore the metadata in the Neptune app:
https://app.neptune.ai/ba-final/cwt-1/e/CWT1-457/metadata
https://app.neptune.ai/ba-final/cwt-1/e/CWT1-458
Split 2, loss train 0.07, score train 0.45, loss val 0.06 score val 0.44
Shutting down background jobs, please wait a moment...
Done!
Waiting for the remaining 10 operations to synchronize with Neptune. Do not kill this process.
All 10 operations synced, thanks for waiting!
Explore the metadata in the Neptune app:
https://app.neptune.ai/ba-final/cwt-1/e/CWT1-458/metadata
https://app.neptune.ai/ba-final/cwt-1/e/CWT1-459
Split 3, loss train 0.08, score train 0.44, loss val 0.08 score val 0.44
Shutting down background jobs, please wait a moment...
Done!
Waiting for the remaining 10 operations to synchronize with Neptune. Do not kill this process.
All 10 operations synced, thanks for waiting!
Explore the metadata in the Neptune app:
https://app.neptune.ai/ba-final/cwt-1/e/CWT1-459/metadata
https://app.neptune.ai/ba-final/cwt-1/e/CWT1-460
Split 4, loss train 0.07, score train 0.46, loss val 0.05 score val 0.50
Shutting down background jobs, please wait a moment...
Done!
Waiting for the remaining 10 operations to synchronize with Neptune. Do not kill this process.
All 10 operations synced, thanks for waiting!
Explore the metadata in the Neptune app:
https://app.neptune.ai/ba-final/cwt-1/e/CWT1-460/metadata
[32m[I 2023-09-05 07:00:50,085][0m Trial 78 finished with value: 0.06992876276056817 and parameters: {'b': 1.1, 'fc': 2.0, 'scale_min': 1.1, 'scale_max': 20, 'n_scales': 115, 'drop': 0.40132770981445803, 'optimizer': 'Adam', 'lr': 0.0007694031270753042, 'weight_decay': 0.02649569786838367, 'batch_size': 32, 'epochs': 100}. Best is trial 73 with value: 0.0556401790456569.[0m
trial 78, loss train mean 0.07, score train mean 0.45, loss val mean 0.07, score val mean 0.46



End Time   : Di 5. Sep 07:00:53 CEST 2023
Duration   : 11515.250201796 seconds

Start Time : Di 5. Sep 07:01:01 CEST 2023
Job ID: 1156560
Node: cc1g07
Partition: gpu_normal_stud
CPU cores: 16
Memory: 98304
GPUs: 0
Python environment: khoa                  *  /home/phamanh/anaconda3/envs/khoa
Current work directory: /home/phamanh/Schreibtisch/bachelorarbeit/im_CNN

device: cuda


https://app.neptune.ai/ba-final/cwt-1/e/CWT1-461
Split 0, loss train 0.07, score train 0.46, loss val 0.14 score val 0.26
Shutting down background jobs, please wait a moment...
Done!
Waiting for the remaining 10 operations to synchronize with Neptune. Do not kill this process.
All 10 operations synced, thanks for waiting!
Explore the metadata in the Neptune app:
https://app.neptune.ai/ba-final/cwt-1/e/CWT1-461/metadata
https://app.neptune.ai/ba-final/cwt-1/e/CWT1-462
Split 1, loss train 0.07, score train 0.46, loss val 0.05 score val 0.50
Shutting down background jobs, please wait a moment...
Done!
Waiting for the remaining 14 operations to synchronize with Neptune. Do not kill this process.
All 14 operations synced, thanks for waiting!
Explore the metadata in the Neptune app:
https://app.neptune.ai/ba-final/cwt-1/e/CWT1-462/metadata
https://app.neptune.ai/ba-final/cwt-1/e/CWT1-463
Split 2, loss train 0.07, score train 0.44, loss val 0.08 score val 0.49
Shutting down background jobs, please wait a moment...
Done!
Waiting for the remaining 10 operations to synchronize with Neptune. Do not kill this process.
All 10 operations synced, thanks for waiting!
Explore the metadata in the Neptune app:
https://app.neptune.ai/ba-final/cwt-1/e/CWT1-463/metadata
https://app.neptune.ai/ba-final/cwt-1/e/CWT1-464
Split 3, loss train 0.07, score train 0.46, loss val 0.07 score val 0.36
Shutting down background jobs, please wait a moment...
Done!
Waiting for the remaining 14 operations to synchronize with Neptune. Do not kill this process.
All 14 operations synced, thanks for waiting!
Explore the metadata in the Neptune app:
https://app.neptune.ai/ba-final/cwt-1/e/CWT1-464/metadata
https://app.neptune.ai/ba-final/cwt-1/e/CWT1-465
Split 4, loss train 0.07, score train 0.47, loss val 0.07 score val 0.35
Shutting down background jobs, please wait a moment...
Done!
Waiting for the remaining 10 operations to synchronize with Neptune. Do not kill this process.
All 10 operations synced, thanks for waiting!
Explore the metadata in the Neptune app:
https://app.neptune.ai/ba-final/cwt-1/e/CWT1-465/metadata
[32m[I 2023-09-05 10:16:19,483][0m Trial 79 finished with value: 0.08373821948436981 and parameters: {'b': 2.9000000000000004, 'fc': 1.8, 'scale_min': 2.3, 'scale_max': 14, 'n_scales': 130, 'drop': 0.635407796573942, 'optimizer': 'Adam', 'lr': 0.0009480543890794245, 'weight_decay': 0.013143326029169615, 'batch_size': 32, 'epochs': 100}. Best is trial 73 with value: 0.0556401790456569.[0m
trial 79, loss train mean 0.07, score train mean 0.46, loss val mean 0.08, score val mean 0.39



End Time   : Di 5. Sep 10:16:21 CEST 2023
Duration   : 11720.133900629 seconds

Start Time : Di 5. Sep 10:16:43 CEST 2023
Job ID: 1156561
Node: cc1g06
Partition: gpu_normal_stud
CPU cores: 16
Memory: 98304
GPUs: 0
Python environment: khoa                  *  /home/phamanh/anaconda3/envs/khoa
Current work directory: /home/phamanh/Schreibtisch/bachelorarbeit/im_CNN

device: cuda


https://app.neptune.ai/ba-final/cwt-1/e/CWT1-466
Shutting down background jobs, please wait a moment...
Done!
Waiting for the remaining 3 operations to synchronize with Neptune. Do not kill this process.
All 3 operations synced, thanks for waiting!
Explore the metadata in the Neptune app:
https://app.neptune.ai/ba-final/cwt-1/e/CWT1-466/metadata
[32m[I 2023-09-05 12:52:07,101][0m Trial 80 pruned. [0m

End Time   : Di 5. Sep 12:52:11 CEST 2023
Duration   : 9328.457459845 seconds

Start Time : Di 5. Sep 12:52:19 CEST 2023
Job ID: 1156562
Node: cc1g05
Partition: gpu_normal_stud
CPU cores: 16
Memory: 98304
GPUs: 0
Python environment: khoa                  *  /home/phamanh/anaconda3/envs/khoa
Current work directory: /home/phamanh/Schreibtisch/bachelorarbeit/im_CNN

device: cuda


https://app.neptune.ai/ba-final/cwt-1/e/CWT1-467
Split 0, loss train 0.06, score train 0.49, loss val 0.09 score val 0.51
Shutting down background jobs, please wait a moment...
Done!
Waiting for the remaining 14 operations to synchronize with Neptune. Do not kill this process.
All 14 operations synced, thanks for waiting!
Explore the metadata in the Neptune app:
https://app.neptune.ai/ba-final/cwt-1/e/CWT1-467/metadata
https://app.neptune.ai/ba-final/cwt-1/e/CWT1-468
Split 1, loss train 0.06, score train 0.49, loss val 0.08 score val 0.36
Shutting down background jobs, please wait a moment...
Done!
Waiting for the remaining 14 operations to synchronize with Neptune. Do not kill this process.
All 14 operations synced, thanks for waiting!
Explore the metadata in the Neptune app:
https://app.neptune.ai/ba-final/cwt-1/e/CWT1-468/metadata
https://app.neptune.ai/ba-final/cwt-1/e/CWT1-469
Split 2, loss train 0.06, score train 0.47, loss val 0.05 score val 0.45
Shutting down background jobs, please wait a moment...
Done!
Waiting for the remaining 14 operations to synchronize with Neptune. Do not kill this process.
All 14 operations synced, thanks for waiting!
Explore the metadata in the Neptune app:
https://app.neptune.ai/ba-final/cwt-1/e/CWT1-469/metadata
https://app.neptune.ai/ba-final/cwt-1/e/CWT1-470
Split 3, loss train 0.06, score train 0.48, loss val 0.12 score val 0.20
Shutting down background jobs, please wait a moment...
Done!
Waiting for the remaining 10 operations to synchronize with Neptune. Do not kill this process.
All 10 operations synced, thanks for waiting!
Explore the metadata in the Neptune app:
https://app.neptune.ai/ba-final/cwt-1/e/CWT1-470/metadata
https://app.neptune.ai/ba-final/cwt-1/e/CWT1-471
Split 4, loss train 0.06, score train 0.49, loss val 0.08 score val 0.33
Shutting down background jobs, please wait a moment...
Done!
Waiting for the remaining 10 operations to synchronize with Neptune. Do not kill this process.
All 10 operations synced, thanks for waiting!
Explore the metadata in the Neptune app:
https://app.neptune.ai/ba-final/cwt-1/e/CWT1-471/metadata
