[32m[I 2023-09-05 18:10:40,176][0m Trial 81 finished with value: 0.0852929135586353 and parameters: {'b': 1.6, 'fc': 1.75, 'scale_min': 0.6, 'scale_max': 32, 'n_scales': 245, 'drop': 0.698674521485562, 'optimizer': 'Adam', 'lr': 0.0006541237829163462, 'weight_decay': 0.004391300872771227, 'batch_size': 32, 'epochs': 100}. Best is trial 73 with value: 0.0556401790456569.[0m
trial 81, loss train mean 0.06, score train mean 0.48, loss val mean 0.09, score val mean 0.37



End Time   : Di 5. Sep 18:10:42 CEST 2023
Duration   : 19103.237564292 seconds

Start Time : Di 5. Sep 18:07:10 CEST 2023
Job ID: 1156563
Node: cc1g02
Partition: gpu_normal_stud
CPU cores: 16
Memory: 98304
GPUs: 0
Python environment: khoa                  *  /home/phamanh/anaconda3/envs/khoa
Current work directory: /home/phamanh/Schreibtisch/bachelorarbeit/im_CNN

device: cuda


https://app.neptune.ai/ba-final/cwt-1/e/CWT1-472
Split 0, loss train 0.06, score train 0.49, loss val 0.07 score val 0.34
Shutting down background jobs, please wait a moment...
Done!
Waiting for the remaining 10 operations to synchronize with Neptune. Do not kill this process.
All 10 operations synced, thanks for waiting!
Explore the metadata in the Neptune app:
https://app.neptune.ai/ba-final/cwt-1/e/CWT1-472/metadata
https://app.neptune.ai/ba-final/cwt-1/e/CWT1-473
Split 1, loss train 0.06, score train 0.50, loss val 0.05 score val 0.55
Shutting down background jobs, please wait a moment...
Done!
Waiting for the remaining 10 operations to synchronize with Neptune. Do not kill this process.
All 10 operations synced, thanks for waiting!
Explore the metadata in the Neptune app:
https://app.neptune.ai/ba-final/cwt-1/e/CWT1-473/metadata
https://app.neptune.ai/ba-final/cwt-1/e/CWT1-474
Split 2, loss train 0.06, score train 0.47, loss val 0.07 score val 0.51
Shutting down background jobs, please wait a moment...
Done!
Waiting for the remaining 10 operations to synchronize with Neptune. Do not kill this process.
All 10 operations synced, thanks for waiting!
Explore the metadata in the Neptune app:
https://app.neptune.ai/ba-final/cwt-1/e/CWT1-474/metadata
https://app.neptune.ai/ba-final/cwt-1/e/CWT1-475
Split 3, loss train 0.06, score train 0.48, loss val 0.04 score val 0.56
Shutting down background jobs, please wait a moment...
Done!
Waiting for the remaining 10 operations to synchronize with Neptune. Do not kill this process.
All 10 operations synced, thanks for waiting!
Explore the metadata in the Neptune app:
https://app.neptune.ai/ba-final/cwt-1/e/CWT1-475/metadata
https://app.neptune.ai/ba-final/cwt-1/e/CWT1-476
Split 4, loss train 0.06, score train 0.48, loss val 0.07 score val 0.43
Shutting down background jobs, please wait a moment...
Done!
Waiting for the remaining 10 operations to synchronize with Neptune. Do not kill this process.
All 10 operations synced, thanks for waiting!
Explore the metadata in the Neptune app:
https://app.neptune.ai/ba-final/cwt-1/e/CWT1-476/metadata
[32m[I 2023-09-05 22:28:59,132][0m Trial 82 finished with value: 0.061187252592533194 and parameters: {'b': 2.0, 'fc': 1.9000000000000001, 'scale_min': 0.8, 'scale_max': 36, 'n_scales': 210, 'drop': 0.635407796573942, 'optimizer': 'Adam', 'lr': 0.0005396446298559371, 'weight_decay': 0.007084419467871519, 'batch_size': 32, 'epochs': 100}. Best is trial 73 with value: 0.0556401790456569.[0m
trial 82, loss train mean 0.06, score train mean 0.48, loss val mean 0.06, score val mean 0.48



End Time   : Di 5. Sep 22:29:01 CEST 2023
Duration   : 15710.912203852 seconds

Start Time : Di 5. Sep 22:32:36 CEST 2023
Job ID: 1156564
Node: cc1g07
Partition: gpu_normal_stud
CPU cores: 16
Memory: 98304
GPUs: 0
Python environment: khoa                  *  /home/phamanh/anaconda3/envs/khoa
Current work directory: /home/phamanh/Schreibtisch/bachelorarbeit/im_CNN

device: cuda


https://app.neptune.ai/ba-final/cwt-1/e/CWT1-477
Split 0, loss train 0.06, score train 0.48, loss val 0.14 score val 0.16
Shutting down background jobs, please wait a moment...
Done!
Waiting for the remaining 10 operations to synchronize with Neptune. Do not kill this process.
All 10 operations synced, thanks for waiting!
Explore the metadata in the Neptune app:
https://app.neptune.ai/ba-final/cwt-1/e/CWT1-477/metadata
https://app.neptune.ai/ba-final/cwt-1/e/CWT1-478
Split 1, loss train 0.06, score train 0.48, loss val 0.04 score val 0.53
Shutting down background jobs, please wait a moment...
Done!
Waiting for the remaining 10 operations to synchronize with Neptune. Do not kill this process.
All 10 operations synced, thanks for waiting!
Explore the metadata in the Neptune app:
https://app.neptune.ai/ba-final/cwt-1/e/CWT1-478/metadata
https://app.neptune.ai/ba-final/cwt-1/e/CWT1-479
Split 2, loss train 0.06, score train 0.46, loss val 0.05 score val 0.64
Shutting down background jobs, please wait a moment...
Done!
Waiting for the remaining 10 operations to synchronize with Neptune. Do not kill this process.
All 10 operations synced, thanks for waiting!
Explore the metadata in the Neptune app:
https://app.neptune.ai/ba-final/cwt-1/e/CWT1-479/metadata
https://app.neptune.ai/ba-final/cwt-1/e/CWT1-480
Split 3, loss train 0.06, score train 0.46, loss val 0.07 score val 0.26
Shutting down background jobs, please wait a moment...
Done!
Waiting for the remaining 10 operations to synchronize with Neptune. Do not kill this process.
All 10 operations synced, thanks for waiting!
Explore the metadata in the Neptune app:
https://app.neptune.ai/ba-final/cwt-1/e/CWT1-480/metadata
https://app.neptune.ai/ba-final/cwt-1/e/CWT1-481
Split 4, loss train 0.06, score train 0.48, loss val 0.06 score val 0.42
Shutting down background jobs, please wait a moment...
Done!
Waiting for the remaining 10 operations to synchronize with Neptune. Do not kill this process.
All 10 operations synced, thanks for waiting!
Explore the metadata in the Neptune app:
https://app.neptune.ai/ba-final/cwt-1/e/CWT1-481/metadata
[32m[I 2023-09-06 03:11:38,298][0m Trial 83 finished with value: 0.07198231575336862 and parameters: {'b': 2.4000000000000004, 'fc': 1.9500000000000002, 'scale_min': 0.9, 'scale_max': 40, 'n_scales': 215, 'drop': 0.6464636032265877, 'optimizer': 'Adam', 'lr': 0.0008814693617926619, 'weight_decay': 0.006182938611365838, 'batch_size': 32, 'epochs': 100}. Best is trial 73 with value: 0.0556401790456569.[0m
trial 83, loss train mean 0.06, score train mean 0.47, loss val mean 0.07, score val mean 0.40



End Time   : Mi 6. Sep 03:11:40 CEST 2023
Duration   : 16744.244733135 seconds

Start Time : Mi 6. Sep 03:11:42 CEST 2023
Job ID: 1156565
Node: cc1g07
Partition: gpu_normal_stud
CPU cores: 16
Memory: 98304
GPUs: 0
Python environment: khoa                  *  /home/phamanh/anaconda3/envs/khoa
Current work directory: /home/phamanh/Schreibtisch/bachelorarbeit/im_CNN

device: cuda


https://app.neptune.ai/ba-final/cwt-1/e/CWT1-482
Split 0, loss train 0.06, score train 0.47, loss val 0.09 score val 0.28
Shutting down background jobs, please wait a moment...
Done!
Waiting for the remaining 14 operations to synchronize with Neptune. Do not kill this process.
All 14 operations synced, thanks for waiting!
Explore the metadata in the Neptune app:
https://app.neptune.ai/ba-final/cwt-1/e/CWT1-482/metadata
https://app.neptune.ai/ba-final/cwt-1/e/CWT1-483
Split 1, loss train 0.07, score train 0.46, loss val 0.06 score val 0.59
Shutting down background jobs, please wait a moment...
Done!
Waiting for the remaining 10 operations to synchronize with Neptune. Do not kill this process.
All 10 operations synced, thanks for waiting!
Explore the metadata in the Neptune app:
https://app.neptune.ai/ba-final/cwt-1/e/CWT1-483/metadata
https://app.neptune.ai/ba-final/cwt-1/e/CWT1-484
Split 2, loss train 0.07, score train 0.45, loss val 0.05 score val 0.57
Shutting down background jobs, please wait a moment...
Done!
Waiting for the remaining 10 operations to synchronize with Neptune. Do not kill this process.
All 10 operations synced, thanks for waiting!
Explore the metadata in the Neptune app:
https://app.neptune.ai/ba-final/cwt-1/e/CWT1-484/metadata
https://app.neptune.ai/ba-final/cwt-1/e/CWT1-485
Split 3, loss train 0.07, score train 0.47, loss val 0.07 score val 0.34
Shutting down background jobs, please wait a moment...
Done!
Waiting for the remaining 10 operations to synchronize with Neptune. Do not kill this process.
All 10 operations synced, thanks for waiting!
Explore the metadata in the Neptune app:
https://app.neptune.ai/ba-final/cwt-1/e/CWT1-485/metadata
https://app.neptune.ai/ba-final/cwt-1/e/CWT1-486
Split 4, loss train 0.06, score train 0.47, loss val 0.05 score val 0.61
Shutting down background jobs, please wait a moment...
Done!
Waiting for the remaining 14 operations to synchronize with Neptune. Do not kill this process.
All 14 operations synced, thanks for waiting!
Explore the metadata in the Neptune app:
https://app.neptune.ai/ba-final/cwt-1/e/CWT1-486/metadata
[32m[I 2023-09-06 07:48:19,748][0m Trial 84 finished with value: 0.06403625163626163 and parameters: {'b': 2.05, 'fc': 2.1, 'scale_min': 0.9, 'scale_max': 40, 'n_scales': 210, 'drop': 0.7545692138098231, 'optimizer': 'Adam', 'lr': 0.0008814693617926619, 'weight_decay': 0.007644232676931715, 'batch_size': 32, 'epochs': 100}. Best is trial 73 with value: 0.0556401790456569.[0m
trial 84, loss train mean 0.07, score train mean 0.46, loss val mean 0.06, score val mean 0.48



End Time   : Mi 6. Sep 07:48:22 CEST 2023
Duration   : 16599.997734582 seconds

Start Time : Mi 6. Sep 07:48:23 CEST 2023
Job ID: 1156566
Node: cc1g04
Partition: gpu_normal_stud
CPU cores: 16
Memory: 98304
GPUs: 0
Python environment: khoa                  *  /home/phamanh/anaconda3/envs/khoa
Current work directory: /home/phamanh/Schreibtisch/bachelorarbeit/im_CNN

device: cuda


https://app.neptune.ai/ba-final/cwt-1/e/CWT1-487
Split 0, loss train 0.05, score train 0.50, loss val 0.06 score val 0.54
Shutting down background jobs, please wait a moment...
Done!
Waiting for the remaining 10 operations to synchronize with Neptune. Do not kill this process.
All 10 operations synced, thanks for waiting!
Explore the metadata in the Neptune app:
https://app.neptune.ai/ba-final/cwt-1/e/CWT1-487/metadata
https://app.neptune.ai/ba-final/cwt-1/e/CWT1-488
Split 1, loss train 0.05, score train 0.50, loss val 0.03 score val 0.55
Shutting down background jobs, please wait a moment...
Done!
Waiting for the remaining 10 operations to synchronize with Neptune. Do not kill this process.
All 10 operations synced, thanks for waiting!
Explore the metadata in the Neptune app:
https://app.neptune.ai/ba-final/cwt-1/e/CWT1-488/metadata
https://app.neptune.ai/ba-final/cwt-1/e/CWT1-489
Split 2, loss train 0.06, score train 0.48, loss val 0.03 score val 0.60
Shutting down background jobs, please wait a moment...
Done!
Waiting for the remaining 10 operations to synchronize with Neptune. Do not kill this process.
All 10 operations synced, thanks for waiting!
Explore the metadata in the Neptune app:
https://app.neptune.ai/ba-final/cwt-1/e/CWT1-489/metadata
https://app.neptune.ai/ba-final/cwt-1/e/CWT1-490
Split 3, loss train 0.06, score train 0.49, loss val 0.05 score val 0.52
Shutting down background jobs, please wait a moment...
Done!
Waiting for the remaining 10 operations to synchronize with Neptune. Do not kill this process.
All 10 operations synced, thanks for waiting!
Explore the metadata in the Neptune app:
https://app.neptune.ai/ba-final/cwt-1/e/CWT1-490/metadata
https://app.neptune.ai/ba-final/cwt-1/e/CWT1-491
Split 4, loss train 0.05, score train 0.50, loss val 0.05 score val 0.57
Shutting down background jobs, please wait a moment...
Done!
Waiting for the remaining 10 operations to synchronize with Neptune. Do not kill this process.
All 10 operations synced, thanks for waiting!
Explore the metadata in the Neptune app:
https://app.neptune.ai/ba-final/cwt-1/e/CWT1-491/metadata
[32m[I 2023-09-06 12:08:39,938][0m Trial 85 finished with value: 0.04277383215883945 and parameters: {'b': 2.05, 'fc': 2.4000000000000004, 'scale_min': 0.9, 'scale_max': 40, 'n_scales': 195, 'drop': 0.3006541491680656, 'optimizer': 'Adam', 'lr': 0.0005748378494523119, 'weight_decay': 0.003280294721647609, 'batch_size': 32, 'epochs': 100}. Best is trial 85 with value: 0.04277383215883945.[0m
trial 85, loss train mean 0.05, score train mean 0.49, loss val mean 0.04, score val mean 0.56



End Time   : Mi 6. Sep 12:08:41 CEST 2023
Duration   : 15617.646009981 seconds

Start Time : Mi 6. Sep 12:08:42 CEST 2023
Job ID: 1156567
Node: cc1g06
Partition: gpu_normal_stud
CPU cores: 16
Memory: 98304
GPUs: 0
Python environment: khoa                  *  /home/phamanh/anaconda3/envs/khoa
Current work directory: /home/phamanh/Schreibtisch/bachelorarbeit/im_CNN

device: cuda


https://app.neptune.ai/ba-final/cwt-1/e/CWT1-492
Split 0, loss train 0.05, score train 0.50, loss val 0.04 score val 0.65
Shutting down background jobs, please wait a moment...
Done!
Waiting for the remaining 10 operations to synchronize with Neptune. Do not kill this process.
All 10 operations synced, thanks for waiting!
Explore the metadata in the Neptune app:
https://app.neptune.ai/ba-final/cwt-1/e/CWT1-492/metadata
https://app.neptune.ai/ba-final/cwt-1/e/CWT1-493
Split 1, loss train 0.06, score train 0.49, loss val 0.08 score val 0.51
Shutting down background jobs, please wait a moment...
Done!
Waiting for the remaining 14 operations to synchronize with Neptune. Do not kill this process.
All 14 operations synced, thanks for waiting!
Explore the metadata in the Neptune app:
https://app.neptune.ai/ba-final/cwt-1/e/CWT1-493/metadata
https://app.neptune.ai/ba-final/cwt-1/e/CWT1-494
Split 2, loss train 0.06, score train 0.48, loss val 0.04 score val 0.62
Shutting down background jobs, please wait a moment...
Done!
Waiting for the remaining 10 operations to synchronize with Neptune. Do not kill this process.
All 10 operations synced, thanks for waiting!
Explore the metadata in the Neptune app:
https://app.neptune.ai/ba-final/cwt-1/e/CWT1-494/metadata
https://app.neptune.ai/ba-final/cwt-1/e/CWT1-495
Split 3, loss train 0.06, score train 0.48, loss val 0.04 score val 0.53
Shutting down background jobs, please wait a moment...
Done!
Waiting for the remaining 10 operations to synchronize with Neptune. Do not kill this process.
All 10 operations synced, thanks for waiting!
Explore the metadata in the Neptune app:
https://app.neptune.ai/ba-final/cwt-1/e/CWT1-495/metadata
https://app.neptune.ai/ba-final/cwt-1/e/CWT1-496
Split 4, loss train 0.05, score train 0.50, loss val 0.07 score val 0.39
Shutting down background jobs, please wait a moment...
Done!
Waiting for the remaining 10 operations to synchronize with Neptune. Do not kill this process.
All 10 operations synced, thanks for waiting!
Explore the metadata in the Neptune app:
https://app.neptune.ai/ba-final/cwt-1/e/CWT1-496/metadata
[32m[I 2023-09-06 15:43:12,507][0m Trial 86 finished with value: 0.051434111595153806 and parameters: {'b': 2.45, 'fc': 2.4000000000000004, 'scale_min': 1.7000000000000002, 'scale_max': 10, 'n_scales': 195, 'drop': 0.3006541491680656, 'optimizer': 'Adam', 'lr': 0.0008658725619064079, 'weight_decay': 0.002290890469853299, 'batch_size': 32, 'epochs': 100}. Best is trial 85 with value: 0.04277383215883945.[0m
trial 86, loss train mean 0.06, score train mean 0.49, loss val mean 0.05, score val mean 0.54



End Time   : Mi 6. Sep 15:43:14 CEST 2023
Duration   : 12871.682165729 seconds

Start Time : Mi 6. Sep 16:30:31 CEST 2023
Job ID: 1157404
Node: cc1g04
Partition: gpu_normal_stud
CPU cores: 16
Memory: 98304
GPUs: 0
Python environment: khoa                  *  /home/phamanh/anaconda3/envs/khoa
Current work directory: /home/phamanh/Schreibtisch/bachelorarbeit/im_CNN

device: cuda


https://app.neptune.ai/ba-final/cwt-1/e/CWT1-497
Split 0, loss train 0.06, score train 0.49, loss val 0.04 score val 0.57
Shutting down background jobs, please wait a moment...
Done!
Waiting for the remaining 10 operations to synchronize with Neptune. Do not kill this process.
All 10 operations synced, thanks for waiting!
Explore the metadata in the Neptune app:
https://app.neptune.ai/ba-final/cwt-1/e/CWT1-497/metadata
https://app.neptune.ai/ba-final/cwt-1/e/CWT1-498
Split 1, loss train 0.06, score train 0.49, loss val 0.09 score val 0.51
Shutting down background jobs, please wait a moment...
Done!
Waiting for the remaining 10 operations to synchronize with Neptune. Do not kill this process.
All 10 operations synced, thanks for waiting!
Explore the metadata in the Neptune app:
https://app.neptune.ai/ba-final/cwt-1/e/CWT1-498/metadata
https://app.neptune.ai/ba-final/cwt-1/e/CWT1-499
Split 2, loss train 0.06, score train 0.47, loss val 0.04 score val 0.65
Shutting down background jobs, please wait a moment...
Done!
Waiting for the remaining 10 operations to synchronize with Neptune. Do not kill this process.
All 10 operations synced, thanks for waiting!
Explore the metadata in the Neptune app:
https://app.neptune.ai/ba-final/cwt-1/e/CWT1-499/metadata
https://app.neptune.ai/ba-final/cwt-1/e/CWT1-500
Split 3, loss train 0.06, score train 0.48, loss val 0.05 score val 0.57
Shutting down background jobs, please wait a moment...
Done!
Waiting for the remaining 10 operations to synchronize with Neptune. Do not kill this process.
All 10 operations synced, thanks for waiting!
Explore the metadata in the Neptune app:
https://app.neptune.ai/ba-final/cwt-1/e/CWT1-500/metadata
https://app.neptune.ai/ba-final/cwt-1/e/CWT1-501
Split 4, loss train 0.06, score train 0.49, loss val 0.05 score val 0.52
Shutting down background jobs, please wait a moment...
Done!
Waiting for the remaining 10 operations to synchronize with Neptune. Do not kill this process.
All 10 operations synced, thanks for waiting!
Explore the metadata in the Neptune app:
https://app.neptune.ai/ba-final/cwt-1/e/CWT1-501/metadata
[32m[I 2023-09-06 20:03:17,159][0m Trial 87 finished with value: 0.052215855679613475 and parameters: {'b': 2.45, 'fc': 2.45, 'scale_min': 0.9, 'scale_max': 10, 'n_scales': 190, 'drop': 0.2981490693627437, 'optimizer': 'Adam', 'lr': 0.0009055402596556113, 'weight_decay': 0.003376325109494383, 'batch_size': 32, 'epochs': 100}. Best is trial 85 with value: 0.04277383215883945.[0m
trial 87, loss train mean 0.06, score train mean 0.49, loss val mean 0.05, score val mean 0.56



End Time   : Mi 6. Sep 20:03:21 CEST 2023
Duration   : 12769.126272764 seconds

Start Time : Mi 6. Sep 20:03:22 CEST 2023
Job ID: 1157405
Node: cc1g07
Partition: gpu_normal_stud
CPU cores: 16
Memory: 98304
GPUs: 0
Python environment: khoa                  *  /home/phamanh/anaconda3/envs/khoa
Current work directory: /home/phamanh/Schreibtisch/bachelorarbeit/im_CNN

device: cuda


https://app.neptune.ai/ba-final/cwt-1/e/CWT1-502
Split 0, loss train 0.06, score train 0.49, loss val 0.08 score val 0.44
Shutting down background jobs, please wait a moment...
Done!
Waiting for the remaining 14 operations to synchronize with Neptune. Do not kill this process.
All 14 operations synced, thanks for waiting!
Explore the metadata in the Neptune app:
https://app.neptune.ai/ba-final/cwt-1/e/CWT1-502/metadata
https://app.neptune.ai/ba-final/cwt-1/e/CWT1-503
Split 1, loss train 0.06, score train 0.49, loss val 0.11 score val 0.46
Shutting down background jobs, please wait a moment...
Done!
Waiting for the remaining 10 operations to synchronize with Neptune. Do not kill this process.
All 10 operations synced, thanks for waiting!
Explore the metadata in the Neptune app:
https://app.neptune.ai/ba-final/cwt-1/e/CWT1-503/metadata
https://app.neptune.ai/ba-final/cwt-1/e/CWT1-504
Split 2, loss train 0.06, score train 0.47, loss val 0.07 score val 0.43
Shutting down background jobs, please wait a moment...
Done!
Waiting for the remaining 10 operations to synchronize with Neptune. Do not kill this process.
All 10 operations synced, thanks for waiting!
Explore the metadata in the Neptune app:
https://app.neptune.ai/ba-final/cwt-1/e/CWT1-504/metadata
https://app.neptune.ai/ba-final/cwt-1/e/CWT1-505
Split 3, loss train 0.06, score train 0.48, loss val 0.03 score val 0.63
Shutting down background jobs, please wait a moment...
Done!
Waiting for the remaining 14 operations to synchronize with Neptune. Do not kill this process.
All 14 operations synced, thanks for waiting!
Explore the metadata in the Neptune app:
https://app.neptune.ai/ba-final/cwt-1/e/CWT1-505/metadata
https://app.neptune.ai/ba-final/cwt-1/e/CWT1-506
Split 4, loss train 0.06, score train 0.48, loss val 0.04 score val 0.64
Shutting down background jobs, please wait a moment...
Done!
Waiting for the remaining 14 operations to synchronize with Neptune. Do not kill this process.
All 14 operations synced, thanks for waiting!
Explore the metadata in the Neptune app:
https://app.neptune.ai/ba-final/cwt-1/e/CWT1-506/metadata
