[32m[I 2023-08-28 16:34:16,114][0m Trial 36 pruned. [0m

End Time   : Mo 28. Aug 16:34:21 CEST 2023
Duration   : 4790.119045524 seconds

Start Time : Mo 28. Aug 18:59:20 CEST 2023
Job ID: 1151111
Node: cc1g03
Partition: gpu_normal_stud
CPU cores: 16
Memory: 98304
GPUs: 0
Python environment: khoa                  *  /home/phamanh/anaconda3/envs/khoa
Current work directory: /home/phamanh/Schreibtisch/bachelorarbeit/im_CNN

device: cuda


https://app.neptune.ai/ba-final/cwt-1/e/CWT1-303
Split 0, loss train 0.09, score train 0.43, loss val 0.11 score val 0.26
Shutting down background jobs, please wait a moment...
Done!
Waiting for the remaining 14 operations to synchronize with Neptune. Do not kill this process.
All 14 operations synced, thanks for waiting!
Explore the metadata in the Neptune app:
https://app.neptune.ai/ba-final/cwt-1/e/CWT1-303/metadata
https://app.neptune.ai/ba-final/cwt-1/e/CWT1-304
Split 1, loss train 0.09, score train 0.43, loss val 0.07 score val 0.47
Shutting down background jobs, please wait a moment...
Done!
Waiting for the remaining 9 operations to synchronize with Neptune. Do not kill this process.
All 9 operations synced, thanks for waiting!
Explore the metadata in the Neptune app:
https://app.neptune.ai/ba-final/cwt-1/e/CWT1-304/metadata
https://app.neptune.ai/ba-final/cwt-1/e/CWT1-305
Split 2, loss train 0.09, score train 0.42, loss val 0.13 score val 0.35
Shutting down background jobs, please wait a moment...
Done!
Waiting for the remaining 10 operations to synchronize with Neptune. Do not kill this process.
All 10 operations synced, thanks for waiting!
Explore the metadata in the Neptune app:
https://app.neptune.ai/ba-final/cwt-1/e/CWT1-305/metadata
https://app.neptune.ai/ba-final/cwt-1/e/CWT1-306
Split 3, loss train 0.10, score train 0.42, loss val 0.13 score val 0.22
Shutting down background jobs, please wait a moment...
Done!
Waiting for the remaining 10 operations to synchronize with Neptune. Do not kill this process.
All 10 operations synced, thanks for waiting!
Explore the metadata in the Neptune app:
https://app.neptune.ai/ba-final/cwt-1/e/CWT1-306/metadata
https://app.neptune.ai/ba-final/cwt-1/e/CWT1-307
Shutting down background jobs, please wait a moment...
Done!
Waiting for the remaining 7 operations to synchronize with Neptune. Do not kill this process.
All 7 operations synced, thanks for waiting!
Explore the metadata in the Neptune app:
https://app.neptune.ai/ba-final/cwt-1/e/CWT1-307/metadata
[32m[I 2023-08-28 22:29:55,005][0m Trial 37 pruned. [0m

End Time   : Mo 28. Aug 22:29:57 CEST 2023
Duration   : 12637.725479427 seconds

Start Time : Mo 28. Aug 22:29:59 CEST 2023
Job ID: 1151112
Node: cc1g03
Partition: gpu_normal_stud
CPU cores: 16
Memory: 98304
GPUs: 0
Python environment: khoa                  *  /home/phamanh/anaconda3/envs/khoa
Current work directory: /home/phamanh/Schreibtisch/bachelorarbeit/im_CNN

device: cuda


https://app.neptune.ai/ba-final/cwt-1/e/CWT1-308
Split 0, loss train 0.07, score train 0.46, loss val 0.11 score val 0.45
Shutting down background jobs, please wait a moment...
Done!
Waiting for the remaining 10 operations to synchronize with Neptune. Do not kill this process.
All 10 operations synced, thanks for waiting!
Explore the metadata in the Neptune app:
https://app.neptune.ai/ba-final/cwt-1/e/CWT1-308/metadata
https://app.neptune.ai/ba-final/cwt-1/e/CWT1-309
Split 1, loss train 0.07, score train 0.45, loss val 0.10 score val 0.40
Shutting down background jobs, please wait a moment...
Done!
Waiting for the remaining 14 operations to synchronize with Neptune. Do not kill this process.
All 14 operations synced, thanks for waiting!
Explore the metadata in the Neptune app:
https://app.neptune.ai/ba-final/cwt-1/e/CWT1-309/metadata
https://app.neptune.ai/ba-final/cwt-1/e/CWT1-310
Split 2, loss train 0.07, score train 0.45, loss val 0.08 score val 0.51
Shutting down background jobs, please wait a moment...
Done!
Waiting for the remaining 10 operations to synchronize with Neptune. Do not kill this process.
All 10 operations synced, thanks for waiting!
Explore the metadata in the Neptune app:
https://app.neptune.ai/ba-final/cwt-1/e/CWT1-310/metadata
https://app.neptune.ai/ba-final/cwt-1/e/CWT1-311
Split 3, loss train 0.07, score train 0.45, loss val 0.05 score val 0.52
Shutting down background jobs, please wait a moment...
Done!
Waiting for the remaining 10 operations to synchronize with Neptune. Do not kill this process.
All 10 operations synced, thanks for waiting!
Explore the metadata in the Neptune app:
https://app.neptune.ai/ba-final/cwt-1/e/CWT1-311/metadata
https://app.neptune.ai/ba-final/cwt-1/e/CWT1-312
Split 4, loss train 0.07, score train 0.46, loss val 0.15 score val 0.35
Shutting down background jobs, please wait a moment...
Done!
Waiting for the remaining 10 operations to synchronize with Neptune. Do not kill this process.
All 10 operations synced, thanks for waiting!
Explore the metadata in the Neptune app:
https://app.neptune.ai/ba-final/cwt-1/e/CWT1-312/metadata
[32m[I 2023-08-29 02:02:50,637][0m Trial 38 finished with value: 0.10007629495985966 and parameters: {'b': 3.6000000000000005, 'fc': 1.6, 'scale_min': 2.4000000000000004, 'scale_max': 24, 'n_scales': 150, 'drop': 0.5746720761483682, 'optimizer': 'Adam', 'lr': 0.0010374756690089077, 'weight_decay': 0.016164669276065115, 'batch_size': 32, 'epochs': 100}. Best is trial 33 with value: 0.05809502500168821.[0m
trial 38, loss train mean 0.07, score train mean 0.45, loss val mean 0.10, score val mean 0.45



End Time   : Di 29. Aug 02:02:52 CEST 2023
Duration   : 12773.445513136 seconds

Start Time : Di 29. Aug 02:03:08 CEST 2023
Job ID: 1151113
Node: cc1g03
Partition: gpu_normal_stud
CPU cores: 16
Memory: 98304
GPUs: 0
Python environment: khoa                  *  /home/phamanh/anaconda3/envs/khoa
Current work directory: /home/phamanh/Schreibtisch/bachelorarbeit/im_CNN

device: cuda


https://app.neptune.ai/ba-final/cwt-1/e/CWT1-313
Shutting down background jobs, please wait a moment...
Done!
Waiting for the remaining 7 operations to synchronize with Neptune. Do not kill this process.
All 7 operations synced, thanks for waiting!
Explore the metadata in the Neptune app:
https://app.neptune.ai/ba-final/cwt-1/e/CWT1-313/metadata
[32m[I 2023-08-29 04:33:50,011][0m Trial 39 pruned. [0m

End Time   : Di 29. Aug 04:33:53 CEST 2023
Duration   : 9045.308717257 seconds

Start Time : Di 29. Aug 04:40:11 CEST 2023
Job ID: 1151114
Node: hades
Partition: gpu_normal_stud
CPU cores: 16
Memory: 98304
GPUs: 0
Python environment: khoa                  *  /home/phamanh/anaconda3/envs/khoa
Current work directory: /home/phamanh/Schreibtisch/bachelorarbeit/im_CNN

device: cuda


https://app.neptune.ai/ba-final/cwt-1/e/CWT1-314
Split 0, loss train 0.06, score train 0.48, loss val 0.14 score val 0.36
Shutting down background jobs, please wait a moment...
Done!
Waiting for the remaining 9 operations to synchronize with Neptune. Do not kill this process.
All 9 operations synced, thanks for waiting!
Explore the metadata in the Neptune app:
https://app.neptune.ai/ba-final/cwt-1/e/CWT1-314/metadata
https://app.neptune.ai/ba-final/cwt-1/e/CWT1-315
Split 1, loss train 0.06, score train 0.48, loss val 0.07 score val 0.39
Shutting down background jobs, please wait a moment...
Done!
Waiting for the remaining 10 operations to synchronize with Neptune. Do not kill this process.
All 10 operations synced, thanks for waiting!
Explore the metadata in the Neptune app:
https://app.neptune.ai/ba-final/cwt-1/e/CWT1-315/metadata
https://app.neptune.ai/ba-final/cwt-1/e/CWT1-316
Split 2, loss train 0.06, score train 0.46, loss val 0.05 score val 0.52
Shutting down background jobs, please wait a moment...
Done!
Waiting for the remaining 10 operations to synchronize with Neptune. Do not kill this process.
All 10 operations synced, thanks for waiting!
Explore the metadata in the Neptune app:
https://app.neptune.ai/ba-final/cwt-1/e/CWT1-316/metadata
https://app.neptune.ai/ba-final/cwt-1/e/CWT1-317
Split 3, loss train 0.06, score train 0.48, loss val 0.07 score val 0.48
Shutting down background jobs, please wait a moment...
Done!
Waiting for the remaining 10 operations to synchronize with Neptune. Do not kill this process.
All 10 operations synced, thanks for waiting!
Explore the metadata in the Neptune app:
https://app.neptune.ai/ba-final/cwt-1/e/CWT1-317/metadata
https://app.neptune.ai/ba-final/cwt-1/e/CWT1-318
Split 4, loss train 0.06, score train 0.48, loss val 0.06 score val 0.51
Shutting down background jobs, please wait a moment...
Done!
Waiting for the remaining 9 operations to synchronize with Neptune. Do not kill this process.
All 9 operations synced, thanks for waiting!
Explore the metadata in the Neptune app:
https://app.neptune.ai/ba-final/cwt-1/e/CWT1-318/metadata
[32m[I 2023-08-29 08:40:40,153][0m Trial 40 finished with value: 0.07678713494158805 and parameters: {'b': 2.7, 'fc': 1.2000000000000002, 'scale_min': 1.9000000000000001, 'scale_max': 14, 'n_scales': 110, 'drop': 0.5746720761483682, 'optimizer': 'Adam', 'lr': 0.0010374756690089077, 'weight_decay': 0.003855326554393807, 'batch_size': 32, 'epochs': 100}. Best is trial 33 with value: 0.05809502500168821.[0m
trial 40, loss train mean 0.06, score train mean 0.48, loss val mean 0.08, score val mean 0.45



End Time   : Di 29. Aug 08:40:42 CEST 2023
Duration   : 14431.199012184 seconds

Start Time : Di 29. Aug 08:40:43 CEST 2023
Job ID: 1151115
Node: hades
Partition: gpu_normal_stud
CPU cores: 16
Memory: 98304
GPUs: 0
Python environment: khoa                  *  /home/phamanh/anaconda3/envs/khoa
Current work directory: /home/phamanh/Schreibtisch/bachelorarbeit/im_CNN

device: cuda


https://app.neptune.ai/ba-final/cwt-1/e/CWT1-319
Shutting down background jobs, please wait a moment...
Done!
Waiting for the remaining 3 operations to synchronize with Neptune. Do not kill this process.
All 3 operations synced, thanks for waiting!
Explore the metadata in the Neptune app:
https://app.neptune.ai/ba-final/cwt-1/e/CWT1-319/metadata
[32m[I 2023-08-29 10:37:25,301][0m Trial 41 pruned. [0m

End Time   : Di 29. Aug 10:37:29 CEST 2023
Duration   : 7005.822193569 seconds

Start Time : Di 29. Aug 10:37:43 CEST 2023
Job ID: 1151116
Node: hades
Partition: gpu_normal_stud
CPU cores: 16
Memory: 98304
GPUs: 0
Python environment: khoa                  *  /home/phamanh/anaconda3/envs/khoa
Current work directory: /home/phamanh/Schreibtisch/bachelorarbeit/im_CNN

device: cuda


https://app.neptune.ai/ba-final/cwt-1/e/CWT1-320
Shutting down background jobs, please wait a moment...
Done!
Waiting for the remaining 7 operations to synchronize with Neptune. Do not kill this process.
All 7 operations synced, thanks for waiting!
Explore the metadata in the Neptune app:
https://app.neptune.ai/ba-final/cwt-1/e/CWT1-320/metadata
[32m[I 2023-08-29 13:20:01,729][0m Trial 42 pruned. [0m

End Time   : Di 29. Aug 13:20:05 CEST 2023
Duration   : 9742.161290717 seconds

Start Time : Di 29. Aug 13:20:06 CEST 2023
Job ID: 1151117
Node: erebos
Partition: gpu_normal_stud
CPU cores: 16
Memory: 98304
GPUs: 0
Python environment: khoa                  *  /home/phamanh/anaconda3/envs/khoa
Current work directory: /home/phamanh/Schreibtisch/bachelorarbeit/im_CNN

device: cuda


https://app.neptune.ai/ba-final/cwt-1/e/CWT1-321
Split 0, loss train 0.07, score train 0.47, loss val 0.05 score val 0.49
Shutting down background jobs, please wait a moment...
Done!
Waiting for the remaining 14 operations to synchronize with Neptune. Do not kill this process.
All 14 operations synced, thanks for waiting!
Explore the metadata in the Neptune app:
https://app.neptune.ai/ba-final/cwt-1/e/CWT1-321/metadata
https://app.neptune.ai/ba-final/cwt-1/e/CWT1-322
Split 1, loss train 0.07, score train 0.46, loss val 0.05 score val 0.58
Shutting down background jobs, please wait a moment...
Done!
Waiting for the remaining 10 operations to synchronize with Neptune. Do not kill this process.
All 10 operations synced, thanks for waiting!
Explore the metadata in the Neptune app:
https://app.neptune.ai/ba-final/cwt-1/e/CWT1-322/metadata
https://app.neptune.ai/ba-final/cwt-1/e/CWT1-323
Split 2, loss train 0.07, score train 0.45, loss val 0.08 score val 0.34
Shutting down background jobs, please wait a moment...
Done!
Waiting for the remaining 10 operations to synchronize with Neptune. Do not kill this process.
All 10 operations synced, thanks for waiting!
Explore the metadata in the Neptune app:
https://app.neptune.ai/ba-final/cwt-1/e/CWT1-323/metadata
https://app.neptune.ai/ba-final/cwt-1/e/CWT1-324
Split 3, loss train 0.07, score train 0.46, loss val 0.09 score val 0.49
Shutting down background jobs, please wait a moment...
Done!
Waiting for the remaining 14 operations to synchronize with Neptune. Do not kill this process.
All 14 operations synced, thanks for waiting!
Explore the metadata in the Neptune app:
https://app.neptune.ai/ba-final/cwt-1/e/CWT1-324/metadata
https://app.neptune.ai/ba-final/cwt-1/e/CWT1-325
Split 4, loss train 0.07, score train 0.46, loss val 0.06 score val 0.47
Shutting down background jobs, please wait a moment...
Done!
Waiting for the remaining 10 operations to synchronize with Neptune. Do not kill this process.
All 10 operations synced, thanks for waiting!
Explore the metadata in the Neptune app:
https://app.neptune.ai/ba-final/cwt-1/e/CWT1-325/metadata
[32m[I 2023-08-29 17:06:18,558][0m Trial 43 finished with value: 0.06524670479145456 and parameters: {'b': 1.25, 'fc': 1.6, 'scale_min': 1.1, 'scale_max': 16, 'n_scales': 135, 'drop': 0.5933921686061265, 'optimizer': 'Adam', 'lr': 0.0007834925954574327, 'weight_decay': 0.017134745686966133, 'batch_size': 32, 'epochs': 100}. Best is trial 33 with value: 0.05809502500168821.[0m
trial 43, loss train mean 0.07, score train mean 0.46, loss val mean 0.07, score val mean 0.47



End Time   : Di 29. Aug 17:06:20 CEST 2023
Duration   : 13573.418565990 seconds

Start Time : Di 29. Aug 17:06:21 CEST 2023
Job ID: 1151118
Node: erebos
Partition: gpu_normal_stud
CPU cores: 16
Memory: 98304
GPUs: 0
Python environment: khoa                  *  /home/phamanh/anaconda3/envs/khoa
Current work directory: /home/phamanh/Schreibtisch/bachelorarbeit/im_CNN

device: cuda


https://app.neptune.ai/ba-final/cwt-1/e/CWT1-326
Split 0, loss train 0.07, score train 0.44, loss val 0.16 score val 0.25
Shutting down background jobs, please wait a moment...
Done!
Waiting for the remaining 10 operations to synchronize with Neptune. Do not kill this process.
All 10 operations synced, thanks for waiting!
Explore the metadata in the Neptune app:
https://app.neptune.ai/ba-final/cwt-1/e/CWT1-326/metadata
https://app.neptune.ai/ba-final/cwt-1/e/CWT1-327
Split 1, loss train 0.08, score train 0.43, loss val 0.36 score val 0.11
Shutting down background jobs, please wait a moment...
Done!
Waiting for the remaining 10 operations to synchronize with Neptune. Do not kill this process.
All 10 operations synced, thanks for waiting!
Explore the metadata in the Neptune app:
https://app.neptune.ai/ba-final/cwt-1/e/CWT1-327/metadata
https://app.neptune.ai/ba-final/cwt-1/e/CWT1-328
Split 2, loss train 0.09, score train 0.42, loss val 0.09 score val 0.49
Shutting down background jobs, please wait a moment...
Done!
Waiting for the remaining 10 operations to synchronize with Neptune. Do not kill this process.
All 10 operations synced, thanks for waiting!
Explore the metadata in the Neptune app:
https://app.neptune.ai/ba-final/cwt-1/e/CWT1-328/metadata
https://app.neptune.ai/ba-final/cwt-1/e/CWT1-329
Split 3, loss train 0.08, score train 0.43, loss val 0.08 score val 0.43
Shutting down background jobs, please wait a moment...
Done!
Waiting for the remaining 14 operations to synchronize with Neptune. Do not kill this process.
All 14 operations synced, thanks for waiting!
Explore the metadata in the Neptune app:
https://app.neptune.ai/ba-final/cwt-1/e/CWT1-329/metadata
https://app.neptune.ai/ba-final/cwt-1/e/CWT1-330
Split 4, loss train 0.08, score train 0.44, loss val 0.06 score val 0.56
Shutting down background jobs, please wait a moment...
Done!
Waiting for the remaining 14 operations to synchronize with Neptune. Do not kill this process.
All 14 operations synced, thanks for waiting!
Explore the metadata in the Neptune app:
https://app.neptune.ai/ba-final/cwt-1/e/CWT1-330/metadata
[32m[I 2023-08-29 20:35:17,725][0m Trial 44 finished with value: 0.1500693524137456 and parameters: {'b': 1.05, 'fc': 1.5, 'scale_min': 0.8, 'scale_max': 16, 'n_scales': 135, 'drop': 0.5753845469840322, 'optimizer': 'Adam', 'lr': 0.002208340442369581, 'weight_decay': 0.009114414449693181, 'batch_size': 32, 'epochs': 100}. Best is trial 33 with value: 0.05809502500168821.[0m
trial 44, loss train mean 0.08, score train mean 0.43, loss val mean 0.15, score val mean 0.37



End Time   : Di 29. Aug 20:35:19 CEST 2023
Duration   : 12537.740988337 seconds

Start Time : Di 29. Aug 20:35:20 CEST 2023
Job ID: 1151119
Node: erebos
Partition: gpu_normal_stud
CPU cores: 16
Memory: 98304
GPUs: 0
Python environment: khoa                  *  /home/phamanh/anaconda3/envs/khoa
Current work directory: /home/phamanh/Schreibtisch/bachelorarbeit/im_CNN

device: cuda


https://app.neptune.ai/ba-final/cwt-1/e/CWT1-331
Split 0, loss train 0.07, score train 0.46, loss val 0.07 score val 0.51
Shutting down background jobs, please wait a moment...
Done!
Waiting for the remaining 14 operations to synchronize with Neptune. Do not kill this process.
All 14 operations synced, thanks for waiting!
Explore the metadata in the Neptune app:
https://app.neptune.ai/ba-final/cwt-1/e/CWT1-331/metadata
https://app.neptune.ai/ba-final/cwt-1/e/CWT1-332
Split 1, loss train 0.08, score train 0.45, loss val 0.12 score val 0.43
Shutting down background jobs, please wait a moment...
Done!
Waiting for the remaining 10 operations to synchronize with Neptune. Do not kill this process.
All 10 operations synced, thanks for waiting!
Explore the metadata in the Neptune app:
https://app.neptune.ai/ba-final/cwt-1/e/CWT1-332/metadata
https://app.neptune.ai/ba-final/cwt-1/e/CWT1-333
Split 2, loss train 0.08, score train 0.45, loss val 0.06 score val 0.54
Shutting down background jobs, please wait a moment...
Done!
Waiting for the remaining 14 operations to synchronize with Neptune. Do not kill this process.
All 14 operations synced, thanks for waiting!
Explore the metadata in the Neptune app:
https://app.neptune.ai/ba-final/cwt-1/e/CWT1-333/metadata
https://app.neptune.ai/ba-final/cwt-1/e/CWT1-334
Split 3, loss train 0.08, score train 0.45, loss val 0.06 score val 0.45
Shutting down background jobs, please wait a moment...
Done!
Waiting for the remaining 10 operations to synchronize with Neptune. Do not kill this process.
All 10 operations synced, thanks for waiting!
Explore the metadata in the Neptune app:
https://app.neptune.ai/ba-final/cwt-1/e/CWT1-334/metadata
https://app.neptune.ai/ba-final/cwt-1/e/CWT1-335
Split 4, loss train 0.07, score train 0.45, loss val 0.05 score val 0.52
Shutting down background jobs, please wait a moment...
Done!
Waiting for the remaining 14 operations to synchronize with Neptune. Do not kill this process.
All 14 operations synced, thanks for waiting!
Explore the metadata in the Neptune app:
https://app.neptune.ai/ba-final/cwt-1/e/CWT1-335/metadata
