[32m[I 2023-08-25 01:59:38,664][0m Trial 13 finished with value: 0.1116734951100451 and parameters: {'b': 0.8, 'fc': 1.4, 'scale_min': 0.5, 'scale_max': 28, 'n_scales': 105, 'drop': 0.785857685591905, 'optimizer': 'Adam', 'lr': 0.0005097168547211427, 'weight_decay': 0.07349493941419305, 'batch_size': 32, 'epochs': 100}. Best is trial 12 with value: 0.06865511853644188.[0m
trial 13, loss train mean 0.09, score train mean 0.43, loss val mean 0.11, score val mean 0.37



End Time   : Fr 25. Aug 01:59:41 CEST 2023
Duration   : 14375.714804619 seconds

Start Time : Fr 25. Aug 01:59:42 CEST 2023
Job ID: 1148344
Node: cc1g02
Partition: gpu_normal_stud
CPU cores: 16
Memory: 71680
GPUs: 0
Python environment: khoa                  *  /home/phamanh/anaconda3/envs/khoa
Current work directory: /home/phamanh/Schreibtisch/bachelorarbeit/im_CNN

device: cuda


https://app.neptune.ai/ba-final/cwt-1/e/CWT1-210
Split 0, loss train 0.08, score train 0.46, loss val 0.17 score val 0.14
Shutting down background jobs, please wait a moment...
Done!
Waiting for the remaining 10 operations to synchronize with Neptune. Do not kill this process.
All 10 operations synced, thanks for waiting!
Explore the metadata in the Neptune app:
https://app.neptune.ai/ba-final/cwt-1/e/CWT1-210/metadata
https://app.neptune.ai/ba-final/cwt-1/e/CWT1-211
Split 1, loss train 0.08, score train 0.45, loss val 0.06 score val 0.47
Shutting down background jobs, please wait a moment...
Done!
Waiting for the remaining 10 operations to synchronize with Neptune. Do not kill this process.
All 10 operations synced, thanks for waiting!
Explore the metadata in the Neptune app:
https://app.neptune.ai/ba-final/cwt-1/e/CWT1-211/metadata
https://app.neptune.ai/ba-final/cwt-1/e/CWT1-212
Split 2, loss train 0.08, score train 0.44, loss val 0.05 score val 0.48
Shutting down background jobs, please wait a moment...
Done!
Waiting for the remaining 14 operations to synchronize with Neptune. Do not kill this process.
All 14 operations synced, thanks for waiting!
Explore the metadata in the Neptune app:
https://app.neptune.ai/ba-final/cwt-1/e/CWT1-212/metadata
https://app.neptune.ai/ba-final/cwt-1/e/CWT1-213
Split 3, loss train 0.08, score train 0.44, loss val 0.07 score val 0.45
Shutting down background jobs, please wait a moment...
Done!
Waiting for the remaining 10 operations to synchronize with Neptune. Do not kill this process.
All 10 operations synced, thanks for waiting!
Explore the metadata in the Neptune app:
https://app.neptune.ai/ba-final/cwt-1/e/CWT1-213/metadata
https://app.neptune.ai/ba-final/cwt-1/e/CWT1-214
Split 4, loss train 0.07, score train 0.45, loss val 0.07 score val 0.54
Shutting down background jobs, please wait a moment...
Done!
Waiting for the remaining 14 operations to synchronize with Neptune. Do not kill this process.
All 14 operations synced, thanks for waiting!
Explore the metadata in the Neptune app:
https://app.neptune.ai/ba-final/cwt-1/e/CWT1-214/metadata
[32m[I 2023-08-25 05:50:52,821][0m Trial 14 finished with value: 0.08459217802007148 and parameters: {'b': 1.25, 'fc': 1.4, 'scale_min': 0.5, 'scale_max': 28, 'n_scales': 105, 'drop': 0.10893332203678571, 'optimizer': 'Adam', 'lr': 0.0005097168547211427, 'weight_decay': 0.047381612412152274, 'batch_size': 32, 'epochs': 100}. Best is trial 12 with value: 0.06865511853644188.[0m
trial 14, loss train mean 0.08, score train mean 0.45, loss val mean 0.08, score val mean 0.42



End Time   : Fr 25. Aug 05:50:55 CEST 2023
Duration   : 13872.524456592 seconds

Start Time : Fr 25. Aug 05:50:56 CEST 2023
Job ID: 1148345
Node: cc1g02
Partition: gpu_normal_stud
CPU cores: 16
Memory: 71680
GPUs: 0
Python environment: khoa                  *  /home/phamanh/anaconda3/envs/khoa
Current work directory: /home/phamanh/Schreibtisch/bachelorarbeit/im_CNN

device: cuda


https://app.neptune.ai/ba-final/cwt-1/e/CWT1-215
Split 0, loss train 0.09, score train 0.44, loss val 0.21 score val 0.08
Shutting down background jobs, please wait a moment...
Done!
Waiting for the remaining 10 operations to synchronize with Neptune. Do not kill this process.
All 10 operations synced, thanks for waiting!
Explore the metadata in the Neptune app:
https://app.neptune.ai/ba-final/cwt-1/e/CWT1-215/metadata
https://app.neptune.ai/ba-final/cwt-1/e/CWT1-216
Split 1, loss train 0.08, score train 0.44, loss val 0.10 score val 0.39
Shutting down background jobs, please wait a moment...
Done!
Waiting for the remaining 14 operations to synchronize with Neptune. Do not kill this process.
All 14 operations synced, thanks for waiting!
Explore the metadata in the Neptune app:
https://app.neptune.ai/ba-final/cwt-1/e/CWT1-216/metadata
https://app.neptune.ai/ba-final/cwt-1/e/CWT1-217
Split 2, loss train 0.09, score train 0.42, loss val 0.17 score val 0.26
Shutting down background jobs, please wait a moment...
Done!
Waiting for the remaining 10 operations to synchronize with Neptune. Do not kill this process.
All 10 operations synced, thanks for waiting!
Explore the metadata in the Neptune app:
https://app.neptune.ai/ba-final/cwt-1/e/CWT1-217/metadata
https://app.neptune.ai/ba-final/cwt-1/e/CWT1-218
Split 3, loss train 0.09, score train 0.42, loss val 0.11 score val 0.42
Shutting down background jobs, please wait a moment...
Done!
Waiting for the remaining 10 operations to synchronize with Neptune. Do not kill this process.
All 10 operations synced, thanks for waiting!
Explore the metadata in the Neptune app:
https://app.neptune.ai/ba-final/cwt-1/e/CWT1-218/metadata
https://app.neptune.ai/ba-final/cwt-1/e/CWT1-219
Split 4, loss train 0.08, score train 0.44, loss val 0.15 score val 0.35
Shutting down background jobs, please wait a moment...
Done!
Waiting for the remaining 10 operations to synchronize with Neptune. Do not kill this process.
All 10 operations synced, thanks for waiting!
Explore the metadata in the Neptune app:
https://app.neptune.ai/ba-final/cwt-1/e/CWT1-219/metadata
[32m[I 2023-08-25 10:40:20,981][0m Trial 15 finished with value: 0.14973746157707052 and parameters: {'b': 1.75, 'fc': 1.05, 'scale_min': 2.7, 'scale_max': 34, 'n_scales': 125, 'drop': 0.785857685591905, 'optimizer': 'Adam', 'lr': 0.0010163145444437647, 'weight_decay': 0.024263030224192964, 'batch_size': 32, 'epochs': 100}. Best is trial 12 with value: 0.06865511853644188.[0m
trial 15, loss train mean 0.09, score train mean 0.43, loss val mean 0.15, score val mean 0.30



End Time   : Fr 25. Aug 10:40:23 CEST 2023
Duration   : 17367.044322517 seconds

Start Time : Fr 25. Aug 11:13:38 CEST 2023
Job ID: 1148346
Node: cc1g01
Partition: gpu_normal_stud
CPU cores: 16
Memory: 71680
GPUs: 0
Python environment: khoa                  *  /home/phamanh/anaconda3/envs/khoa
Current work directory: /home/phamanh/Schreibtisch/bachelorarbeit/im_CNN

device: cuda


https://app.neptune.ai/ba-final/cwt-1/e/CWT1-220
Split 0, loss train 0.37, score train 0.17, loss val 458.47 score val 0.03
Shutting down background jobs, please wait a moment...
Done!
Waiting for the remaining 10 operations to synchronize with Neptune. Do not kill this process.
All 10 operations synced, thanks for waiting!
Explore the metadata in the Neptune app:
https://app.neptune.ai/ba-final/cwt-1/e/CWT1-220/metadata
https://app.neptune.ai/ba-final/cwt-1/e/CWT1-221
Split 1, loss train 0.38, score train 0.16, loss val 8.10 score val 0.06
Shutting down background jobs, please wait a moment...
Done!
Waiting for the remaining 10 operations to synchronize with Neptune. Do not kill this process.
All 10 operations synced, thanks for waiting!
Explore the metadata in the Neptune app:
https://app.neptune.ai/ba-final/cwt-1/e/CWT1-221/metadata
https://app.neptune.ai/ba-final/cwt-1/e/CWT1-222
Split 2, loss train 0.38, score train 0.16, loss val 0.43 score val 0.13
Shutting down background jobs, please wait a moment...
Done!
Waiting for the remaining 10 operations to synchronize with Neptune. Do not kill this process.
All 10 operations synced, thanks for waiting!
Explore the metadata in the Neptune app:
https://app.neptune.ai/ba-final/cwt-1/e/CWT1-222/metadata
https://app.neptune.ai/ba-final/cwt-1/e/CWT1-223
Split 3, loss train 0.39, score train 0.17, loss val 0.32 score val 0.20
Shutting down background jobs, please wait a moment...
Done!
Waiting for the remaining 14 operations to synchronize with Neptune. Do not kill this process.
All 14 operations synced, thanks for waiting!
Explore the metadata in the Neptune app:
https://app.neptune.ai/ba-final/cwt-1/e/CWT1-223/metadata
https://app.neptune.ai/ba-final/cwt-1/e/CWT1-224
Split 4, loss train 0.38, score train 0.17, loss val 5.51 score val 0.03
Shutting down background jobs, please wait a moment...
Done!
Waiting for the remaining 10 operations to synchronize with Neptune. Do not kill this process.
All 10 operations synced, thanks for waiting!
Explore the metadata in the Neptune app:
https://app.neptune.ai/ba-final/cwt-1/e/CWT1-224/metadata
[32m[I 2023-08-25 14:52:34,838][0m Trial 16 finished with value: 94.56595484956782 and parameters: {'b': 2.1500000000000004, 'fc': 1.6500000000000001, 'scale_min': 2.6, 'scale_max': 34, 'n_scales': 135, 'drop': 0.3671339504091841, 'optimizer': 'Adam', 'lr': 0.12421906633558594, 'weight_decay': 0.011508105619724445, 'batch_size': 32, 'epochs': 100}. Best is trial 12 with value: 0.06865511853644188.[0m
trial 16, loss train mean 0.38, score train mean 0.16, loss val mean 94.57, score val mean 0.09



End Time   : Fr 25. Aug 14:52:36 CEST 2023
Duration   : 13138.540219306 seconds

Start Time : Fr 25. Aug 15:46:49 CEST 2023
Job ID: 1148347
Node: cc1g05
Partition: gpu_normal_stud
CPU cores: 16
Memory: 71680
GPUs: 0
Python environment: khoa                  *  /home/phamanh/anaconda3/envs/khoa
Current work directory: /home/phamanh/Schreibtisch/bachelorarbeit/im_CNN

device: cuda


https://app.neptune.ai/ba-final/cwt-1/e/CWT1-225
Split 0, loss train 0.07, score train 0.47, loss val 0.08 score val 0.53
Shutting down background jobs, please wait a moment...
Done!
Waiting for the remaining 10 operations to synchronize with Neptune. Do not kill this process.
All 10 operations synced, thanks for waiting!
Explore the metadata in the Neptune app:
https://app.neptune.ai/ba-final/cwt-1/e/CWT1-225/metadata
https://app.neptune.ai/ba-final/cwt-1/e/CWT1-226
Split 1, loss train 0.07, score train 0.46, loss val 0.08 score val 0.28
Shutting down background jobs, please wait a moment...
Done!
Waiting for the remaining 10 operations to synchronize with Neptune. Do not kill this process.
All 10 operations synced, thanks for waiting!
Explore the metadata in the Neptune app:
https://app.neptune.ai/ba-final/cwt-1/e/CWT1-226/metadata
https://app.neptune.ai/ba-final/cwt-1/e/CWT1-227
Split 2, loss train 0.07, score train 0.45, loss val 0.05 score val 0.48
Shutting down background jobs, please wait a moment...
Done!
Waiting for the remaining 10 operations to synchronize with Neptune. Do not kill this process.
All 10 operations synced, thanks for waiting!
Explore the metadata in the Neptune app:
https://app.neptune.ai/ba-final/cwt-1/e/CWT1-227/metadata
https://app.neptune.ai/ba-final/cwt-1/e/CWT1-228
Split 3, loss train 0.07, score train 0.45, loss val 0.07 score val 0.46
Shutting down background jobs, please wait a moment...
Done!
Waiting for the remaining 14 operations to synchronize with Neptune. Do not kill this process.
All 14 operations synced, thanks for waiting!
Explore the metadata in the Neptune app:
https://app.neptune.ai/ba-final/cwt-1/e/CWT1-228/metadata
https://app.neptune.ai/ba-final/cwt-1/e/CWT1-229
Split 4, loss train 0.07, score train 0.46, loss val 0.07 score val 0.40
Shutting down background jobs, please wait a moment...
Done!
Waiting for the remaining 10 operations to synchronize with Neptune. Do not kill this process.
All 10 operations synced, thanks for waiting!
Explore the metadata in the Neptune app:
https://app.neptune.ai/ba-final/cwt-1/e/CWT1-229/metadata
[32m[I 2023-08-25 20:16:52,281][0m Trial 17 finished with value: 0.06906902333523365 and parameters: {'b': 2.3, 'fc': 2.5, 'scale_min': 0.9, 'scale_max': 16, 'n_scales': 250, 'drop': 0.785857685591905, 'optimizer': 'Adam', 'lr': 0.0011466060696989774, 'weight_decay': 0.008136197411773289, 'batch_size': 32, 'epochs': 100}. Best is trial 12 with value: 0.06865511853644188.[0m
trial 17, loss train mean 0.07, score train mean 0.46, loss val mean 0.07, score val mean 0.43



End Time   : Fr 25. Aug 20:16:53 CEST 2023
Duration   : 16204.413037643 seconds

Start Time : Fr 25. Aug 20:16:55 CEST 2023
Job ID: 1148348
Node: cc1g01
Partition: gpu_normal_stud
CPU cores: 16
Memory: 71680
GPUs: 0
Python environment: khoa                  *  /home/phamanh/anaconda3/envs/khoa
Current work directory: /home/phamanh/Schreibtisch/bachelorarbeit/im_CNN

device: cuda


[33m[W 2023-08-25 23:11:03,491][0m Trial 18 failed with parameters: {'b': 1.55, 'fc': 1.1, 'scale_min': 3.5, 'scale_max': 24, 'n_scales': 300, 'drop': 0.3671339504091841, 'optimizer': 'Adam', 'lr': 0.008956397000836898, 'weight_decay': 0.003255027671883293, 'batch_size': 32, 'epochs': 100} because of the following error: TerminatedWorkerError('A worker process managed by the executor was unexpectedly terminated. This could be caused by a segmentation fault while calling the function or by an excessive memory usage causing the Operating System to kill the worker.\n\nThe exit codes of the workers are {SIGKILL(-9)}').
Traceback (most recent call last):
  File "/home/phamanh/anaconda3/envs/khoa/lib/python3.10/site-packages/optuna/study/_optimize.py", line 200, in _run_trial
    value_or_values = func(trial)
  File "/home/phamanh/Schreibtisch/bachelorarbeit/im_CNN/cwt_cv.py", line 805, in objective
    loss_val = cross.cross_validation(trial=trial,drop=drop,b = b,fc = fc,scale_min = scale_min, scale_max = scale_max, n_scales = n_scales,optimizer_name=optimizer_name,lr=lr,batch_size=batch_size,epochs=epochs,weight_decay=weight_decay)
  File "/home/phamanh/Schreibtisch/bachelorarbeit/im_CNN/cwt_cv.py", line 386, in cross_validation
    load_data = Parallel(n_jobs=N_JOBS_LOAD_DATA)(delayed(self.cv_load_data_parallel)(batch_size,b,fc, scale_min, scale_max, n_scales,params_idx) for params_idx in enumerate(kf.split(self.train_val_raw_data)))
  File "/home/phamanh/anaconda3/envs/khoa/lib/python3.10/site-packages/joblib/parallel.py", line 1061, in __call__
    self.retrieve()
  File "/home/phamanh/anaconda3/envs/khoa/lib/python3.10/site-packages/joblib/parallel.py", line 938, in retrieve
    self._output.extend(job.get(timeout=self.timeout))
  File "/home/phamanh/anaconda3/envs/khoa/lib/python3.10/site-packages/joblib/_parallel_backends.py", line 542, in wrap_future_result
    return future.result(timeout=timeout)
  File "/home/phamanh/anaconda3/envs/khoa/lib/python3.10/concurrent/futures/_base.py", line 458, in result
    return self.__get_result()
  File "/home/phamanh/anaconda3/envs/khoa/lib/python3.10/concurrent/futures/_base.py", line 403, in __get_result
    raise self._exception
joblib.externals.loky.process_executor.TerminatedWorkerError: A worker process managed by the executor was unexpectedly terminated. This could be caused by a segmentation fault while calling the function or by an excessive memory usage causing the Operating System to kill the worker.

The exit codes of the workers are {SIGKILL(-9)}[0m
[33m[W 2023-08-25 23:11:03,510][0m Trial 18 failed with value None.[0m
Traceback (most recent call last):
  File "/home/phamanh/Schreibtisch/bachelorarbeit/im_CNN/cwt_cv.py", line 900, in <module>
    study.optimize(objective, n_trials=n_trials)
  File "/home/phamanh/anaconda3/envs/khoa/lib/python3.10/site-packages/optuna/study/study.py", line 425, in optimize
    _optimize(
  File "/home/phamanh/anaconda3/envs/khoa/lib/python3.10/site-packages/optuna/study/_optimize.py", line 66, in _optimize
    _optimize_sequential(
  File "/home/phamanh/anaconda3/envs/khoa/lib/python3.10/site-packages/optuna/study/_optimize.py", line 163, in _optimize_sequential
    frozen_trial = _run_trial(study, func, catch)
  File "/home/phamanh/anaconda3/envs/khoa/lib/python3.10/site-packages/optuna/study/_optimize.py", line 251, in _run_trial
    raise func_err
  File "/home/phamanh/anaconda3/envs/khoa/lib/python3.10/site-packages/optuna/study/_optimize.py", line 200, in _run_trial
    value_or_values = func(trial)
  File "/home/phamanh/Schreibtisch/bachelorarbeit/im_CNN/cwt_cv.py", line 805, in objective
    loss_val = cross.cross_validation(trial=trial,drop=drop,b = b,fc = fc,scale_min = scale_min, scale_max = scale_max, n_scales = n_scales,optimizer_name=optimizer_name,lr=lr,batch_size=batch_size,epochs=epochs,weight_decay=weight_decay)
  File "/home/phamanh/Schreibtisch/bachelorarbeit/im_CNN/cwt_cv.py", line 386, in cross_validation
    load_data = Parallel(n_jobs=N_JOBS_LOAD_DATA)(delayed(self.cv_load_data_parallel)(batch_size,b,fc, scale_min, scale_max, n_scales,params_idx) for params_idx in enumerate(kf.split(self.train_val_raw_data)))
  File "/home/phamanh/anaconda3/envs/khoa/lib/python3.10/site-packages/joblib/parallel.py", line 1061, in __call__
    self.retrieve()
  File "/home/phamanh/anaconda3/envs/khoa/lib/python3.10/site-packages/joblib/parallel.py", line 938, in retrieve
    self._output.extend(job.get(timeout=self.timeout))
  File "/home/phamanh/anaconda3/envs/khoa/lib/python3.10/site-packages/joblib/_parallel_backends.py", line 542, in wrap_future_result
    return future.result(timeout=timeout)
  File "/home/phamanh/anaconda3/envs/khoa/lib/python3.10/concurrent/futures/_base.py", line 458, in result
    return self.__get_result()
  File "/home/phamanh/anaconda3/envs/khoa/lib/python3.10/concurrent/futures/_base.py", line 403, in __get_result
    raise self._exception
joblib.externals.loky.process_executor.TerminatedWorkerError: A worker process managed by the executor was unexpectedly terminated. This could be caused by a segmentation fault while calling the function or by an excessive memory usage causing the Operating System to kill the worker.

The exit codes of the workers are {SIGKILL(-9)}

End Time   : Fr 25. Aug 23:11:04 CEST 2023
Duration   : 10449.391598323 seconds
slurmstepd: error: Detected 3 oom-kill event(s) in StepId=1148348.batch cgroup. Some of your processes may have been killed by the cgroup out-of-memory handler.

Start Time : Fr 25. Aug 23:43:48 CEST 2023
Job ID: 1149364
Node: cc1g03
Partition: gpu_normal_stud
CPU cores: 16
Memory: 98304
GPUs: 0
Python environment: khoa                  *  /home/phamanh/anaconda3/envs/khoa
Current work directory: /home/phamanh/Schreibtisch/bachelorarbeit/im_CNN

device: cuda


https://app.neptune.ai/ba-final/cwt-1/e/CWT1-230
Split 0, loss train 0.09, score train 0.41, loss val 0.15 score val 0.31
Shutting down background jobs, please wait a moment...
Done!
Waiting for the remaining 14 operations to synchronize with Neptune. Do not kill this process.
All 14 operations synced, thanks for waiting!
Explore the metadata in the Neptune app:
https://app.neptune.ai/ba-final/cwt-1/e/CWT1-230/metadata
https://app.neptune.ai/ba-final/cwt-1/e/CWT1-231
Split 1, loss train 0.09, score train 0.40, loss val 0.16 score val 0.31
Shutting down background jobs, please wait a moment...
Done!
Waiting for the remaining 10 operations to synchronize with Neptune. Do not kill this process.
All 10 operations synced, thanks for waiting!
Explore the metadata in the Neptune app:
https://app.neptune.ai/ba-final/cwt-1/e/CWT1-231/metadata
https://app.neptune.ai/ba-final/cwt-1/e/CWT1-232
Split 2, loss train 0.11, score train 0.38, loss val 0.31 score val 0.20
Shutting down background jobs, please wait a moment...
Done!
Waiting for the remaining 10 operations to synchronize with Neptune. Do not kill this process.
All 10 operations synced, thanks for waiting!
Explore the metadata in the Neptune app:
https://app.neptune.ai/ba-final/cwt-1/e/CWT1-232/metadata
https://app.neptune.ai/ba-final/cwt-1/e/CWT1-233
Split 3, loss train 0.09, score train 0.41, loss val 0.23 score val 0.20
Shutting down background jobs, please wait a moment...
Done!
Waiting for the remaining 10 operations to synchronize with Neptune. Do not kill this process.
All 10 operations synced, thanks for waiting!
Explore the metadata in the Neptune app:
https://app.neptune.ai/ba-final/cwt-1/e/CWT1-233/metadata
https://app.neptune.ai/ba-final/cwt-1/e/CWT1-234
Split 4, loss train 0.10, score train 0.39, loss val 0.22 score val 0.13
Shutting down background jobs, please wait a moment...
Done!
Waiting for the remaining 10 operations to synchronize with Neptune. Do not kill this process.
All 10 operations synced, thanks for waiting!
Explore the metadata in the Neptune app:
https://app.neptune.ai/ba-final/cwt-1/e/CWT1-234/metadata
