[32m[I 2023-08-26 04:41:47,357][0m Trial 19 finished with value: 0.21659156921062062 and parameters: {'b': 1.55, 'fc': 1.1, 'scale_min': 3.5, 'scale_max': 24, 'n_scales': 300, 'drop': 0.3671339504091841, 'optimizer': 'Adam', 'lr': 0.008956397000836898, 'weight_decay': 0.003255027671883293, 'batch_size': 32, 'epochs': 100}. Best is trial 12 with value: 0.06865511853644188.[0m
trial 19, loss train mean 0.10, score train mean 0.40, loss val mean 0.22, score val mean 0.23



End Time   : Sa 26. Aug 04:41:49 CEST 2023
Duration   : 17880.166122990 seconds

Start Time : Sa 26. Aug 04:42:02 CEST 2023
Job ID: 1149365
Node: cc1g01
Partition: gpu_normal_stud
CPU cores: 16
Memory: 98304
GPUs: 0
Python environment: khoa                  *  /home/phamanh/anaconda3/envs/khoa
Current work directory: /home/phamanh/Schreibtisch/bachelorarbeit/im_CNN

device: cuda


https://app.neptune.ai/ba-final/cwt-1/e/CWT1-235
Split 0, loss train 0.10, score train 0.41, loss val 0.09 score val 0.41
Shutting down background jobs, please wait a moment...
Done!
Waiting for the remaining 10 operations to synchronize with Neptune. Do not kill this process.
All 10 operations synced, thanks for waiting!
Explore the metadata in the Neptune app:
https://app.neptune.ai/ba-final/cwt-1/e/CWT1-235/metadata
https://app.neptune.ai/ba-final/cwt-1/e/CWT1-236
Split 1, loss train 0.09, score train 0.42, loss val 0.11 score val 0.43
Shutting down background jobs, please wait a moment...
Done!
Waiting for the remaining 10 operations to synchronize with Neptune. Do not kill this process.
All 10 operations synced, thanks for waiting!
Explore the metadata in the Neptune app:
https://app.neptune.ai/ba-final/cwt-1/e/CWT1-236/metadata
https://app.neptune.ai/ba-final/cwt-1/e/CWT1-237
Split 2, loss train 0.10, score train 0.41, loss val 0.09 score val 0.50
Shutting down background jobs, please wait a moment...
Done!
Waiting for the remaining 10 operations to synchronize with Neptune. Do not kill this process.
All 10 operations synced, thanks for waiting!
Explore the metadata in the Neptune app:
https://app.neptune.ai/ba-final/cwt-1/e/CWT1-237/metadata
https://app.neptune.ai/ba-final/cwt-1/e/CWT1-238
Split 3, loss train 0.09, score train 0.42, loss val 0.12 score val 0.32
Shutting down background jobs, please wait a moment...
Done!
Waiting for the remaining 10 operations to synchronize with Neptune. Do not kill this process.
All 10 operations synced, thanks for waiting!
Explore the metadata in the Neptune app:
https://app.neptune.ai/ba-final/cwt-1/e/CWT1-238/metadata
https://app.neptune.ai/ba-final/cwt-1/e/CWT1-239
Split 4, loss train 0.10, score train 0.42, loss val 0.08 score val 0.37
Shutting down background jobs, please wait a moment...
Done!
Waiting for the remaining 14 operations to synchronize with Neptune. Do not kill this process.
All 14 operations synced, thanks for waiting!
Explore the metadata in the Neptune app:
https://app.neptune.ai/ba-final/cwt-1/e/CWT1-239/metadata
[32m[I 2023-08-26 08:13:33,296][0m Trial 20 finished with value: 0.09685257039171584 and parameters: {'b': 2.4000000000000004, 'fc': 1.6500000000000001, 'scale_min': 1.0, 'scale_max': 34, 'n_scales': 135, 'drop': 0.663015335432333, 'optimizer': 'Adam', 'lr': 0.0010163145444437647, 'weight_decay': 0.07349493941419305, 'batch_size': 32, 'epochs': 100}. Best is trial 12 with value: 0.06865511853644188.[0m
trial 20, loss train mean 0.10, score train mean 0.42, loss val mean 0.10, score val mean 0.41



End Time   : Sa 26. Aug 08:13:35 CEST 2023
Duration   : 12692.779357148 seconds

Start Time : Sa 26. Aug 08:13:41 CEST 2023
Job ID: 1149366
Node: cc1g01
Partition: gpu_normal_stud
CPU cores: 16
Memory: 98304
GPUs: 0
Python environment: khoa                  *  /home/phamanh/anaconda3/envs/khoa
Current work directory: /home/phamanh/Schreibtisch/bachelorarbeit/im_CNN

device: cuda


https://app.neptune.ai/ba-final/cwt-1/e/CWT1-240
Shutting down background jobs, please wait a moment...
Done!
Waiting for the remaining 7 operations to synchronize with Neptune. Do not kill this process.
All 7 operations synced, thanks for waiting!
Explore the metadata in the Neptune app:
https://app.neptune.ai/ba-final/cwt-1/e/CWT1-240/metadata
[32m[I 2023-08-26 10:22:30,197][0m Trial 21 pruned. [0m

End Time   : Sa 26. Aug 10:22:33 CEST 2023
Duration   : 7732.078495283 seconds

Start Time : Sa 26. Aug 10:22:43 CEST 2023
Job ID: 1149367
Node: cc1g07
Partition: gpu_normal_stud
CPU cores: 16
Memory: 98304
GPUs: 0
Python environment: khoa                  *  /home/phamanh/anaconda3/envs/khoa
Current work directory: /home/phamanh/Schreibtisch/bachelorarbeit/im_CNN

device: cuda


https://app.neptune.ai/ba-final/cwt-1/e/CWT1-241
Split 0, loss train 0.07, score train 0.46, loss val 0.08 score val 0.51
Shutting down background jobs, please wait a moment...
Done!
Waiting for the remaining 10 operations to synchronize with Neptune. Do not kill this process.
All 10 operations synced, thanks for waiting!
Explore the metadata in the Neptune app:
https://app.neptune.ai/ba-final/cwt-1/e/CWT1-241/metadata
https://app.neptune.ai/ba-final/cwt-1/e/CWT1-242
Split 1, loss train 0.07, score train 0.46, loss val 0.09 score val 0.38
Shutting down background jobs, please wait a moment...
Done!
Waiting for the remaining 10 operations to synchronize with Neptune. Do not kill this process.
All 10 operations synced, thanks for waiting!
Explore the metadata in the Neptune app:
https://app.neptune.ai/ba-final/cwt-1/e/CWT1-242/metadata
https://app.neptune.ai/ba-final/cwt-1/e/CWT1-243
Split 2, loss train 0.07, score train 0.45, loss val 0.05 score val 0.53
Shutting down background jobs, please wait a moment...
Done!
Waiting for the remaining 10 operations to synchronize with Neptune. Do not kill this process.
All 10 operations synced, thanks for waiting!
Explore the metadata in the Neptune app:
https://app.neptune.ai/ba-final/cwt-1/e/CWT1-243/metadata
https://app.neptune.ai/ba-final/cwt-1/e/CWT1-244
Split 3, loss train 0.07, score train 0.46, loss val 0.10 score val 0.44
Shutting down background jobs, please wait a moment...
Done!
Waiting for the remaining 10 operations to synchronize with Neptune. Do not kill this process.
All 10 operations synced, thanks for waiting!
Explore the metadata in the Neptune app:
https://app.neptune.ai/ba-final/cwt-1/e/CWT1-244/metadata
https://app.neptune.ai/ba-final/cwt-1/e/CWT1-245
Split 4, loss train 0.07, score train 0.46, loss val 0.06 score val 0.56
Shutting down background jobs, please wait a moment...
Done!
Waiting for the remaining 10 operations to synchronize with Neptune. Do not kill this process.
All 10 operations synced, thanks for waiting!
Explore the metadata in the Neptune app:
https://app.neptune.ai/ba-final/cwt-1/e/CWT1-245/metadata
[32m[I 2023-08-26 18:50:49,533][0m Trial 22 finished with value: 0.07526442852426082 and parameters: {'b': 2.1500000000000004, 'fc': 2.5, 'scale_min': 0.9, 'scale_max': 12, 'n_scales': 250, 'drop': 0.785857685591905, 'optimizer': 'Adam', 'lr': 0.0012662255240053065, 'weight_decay': 0.006661322652138933, 'batch_size': 32, 'epochs': 100}. Best is trial 12 with value: 0.06865511853644188.[0m
trial 22, loss train mean 0.07, score train mean 0.46, loss val mean 0.08, score val mean 0.48



End Time   : Sa 26. Aug 18:50:52 CEST 2023
Duration   : 30488.394546958 seconds

Start Time : Sa 26. Aug 19:02:12 CEST 2023
Job ID: 1149368
Node: cc1g06
Partition: gpu_normal_stud
CPU cores: 16
Memory: 98304
GPUs: 0
Python environment: khoa                  *  /home/phamanh/anaconda3/envs/khoa
Current work directory: /home/phamanh/Schreibtisch/bachelorarbeit/im_CNN

device: cuda


https://app.neptune.ai/ba-final/cwt-1/e/CWT1-246
Split 0, loss train 0.06, score train 0.47, loss val 0.05 score val 0.43
Shutting down background jobs, please wait a moment...
Done!
Waiting for the remaining 14 operations to synchronize with Neptune. Do not kill this process.
All 14 operations synced, thanks for waiting!
Explore the metadata in the Neptune app:
https://app.neptune.ai/ba-final/cwt-1/e/CWT1-246/metadata
https://app.neptune.ai/ba-final/cwt-1/e/CWT1-247
Split 1, loss train 0.06, score train 0.47, loss val 0.06 score val 0.44
Shutting down background jobs, please wait a moment...
Done!
Waiting for the remaining 10 operations to synchronize with Neptune. Do not kill this process.
All 10 operations synced, thanks for waiting!
Explore the metadata in the Neptune app:
https://app.neptune.ai/ba-final/cwt-1/e/CWT1-247/metadata
https://app.neptune.ai/ba-final/cwt-1/e/CWT1-248
Split 2, loss train 0.06, score train 0.46, loss val 0.07 score val 0.44
Shutting down background jobs, please wait a moment...
Done!
Waiting for the remaining 10 operations to synchronize with Neptune. Do not kill this process.
All 10 operations synced, thanks for waiting!
Explore the metadata in the Neptune app:
https://app.neptune.ai/ba-final/cwt-1/e/CWT1-248/metadata
https://app.neptune.ai/ba-final/cwt-1/e/CWT1-249
Split 3, loss train 0.06, score train 0.47, loss val 0.06 score val 0.37
Shutting down background jobs, please wait a moment...
Done!
Waiting for the remaining 10 operations to synchronize with Neptune. Do not kill this process.
All 10 operations synced, thanks for waiting!
Explore the metadata in the Neptune app:
https://app.neptune.ai/ba-final/cwt-1/e/CWT1-249/metadata
https://app.neptune.ai/ba-final/cwt-1/e/CWT1-250
Split 4, loss train 0.06, score train 0.48, loss val 0.06 score val 0.46
Shutting down background jobs, please wait a moment...
Done!
Waiting for the remaining 10 operations to synchronize with Neptune. Do not kill this process.
All 10 operations synced, thanks for waiting!
Explore the metadata in the Neptune app:
https://app.neptune.ai/ba-final/cwt-1/e/CWT1-250/metadata
[32m[I 2023-08-26 22:51:25,029][0m Trial 23 finished with value: 0.059777665645518195 and parameters: {'b': 1.5, 'fc': 1.15, 'scale_min': 0.9, 'scale_max': 12, 'n_scales': 215, 'drop': 0.6622130556269024, 'optimizer': 'Adam', 'lr': 0.0012662255240053065, 'weight_decay': 0.0036325577078120813, 'batch_size': 32, 'epochs': 100}. Best is trial 23 with value: 0.059777665645518195.[0m
trial 23, loss train mean 0.06, score train mean 0.47, loss val mean 0.06, score val mean 0.43



End Time   : Sa 26. Aug 22:51:27 CEST 2023
Duration   : 13755.015704979 seconds

Start Time : Sa 26. Aug 22:51:45 CEST 2023
Job ID: 1149369
Node: cc1g06
Partition: gpu_normal_stud
CPU cores: 16
Memory: 98304
GPUs: 0
Python environment: khoa                  *  /home/phamanh/anaconda3/envs/khoa
Current work directory: /home/phamanh/Schreibtisch/bachelorarbeit/im_CNN

device: cuda


https://app.neptune.ai/ba-final/cwt-1/e/CWT1-251
Split 0, loss train 0.06, score train 0.49, loss val 0.09 score val 0.43
Shutting down background jobs, please wait a moment...
Done!
Waiting for the remaining 14 operations to synchronize with Neptune. Do not kill this process.
All 14 operations synced, thanks for waiting!
Explore the metadata in the Neptune app:
https://app.neptune.ai/ba-final/cwt-1/e/CWT1-251/metadata
https://app.neptune.ai/ba-final/cwt-1/e/CWT1-252
Split 1, loss train 0.06, score train 0.49, loss val 0.12 score val 0.40
Shutting down background jobs, please wait a moment...
Done!
Waiting for the remaining 10 operations to synchronize with Neptune. Do not kill this process.
All 10 operations synced, thanks for waiting!
Explore the metadata in the Neptune app:
https://app.neptune.ai/ba-final/cwt-1/e/CWT1-252/metadata
https://app.neptune.ai/ba-final/cwt-1/e/CWT1-253
Split 2, loss train 0.06, score train 0.47, loss val 0.07 score val 0.55
Shutting down background jobs, please wait a moment...
Done!
Waiting for the remaining 10 operations to synchronize with Neptune. Do not kill this process.
All 10 operations synced, thanks for waiting!
Explore the metadata in the Neptune app:
https://app.neptune.ai/ba-final/cwt-1/e/CWT1-253/metadata
https://app.neptune.ai/ba-final/cwt-1/e/CWT1-254
Split 3, loss train 0.06, score train 0.48, loss val 0.11 score val 0.39
Shutting down background jobs, please wait a moment...
Done!
Waiting for the remaining 10 operations to synchronize with Neptune. Do not kill this process.
All 10 operations synced, thanks for waiting!
Explore the metadata in the Neptune app:
https://app.neptune.ai/ba-final/cwt-1/e/CWT1-254/metadata
https://app.neptune.ai/ba-final/cwt-1/e/CWT1-255
Split 4, loss train 0.06, score train 0.49, loss val 0.07 score val 0.38
Shutting down background jobs, please wait a moment...
Done!
Waiting for the remaining 10 operations to synchronize with Neptune. Do not kill this process.
All 10 operations synced, thanks for waiting!
Explore the metadata in the Neptune app:
https://app.neptune.ai/ba-final/cwt-1/e/CWT1-255/metadata
[32m[I 2023-08-27 03:21:48,203][0m Trial 24 finished with value: 0.09320282834641477 and parameters: {'b': 1.25, 'fc': 1.15, 'scale_min': 1.1, 'scale_max': 36, 'n_scales': 215, 'drop': 0.656531246679518, 'optimizer': 'Adam', 'lr': 0.0007834925954574327, 'weight_decay': 0.0026463449673493553, 'batch_size': 32, 'epochs': 100}. Best is trial 23 with value: 0.059777665645518195.[0m
trial 24, loss train mean 0.06, score train mean 0.48, loss val mean 0.09, score val mean 0.43



End Time   : So 27. Aug 03:21:50 CEST 2023
Duration   : 16205.029175186 seconds

Start Time : So 27. Aug 03:21:51 CEST 2023
Job ID: 1149370
Node: cc1g06
Partition: gpu_normal_stud
CPU cores: 16
Memory: 98304
GPUs: 0
Python environment: khoa                  *  /home/phamanh/anaconda3/envs/khoa
Current work directory: /home/phamanh/Schreibtisch/bachelorarbeit/im_CNN

device: cuda


https://app.neptune.ai/ba-final/cwt-1/e/CWT1-256
Split 0, loss train 0.09, score train 0.42, loss val 0.16 score val 0.26
Shutting down background jobs, please wait a moment...
Done!
Waiting for the remaining 10 operations to synchronize with Neptune. Do not kill this process.
All 10 operations synced, thanks for waiting!
Explore the metadata in the Neptune app:
https://app.neptune.ai/ba-final/cwt-1/e/CWT1-256/metadata
https://app.neptune.ai/ba-final/cwt-1/e/CWT1-257
Split 1, loss train 0.09, score train 0.42, loss val 0.14 score val 0.22
Shutting down background jobs, please wait a moment...
Done!
Waiting for the remaining 10 operations to synchronize with Neptune. Do not kill this process.
All 10 operations synced, thanks for waiting!
Explore the metadata in the Neptune app:
https://app.neptune.ai/ba-final/cwt-1/e/CWT1-257/metadata
https://app.neptune.ai/ba-final/cwt-1/e/CWT1-258
Shutting down background jobs, please wait a moment...
Done!
Waiting for the remaining 3 operations to synchronize with Neptune. Do not kill this process.
All 3 operations synced, thanks for waiting!
Explore the metadata in the Neptune app:
https://app.neptune.ai/ba-final/cwt-1/e/CWT1-258/metadata
[32m[I 2023-08-27 06:37:26,691][0m Trial 25 pruned. [0m

End Time   : So 27. Aug 06:37:29 CEST 2023
Duration   : 11737.689514961 seconds

Start Time : So 27. Aug 06:37:44 CEST 2023
Job ID: 1149371
Node: cc1g06
Partition: gpu_normal_stud
CPU cores: 16
Memory: 98304
GPUs: 0
Python environment: khoa                  *  /home/phamanh/anaconda3/envs/khoa
Current work directory: /home/phamanh/Schreibtisch/bachelorarbeit/im_CNN

device: cuda


https://app.neptune.ai/ba-final/cwt-1/e/CWT1-259
Split 0, loss train 0.06, score train 0.47, loss val 0.08 score val 0.47
Shutting down background jobs, please wait a moment...
Done!
Waiting for the remaining 10 operations to synchronize with Neptune. Do not kill this process.
All 10 operations synced, thanks for waiting!
Explore the metadata in the Neptune app:
https://app.neptune.ai/ba-final/cwt-1/e/CWT1-259/metadata
https://app.neptune.ai/ba-final/cwt-1/e/CWT1-260
slurmstepd: error: *** JOB 1149371 ON cc1g06 CANCELLED AT 2023-08-27T08:15:53 ***

Start Time : So 27. Aug 08:17:18 CEST 2023
Job ID: 1150008
Node: cc1g03
Partition: gpu_normal_stud
CPU cores: 16
Memory: 98304
GPUs: 0
Python environment: khoa                  *  /home/phamanh/anaconda3/envs/khoa
Current work directory: /home/phamanh/Schreibtisch/bachelorarbeit/im_CNN

device: cuda


https://app.neptune.ai/ba-final/cwt-1/e/CWT1-261
Split 0, loss train 0.06, score train 0.47, loss val 0.08 score val 0.47
Shutting down background jobs, please wait a moment...
Done!
Waiting for the remaining 14 operations to synchronize with Neptune. Do not kill this process.
All 14 operations synced, thanks for waiting!
Explore the metadata in the Neptune app:
https://app.neptune.ai/ba-final/cwt-1/e/CWT1-261/metadata
https://app.neptune.ai/ba-final/cwt-1/e/CWT1-262
Split 1, loss train 0.07, score train 0.46, loss val 0.09 score val 0.43
Shutting down background jobs, please wait a moment...
Done!
Waiting for the remaining 10 operations to synchronize with Neptune. Do not kill this process.
All 10 operations synced, thanks for waiting!
Explore the metadata in the Neptune app:
https://app.neptune.ai/ba-final/cwt-1/e/CWT1-262/metadata
https://app.neptune.ai/ba-final/cwt-1/e/CWT1-263
Split 2, loss train 0.07, score train 0.45, loss val 0.04 score val 0.59
Shutting down background jobs, please wait a moment...
Done!
Waiting for the remaining 9 operations to synchronize with Neptune. Do not kill this process.
All 9 operations synced, thanks for waiting!
Explore the metadata in the Neptune app:
https://app.neptune.ai/ba-final/cwt-1/e/CWT1-263/metadata
https://app.neptune.ai/ba-final/cwt-1/e/CWT1-264
Split 3, loss train 0.07, score train 0.46, loss val 0.07 score val 0.43
Shutting down background jobs, please wait a moment...
Done!
Waiting for the remaining 10 operations to synchronize with Neptune. Do not kill this process.
All 10 operations synced, thanks for waiting!
Explore the metadata in the Neptune app:
https://app.neptune.ai/ba-final/cwt-1/e/CWT1-264/metadata
https://app.neptune.ai/ba-final/cwt-1/e/CWT1-265
Split 4, loss train 0.07, score train 0.47, loss val 0.06 score val 0.52
Shutting down background jobs, please wait a moment...
Done!
Waiting for the remaining 10 operations to synchronize with Neptune. Do not kill this process.
All 10 operations synced, thanks for waiting!
Explore the metadata in the Neptune app:
https://app.neptune.ai/ba-final/cwt-1/e/CWT1-265/metadata
[32m[I 2023-08-27 11:28:39,193][0m Trial 27 finished with value: 0.06893166785544538 and parameters: {'b': 1.25, 'fc': 1.7000000000000002, 'scale_min': 1.1, 'scale_max': 18, 'n_scales': 120, 'drop': 0.4027868660529891, 'optimizer': 'Adam', 'lr': 0.0007190525844628486, 'weight_decay': 0.01623373290531213, 'batch_size': 32, 'epochs': 100}. Best is trial 23 with value: 0.059777665645518195.[0m
trial 27, loss train mean 0.07, score train mean 0.46, loss val mean 0.07, score val mean 0.49



End Time   : So 27. Aug 11:28:41 CEST 2023
Duration   : 11482.335127710 seconds

Start Time : So 27. Aug 11:28:42 CEST 2023
Job ID: 1150009
Node: cc1g03
Partition: gpu_normal_stud
CPU cores: 16
Memory: 98304
GPUs: 0
Python environment: khoa                  *  /home/phamanh/anaconda3/envs/khoa
Current work directory: /home/phamanh/Schreibtisch/bachelorarbeit/im_CNN

device: cuda


https://app.neptune.ai/ba-final/cwt-1/e/CWT1-266
Split 0, loss train 0.09, score train 0.43, loss val 0.12 score val 0.24
Shutting down background jobs, please wait a moment...
Done!
Waiting for the remaining 10 operations to synchronize with Neptune. Do not kill this process.
All 10 operations synced, thanks for waiting!
Explore the metadata in the Neptune app:
https://app.neptune.ai/ba-final/cwt-1/e/CWT1-266/metadata
https://app.neptune.ai/ba-final/cwt-1/e/CWT1-267
Split 1, loss train 0.09, score train 0.42, loss val 0.15 score val 0.32
Shutting down background jobs, please wait a moment...
Done!
Waiting for the remaining 10 operations to synchronize with Neptune. Do not kill this process.
All 10 operations synced, thanks for waiting!
Explore the metadata in the Neptune app:
https://app.neptune.ai/ba-final/cwt-1/e/CWT1-267/metadata
https://app.neptune.ai/ba-final/cwt-1/e/CWT1-268
Shutting down background jobs, please wait a moment...
Done!
Waiting for the remaining 3 operations to synchronize with Neptune. Do not kill this process.
All 3 operations synced, thanks for waiting!
Explore the metadata in the Neptune app:
https://app.neptune.ai/ba-final/cwt-1/e/CWT1-268/metadata
