Start Time : Di 22. Aug 13:31:55 CEST 2023
Job ID: 1147283
Node: cc1g01
Partition: gpu_normal_stud
CPU cores: 16
Memory: 98304
GPUs: 0
Python environment: khoa                  *  /home/phamanh/anaconda3/envs/khoa
Current work directory: /home/phamanh/Schreibtisch/bachelorarbeit/im_CNN

device: cuda


[32m[I 2023-08-22 13:32:08,612][0m A new study created in RDB with name: CWT[0m
https://app.neptune.ai/ba-final/cwt-1/e/CWT1-140
Split 0, loss train 0.06, score train 0.51, loss val 0.13 score val 0.30
Shutting down background jobs, please wait a moment...
Done!
Waiting for the remaining 9 operations to synchronize with Neptune. Do not kill this process.
All 9 operations synced, thanks for waiting!
Explore the metadata in the Neptune app:
https://app.neptune.ai/ba-final/cwt-1/e/CWT1-140/metadata
https://app.neptune.ai/ba-final/cwt-1/e/CWT1-141
Split 1, loss train 0.06, score train 0.51, loss val 0.21 score val 0.31
Shutting down background jobs, please wait a moment...
Done!
Waiting for the remaining 14 operations to synchronize with Neptune. Do not kill this process.
All 14 operations synced, thanks for waiting!
Explore the metadata in the Neptune app:
https://app.neptune.ai/ba-final/cwt-1/e/CWT1-141/metadata
https://app.neptune.ai/ba-final/cwt-1/e/CWT1-142
Split 2, loss train 0.06, score train 0.49, loss val 0.20 score val 0.43
Shutting down background jobs, please wait a moment...
Done!
Waiting for the remaining 14 operations to synchronize with Neptune. Do not kill this process.
All 14 operations synced, thanks for waiting!
Explore the metadata in the Neptune app:
https://app.neptune.ai/ba-final/cwt-1/e/CWT1-142/metadata
https://app.neptune.ai/ba-final/cwt-1/e/CWT1-143
Split 3, loss train 0.06, score train 0.49, loss val 0.15 score val 0.21
Shutting down background jobs, please wait a moment...
Done!
Waiting for the remaining 10 operations to synchronize with Neptune. Do not kill this process.
All 10 operations synced, thanks for waiting!
Explore the metadata in the Neptune app:
https://app.neptune.ai/ba-final/cwt-1/e/CWT1-143/metadata
https://app.neptune.ai/ba-final/cwt-1/e/CWT1-144
Split 4, loss train 0.06, score train 0.50, loss val 0.18 score val 0.56
Shutting down background jobs, please wait a moment...
Done!
Waiting for the remaining 10 operations to synchronize with Neptune. Do not kill this process.
All 10 operations synced, thanks for waiting!
Explore the metadata in the Neptune app:
https://app.neptune.ai/ba-final/cwt-1/e/CWT1-144/metadata
[32m[I 2023-08-22 17:43:59,353][0m Trial 0 finished with value: 0.17573857205979368 and parameters: {'b': 3.1500000000000004, 'fc': 2.05, 'scale_min': 1.6, 'scale_max': 42, 'n_scales': 170, 'drop': 0.5241908601441085, 'optimizer': 'SGD', 'lr': 0.003077401349489438, 'weight_decay': 0.0005867534868260941, 'batch_size': 32, 'epochs': 100}. Best is trial 0 with value: 0.17573857205979368.[0m
trial 0, loss train mean 0.06, score train mean 0.50, loss val mean 0.18, score val mean 0.36



End Time   : Di 22. Aug 17:44:01 CEST 2023
Duration   : 15125.511274261 seconds

Start Time : Di 22. Aug 17:44:02 CEST 2023
Job ID: 1147284
Node: cc1g01
Partition: gpu_normal_stud
CPU cores: 16
Memory: 71680
GPUs: 0
Python environment: khoa                  *  /home/phamanh/anaconda3/envs/khoa
Current work directory: /home/phamanh/Schreibtisch/bachelorarbeit/im_CNN

device: cuda


https://app.neptune.ai/ba-final/cwt-1/e/CWT1-145
Split 0, loss train 0.06, score train 0.51, loss val 0.13 score val 0.30
Shutting down background jobs, please wait a moment...
Done!
Waiting for the remaining 14 operations to synchronize with Neptune. Do not kill this process.
All 14 operations synced, thanks for waiting!
Explore the metadata in the Neptune app:
https://app.neptune.ai/ba-final/cwt-1/e/CWT1-145/metadata
https://app.neptune.ai/ba-final/cwt-1/e/CWT1-146
Split 1, loss train 0.06, score train 0.51, loss val 0.21 score val 0.31
Shutting down background jobs, please wait a moment...
Done!
Waiting for the remaining 10 operations to synchronize with Neptune. Do not kill this process.
All 10 operations synced, thanks for waiting!
Explore the metadata in the Neptune app:
https://app.neptune.ai/ba-final/cwt-1/e/CWT1-146/metadata
https://app.neptune.ai/ba-final/cwt-1/e/CWT1-147
Split 2, loss train 0.06, score train 0.49, loss val 0.20 score val 0.43
Shutting down background jobs, please wait a moment...
Done!
Waiting for the remaining 10 operations to synchronize with Neptune. Do not kill this process.
All 10 operations synced, thanks for waiting!
Explore the metadata in the Neptune app:
https://app.neptune.ai/ba-final/cwt-1/e/CWT1-147/metadata
https://app.neptune.ai/ba-final/cwt-1/e/CWT1-148
Split 3, loss train 0.06, score train 0.49, loss val 0.15 score val 0.21
Shutting down background jobs, please wait a moment...
Done!
Waiting for the remaining 10 operations to synchronize with Neptune. Do not kill this process.
All 10 operations synced, thanks for waiting!
Explore the metadata in the Neptune app:
https://app.neptune.ai/ba-final/cwt-1/e/CWT1-148/metadata
https://app.neptune.ai/ba-final/cwt-1/e/CWT1-149
Split 4, loss train 0.06, score train 0.50, loss val 0.18 score val 0.56
Shutting down background jobs, please wait a moment...
Done!
Waiting for the remaining 10 operations to synchronize with Neptune. Do not kill this process.
All 10 operations synced, thanks for waiting!
Explore the metadata in the Neptune app:
https://app.neptune.ai/ba-final/cwt-1/e/CWT1-149/metadata
[32m[I 2023-08-22 22:02:48,809][0m Trial 1 finished with value: 0.17573857205979368 and parameters: {'b': 3.1500000000000004, 'fc': 2.05, 'scale_min': 1.6, 'scale_max': 42, 'n_scales': 170, 'drop': 0.5241908601441085, 'optimizer': 'SGD', 'lr': 0.003077401349489438, 'weight_decay': 0.0005867534868260941, 'batch_size': 32, 'epochs': 100}. Best is trial 0 with value: 0.17573857205979368.[0m
trial 1, loss train mean 0.06, score train mean 0.50, loss val mean 0.18, score val mean 0.36



End Time   : Di 22. Aug 22:02:51 CEST 2023
Duration   : 15528.214209480 seconds

Start Time : Di 22. Aug 22:02:53 CEST 2023
Job ID: 1147285
Node: cc1g06
Partition: gpu_normal_stud
CPU cores: 16
Memory: 71680
GPUs: 0
Python environment: khoa                  *  /home/phamanh/anaconda3/envs/khoa
Current work directory: /home/phamanh/Schreibtisch/bachelorarbeit/im_CNN

device: cuda


https://app.neptune.ai/ba-final/cwt-1/e/CWT1-150
Split 0, loss train 0.06, score train 0.51, loss val 0.13 score val 0.30
Shutting down background jobs, please wait a moment...
Done!
Waiting for the remaining 10 operations to synchronize with Neptune. Do not kill this process.
All 10 operations synced, thanks for waiting!
Explore the metadata in the Neptune app:
https://app.neptune.ai/ba-final/cwt-1/e/CWT1-150/metadata
https://app.neptune.ai/ba-final/cwt-1/e/CWT1-151
Split 1, loss train 0.06, score train 0.51, loss val 0.21 score val 0.31
Shutting down background jobs, please wait a moment...
Done!
Waiting for the remaining 10 operations to synchronize with Neptune. Do not kill this process.
All 10 operations synced, thanks for waiting!
Explore the metadata in the Neptune app:
https://app.neptune.ai/ba-final/cwt-1/e/CWT1-151/metadata
https://app.neptune.ai/ba-final/cwt-1/e/CWT1-152
Split 2, loss train 0.06, score train 0.49, loss val 0.20 score val 0.43
Shutting down background jobs, please wait a moment...
Done!
Waiting for the remaining 10 operations to synchronize with Neptune. Do not kill this process.
All 10 operations synced, thanks for waiting!
Explore the metadata in the Neptune app:
https://app.neptune.ai/ba-final/cwt-1/e/CWT1-152/metadata
https://app.neptune.ai/ba-final/cwt-1/e/CWT1-153
Split 3, loss train 0.06, score train 0.49, loss val 0.15 score val 0.21
Shutting down background jobs, please wait a moment...
Done!
Waiting for the remaining 10 operations to synchronize with Neptune. Do not kill this process.
All 10 operations synced, thanks for waiting!
Explore the metadata in the Neptune app:
https://app.neptune.ai/ba-final/cwt-1/e/CWT1-153/metadata
https://app.neptune.ai/ba-final/cwt-1/e/CWT1-154
Split 4, loss train 0.06, score train 0.50, loss val 0.18 score val 0.56
Shutting down background jobs, please wait a moment...
Done!
Waiting for the remaining 10 operations to synchronize with Neptune. Do not kill this process.
All 10 operations synced, thanks for waiting!
Explore the metadata in the Neptune app:
https://app.neptune.ai/ba-final/cwt-1/e/CWT1-154/metadata
[32m[I 2023-08-23 02:13:05,328][0m Trial 2 finished with value: 0.17573857205979368 and parameters: {'b': 3.1500000000000004, 'fc': 2.05, 'scale_min': 1.6, 'scale_max': 42, 'n_scales': 170, 'drop': 0.5241908601441085, 'optimizer': 'SGD', 'lr': 0.003077401349489438, 'weight_decay': 0.0005867534868260941, 'batch_size': 32, 'epochs': 100}. Best is trial 0 with value: 0.17573857205979368.[0m
trial 2, loss train mean 0.06, score train mean 0.50, loss val mean 0.18, score val mean 0.36



End Time   : Mi 23. Aug 02:13:07 CEST 2023
Duration   : 15014.280615790 seconds

Start Time : Mi 23. Aug 02:09:24 CEST 2023
Job ID: 1147286
Node: cc1g02
Partition: gpu_normal_stud
CPU cores: 16
Memory: 71680
GPUs: 0
Python environment: khoa                  *  /home/phamanh/anaconda3/envs/khoa
Current work directory: /home/phamanh/Schreibtisch/bachelorarbeit/im_CNN

device: cuda


https://app.neptune.ai/ba-final/cwt-1/e/CWT1-155
Split 0, loss train 0.06, score train 0.51, loss val 0.13 score val 0.30
Shutting down background jobs, please wait a moment...
Done!
Waiting for the remaining 10 operations to synchronize with Neptune. Do not kill this process.
All 10 operations synced, thanks for waiting!
Explore the metadata in the Neptune app:
https://app.neptune.ai/ba-final/cwt-1/e/CWT1-155/metadata
https://app.neptune.ai/ba-final/cwt-1/e/CWT1-156
Split 1, loss train 0.06, score train 0.51, loss val 0.21 score val 0.31
Shutting down background jobs, please wait a moment...
Done!
Waiting for the remaining 14 operations to synchronize with Neptune. Do not kill this process.
All 14 operations synced, thanks for waiting!
Explore the metadata in the Neptune app:
https://app.neptune.ai/ba-final/cwt-1/e/CWT1-156/metadata
https://app.neptune.ai/ba-final/cwt-1/e/CWT1-157
Split 2, loss train 0.06, score train 0.49, loss val 0.20 score val 0.43
Shutting down background jobs, please wait a moment...
Done!
Waiting for the remaining 14 operations to synchronize with Neptune. Do not kill this process.
All 14 operations synced, thanks for waiting!
Explore the metadata in the Neptune app:
https://app.neptune.ai/ba-final/cwt-1/e/CWT1-157/metadata
https://app.neptune.ai/ba-final/cwt-1/e/CWT1-158
Split 3, loss train 0.06, score train 0.49, loss val 0.15 score val 0.21
Shutting down background jobs, please wait a moment...
Done!
Waiting for the remaining 10 operations to synchronize with Neptune. Do not kill this process.
All 10 operations synced, thanks for waiting!
Explore the metadata in the Neptune app:
https://app.neptune.ai/ba-final/cwt-1/e/CWT1-158/metadata
https://app.neptune.ai/ba-final/cwt-1/e/CWT1-159
Split 4, loss train 0.06, score train 0.50, loss val 0.18 score val 0.56
Shutting down background jobs, please wait a moment...
Done!
Waiting for the remaining 14 operations to synchronize with Neptune. Do not kill this process.
All 14 operations synced, thanks for waiting!
Explore the metadata in the Neptune app:
https://app.neptune.ai/ba-final/cwt-1/e/CWT1-159/metadata
[32m[I 2023-08-23 06:55:51,023][0m Trial 3 finished with value: 0.17573857205979368 and parameters: {'b': 3.1500000000000004, 'fc': 2.05, 'scale_min': 1.6, 'scale_max': 42, 'n_scales': 170, 'drop': 0.5241908601441085, 'optimizer': 'SGD', 'lr': 0.003077401349489438, 'weight_decay': 0.0005867534868260941, 'batch_size': 32, 'epochs': 100}. Best is trial 0 with value: 0.17573857205979368.[0m
trial 3, loss train mean 0.06, score train mean 0.50, loss val mean 0.18, score val mean 0.36



End Time   : Mi 23. Aug 06:55:53 CEST 2023
Duration   : 17189.108550696 seconds

Start Time : Mi 23. Aug 06:56:18 CEST 2023
Job ID: 1147287
Node: cc1g02
Partition: gpu_normal_stud
CPU cores: 16
Memory: 71680
GPUs: 0
Python environment: khoa                  *  /home/phamanh/anaconda3/envs/khoa
Current work directory: /home/phamanh/Schreibtisch/bachelorarbeit/im_CNN

device: cuda


https://app.neptune.ai/ba-final/cwt-1/e/CWT1-160
Split 0, loss train 0.06, score train 0.51, loss val 0.13 score val 0.30
Shutting down background jobs, please wait a moment...
Done!
Waiting for the remaining 14 operations to synchronize with Neptune. Do not kill this process.
All 14 operations synced, thanks for waiting!
Explore the metadata in the Neptune app:
https://app.neptune.ai/ba-final/cwt-1/e/CWT1-160/metadata
https://app.neptune.ai/ba-final/cwt-1/e/CWT1-161
Split 1, loss train 0.06, score train 0.51, loss val 0.21 score val 0.31
Shutting down background jobs, please wait a moment...
Done!
Waiting for the remaining 10 operations to synchronize with Neptune. Do not kill this process.
All 10 operations synced, thanks for waiting!
Explore the metadata in the Neptune app:
https://app.neptune.ai/ba-final/cwt-1/e/CWT1-161/metadata
https://app.neptune.ai/ba-final/cwt-1/e/CWT1-162
Split 2, loss train 0.06, score train 0.49, loss val 0.20 score val 0.43
Shutting down background jobs, please wait a moment...
Done!
Waiting for the remaining 10 operations to synchronize with Neptune. Do not kill this process.
All 10 operations synced, thanks for waiting!
Explore the metadata in the Neptune app:
https://app.neptune.ai/ba-final/cwt-1/e/CWT1-162/metadata
https://app.neptune.ai/ba-final/cwt-1/e/CWT1-163
Split 3, loss train 0.06, score train 0.49, loss val 0.15 score val 0.21
Shutting down background jobs, please wait a moment...
Done!
Waiting for the remaining 10 operations to synchronize with Neptune. Do not kill this process.
All 10 operations synced, thanks for waiting!
Explore the metadata in the Neptune app:
https://app.neptune.ai/ba-final/cwt-1/e/CWT1-163/metadata
https://app.neptune.ai/ba-final/cwt-1/e/CWT1-164
Split 4, loss train 0.06, score train 0.50, loss val 0.18 score val 0.56
Shutting down background jobs, please wait a moment...
Done!
Waiting for the remaining 14 operations to synchronize with Neptune. Do not kill this process.
All 14 operations synced, thanks for waiting!
Explore the metadata in the Neptune app:
https://app.neptune.ai/ba-final/cwt-1/e/CWT1-164/metadata
[32m[I 2023-08-23 12:12:44,835][0m Trial 4 finished with value: 0.17573857205979368 and parameters: {'b': 3.1500000000000004, 'fc': 2.05, 'scale_min': 1.6, 'scale_max': 42, 'n_scales': 170, 'drop': 0.5241908601441085, 'optimizer': 'SGD', 'lr': 0.003077401349489438, 'weight_decay': 0.0005867534868260941, 'batch_size': 32, 'epochs': 100}. Best is trial 0 with value: 0.17573857205979368.[0m
trial 4, loss train mean 0.06, score train mean 0.50, loss val mean 0.18, score val mean 0.36



End Time   : Mi 23. Aug 12:12:47 CEST 2023
Duration   : 18989.194122480 seconds

Start Time : Mi 23. Aug 12:16:33 CEST 2023
Job ID: 1147288
Node: cc1g05
Partition: gpu_normal_stud
CPU cores: 16
Memory: 71680
GPUs: 0
Python environment: khoa                  *  /home/phamanh/anaconda3/envs/khoa
Current work directory: /home/phamanh/Schreibtisch/bachelorarbeit/im_CNN

device: cuda


https://app.neptune.ai/ba-final/cwt-1/e/CWT1-165
Split 0, loss train 0.06, score train 0.51, loss val 0.13 score val 0.30
Shutting down background jobs, please wait a moment...
Done!
Waiting for the remaining 14 operations to synchronize with Neptune. Do not kill this process.
All 14 operations synced, thanks for waiting!
Explore the metadata in the Neptune app:
https://app.neptune.ai/ba-final/cwt-1/e/CWT1-165/metadata
https://app.neptune.ai/ba-final/cwt-1/e/CWT1-166
Split 1, loss train 0.06, score train 0.51, loss val 0.21 score val 0.31
Shutting down background jobs, please wait a moment...
Done!
Waiting for the remaining 10 operations to synchronize with Neptune. Do not kill this process.
All 10 operations synced, thanks for waiting!
Explore the metadata in the Neptune app:
https://app.neptune.ai/ba-final/cwt-1/e/CWT1-166/metadata
https://app.neptune.ai/ba-final/cwt-1/e/CWT1-167
Split 2, loss train 0.06, score train 0.49, loss val 0.20 score val 0.43
Shutting down background jobs, please wait a moment...
Done!
Waiting for the remaining 14 operations to synchronize with Neptune. Do not kill this process.
All 14 operations synced, thanks for waiting!
Explore the metadata in the Neptune app:
https://app.neptune.ai/ba-final/cwt-1/e/CWT1-167/metadata
https://app.neptune.ai/ba-final/cwt-1/e/CWT1-168
Split 3, loss train 0.06, score train 0.49, loss val 0.15 score val 0.21
Shutting down background jobs, please wait a moment...
Done!
Waiting for the remaining 10 operations to synchronize with Neptune. Do not kill this process.
All 10 operations synced, thanks for waiting!
Explore the metadata in the Neptune app:
https://app.neptune.ai/ba-final/cwt-1/e/CWT1-168/metadata
https://app.neptune.ai/ba-final/cwt-1/e/CWT1-169
Split 4, loss train 0.06, score train 0.50, loss val 0.18 score val 0.56
Shutting down background jobs, please wait a moment...
Done!
Waiting for the remaining 10 operations to synchronize with Neptune. Do not kill this process.
All 10 operations synced, thanks for waiting!
Explore the metadata in the Neptune app:
https://app.neptune.ai/ba-final/cwt-1/e/CWT1-169/metadata
[32m[I 2023-08-23 16:28:43,638][0m Trial 5 finished with value: 0.17573857205979368 and parameters: {'b': 3.1500000000000004, 'fc': 2.05, 'scale_min': 1.6, 'scale_max': 42, 'n_scales': 170, 'drop': 0.5241908601441085, 'optimizer': 'SGD', 'lr': 0.003077401349489438, 'weight_decay': 0.0005867534868260941, 'batch_size': 32, 'epochs': 100}. Best is trial 0 with value: 0.17573857205979368.[0m
trial 5, loss train mean 0.06, score train mean 0.50, loss val mean 0.18, score val mean 0.36



End Time   : Mi 23. Aug 16:28:45 CEST 2023
Duration   : 15131.495099440 seconds

Start Time : Mi 23. Aug 16:28:50 CEST 2023
Job ID: 1147289
Node: hades
Partition: gpu_normal_stud
CPU cores: 16
Memory: 71680
GPUs: 0
Python environment: khoa                  *  /home/phamanh/anaconda3/envs/khoa
Current work directory: /home/phamanh/Schreibtisch/bachelorarbeit/im_CNN

device: cuda


https://app.neptune.ai/ba-final/cwt-1/e/CWT1-170
Split 0, loss train 0.06, score train 0.51, loss val 0.13 score val 0.30
Shutting down background jobs, please wait a moment...
Done!
Waiting for the remaining 10 operations to synchronize with Neptune. Do not kill this process.
All 10 operations synced, thanks for waiting!
Explore the metadata in the Neptune app:
https://app.neptune.ai/ba-final/cwt-1/e/CWT1-170/metadata
https://app.neptune.ai/ba-final/cwt-1/e/CWT1-171
Split 1, loss train 0.06, score train 0.51, loss val 0.21 score val 0.31
Shutting down background jobs, please wait a moment...
Done!
Waiting for the remaining 10 operations to synchronize with Neptune. Do not kill this process.
All 10 operations synced, thanks for waiting!
Explore the metadata in the Neptune app:
https://app.neptune.ai/ba-final/cwt-1/e/CWT1-171/metadata
https://app.neptune.ai/ba-final/cwt-1/e/CWT1-172
Split 2, loss train 0.06, score train 0.49, loss val 0.20 score val 0.43
Shutting down background jobs, please wait a moment...
Done!
Waiting for the remaining 9 operations to synchronize with Neptune. Do not kill this process.
All 9 operations synced, thanks for waiting!
Explore the metadata in the Neptune app:
https://app.neptune.ai/ba-final/cwt-1/e/CWT1-172/metadata
https://app.neptune.ai/ba-final/cwt-1/e/CWT1-173
Split 3, loss train 0.06, score train 0.49, loss val 0.15 score val 0.21
Shutting down background jobs, please wait a moment...
Done!
Waiting for the remaining 14 operations to synchronize with Neptune. Do not kill this process.
All 14 operations synced, thanks for waiting!
Explore the metadata in the Neptune app:
https://app.neptune.ai/ba-final/cwt-1/e/CWT1-173/metadata
https://app.neptune.ai/ba-final/cwt-1/e/CWT1-174
Split 4, loss train 0.06, score train 0.50, loss val 0.18 score val 0.56
Shutting down background jobs, please wait a moment...
Done!
Waiting for the remaining 10 operations to synchronize with Neptune. Do not kill this process.
All 10 operations synced, thanks for waiting!
Explore the metadata in the Neptune app:
https://app.neptune.ai/ba-final/cwt-1/e/CWT1-174/metadata
