[32m[I 2023-08-27 14:23:17,382][0m Trial 28 pruned. [0m

End Time   : So 27. Aug 14:23:19 CEST 2023
Duration   : 10477.520746973 seconds

Start Time : So 27. Aug 14:23:21 CEST 2023
Job ID: 1150010
Node: cc1g03
Partition: gpu_normal_stud
CPU cores: 16
Memory: 98304
GPUs: 0
Python environment: khoa                  *  /home/phamanh/anaconda3/envs/khoa
Current work directory: /home/phamanh/Schreibtisch/bachelorarbeit/im_CNN

device: cuda


https://app.neptune.ai/ba-final/cwt-1/e/CWT1-269
Split 0, loss train 0.06, score train 0.49, loss val 0.05 score val 0.49
Shutting down background jobs, please wait a moment...
Done!
Waiting for the remaining 10 operations to synchronize with Neptune. Do not kill this process.
All 10 operations synced, thanks for waiting!
Explore the metadata in the Neptune app:
https://app.neptune.ai/ba-final/cwt-1/e/CWT1-269/metadata
https://app.neptune.ai/ba-final/cwt-1/e/CWT1-270
Split 1, loss train 0.06, score train 0.49, loss val 0.07 score val 0.51
Shutting down background jobs, please wait a moment...
Done!
Waiting for the remaining 10 operations to synchronize with Neptune. Do not kill this process.
All 10 operations synced, thanks for waiting!
Explore the metadata in the Neptune app:
https://app.neptune.ai/ba-final/cwt-1/e/CWT1-270/metadata
https://app.neptune.ai/ba-final/cwt-1/e/CWT1-271
Split 2, loss train 0.06, score train 0.48, loss val 0.05 score val 0.52
Shutting down background jobs, please wait a moment...
Done!
Waiting for the remaining 10 operations to synchronize with Neptune. Do not kill this process.
All 10 operations synced, thanks for waiting!
Explore the metadata in the Neptune app:
https://app.neptune.ai/ba-final/cwt-1/e/CWT1-271/metadata
https://app.neptune.ai/ba-final/cwt-1/e/CWT1-272
Split 3, loss train 0.06, score train 0.48, loss val 0.09 score val 0.34
Shutting down background jobs, please wait a moment...
Done!
Waiting for the remaining 14 operations to synchronize with Neptune. Do not kill this process.
All 14 operations synced, thanks for waiting!
Explore the metadata in the Neptune app:
https://app.neptune.ai/ba-final/cwt-1/e/CWT1-272/metadata
https://app.neptune.ai/ba-final/cwt-1/e/CWT1-273
Split 4, loss train 0.06, score train 0.49, loss val 0.09 score val 0.52
Shutting down background jobs, please wait a moment...
Done!
Waiting for the remaining 14 operations to synchronize with Neptune. Do not kill this process.
All 14 operations synced, thanks for waiting!
Explore the metadata in the Neptune app:
https://app.neptune.ai/ba-final/cwt-1/e/CWT1-273/metadata
[32m[I 2023-08-27 18:41:26,905][0m Trial 29 finished with value: 0.07021702604090915 and parameters: {'b': 1.6, 'fc': 1.8, 'scale_min': 0.8, 'scale_max': 38, 'n_scales': 195, 'drop': 0.27305073018609494, 'optimizer': 'Adam', 'lr': 0.0007190525844628486, 'weight_decay': 0.00470197887643078, 'batch_size': 32, 'epochs': 100}. Best is trial 23 with value: 0.059777665645518195.[0m
trial 29, loss train mean 0.06, score train mean 0.49, loss val mean 0.07, score val mean 0.48



End Time   : So 27. Aug 18:41:28 CEST 2023
Duration   : 15487.656962603 seconds

Start Time : So 27. Aug 18:41:31 CEST 2023
Job ID: 1150011
Node: cc1g05
Partition: gpu_normal_stud
CPU cores: 16
Memory: 98304
GPUs: 0
Python environment: khoa                  *  /home/phamanh/anaconda3/envs/khoa
Current work directory: /home/phamanh/Schreibtisch/bachelorarbeit/im_CNN

device: cuda


https://app.neptune.ai/ba-final/cwt-1/e/CWT1-274
Split 0, loss train 0.08, score train 0.45, loss val 0.11 score val 0.37
Shutting down background jobs, please wait a moment...
Done!
Waiting for the remaining 10 operations to synchronize with Neptune. Do not kill this process.
All 10 operations synced, thanks for waiting!
Explore the metadata in the Neptune app:
https://app.neptune.ai/ba-final/cwt-1/e/CWT1-274/metadata
https://app.neptune.ai/ba-final/cwt-1/e/CWT1-275
Split 1, loss train 0.08, score train 0.45, loss val 0.12 score val 0.26
Shutting down background jobs, please wait a moment...
Done!
Waiting for the remaining 10 operations to synchronize with Neptune. Do not kill this process.
All 10 operations synced, thanks for waiting!
Explore the metadata in the Neptune app:
https://app.neptune.ai/ba-final/cwt-1/e/CWT1-275/metadata
https://app.neptune.ai/ba-final/cwt-1/e/CWT1-276
Split 2, loss train 0.08, score train 0.44, loss val 0.06 score val 0.51
Shutting down background jobs, please wait a moment...
Done!
Waiting for the remaining 10 operations to synchronize with Neptune. Do not kill this process.
All 10 operations synced, thanks for waiting!
Explore the metadata in the Neptune app:
https://app.neptune.ai/ba-final/cwt-1/e/CWT1-276/metadata
https://app.neptune.ai/ba-final/cwt-1/e/CWT1-277
Split 3, loss train 0.08, score train 0.44, loss val 0.08 score val 0.43
Shutting down background jobs, please wait a moment...
Done!
Waiting for the remaining 14 operations to synchronize with Neptune. Do not kill this process.
All 14 operations synced, thanks for waiting!
Explore the metadata in the Neptune app:
https://app.neptune.ai/ba-final/cwt-1/e/CWT1-277/metadata
https://app.neptune.ai/ba-final/cwt-1/e/CWT1-278
Split 4, loss train 0.08, score train 0.44, loss val 0.12 score val 0.20
Shutting down background jobs, please wait a moment...
Done!
Waiting for the remaining 10 operations to synchronize with Neptune. Do not kill this process.
All 10 operations synced, thanks for waiting!
Explore the metadata in the Neptune app:
https://app.neptune.ai/ba-final/cwt-1/e/CWT1-278/metadata
[32m[I 2023-08-27 22:36:05,616][0m Trial 30 finished with value: 0.09581559972560152 and parameters: {'b': 1.9500000000000002, 'fc': 1.3, 'scale_min': 0.7, 'scale_max': 12, 'n_scales': 225, 'drop': 0.4187781596958476, 'optimizer': 'Adam', 'lr': 0.0018916973404445568, 'weight_decay': 0.011763511628051039, 'batch_size': 32, 'epochs': 100}. Best is trial 23 with value: 0.059777665645518195.[0m
trial 30, loss train mean 0.08, score train mean 0.45, loss val mean 0.10, score val mean 0.35



End Time   : So 27. Aug 22:36:07 CEST 2023
Duration   : 14076.017747221 seconds

Start Time : So 27. Aug 22:36:24 CEST 2023
Job ID: 1150012
Node: cc1g05
Partition: gpu_normal_stud
CPU cores: 16
Memory: 98304
GPUs: 0
Python environment: khoa                  *  /home/phamanh/anaconda3/envs/khoa
Current work directory: /home/phamanh/Schreibtisch/bachelorarbeit/im_CNN

device: cuda


https://app.neptune.ai/ba-final/cwt-1/e/CWT1-279
Split 0, loss train 0.06, score train 0.48, loss val 0.13 score val 0.27
Shutting down background jobs, please wait a moment...
Done!
Waiting for the remaining 10 operations to synchronize with Neptune. Do not kill this process.
All 10 operations synced, thanks for waiting!
Explore the metadata in the Neptune app:
https://app.neptune.ai/ba-final/cwt-1/e/CWT1-279/metadata
https://app.neptune.ai/ba-final/cwt-1/e/CWT1-280
Split 1, loss train 0.06, score train 0.47, loss val 0.21 score val 0.20
Shutting down background jobs, please wait a moment...
Done!
Waiting for the remaining 10 operations to synchronize with Neptune. Do not kill this process.
All 10 operations synced, thanks for waiting!
Explore the metadata in the Neptune app:
https://app.neptune.ai/ba-final/cwt-1/e/CWT1-280/metadata
https://app.neptune.ai/ba-final/cwt-1/e/CWT1-281
Split 2, loss train 0.07, score train 0.45, loss val 0.10 score val 0.27
Shutting down background jobs, please wait a moment...
Done!
Waiting for the remaining 10 operations to synchronize with Neptune. Do not kill this process.
All 10 operations synced, thanks for waiting!
Explore the metadata in the Neptune app:
https://app.neptune.ai/ba-final/cwt-1/e/CWT1-281/metadata
https://app.neptune.ai/ba-final/cwt-1/e/CWT1-282
Split 3, loss train 0.06, score train 0.46, loss val 0.11 score val 0.42
Shutting down background jobs, please wait a moment...
Done!
Waiting for the remaining 14 operations to synchronize with Neptune. Do not kill this process.
All 14 operations synced, thanks for waiting!
Explore the metadata in the Neptune app:
https://app.neptune.ai/ba-final/cwt-1/e/CWT1-282/metadata
https://app.neptune.ai/ba-final/cwt-1/e/CWT1-283
Split 4, loss train 0.06, score train 0.47, loss val 0.10 score val 0.37
Shutting down background jobs, please wait a moment...
Done!
Waiting for the remaining 10 operations to synchronize with Neptune. Do not kill this process.
All 10 operations synced, thanks for waiting!
Explore the metadata in the Neptune app:
https://app.neptune.ai/ba-final/cwt-1/e/CWT1-283/metadata
[32m[I 2023-08-28 02:01:43,692][0m Trial 31 finished with value: 0.13169106625496074 and parameters: {'b': 3.75, 'fc': 1.5, 'scale_min': 2.0, 'scale_max': 46, 'n_scales': 100, 'drop': 0.6142065425977165, 'optimizer': 'Adam', 'lr': 0.0018916973404445568, 'weight_decay': 0.001796746245339413, 'batch_size': 32, 'epochs': 100}. Best is trial 23 with value: 0.059777665645518195.[0m
trial 31, loss train mean 0.06, score train mean 0.47, loss val mean 0.13, score val mean 0.30



End Time   : Mo 28. Aug 02:01:45 CEST 2023
Duration   : 12320.778833162 seconds

Start Time : Mo 28. Aug 02:01:56 CEST 2023
Job ID: 1150013
Node: cc1g05
Partition: gpu_normal_stud
CPU cores: 16
Memory: 98304
GPUs: 0
Python environment: khoa                  *  /home/phamanh/anaconda3/envs/khoa
Current work directory: /home/phamanh/Schreibtisch/bachelorarbeit/im_CNN

device: cuda


https://app.neptune.ai/ba-final/cwt-1/e/CWT1-284
Split 0, loss train 0.06, score train 0.48, loss val 0.10 score val 0.32
Shutting down background jobs, please wait a moment...
Done!
Waiting for the remaining 10 operations to synchronize with Neptune. Do not kill this process.
All 10 operations synced, thanks for waiting!
Explore the metadata in the Neptune app:
https://app.neptune.ai/ba-final/cwt-1/e/CWT1-284/metadata
https://app.neptune.ai/ba-final/cwt-1/e/CWT1-285
Split 1, loss train 0.06, score train 0.47, loss val 0.10 score val 0.38
Shutting down background jobs, please wait a moment...
Done!
Waiting for the remaining 10 operations to synchronize with Neptune. Do not kill this process.
All 10 operations synced, thanks for waiting!
Explore the metadata in the Neptune app:
https://app.neptune.ai/ba-final/cwt-1/e/CWT1-285/metadata
https://app.neptune.ai/ba-final/cwt-1/e/CWT1-286
Split 2, loss train 0.06, score train 0.47, loss val 0.06 score val 0.56
Shutting down background jobs, please wait a moment...
Done!
Waiting for the remaining 14 operations to synchronize with Neptune. Do not kill this process.
All 14 operations synced, thanks for waiting!
Explore the metadata in the Neptune app:
https://app.neptune.ai/ba-final/cwt-1/e/CWT1-286/metadata
https://app.neptune.ai/ba-final/cwt-1/e/CWT1-287
Split 3, loss train 0.06, score train 0.47, loss val 0.04 score val 0.58
Shutting down background jobs, please wait a moment...
Done!
Waiting for the remaining 10 operations to synchronize with Neptune. Do not kill this process.
All 10 operations synced, thanks for waiting!
Explore the metadata in the Neptune app:
https://app.neptune.ai/ba-final/cwt-1/e/CWT1-287/metadata
https://app.neptune.ai/ba-final/cwt-1/e/CWT1-288
Split 4, loss train 0.06, score train 0.48, loss val 0.05 score val 0.52
Shutting down background jobs, please wait a moment...
Done!
Waiting for the remaining 9 operations to synchronize with Neptune. Do not kill this process.
All 9 operations synced, thanks for waiting!
Explore the metadata in the Neptune app:
https://app.neptune.ai/ba-final/cwt-1/e/CWT1-288/metadata
[32m[I 2023-08-28 06:06:31,257][0m Trial 32 finished with value: 0.07148082357771854 and parameters: {'b': 1.1500000000000001, 'fc': 1.8, 'scale_min': 1.3, 'scale_max': 38, 'n_scales': 150, 'drop': 0.7065898857348413, 'optimizer': 'Adam', 'lr': 0.0007834925954574327, 'weight_decay': 0.005784816072007379, 'batch_size': 32, 'epochs': 100}. Best is trial 23 with value: 0.059777665645518195.[0m
trial 32, loss train mean 0.06, score train mean 0.47, loss val mean 0.07, score val mean 0.47



End Time   : Mo 28. Aug 06:06:33 CEST 2023
Duration   : 14676.269164427 seconds

Start Time : Mo 28. Aug 06:06:46 CEST 2023
Job ID: 1150014
Node: cc1g07
Partition: gpu_normal_stud
CPU cores: 16
Memory: 98304
GPUs: 0
Python environment: khoa                  *  /home/phamanh/anaconda3/envs/khoa
Current work directory: /home/phamanh/Schreibtisch/bachelorarbeit/im_CNN

device: cuda


https://app.neptune.ai/ba-final/cwt-1/e/CWT1-289
Split 0, loss train 0.06, score train 0.48, loss val 0.04 score val 0.55
Shutting down background jobs, please wait a moment...
Done!
Waiting for the remaining 10 operations to synchronize with Neptune. Do not kill this process.
All 10 operations synced, thanks for waiting!
Explore the metadata in the Neptune app:
https://app.neptune.ai/ba-final/cwt-1/e/CWT1-289/metadata
https://app.neptune.ai/ba-final/cwt-1/e/CWT1-290
Split 1, loss train 0.06, score train 0.47, loss val 0.07 score val 0.53
Shutting down background jobs, please wait a moment...
Done!
Waiting for the remaining 10 operations to synchronize with Neptune. Do not kill this process.
All 10 operations synced, thanks for waiting!
Explore the metadata in the Neptune app:
https://app.neptune.ai/ba-final/cwt-1/e/CWT1-290/metadata
https://app.neptune.ai/ba-final/cwt-1/e/CWT1-291
Split 2, loss train 0.07, score train 0.46, loss val 0.06 score val 0.46
Shutting down background jobs, please wait a moment...
Done!
Waiting for the remaining 10 operations to synchronize with Neptune. Do not kill this process.
All 10 operations synced, thanks for waiting!
Explore the metadata in the Neptune app:
https://app.neptune.ai/ba-final/cwt-1/e/CWT1-291/metadata
https://app.neptune.ai/ba-final/cwt-1/e/CWT1-292
Split 3, loss train 0.07, score train 0.46, loss val 0.05 score val 0.54
Shutting down background jobs, please wait a moment...
Done!
Waiting for the remaining 10 operations to synchronize with Neptune. Do not kill this process.
All 10 operations synced, thanks for waiting!
Explore the metadata in the Neptune app:
https://app.neptune.ai/ba-final/cwt-1/e/CWT1-292/metadata
https://app.neptune.ai/ba-final/cwt-1/e/CWT1-293
Split 4, loss train 0.07, score train 0.47, loss val 0.06 score val 0.48
Shutting down background jobs, please wait a moment...
Done!
Waiting for the remaining 10 operations to synchronize with Neptune. Do not kill this process.
All 10 operations synced, thanks for waiting!
Explore the metadata in the Neptune app:
https://app.neptune.ai/ba-final/cwt-1/e/CWT1-293/metadata
[32m[I 2023-08-28 09:25:01,494][0m Trial 33 finished with value: 0.05809502500168821 and parameters: {'b': 2.6, 'fc': 1.6, 'scale_min': 1.2000000000000002, 'scale_max': 20, 'n_scales': 120, 'drop': 0.6023485791145166, 'optimizer': 'Adam', 'lr': 0.0006784101822725967, 'weight_decay': 0.015456541733743523, 'batch_size': 32, 'epochs': 100}. Best is trial 33 with value: 0.05809502500168821.[0m
trial 33, loss train mean 0.07, score train mean 0.47, loss val mean 0.06, score val mean 0.51



End Time   : Mo 28. Aug 09:25:04 CEST 2023
Duration   : 11897.892595074 seconds

Start Time : Mo 28. Aug 09:25:29 CEST 2023
Job ID: 1150015
Node: cc1g07
Partition: gpu_normal_stud
CPU cores: 16
Memory: 98304
GPUs: 0
Python environment: khoa                  *  /home/phamanh/anaconda3/envs/khoa
Current work directory: /home/phamanh/Schreibtisch/bachelorarbeit/im_CNN

device: cuda


https://app.neptune.ai/ba-final/cwt-1/e/CWT1-294
Split 0, loss train 0.06, score train 0.48, loss val 0.10 score val 0.39
Shutting down background jobs, please wait a moment...
Done!
Waiting for the remaining 14 operations to synchronize with Neptune. Do not kill this process.
All 14 operations synced, thanks for waiting!
Explore the metadata in the Neptune app:
https://app.neptune.ai/ba-final/cwt-1/e/CWT1-294/metadata
https://app.neptune.ai/ba-final/cwt-1/e/CWT1-295
Split 1, loss train 0.06, score train 0.47, loss val 0.08 score val 0.42
Shutting down background jobs, please wait a moment...
Done!
Waiting for the remaining 14 operations to synchronize with Neptune. Do not kill this process.
All 14 operations synced, thanks for waiting!
Explore the metadata in the Neptune app:
https://app.neptune.ai/ba-final/cwt-1/e/CWT1-295/metadata
https://app.neptune.ai/ba-final/cwt-1/e/CWT1-296
Split 2, loss train 0.07, score train 0.46, loss val 0.05 score val 0.47
Shutting down background jobs, please wait a moment...
Done!
Waiting for the remaining 14 operations to synchronize with Neptune. Do not kill this process.
All 14 operations synced, thanks for waiting!
Explore the metadata in the Neptune app:
https://app.neptune.ai/ba-final/cwt-1/e/CWT1-296/metadata
https://app.neptune.ai/ba-final/cwt-1/e/CWT1-297
Split 3, loss train 0.07, score train 0.46, loss val 0.11 score val 0.32
Shutting down background jobs, please wait a moment...
Done!
Waiting for the remaining 10 operations to synchronize with Neptune. Do not kill this process.
All 10 operations synced, thanks for waiting!
Explore the metadata in the Neptune app:
https://app.neptune.ai/ba-final/cwt-1/e/CWT1-297/metadata
https://app.neptune.ai/ba-final/cwt-1/e/CWT1-298
Split 4, loss train 0.06, score train 0.48, loss val 0.10 score val 0.48
Shutting down background jobs, please wait a moment...
Done!
Waiting for the remaining 10 operations to synchronize with Neptune. Do not kill this process.
All 10 operations synced, thanks for waiting!
Explore the metadata in the Neptune app:
https://app.neptune.ai/ba-final/cwt-1/e/CWT1-298/metadata
[32m[I 2023-08-28 12:43:20,782][0m Trial 34 finished with value: 0.08738976640904203 and parameters: {'b': 2.6, 'fc': 0.9, 'scale_min': 1.2000000000000002, 'scale_max': 20, 'n_scales': 120, 'drop': 0.6023485791145166, 'optimizer': 'Adam', 'lr': 0.0005140571023065126, 'weight_decay': 0.015456541733743523, 'batch_size': 32, 'epochs': 100}. Best is trial 33 with value: 0.05809502500168821.[0m
trial 34, loss train mean 0.06, score train mean 0.47, loss val mean 0.09, score val mean 0.42



End Time   : Mo 28. Aug 12:43:23 CEST 2023
Duration   : 11874.092746985 seconds

Start Time : Mo 28. Aug 12:43:30 CEST 2023
Job ID: 1150016
Node: cc1g07
Partition: gpu_normal_stud
CPU cores: 16
Memory: 98304
GPUs: 0
Python environment: khoa                  *  /home/phamanh/anaconda3/envs/khoa
Current work directory: /home/phamanh/Schreibtisch/bachelorarbeit/im_CNN

device: cuda


https://app.neptune.ai/ba-final/cwt-1/e/CWT1-299
Split 0, loss train 0.08, score train 0.44, loss val 0.07 score val 0.52
Shutting down background jobs, please wait a moment...
Done!
Waiting for the remaining 10 operations to synchronize with Neptune. Do not kill this process.
All 10 operations synced, thanks for waiting!
Explore the metadata in the Neptune app:
https://app.neptune.ai/ba-final/cwt-1/e/CWT1-299/metadata
https://app.neptune.ai/ba-final/cwt-1/e/CWT1-300
Split 1, loss train 0.09, score train 0.43, loss val 0.10 score val 0.46
Shutting down background jobs, please wait a moment...
Done!
Waiting for the remaining 10 operations to synchronize with Neptune. Do not kill this process.
All 10 operations synced, thanks for waiting!
Explore the metadata in the Neptune app:
https://app.neptune.ai/ba-final/cwt-1/e/CWT1-300/metadata
https://app.neptune.ai/ba-final/cwt-1/e/CWT1-301
Shutting down background jobs, please wait a moment...
Done!
Waiting for the remaining 7 operations to synchronize with Neptune. Do not kill this process.
All 7 operations synced, thanks for waiting!
Explore the metadata in the Neptune app:
https://app.neptune.ai/ba-final/cwt-1/e/CWT1-301/metadata
[32m[I 2023-08-28 15:14:23,435][0m Trial 35 pruned. [0m

End Time   : Mo 28. Aug 15:14:26 CEST 2023
Duration   : 9056.318184313 seconds

Start Time : Mo 28. Aug 15:14:31 CEST 2023
Job ID: 1150017
Node: cc1g07
Partition: gpu_normal_stud
CPU cores: 16
Memory: 98304
GPUs: 0
Python environment: khoa                  *  /home/phamanh/anaconda3/envs/khoa
Current work directory: /home/phamanh/Schreibtisch/bachelorarbeit/im_CNN

device: cuda


https://app.neptune.ai/ba-final/cwt-1/e/CWT1-302
Shutting down background jobs, please wait a moment...
Done!
Waiting for the remaining 3 operations to synchronize with Neptune. Do not kill this process.
All 3 operations synced, thanks for waiting!
Explore the metadata in the Neptune app:
https://app.neptune.ai/ba-final/cwt-1/e/CWT1-302/metadata
