[32m[I 2023-09-06 23:34:38,593][0m Trial 88 finished with value: 0.06426338591474168 and parameters: {'b': 2.4000000000000004, 'fc': 2.4000000000000004, 'scale_min': 0.9, 'scale_max': 10, 'n_scales': 190, 'drop': 0.3258208045077071, 'optimizer': 'Adam', 'lr': 0.0011608365770587857, 'weight_decay': 0.002399519149396367, 'batch_size': 32, 'epochs': 100}. Best is trial 85 with value: 0.04277383215883945.[0m
trial 88, loss train mean 0.06, score train mean 0.48, loss val mean 0.06, score val mean 0.52



End Time   : Mi 6. Sep 23:34:41 CEST 2023
Duration   : 12678.676051744 seconds

Start Time : Do 7. Sep 04:52:32 CEST 2023
Job ID: 1157406
Node: cc1g06
Partition: gpu_normal_stud
CPU cores: 16
Memory: 98304
GPUs: 0
Python environment: khoa                  *  /home/phamanh/anaconda3/envs/khoa
Current work directory: /home/phamanh/Schreibtisch/bachelorarbeit/im_CNN

device: cuda


https://app.neptune.ai/ba-final/cwt-1/e/CWT1-507
Split 0, loss train 0.06, score train 0.49, loss val 0.05 score val 0.56
Shutting down background jobs, please wait a moment...
Done!
Waiting for the remaining 10 operations to synchronize with Neptune. Do not kill this process.
All 10 operations synced, thanks for waiting!
Explore the metadata in the Neptune app:
https://app.neptune.ai/ba-final/cwt-1/e/CWT1-507/metadata
https://app.neptune.ai/ba-final/cwt-1/e/CWT1-508
Split 1, loss train 0.06, score train 0.49, loss val 0.08 score val 0.45
Shutting down background jobs, please wait a moment...
Done!
Waiting for the remaining 10 operations to synchronize with Neptune. Do not kill this process.
All 10 operations synced, thanks for waiting!
Explore the metadata in the Neptune app:
https://app.neptune.ai/ba-final/cwt-1/e/CWT1-508/metadata
https://app.neptune.ai/ba-final/cwt-1/e/CWT1-509
Split 2, loss train 0.06, score train 0.48, loss val 0.03 score val 0.62
Shutting down background jobs, please wait a moment...
Done!
Waiting for the remaining 14 operations to synchronize with Neptune. Do not kill this process.
All 14 operations synced, thanks for waiting!
Explore the metadata in the Neptune app:
https://app.neptune.ai/ba-final/cwt-1/e/CWT1-509/metadata
https://app.neptune.ai/ba-final/cwt-1/e/CWT1-510
Split 3, loss train 0.06, score train 0.48, loss val 0.03 score val 0.59
Shutting down background jobs, please wait a moment...
Done!
Waiting for the remaining 14 operations to synchronize with Neptune. Do not kill this process.
All 14 operations synced, thanks for waiting!
Explore the metadata in the Neptune app:
https://app.neptune.ai/ba-final/cwt-1/e/CWT1-510/metadata
https://app.neptune.ai/ba-final/cwt-1/e/CWT1-511
Split 4, loss train 0.06, score train 0.49, loss val 0.06 score val 0.56
Shutting down background jobs, please wait a moment...
Done!
Waiting for the remaining 10 operations to synchronize with Neptune. Do not kill this process.
All 10 operations synced, thanks for waiting!
Explore the metadata in the Neptune app:
https://app.neptune.ai/ba-final/cwt-1/e/CWT1-511/metadata
[32m[I 2023-09-07 09:03:47,403][0m Trial 89 finished with value: 0.051694749264006926 and parameters: {'b': 2.8, 'fc': 2.45, 'scale_min': 0.9, 'scale_max': 10, 'n_scales': 200, 'drop': 0.28804885615572573, 'optimizer': 'Adam', 'lr': 0.0008571907543233288, 'weight_decay': 0.003529372638237008, 'batch_size': 32, 'epochs': 100}. Best is trial 85 with value: 0.04277383215883945.[0m
trial 89, loss train mean 0.06, score train mean 0.48, loss val mean 0.05, score val mean 0.56



End Time   : Do 7. Sep 09:03:49 CEST 2023
Duration   : 15076.991373797 seconds

Start Time : Do 7. Sep 09:03:50 CEST 2023
Job ID: 1157407
Node: cc1g03
Partition: gpu_normal_stud
CPU cores: 16
Memory: 98304
GPUs: 0
Python environment: khoa                  *  /home/phamanh/anaconda3/envs/khoa
Current work directory: /home/phamanh/Schreibtisch/bachelorarbeit/im_CNN

device: cuda


https://app.neptune.ai/ba-final/cwt-1/e/CWT1-512
Split 0, loss train 0.05, score train 0.50, loss val 0.04 score val 0.55
Shutting down background jobs, please wait a moment...
Done!
Waiting for the remaining 10 operations to synchronize with Neptune. Do not kill this process.
All 10 operations synced, thanks for waiting!
Explore the metadata in the Neptune app:
https://app.neptune.ai/ba-final/cwt-1/e/CWT1-512/metadata
https://app.neptune.ai/ba-final/cwt-1/e/CWT1-513
Split 1, loss train 0.06, score train 0.49, loss val 0.08 score val 0.56
Shutting down background jobs, please wait a moment...
Done!
Waiting for the remaining 10 operations to synchronize with Neptune. Do not kill this process.
All 10 operations synced, thanks for waiting!
Explore the metadata in the Neptune app:
https://app.neptune.ai/ba-final/cwt-1/e/CWT1-513/metadata
https://app.neptune.ai/ba-final/cwt-1/e/CWT1-514
Split 2, loss train 0.06, score train 0.48, loss val 0.04 score val 0.52
Shutting down background jobs, please wait a moment...
Done!
Waiting for the remaining 10 operations to synchronize with Neptune. Do not kill this process.
All 10 operations synced, thanks for waiting!
Explore the metadata in the Neptune app:
https://app.neptune.ai/ba-final/cwt-1/e/CWT1-514/metadata
https://app.neptune.ai/ba-final/cwt-1/e/CWT1-515
Split 3, loss train 0.06, score train 0.48, loss val 0.04 score val 0.49
Shutting down background jobs, please wait a moment...
Done!
Waiting for the remaining 14 operations to synchronize with Neptune. Do not kill this process.
All 14 operations synced, thanks for waiting!
Explore the metadata in the Neptune app:
https://app.neptune.ai/ba-final/cwt-1/e/CWT1-515/metadata
https://app.neptune.ai/ba-final/cwt-1/e/CWT1-516
Split 4, loss train 0.06, score train 0.49, loss val 0.06 score val 0.46
Shutting down background jobs, please wait a moment...
Done!
Waiting for the remaining 14 operations to synchronize with Neptune. Do not kill this process.
All 14 operations synced, thanks for waiting!
Explore the metadata in the Neptune app:
https://app.neptune.ai/ba-final/cwt-1/e/CWT1-516/metadata
[32m[I 2023-09-07 12:36:43,907][0m Trial 90 finished with value: 0.051003028484101 and parameters: {'b': 2.8, 'fc': 2.45, 'scale_min': 1.2000000000000002, 'scale_max': 10, 'n_scales': 195, 'drop': 0.29566486380717866, 'optimizer': 'Adam', 'lr': 0.0007072674163566621, 'weight_decay': 0.003475153410934645, 'batch_size': 32, 'epochs': 100}. Best is trial 85 with value: 0.04277383215883945.[0m
trial 90, loss train mean 0.06, score train mean 0.49, loss val mean 0.05, score val mean 0.52



End Time   : Do 7. Sep 12:36:45 CEST 2023
Duration   : 12775.011151456 seconds

Start Time : Do 7. Sep 12:37:52 CEST 2023
Job ID: 1157408
Node: hades
Partition: gpu_normal_stud
CPU cores: 16
Memory: 98304
GPUs: 0
Python environment: khoa                  *  /home/phamanh/anaconda3/envs/khoa
Current work directory: /home/phamanh/Schreibtisch/bachelorarbeit/im_CNN

device: cuda


https://app.neptune.ai/ba-final/cwt-1/e/CWT1-517
Split 0, loss train 0.05, score train 0.50, loss val 0.05 score val 0.55
Shutting down background jobs, please wait a moment...
Done!
Waiting for the remaining 10 operations to synchronize with Neptune. Do not kill this process.
All 10 operations synced, thanks for waiting!
Explore the metadata in the Neptune app:
https://app.neptune.ai/ba-final/cwt-1/e/CWT1-517/metadata
https://app.neptune.ai/ba-final/cwt-1/e/CWT1-518
Split 1, loss train 0.06, score train 0.49, loss val 0.06 score val 0.53
Shutting down background jobs, please wait a moment...
Done!
Waiting for the remaining 10 operations to synchronize with Neptune. Do not kill this process.
All 10 operations synced, thanks for waiting!
Explore the metadata in the Neptune app:
https://app.neptune.ai/ba-final/cwt-1/e/CWT1-518/metadata
https://app.neptune.ai/ba-final/cwt-1/e/CWT1-519
Split 2, loss train 0.06, score train 0.48, loss val 0.06 score val 0.47
Shutting down background jobs, please wait a moment...
Done!
Waiting for the remaining 10 operations to synchronize with Neptune. Do not kill this process.
All 10 operations synced, thanks for waiting!
Explore the metadata in the Neptune app:
https://app.neptune.ai/ba-final/cwt-1/e/CWT1-519/metadata
https://app.neptune.ai/ba-final/cwt-1/e/CWT1-520
Split 3, loss train 0.06, score train 0.49, loss val 0.04 score val 0.58
Shutting down background jobs, please wait a moment...
Done!
Waiting for the remaining 10 operations to synchronize with Neptune. Do not kill this process.
All 10 operations synced, thanks for waiting!
Explore the metadata in the Neptune app:
https://app.neptune.ai/ba-final/cwt-1/e/CWT1-520/metadata
https://app.neptune.ai/ba-final/cwt-1/e/CWT1-521
Split 4, loss train 0.06, score train 0.49, loss val 0.05 score val 0.41
Shutting down background jobs, please wait a moment...
Done!
Waiting for the remaining 14 operations to synchronize with Neptune. Do not kill this process.
All 14 operations synced, thanks for waiting!
Explore the metadata in the Neptune app:
https://app.neptune.ai/ba-final/cwt-1/e/CWT1-521/metadata
[32m[I 2023-09-07 17:23:19,527][0m Trial 91 finished with value: 0.04999803583672706 and parameters: {'b': 2.8500000000000005, 'fc': 2.45, 'scale_min': 1.2000000000000002, 'scale_max': 10, 'n_scales': 195, 'drop': 0.2981652067473013, 'optimizer': 'Adam', 'lr': 0.000700274977463823, 'weight_decay': 0.0036326551433823414, 'batch_size': 32, 'epochs': 100}. Best is trial 85 with value: 0.04277383215883945.[0m
trial 91, loss train mean 0.06, score train mean 0.49, loss val mean 0.05, score val mean 0.51



End Time   : Do 7. Sep 17:23:21 CEST 2023
Duration   : 17129.082941535 seconds

Start Time : Do 7. Sep 17:23:22 CEST 2023
Job ID: 1157409
Node: hades
Partition: gpu_normal_stud
CPU cores: 16
Memory: 98304
GPUs: 0
Python environment: khoa                  *  /home/phamanh/anaconda3/envs/khoa
Current work directory: /home/phamanh/Schreibtisch/bachelorarbeit/im_CNN

device: cuda


https://app.neptune.ai/ba-final/cwt-1/e/CWT1-522
Split 0, loss train 0.05, score train 0.50, loss val 0.08 score val 0.31
Shutting down background jobs, please wait a moment...
Done!
Waiting for the remaining 14 operations to synchronize with Neptune. Do not kill this process.
All 14 operations synced, thanks for waiting!
Explore the metadata in the Neptune app:
https://app.neptune.ai/ba-final/cwt-1/e/CWT1-522/metadata
https://app.neptune.ai/ba-final/cwt-1/e/CWT1-523
Split 1, loss train 0.06, score train 0.49, loss val 0.05 score val 0.57
Shutting down background jobs, please wait a moment...
Done!
Waiting for the remaining 10 operations to synchronize with Neptune. Do not kill this process.
All 10 operations synced, thanks for waiting!
Explore the metadata in the Neptune app:
https://app.neptune.ai/ba-final/cwt-1/e/CWT1-523/metadata
https://app.neptune.ai/ba-final/cwt-1/e/CWT1-524
Split 2, loss train 0.06, score train 0.48, loss val 0.04 score val 0.51
Shutting down background jobs, please wait a moment...
Done!
Waiting for the remaining 10 operations to synchronize with Neptune. Do not kill this process.
All 10 operations synced, thanks for waiting!
Explore the metadata in the Neptune app:
https://app.neptune.ai/ba-final/cwt-1/e/CWT1-524/metadata
https://app.neptune.ai/ba-final/cwt-1/e/CWT1-525
Split 3, loss train 0.06, score train 0.48, loss val 0.05 score val 0.61
Shutting down background jobs, please wait a moment...
Done!
Waiting for the remaining 10 operations to synchronize with Neptune. Do not kill this process.
All 10 operations synced, thanks for waiting!
Explore the metadata in the Neptune app:
https://app.neptune.ai/ba-final/cwt-1/e/CWT1-525/metadata
https://app.neptune.ai/ba-final/cwt-1/e/CWT1-526
Split 4, loss train 0.06, score train 0.49, loss val 0.06 score val 0.40
Shutting down background jobs, please wait a moment...
Done!
Waiting for the remaining 10 operations to synchronize with Neptune. Do not kill this process.
All 10 operations synced, thanks for waiting!
Explore the metadata in the Neptune app:
https://app.neptune.ai/ba-final/cwt-1/e/CWT1-526/metadata
[32m[I 2023-09-07 20:29:43,025][0m Trial 92 finished with value: 0.055506649423152844 and parameters: {'b': 2.8500000000000005, 'fc': 2.4000000000000004, 'scale_min': 1.8, 'scale_max': 10, 'n_scales': 195, 'drop': 0.2932013582347465, 'optimizer': 'Adam', 'lr': 0.0006972525591862385, 'weight_decay': 0.0035768586953570203, 'batch_size': 32, 'epochs': 100}. Best is trial 85 with value: 0.04277383215883945.[0m
trial 92, loss train mean 0.06, score train mean 0.49, loss val mean 0.06, score val mean 0.48



End Time   : Do 7. Sep 20:29:44 CEST 2023
Duration   : 11182.349850806 seconds

Start Time : Do 7. Sep 23:42:36 CEST 2023
Job ID: 1157410
Node: cc1g06
Partition: gpu_normal_stud
CPU cores: 16
Memory: 98304
GPUs: 0
Python environment: khoa                  *  /home/phamanh/anaconda3/envs/khoa
Current work directory: /home/phamanh/Schreibtisch/bachelorarbeit/im_CNN

device: cuda


https://app.neptune.ai/ba-final/cwt-1/e/CWT1-527
Split 0, loss train 0.05, score train 0.50, loss val 0.07 score val 0.54
Shutting down background jobs, please wait a moment...
Done!
Waiting for the remaining 9 operations to synchronize with Neptune. Do not kill this process.
All 9 operations synced, thanks for waiting!
Explore the metadata in the Neptune app:
https://app.neptune.ai/ba-final/cwt-1/e/CWT1-527/metadata
https://app.neptune.ai/ba-final/cwt-1/e/CWT1-528
Split 1, loss train 0.05, score train 0.49, loss val 0.07 score val 0.50
Shutting down background jobs, please wait a moment...
Done!
Waiting for the remaining 10 operations to synchronize with Neptune. Do not kill this process.
All 10 operations synced, thanks for waiting!
Explore the metadata in the Neptune app:
https://app.neptune.ai/ba-final/cwt-1/e/CWT1-528/metadata
https://app.neptune.ai/ba-final/cwt-1/e/CWT1-529
Split 2, loss train 0.06, score train 0.48, loss val 0.04 score val 0.52
Shutting down background jobs, please wait a moment...
Done!
Waiting for the remaining 10 operations to synchronize with Neptune. Do not kill this process.
All 10 operations synced, thanks for waiting!
Explore the metadata in the Neptune app:
https://app.neptune.ai/ba-final/cwt-1/e/CWT1-529/metadata
https://app.neptune.ai/ba-final/cwt-1/e/CWT1-530
Split 3, loss train 0.06, score train 0.48, loss val 0.06 score val 0.56
Shutting down background jobs, please wait a moment...
Done!
Waiting for the remaining 10 operations to synchronize with Neptune. Do not kill this process.
All 10 operations synced, thanks for waiting!
Explore the metadata in the Neptune app:
https://app.neptune.ai/ba-final/cwt-1/e/CWT1-530/metadata
https://app.neptune.ai/ba-final/cwt-1/e/CWT1-531
Split 4, loss train 0.06, score train 0.49, loss val 0.05 score val 0.56
Shutting down background jobs, please wait a moment...
Done!
Waiting for the remaining 10 operations to synchronize with Neptune. Do not kill this process.
All 10 operations synced, thanks for waiting!
Explore the metadata in the Neptune app:
https://app.neptune.ai/ba-final/cwt-1/e/CWT1-531/metadata
[32m[I 2023-09-08 03:25:03,033][0m Trial 93 finished with value: 0.057385422321076095 and parameters: {'b': 2.8500000000000005, 'fc': 2.4000000000000004, 'scale_min': 1.7000000000000002, 'scale_max': 10, 'n_scales': 195, 'drop': 0.2958871069562295, 'optimizer': 'Adam', 'lr': 0.0007081918100433739, 'weight_decay': 0.0035683556192167513, 'batch_size': 32, 'epochs': 100}. Best is trial 85 with value: 0.04277383215883945.[0m
trial 93, loss train mean 0.06, score train mean 0.49, loss val mean 0.06, score val mean 0.54



End Time   : Fr 8. Sep 03:25:05 CEST 2023
Duration   : 13349.204998984 seconds

Start Time : Fr 8. Sep 03:25:06 CEST 2023
Job ID: 1157411
Node: cc1g06
Partition: gpu_normal_stud
CPU cores: 16
Memory: 98304
GPUs: 0
Python environment: khoa                  *  /home/phamanh/anaconda3/envs/khoa
Current work directory: /home/phamanh/Schreibtisch/bachelorarbeit/im_CNN

device: cuda


https://app.neptune.ai/ba-final/cwt-1/e/CWT1-532
Split 0, loss train 0.05, score train 0.49, loss val 0.06 score val 0.61
Shutting down background jobs, please wait a moment...
Done!
Waiting for the remaining 10 operations to synchronize with Neptune. Do not kill this process.
All 10 operations synced, thanks for waiting!
Explore the metadata in the Neptune app:
https://app.neptune.ai/ba-final/cwt-1/e/CWT1-532/metadata
https://app.neptune.ai/ba-final/cwt-1/e/CWT1-533
Split 1, loss train 0.06, score train 0.50, loss val 0.07 score val 0.57
Shutting down background jobs, please wait a moment...
Done!
Waiting for the remaining 10 operations to synchronize with Neptune. Do not kill this process.
All 10 operations synced, thanks for waiting!
Explore the metadata in the Neptune app:
https://app.neptune.ai/ba-final/cwt-1/e/CWT1-533/metadata
https://app.neptune.ai/ba-final/cwt-1/e/CWT1-534
Split 2, loss train 0.06, score train 0.48, loss val 0.08 score val 0.52
Shutting down background jobs, please wait a moment...
Done!
Waiting for the remaining 14 operations to synchronize with Neptune. Do not kill this process.
All 14 operations synced, thanks for waiting!
Explore the metadata in the Neptune app:
https://app.neptune.ai/ba-final/cwt-1/e/CWT1-534/metadata
https://app.neptune.ai/ba-final/cwt-1/e/CWT1-535
Split 3, loss train 0.06, score train 0.48, loss val 0.03 score val 0.65
Shutting down background jobs, please wait a moment...
Done!
Waiting for the remaining 14 operations to synchronize with Neptune. Do not kill this process.
All 14 operations synced, thanks for waiting!
Explore the metadata in the Neptune app:
https://app.neptune.ai/ba-final/cwt-1/e/CWT1-535/metadata
https://app.neptune.ai/ba-final/cwt-1/e/CWT1-536
Split 4, loss train 0.06, score train 0.49, loss val 0.04 score val 0.51
Shutting down background jobs, please wait a moment...
Done!
Waiting for the remaining 10 operations to synchronize with Neptune. Do not kill this process.
All 10 operations synced, thanks for waiting!
Explore the metadata in the Neptune app:
https://app.neptune.ai/ba-final/cwt-1/e/CWT1-536/metadata
[32m[I 2023-09-08 07:02:27,982][0m Trial 94 finished with value: 0.055402413834916786 and parameters: {'b': 2.9000000000000004, 'fc': 2.4000000000000004, 'scale_min': 1.9000000000000001, 'scale_max': 10, 'n_scales': 195, 'drop': 0.2926011325164221, 'optimizer': 'Adam', 'lr': 0.0006930618144329937, 'weight_decay': 0.0031402063846166076, 'batch_size': 32, 'epochs': 100}. Best is trial 85 with value: 0.04277383215883945.[0m
trial 94, loss train mean 0.06, score train mean 0.49, loss val mean 0.06, score val mean 0.57



End Time   : Fr 8. Sep 07:02:30 CEST 2023
Duration   : 13043.339846982 seconds

Start Time : Fr 8. Sep 07:02:54 CEST 2023
Job ID: 1157412
Node: cc1g03
Partition: gpu_normal_stud
CPU cores: 16
Memory: 98304
GPUs: 0
Python environment: khoa                  *  /home/phamanh/anaconda3/envs/khoa
Current work directory: /home/phamanh/Schreibtisch/bachelorarbeit/im_CNN

device: cuda


https://app.neptune.ai/ba-final/cwt-1/e/CWT1-537
Split 0, loss train 0.05, score train 0.49, loss val 0.06 score val 0.58
Shutting down background jobs, please wait a moment...
Done!
Waiting for the remaining 10 operations to synchronize with Neptune. Do not kill this process.
All 10 operations synced, thanks for waiting!
Explore the metadata in the Neptune app:
https://app.neptune.ai/ba-final/cwt-1/e/CWT1-537/metadata
https://app.neptune.ai/ba-final/cwt-1/e/CWT1-538
Split 1, loss train 0.05, score train 0.50, loss val 0.06 score val 0.52
Shutting down background jobs, please wait a moment...
Done!
Waiting for the remaining 10 operations to synchronize with Neptune. Do not kill this process.
All 10 operations synced, thanks for waiting!
Explore the metadata in the Neptune app:
https://app.neptune.ai/ba-final/cwt-1/e/CWT1-538/metadata
https://app.neptune.ai/ba-final/cwt-1/e/CWT1-539
Split 2, loss train 0.06, score train 0.48, loss val 0.04 score val 0.49
Shutting down background jobs, please wait a moment...
Done!
Waiting for the remaining 10 operations to synchronize with Neptune. Do not kill this process.
All 10 operations synced, thanks for waiting!
Explore the metadata in the Neptune app:
https://app.neptune.ai/ba-final/cwt-1/e/CWT1-539/metadata
https://app.neptune.ai/ba-final/cwt-1/e/CWT1-540
Split 3, loss train 0.06, score train 0.49, loss val 0.05 score val 0.46
Shutting down background jobs, please wait a moment...
Done!
Waiting for the remaining 10 operations to synchronize with Neptune. Do not kill this process.
All 10 operations synced, thanks for waiting!
Explore the metadata in the Neptune app:
https://app.neptune.ai/ba-final/cwt-1/e/CWT1-540/metadata
https://app.neptune.ai/ba-final/cwt-1/e/CWT1-541
Split 4, loss train 0.06, score train 0.50, loss val 0.04 score val 0.56
Shutting down background jobs, please wait a moment...
Done!
Waiting for the remaining 10 operations to synchronize with Neptune. Do not kill this process.
All 10 operations synced, thanks for waiting!
Explore the metadata in the Neptune app:
https://app.neptune.ai/ba-final/cwt-1/e/CWT1-541/metadata
