[32m[I 2023-09-02 11:33:41,974][0m Trial 65 finished with value: 0.08024096387497923 and parameters: {'b': 2.55, 'fc': 1.15, 'scale_min': 1.0, 'scale_max': 14, 'n_scales': 235, 'drop': 0.6181192532953618, 'optimizer': 'Adam', 'lr': 0.0005069477018264984, 'weight_decay': 0.008594127474011781, 'batch_size': 32, 'epochs': 100}. Best is trial 33 with value: 0.05809502500168821.[0m
trial 65, loss train mean 0.06, score train mean 0.48, loss val mean 0.08, score val mean 0.39



End Time   : Sa 2. Sep 11:33:44 CEST 2023
Duration   : 18423.434749939 seconds

Start Time : Sa 2. Sep 11:33:51 CEST 2023
Job ID: 1153639
Node: cc1g04
Partition: gpu_normal_stud
CPU cores: 16
Memory: 98304
GPUs: 0
Python environment: khoa                  *  /home/phamanh/anaconda3/envs/khoa
Current work directory: /home/phamanh/Schreibtisch/bachelorarbeit/im_CNN

device: cuda


https://app.neptune.ai/ba-final/cwt-1/e/CWT1-404
Split 0, loss train 0.07, score train 0.45, loss val 0.08 score val 0.47
Shutting down background jobs, please wait a moment...
Done!
Waiting for the remaining 14 operations to synchronize with Neptune. Do not kill this process.
All 14 operations synced, thanks for waiting!
Explore the metadata in the Neptune app:
https://app.neptune.ai/ba-final/cwt-1/e/CWT1-404/metadata
https://app.neptune.ai/ba-final/cwt-1/e/CWT1-405
Split 1, loss train 0.07, score train 0.44, loss val 0.10 score val 0.48
Shutting down background jobs, please wait a moment...
Done!
Waiting for the remaining 10 operations to synchronize with Neptune. Do not kill this process.
All 10 operations synced, thanks for waiting!
Explore the metadata in the Neptune app:
https://app.neptune.ai/ba-final/cwt-1/e/CWT1-405/metadata
https://app.neptune.ai/ba-final/cwt-1/e/CWT1-406
Split 2, loss train 0.08, score train 0.41, loss val 0.10 score val 0.30
Shutting down background jobs, please wait a moment...
Done!
Waiting for the remaining 14 operations to synchronize with Neptune. Do not kill this process.
All 14 operations synced, thanks for waiting!
Explore the metadata in the Neptune app:
https://app.neptune.ai/ba-final/cwt-1/e/CWT1-406/metadata
https://app.neptune.ai/ba-final/cwt-1/e/CWT1-407
Split 3, loss train 0.09, score train 0.43, loss val 0.11 score val 0.43
Shutting down background jobs, please wait a moment...
Done!
Waiting for the remaining 14 operations to synchronize with Neptune. Do not kill this process.
All 14 operations synced, thanks for waiting!
Explore the metadata in the Neptune app:
https://app.neptune.ai/ba-final/cwt-1/e/CWT1-407/metadata
https://app.neptune.ai/ba-final/cwt-1/e/CWT1-408
Split 4, loss train 0.08, score train 0.43, loss val 0.40 score val 0.09
Shutting down background jobs, please wait a moment...
Done!
Waiting for the remaining 14 operations to synchronize with Neptune. Do not kill this process.
All 14 operations synced, thanks for waiting!
Explore the metadata in the Neptune app:
https://app.neptune.ai/ba-final/cwt-1/e/CWT1-408/metadata
[32m[I 2023-09-02 14:49:00,587][0m Trial 66 finished with value: 0.15661550075449843 and parameters: {'b': 2.1, 'fc': 1.55, 'scale_min': 0.8, 'scale_max': 20, 'n_scales': 130, 'drop': 0.6604041278566009, 'optimizer': 'Adam', 'lr': 0.0036949077014400288, 'weight_decay': 0.00389405952469896, 'batch_size': 32, 'epochs': 100}. Best is trial 33 with value: 0.05809502500168821.[0m
trial 66, loss train mean 0.08, score train mean 0.43, loss val mean 0.16, score val mean 0.36



End Time   : Sa 2. Sep 14:49:02 CEST 2023
Duration   : 11710.214416117 seconds

Start Time : Sa 2. Sep 15:16:29 CEST 2023
Job ID: 1154439
Node: cc1g06
Partition: gpu_normal_stud
CPU cores: 16
Memory: 98304
GPUs: 0
Python environment: khoa                  *  /home/phamanh/anaconda3/envs/khoa
Current work directory: /home/phamanh/Schreibtisch/bachelorarbeit/im_CNN

device: cuda


https://app.neptune.ai/ba-final/cwt-1/e/CWT1-409
Split 0, loss train 0.07, score train 0.45, loss val 0.07 score val 0.32
Shutting down background jobs, please wait a moment...
Done!
Waiting for the remaining 10 operations to synchronize with Neptune. Do not kill this process.
All 10 operations synced, thanks for waiting!
Explore the metadata in the Neptune app:
https://app.neptune.ai/ba-final/cwt-1/e/CWT1-409/metadata
https://app.neptune.ai/ba-final/cwt-1/e/CWT1-410
Split 1, loss train 0.08, score train 0.45, loss val 0.10 score val 0.46
Shutting down background jobs, please wait a moment...
Done!
Waiting for the remaining 10 operations to synchronize with Neptune. Do not kill this process.
All 10 operations synced, thanks for waiting!
Explore the metadata in the Neptune app:
https://app.neptune.ai/ba-final/cwt-1/e/CWT1-410/metadata
https://app.neptune.ai/ba-final/cwt-1/e/CWT1-411
Split 2, loss train 0.08, score train 0.44, loss val 0.05 score val 0.50
Shutting down background jobs, please wait a moment...
Done!
Waiting for the remaining 10 operations to synchronize with Neptune. Do not kill this process.
All 10 operations synced, thanks for waiting!
Explore the metadata in the Neptune app:
https://app.neptune.ai/ba-final/cwt-1/e/CWT1-411/metadata
https://app.neptune.ai/ba-final/cwt-1/e/CWT1-412
Split 3, loss train 0.07, score train 0.44, loss val 0.09 score val 0.35
Shutting down background jobs, please wait a moment...
Done!
Waiting for the remaining 10 operations to synchronize with Neptune. Do not kill this process.
All 10 operations synced, thanks for waiting!
Explore the metadata in the Neptune app:
https://app.neptune.ai/ba-final/cwt-1/e/CWT1-412/metadata
https://app.neptune.ai/ba-final/cwt-1/e/CWT1-413
Split 4, loss train 0.07, score train 0.45, loss val 0.06 score val 0.57
Shutting down background jobs, please wait a moment...
Done!
Waiting for the remaining 14 operations to synchronize with Neptune. Do not kill this process.
All 14 operations synced, thanks for waiting!
Explore the metadata in the Neptune app:
https://app.neptune.ai/ba-final/cwt-1/e/CWT1-413/metadata
[32m[I 2023-09-02 19:51:39,653][0m Trial 67 finished with value: 0.074992547136672 and parameters: {'b': 1.35, 'fc': 1.85, 'scale_min': 0.6, 'scale_max': 18, 'n_scales': 290, 'drop': 0.7454549578646963, 'optimizer': 'Adam', 'lr': 0.0006724759918476228, 'weight_decay': 0.024073230353559093, 'batch_size': 32, 'epochs': 100}. Best is trial 33 with value: 0.05809502500168821.[0m
trial 67, loss train mean 0.08, score train mean 0.45, loss val mean 0.07, score val mean 0.44



End Time   : Sa 2. Sep 19:51:41 CEST 2023
Duration   : 16512.495913771 seconds

Start Time : Sa 2. Sep 19:51:43 CEST 2023
Job ID: 1154440
Node: cc1g05
Partition: gpu_normal_stud
CPU cores: 16
Memory: 98304
GPUs: 0
Python environment: khoa                  *  /home/phamanh/anaconda3/envs/khoa
Current work directory: /home/phamanh/Schreibtisch/bachelorarbeit/im_CNN

device: cuda


https://app.neptune.ai/ba-final/cwt-1/e/CWT1-414
Split 0, loss train 0.08, score train 0.45, loss val 0.09 score val 0.39
Shutting down background jobs, please wait a moment...
Done!
Waiting for the remaining 10 operations to synchronize with Neptune. Do not kill this process.
All 10 operations synced, thanks for waiting!
Explore the metadata in the Neptune app:
https://app.neptune.ai/ba-final/cwt-1/e/CWT1-414/metadata
https://app.neptune.ai/ba-final/cwt-1/e/CWT1-415
Split 1, loss train 0.08, score train 0.44, loss val 0.22 score val 0.28
Shutting down background jobs, please wait a moment...
Done!
Waiting for the remaining 14 operations to synchronize with Neptune. Do not kill this process.
All 14 operations synced, thanks for waiting!
Explore the metadata in the Neptune app:
https://app.neptune.ai/ba-final/cwt-1/e/CWT1-415/metadata
https://app.neptune.ai/ba-final/cwt-1/e/CWT1-416
Split 2, loss train 0.08, score train 0.44, loss val 0.07 score val 0.47
Shutting down background jobs, please wait a moment...
Done!
Waiting for the remaining 10 operations to synchronize with Neptune. Do not kill this process.
All 10 operations synced, thanks for waiting!
Explore the metadata in the Neptune app:
https://app.neptune.ai/ba-final/cwt-1/e/CWT1-416/metadata
https://app.neptune.ai/ba-final/cwt-1/e/CWT1-417
Split 3, loss train 0.08, score train 0.44, loss val 0.10 score val 0.28
Shutting down background jobs, please wait a moment...
Done!
Waiting for the remaining 10 operations to synchronize with Neptune. Do not kill this process.
All 10 operations synced, thanks for waiting!
Explore the metadata in the Neptune app:
https://app.neptune.ai/ba-final/cwt-1/e/CWT1-417/metadata
https://app.neptune.ai/ba-final/cwt-1/e/CWT1-418
Split 4, loss train 0.07, score train 0.45, loss val 0.10 score val 0.24
Shutting down background jobs, please wait a moment...
Done!
Waiting for the remaining 10 operations to synchronize with Neptune. Do not kill this process.
All 10 operations synced, thanks for waiting!
Explore the metadata in the Neptune app:
https://app.neptune.ai/ba-final/cwt-1/e/CWT1-418/metadata
[32m[I 2023-09-02 23:47:48,864][0m Trial 68 finished with value: 0.11473544607771205 and parameters: {'b': 1.6500000000000001, 'fc': 1.7000000000000002, 'scale_min': 1.2000000000000002, 'scale_max': 12, 'n_scales': 235, 'drop': 0.793631464104538, 'optimizer': 'Adam', 'lr': 0.0012087180617290833, 'weight_decay': 0.015309328414588286, 'batch_size': 32, 'epochs': 100}. Best is trial 33 with value: 0.05809502500168821.[0m
trial 68, loss train mean 0.08, score train mean 0.44, loss val mean 0.11, score val mean 0.33



End Time   : Sa 2. Sep 23:47:50 CEST 2023
Duration   : 14167.518163549 seconds

Start Time : Sa 2. Sep 23:48:09 CEST 2023
Job ID: 1154441
Node: cc1g03
Partition: gpu_normal_stud
CPU cores: 16
Memory: 98304
GPUs: 0
Python environment: khoa                  *  /home/phamanh/anaconda3/envs/khoa
Current work directory: /home/phamanh/Schreibtisch/bachelorarbeit/im_CNN

device: cuda


https://app.neptune.ai/ba-final/cwt-1/e/CWT1-419
Split 0, loss train 0.06, score train 0.48, loss val 0.08 score val 0.50
Shutting down background jobs, please wait a moment...
Done!
Waiting for the remaining 10 operations to synchronize with Neptune. Do not kill this process.
All 10 operations synced, thanks for waiting!
Explore the metadata in the Neptune app:
https://app.neptune.ai/ba-final/cwt-1/e/CWT1-419/metadata
https://app.neptune.ai/ba-final/cwt-1/e/CWT1-420
Split 1, loss train 0.06, score train 0.47, loss val 0.10 score val 0.35
Shutting down background jobs, please wait a moment...
Done!
Waiting for the remaining 10 operations to synchronize with Neptune. Do not kill this process.
All 10 operations synced, thanks for waiting!
Explore the metadata in the Neptune app:
https://app.neptune.ai/ba-final/cwt-1/e/CWT1-420/metadata
https://app.neptune.ai/ba-final/cwt-1/e/CWT1-421
Split 2, loss train 0.07, score train 0.46, loss val 0.08 score val 0.38
Shutting down background jobs, please wait a moment...
Done!
Waiting for the remaining 10 operations to synchronize with Neptune. Do not kill this process.
All 10 operations synced, thanks for waiting!
Explore the metadata in the Neptune app:
https://app.neptune.ai/ba-final/cwt-1/e/CWT1-421/metadata
https://app.neptune.ai/ba-final/cwt-1/e/CWT1-422
Split 3, loss train 0.07, score train 0.46, loss val 0.07 score val 0.56
Shutting down background jobs, please wait a moment...
Done!
Waiting for the remaining 10 operations to synchronize with Neptune. Do not kill this process.
All 10 operations synced, thanks for waiting!
Explore the metadata in the Neptune app:
https://app.neptune.ai/ba-final/cwt-1/e/CWT1-422/metadata
https://app.neptune.ai/ba-final/cwt-1/e/CWT1-423
Split 4, loss train 0.06, score train 0.48, loss val 0.06 score val 0.50
Shutting down background jobs, please wait a moment...
Done!
Waiting for the remaining 10 operations to synchronize with Neptune. Do not kill this process.
All 10 operations synced, thanks for waiting!
Explore the metadata in the Neptune app:
https://app.neptune.ai/ba-final/cwt-1/e/CWT1-423/metadata
[32m[I 2023-09-03 03:37:13,182][0m Trial 69 finished with value: 0.07970221296269844 and parameters: {'b': 1.9000000000000001, 'fc': 1.35, 'scale_min': 1.5, 'scale_max': 34, 'n_scales': 130, 'drop': 0.6887491652935572, 'optimizer': 'Adam', 'lr': 0.0007834925954574327, 'weight_decay': 0.006882529066308771, 'batch_size': 32, 'epochs': 100}. Best is trial 33 with value: 0.05809502500168821.[0m
trial 69, loss train mean 0.06, score train mean 0.47, loss val mean 0.08, score val mean 0.46



End Time   : So 3. Sep 03:37:16 CEST 2023
Duration   : 13747.042342317 seconds

Start Time : So 3. Sep 03:37:33 CEST 2023
Job ID: 1154442
Node: cc1g03
Partition: gpu_normal_stud
CPU cores: 16
Memory: 98304
GPUs: 0
Python environment: khoa                  *  /home/phamanh/anaconda3/envs/khoa
Current work directory: /home/phamanh/Schreibtisch/bachelorarbeit/im_CNN

device: cuda


https://app.neptune.ai/ba-final/cwt-1/e/CWT1-424
Split 0, loss train 0.08, score train 0.45, loss val 0.13 score val 0.17
Shutting down background jobs, please wait a moment...
Done!
Waiting for the remaining 10 operations to synchronize with Neptune. Do not kill this process.
All 10 operations synced, thanks for waiting!
Explore the metadata in the Neptune app:
https://app.neptune.ai/ba-final/cwt-1/e/CWT1-424/metadata
https://app.neptune.ai/ba-final/cwt-1/e/CWT1-425
Split 1, loss train 0.08, score train 0.44, loss val 0.08 score val 0.53
Shutting down background jobs, please wait a moment...
Done!
Waiting for the remaining 18 operations to synchronize with Neptune. Do not kill this process.
All 18 operations synced, thanks for waiting!
Explore the metadata in the Neptune app:
https://app.neptune.ai/ba-final/cwt-1/e/CWT1-425/metadata
https://app.neptune.ai/ba-final/cwt-1/e/CWT1-426
Split 2, loss train 0.08, score train 0.45, loss val 0.08 score val 0.33
Shutting down background jobs, please wait a moment...
Done!
Waiting for the remaining 10 operations to synchronize with Neptune. Do not kill this process.
All 10 operations synced, thanks for waiting!
Explore the metadata in the Neptune app:
https://app.neptune.ai/ba-final/cwt-1/e/CWT1-426/metadata
https://app.neptune.ai/ba-final/cwt-1/e/CWT1-427
Split 3, loss train 0.08, score train 0.43, loss val 0.11 score val 0.43
Shutting down background jobs, please wait a moment...
Done!
Waiting for the remaining 14 operations to synchronize with Neptune. Do not kill this process.
All 14 operations synced, thanks for waiting!
Explore the metadata in the Neptune app:
https://app.neptune.ai/ba-final/cwt-1/e/CWT1-427/metadata
https://app.neptune.ai/ba-final/cwt-1/e/CWT1-428
Split 4, loss train 0.08, score train 0.45, loss val 0.05 score val 0.49
Shutting down background jobs, please wait a moment...
Done!
Waiting for the remaining 10 operations to synchronize with Neptune. Do not kill this process.
All 10 operations synced, thanks for waiting!
Explore the metadata in the Neptune app:
https://app.neptune.ai/ba-final/cwt-1/e/CWT1-428/metadata
[32m[I 2023-09-03 11:07:43,798][0m Trial 70 finished with value: 0.09033505764413388 and parameters: {'b': 3.0, 'fc': 1.25, 'scale_min': 0.5, 'scale_max': 28, 'n_scales': 145, 'drop': 0.6181192532953618, 'optimizer': 'Adam', 'lr': 0.0005925640287641499, 'weight_decay': 0.043892977125650434, 'batch_size': 32, 'epochs': 100}. Best is trial 33 with value: 0.05809502500168821.[0m
trial 70, loss train mean 0.08, score train mean 0.44, loss val mean 0.09, score val mean 0.39



End Time   : So 3. Sep 11:07:46 CEST 2023
Duration   : 27012.723418442 seconds

Start Time : So 3. Sep 11:07:47 CEST 2023
Job ID: 1154443
Node: cc1g03
Partition: gpu_normal_stud
CPU cores: 16
Memory: 98304
GPUs: 0
Python environment: khoa                  *  /home/phamanh/anaconda3/envs/khoa
Current work directory: /home/phamanh/Schreibtisch/bachelorarbeit/im_CNN

device: cuda


https://app.neptune.ai/ba-final/cwt-1/e/CWT1-429
Shutting down background jobs, please wait a moment...
Done!
Waiting for the remaining 3 operations to synchronize with Neptune. Do not kill this process.
All 3 operations synced, thanks for waiting!
Explore the metadata in the Neptune app:
https://app.neptune.ai/ba-final/cwt-1/e/CWT1-429/metadata
[32m[I 2023-09-04 01:55:53,533][0m Trial 71 pruned. [0m

End Time   : Mo 4. Sep 01:55:57 CEST 2023
Duration   : 53289.790421140 seconds

Start Time : Mo 4. Sep 01:55:59 CEST 2023
Job ID: 1154444
Node: cc1g03
Partition: gpu_normal_stud
CPU cores: 16
Memory: 98304
GPUs: 0
Python environment: khoa                  *  /home/phamanh/anaconda3/envs/khoa
Current work directory: /home/phamanh/Schreibtisch/bachelorarbeit/im_CNN

device: cuda


https://app.neptune.ai/ba-final/cwt-1/e/CWT1-430
Shutting down background jobs, please wait a moment...
Done!
Waiting for the remaining 7 operations to synchronize with Neptune. Do not kill this process.
All 7 operations synced, thanks for waiting!
Explore the metadata in the Neptune app:
https://app.neptune.ai/ba-final/cwt-1/e/CWT1-430/metadata
[32m[I 2023-09-04 04:18:43,188][0m Trial 72 pruned. [0m

End Time   : Mo 4. Sep 04:18:47 CEST 2023
Duration   : 8568.007726465 seconds

Start Time : Mo 4. Sep 04:18:48 CEST 2023
Job ID: 1154445
Node: cc1g03
Partition: gpu_normal_stud
CPU cores: 16
Memory: 98304
GPUs: 0
Python environment: khoa                  *  /home/phamanh/anaconda3/envs/khoa
Current work directory: /home/phamanh/Schreibtisch/bachelorarbeit/im_CNN

device: cuda


https://app.neptune.ai/ba-final/cwt-1/e/CWT1-431
Split 0, loss train 0.06, score train 0.49, loss val 0.07 score val 0.35
Shutting down background jobs, please wait a moment...
Done!
Waiting for the remaining 10 operations to synchronize with Neptune. Do not kill this process.
All 10 operations synced, thanks for waiting!
Explore the metadata in the Neptune app:
https://app.neptune.ai/ba-final/cwt-1/e/CWT1-431/metadata
https://app.neptune.ai/ba-final/cwt-1/e/CWT1-432
Split 1, loss train 0.06, score train 0.48, loss val 0.05 score val 0.55
Shutting down background jobs, please wait a moment...
Done!
Waiting for the remaining 10 operations to synchronize with Neptune. Do not kill this process.
All 10 operations synced, thanks for waiting!
Explore the metadata in the Neptune app:
https://app.neptune.ai/ba-final/cwt-1/e/CWT1-432/metadata
https://app.neptune.ai/ba-final/cwt-1/e/CWT1-433
Split 2, loss train 0.06, score train 0.47, loss val 0.05 score val 0.54
Shutting down background jobs, please wait a moment...
Done!
Waiting for the remaining 10 operations to synchronize with Neptune. Do not kill this process.
All 10 operations synced, thanks for waiting!
Explore the metadata in the Neptune app:
https://app.neptune.ai/ba-final/cwt-1/e/CWT1-433/metadata
https://app.neptune.ai/ba-final/cwt-1/e/CWT1-434
Split 3, loss train 0.06, score train 0.47, loss val 0.06 score val 0.47
Shutting down background jobs, please wait a moment...
Done!
Waiting for the remaining 10 operations to synchronize with Neptune. Do not kill this process.
All 10 operations synced, thanks for waiting!
Explore the metadata in the Neptune app:
https://app.neptune.ai/ba-final/cwt-1/e/CWT1-434/metadata
https://app.neptune.ai/ba-final/cwt-1/e/CWT1-435
Split 4, loss train 0.06, score train 0.49, loss val 0.05 score val 0.46
Shutting down background jobs, please wait a moment...
Done!
Waiting for the remaining 10 operations to synchronize with Neptune. Do not kill this process.
All 10 operations synced, thanks for waiting!
Explore the metadata in the Neptune app:
https://app.neptune.ai/ba-final/cwt-1/e/CWT1-435/metadata
