[32m[I 2023-09-08 21:20:36,612][0m Trial 95 finished with value: 0.05118575654131301 and parameters: {'b': 3.3, 'fc': 2.4000000000000004, 'scale_min': 2.1, 'scale_max': 10, 'n_scales': 195, 'drop': 0.29362641283611063, 'optimizer': 'Adam', 'lr': 0.0006901934082031106, 'weight_decay': 0.003091967178424259, 'batch_size': 32, 'epochs': 100}. Best is trial 85 with value: 0.04277383215883945.[0m
trial 95, loss train mean 0.06, score train mean 0.49, loss val mean 0.05, score val mean 0.52



End Time   : Fr 8. Sep 21:20:39 CEST 2023
Duration   : 51464.796969215 seconds

Start Time : Fr 8. Sep 21:20:41 CEST 2023
Job ID: 1157413
Node: cc1g03
Partition: gpu_normal_stud
CPU cores: 16
Memory: 98304
GPUs: 0
Python environment: khoa                  *  /home/phamanh/anaconda3/envs/khoa
Current work directory: /home/phamanh/Schreibtisch/bachelorarbeit/im_CNN

device: cuda


https://app.neptune.ai/ba-final/cwt-1/e/CWT1-542
Split 0, loss train 0.05, score train 0.49, loss val 0.05 score val 0.59
Shutting down background jobs, please wait a moment...
Done!
Waiting for the remaining 10 operations to synchronize with Neptune. Do not kill this process.
All 10 operations synced, thanks for waiting!
Explore the metadata in the Neptune app:
https://app.neptune.ai/ba-final/cwt-1/e/CWT1-542/metadata
https://app.neptune.ai/ba-final/cwt-1/e/CWT1-543
Split 1, loss train 0.06, score train 0.49, loss val 0.09 score val 0.47
Shutting down background jobs, please wait a moment...
Done!
Waiting for the remaining 10 operations to synchronize with Neptune. Do not kill this process.
All 10 operations synced, thanks for waiting!
Explore the metadata in the Neptune app:
https://app.neptune.ai/ba-final/cwt-1/e/CWT1-543/metadata
https://app.neptune.ai/ba-final/cwt-1/e/CWT1-544
Split 2, loss train 0.06, score train 0.48, loss val 0.03 score val 0.56
Shutting down background jobs, please wait a moment...
Done!
Waiting for the remaining 14 operations to synchronize with Neptune. Do not kill this process.
All 14 operations synced, thanks for waiting!
Explore the metadata in the Neptune app:
https://app.neptune.ai/ba-final/cwt-1/e/CWT1-544/metadata
https://app.neptune.ai/ba-final/cwt-1/e/CWT1-545
Split 3, loss train 0.06, score train 0.48, loss val 0.05 score val 0.55
Shutting down background jobs, please wait a moment...
Done!
Waiting for the remaining 10 operations to synchronize with Neptune. Do not kill this process.
All 10 operations synced, thanks for waiting!
Explore the metadata in the Neptune app:
https://app.neptune.ai/ba-final/cwt-1/e/CWT1-545/metadata
https://app.neptune.ai/ba-final/cwt-1/e/CWT1-546
Split 4, loss train 0.05, score train 0.50, loss val 0.05 score val 0.46
Shutting down background jobs, please wait a moment...
Done!
Waiting for the remaining 10 operations to synchronize with Neptune. Do not kill this process.
All 10 operations synced, thanks for waiting!
Explore the metadata in the Neptune app:
https://app.neptune.ai/ba-final/cwt-1/e/CWT1-546/metadata
[32m[I 2023-09-09 04:28:29,460][0m Trial 96 finished with value: 0.055561408590763174 and parameters: {'b': 3.3500000000000005, 'fc': 2.3, 'scale_min': 2.1, 'scale_max': 10, 'n_scales': 180, 'drop': 0.29342042495832255, 'optimizer': 'Adam', 'lr': 0.000897915515952025, 'weight_decay': 0.0027805363831136074, 'batch_size': 32, 'epochs': 100}. Best is trial 85 with value: 0.04277383215883945.[0m
trial 96, loss train mean 0.06, score train mean 0.49, loss val mean 0.06, score val mean 0.53



End Time   : Sa 9. Sep 04:28:31 CEST 2023
Duration   : 25670.456495721 seconds

Start Time : Sa 9. Sep 10:32:48 CEST 2023
Job ID: 1158915
Node: cc1g05
Partition: gpu_normal_stud
CPU cores: 16
Memory: 98304
GPUs: 0
Python environment: khoa                  *  /home/phamanh/anaconda3/envs/khoa
Current work directory: /home/phamanh/Schreibtisch/bachelorarbeit/im_CNN

device: cuda


https://app.neptune.ai/ba-final/cwt-1/e/CWT1-547
Split 0, loss train 0.05, score train 0.50, loss val 0.08 score val 0.51
Shutting down background jobs, please wait a moment...
Done!
Waiting for the remaining 14 operations to synchronize with Neptune. Do not kill this process.
All 14 operations synced, thanks for waiting!
Explore the metadata in the Neptune app:
https://app.neptune.ai/ba-final/cwt-1/e/CWT1-547/metadata
https://app.neptune.ai/ba-final/cwt-1/e/CWT1-548
Split 1, loss train 0.06, score train 0.49, loss val 0.10 score val 0.47
Shutting down background jobs, please wait a moment...
Done!
Waiting for the remaining 10 operations to synchronize with Neptune. Do not kill this process.
All 10 operations synced, thanks for waiting!
Explore the metadata in the Neptune app:
https://app.neptune.ai/ba-final/cwt-1/e/CWT1-548/metadata
https://app.neptune.ai/ba-final/cwt-1/e/CWT1-549
Split 2, loss train 0.06, score train 0.48, loss val 0.08 score val 0.34
Shutting down background jobs, please wait a moment...
Done!
Waiting for the remaining 10 operations to synchronize with Neptune. Do not kill this process.
All 10 operations synced, thanks for waiting!
Explore the metadata in the Neptune app:
https://app.neptune.ai/ba-final/cwt-1/e/CWT1-549/metadata
https://app.neptune.ai/ba-final/cwt-1/e/CWT1-550
Split 3, loss train 0.06, score train 0.49, loss val 0.03 score val 0.58
Shutting down background jobs, please wait a moment...
Done!
Waiting for the remaining 10 operations to synchronize with Neptune. Do not kill this process.
All 10 operations synced, thanks for waiting!
Explore the metadata in the Neptune app:
https://app.neptune.ai/ba-final/cwt-1/e/CWT1-550/metadata
https://app.neptune.ai/ba-final/cwt-1/e/CWT1-551
Split 4, loss train 0.05, score train 0.50, loss val 0.04 score val 0.62
Shutting down background jobs, please wait a moment...
Done!
Waiting for the remaining 14 operations to synchronize with Neptune. Do not kill this process.
All 14 operations synced, thanks for waiting!
Explore the metadata in the Neptune app:
https://app.neptune.ai/ba-final/cwt-1/e/CWT1-551/metadata
[32m[I 2023-09-09 14:53:37,890][0m Trial 97 finished with value: 0.06506020566250416 and parameters: {'b': 3.3500000000000005, 'fc': 2.3, 'scale_min': 2.1, 'scale_max': 10, 'n_scales': 180, 'drop': 0.2959017873003756, 'optimizer': 'Adam', 'lr': 0.0006990136225640938, 'weight_decay': 0.0027378296072385483, 'batch_size': 32, 'epochs': 100}. Best is trial 85 with value: 0.04277383215883945.[0m
trial 97, loss train mean 0.06, score train mean 0.49, loss val mean 0.07, score val mean 0.50



End Time   : Sa 9. Sep 14:53:39 CEST 2023
Duration   : 15650.922869328 seconds

Start Time : Sa 9. Sep 17:59:50 CEST 2023
Job ID: 1158916
Node: persephone
Partition: gpu_normal_stud
CPU cores: 16
Memory: 98304
GPUs: 0
Python environment: khoa                  *  /home/phamanh/anaconda3/envs/khoa
Current work directory: /home/phamanh/Schreibtisch/bachelorarbeit/im_CNN

device: cuda


https://app.neptune.ai/ba-final/cwt-1/e/CWT1-552
Split 0, loss train 0.06, score train 0.49, loss val 0.06 score val 0.61
Shutting down background jobs, please wait a moment...
Done!
Waiting for the remaining 10 operations to synchronize with Neptune. Do not kill this process.
All 10 operations synced, thanks for waiting!
Explore the metadata in the Neptune app:
https://app.neptune.ai/ba-final/cwt-1/e/CWT1-552/metadata
https://app.neptune.ai/ba-final/cwt-1/e/CWT1-553
Split 1, loss train 0.06, score train 0.49, loss val 0.09 score val 0.50
Shutting down background jobs, please wait a moment...
Done!
Waiting for the remaining 13 operations to synchronize with Neptune. Do not kill this process.
All 13 operations synced, thanks for waiting!
Explore the metadata in the Neptune app:
https://app.neptune.ai/ba-final/cwt-1/e/CWT1-553/metadata
https://app.neptune.ai/ba-final/cwt-1/e/CWT1-554
Split 2, loss train 0.06, score train 0.48, loss val 0.07 score val 0.28
Shutting down background jobs, please wait a moment...
Done!
Waiting for the remaining 14 operations to synchronize with Neptune. Do not kill this process.
All 14 operations synced, thanks for waiting!
Explore the metadata in the Neptune app:
https://app.neptune.ai/ba-final/cwt-1/e/CWT1-554/metadata
https://app.neptune.ai/ba-final/cwt-1/e/CWT1-555
Split 3, loss train 0.06, score train 0.48, loss val 0.09 score val 0.32
Shutting down background jobs, please wait a moment...
Done!
Waiting for the remaining 14 operations to synchronize with Neptune. Do not kill this process.
All 14 operations synced, thanks for waiting!
Explore the metadata in the Neptune app:
https://app.neptune.ai/ba-final/cwt-1/e/CWT1-555/metadata
https://app.neptune.ai/ba-final/cwt-1/e/CWT1-556
Split 4, loss train 0.06, score train 0.49, loss val 0.07 score val 0.39
Shutting down background jobs, please wait a moment...
Done!
Waiting for the remaining 10 operations to synchronize with Neptune. Do not kill this process.
All 10 operations synced, thanks for waiting!
Explore the metadata in the Neptune app:
https://app.neptune.ai/ba-final/cwt-1/e/CWT1-556/metadata
[32m[I 2023-09-10 00:10:55,884][0m Trial 98 finished with value: 0.07633612308096378 and parameters: {'b': 3.3500000000000005, 'fc': 2.45, 'scale_min': 2.5, 'scale_max': 10, 'n_scales': 185, 'drop': 0.3199698096680941, 'optimizer': 'Adam', 'lr': 0.001117392323322838, 'weight_decay': 0.0019187599419929595, 'batch_size': 32, 'epochs': 100}. Best is trial 85 with value: 0.04277383215883945.[0m
trial 98, loss train mean 0.06, score train mean 0.49, loss val mean 0.08, score val mean 0.42



End Time   : So 10. Sep 00:10:57 CEST 2023
Duration   : 22267.363185487 seconds

Start Time : So 10. Sep 00:10:59 CEST 2023
Job ID: 1158917
Node: erebos
Partition: gpu_normal_stud
CPU cores: 16
Memory: 98304
GPUs: 0
Python environment: khoa                  *  /home/phamanh/anaconda3/envs/khoa
Current work directory: /home/phamanh/Schreibtisch/bachelorarbeit/im_CNN

device: cuda


https://app.neptune.ai/ba-final/cwt-1/e/CWT1-557
Split 0, loss train 0.06, score train 0.49, loss val 0.06 score val 0.45
Shutting down background jobs, please wait a moment...
Done!
Waiting for the remaining 10 operations to synchronize with Neptune. Do not kill this process.
All 10 operations synced, thanks for waiting!
Explore the metadata in the Neptune app:
https://app.neptune.ai/ba-final/cwt-1/e/CWT1-557/metadata
https://app.neptune.ai/ba-final/cwt-1/e/CWT1-558
Split 1, loss train 0.06, score train 0.49, loss val 0.11 score val 0.42
Shutting down background jobs, please wait a moment...
Done!
Waiting for the remaining 14 operations to synchronize with Neptune. Do not kill this process.
All 14 operations synced, thanks for waiting!
Explore the metadata in the Neptune app:
https://app.neptune.ai/ba-final/cwt-1/e/CWT1-558/metadata
https://app.neptune.ai/ba-final/cwt-1/e/CWT1-559
Split 2, loss train 0.06, score train 0.47, loss val 0.05 score val 0.54
Shutting down background jobs, please wait a moment...
Done!
Waiting for the remaining 10 operations to synchronize with Neptune. Do not kill this process.
All 10 operations synced, thanks for waiting!
Explore the metadata in the Neptune app:
https://app.neptune.ai/ba-final/cwt-1/e/CWT1-559/metadata
https://app.neptune.ai/ba-final/cwt-1/e/CWT1-560
Split 3, loss train 0.06, score train 0.48, loss val 0.05 score val 0.43
Shutting down background jobs, please wait a moment...
Done!
Waiting for the remaining 14 operations to synchronize with Neptune. Do not kill this process.
All 14 operations synced, thanks for waiting!
Explore the metadata in the Neptune app:
https://app.neptune.ai/ba-final/cwt-1/e/CWT1-560/metadata
https://app.neptune.ai/ba-final/cwt-1/e/CWT1-561
Split 4, loss train 0.06, score train 0.49, loss val 0.05 score val 0.40
Shutting down background jobs, please wait a moment...
Done!
Waiting for the remaining 14 operations to synchronize with Neptune. Do not kill this process.
All 14 operations synced, thanks for waiting!
Explore the metadata in the Neptune app:
https://app.neptune.ai/ba-final/cwt-1/e/CWT1-561/metadata
[32m[I 2023-09-10 04:04:52,538][0m Trial 99 finished with value: 0.06453536520613001 and parameters: {'b': 3.5, 'fc': 2.25, 'scale_min': 2.0, 'scale_max': 10, 'n_scales': 200, 'drop': 0.24182640271963632, 'optimizer': 'Adam', 'lr': 0.0008751540832958851, 'weight_decay': 0.003224434248486106, 'batch_size': 32, 'epochs': 100}. Best is trial 85 with value: 0.04277383215883945.[0m
trial 99, loss train mean 0.06, score train mean 0.49, loss val mean 0.06, score val mean 0.45



End Time   : So 10. Sep 04:04:54 CEST 2023
Duration   : 14034.949792433 seconds

Start Time : So 10. Sep 04:04:55 CEST 2023
Job ID: 1158918
Node: cc1g01
Partition: gpu_normal_stud
CPU cores: 16
Memory: 98304
GPUs: 0
Python environment: khoa                  *  /home/phamanh/anaconda3/envs/khoa
Current work directory: /home/phamanh/Schreibtisch/bachelorarbeit/im_CNN

device: cuda


https://app.neptune.ai/ba-final/cwt-1/e/CWT1-562
Split 0, loss train 0.05, score train 0.50, loss val 0.05 score val 0.58
Shutting down background jobs, please wait a moment...
Done!
Waiting for the remaining 45 operations to synchronize with Neptune. Do not kill this process.
All 45 operations synced, thanks for waiting!
Explore the metadata in the Neptune app:
https://app.neptune.ai/ba-final/cwt-1/e/CWT1-562/metadata
https://app.neptune.ai/ba-final/cwt-1/e/CWT1-563
Split 1, loss train 0.05, score train 0.50, loss val 0.07 score val 0.46
Shutting down background jobs, please wait a moment...
Done!
Waiting for the remaining 8 operations to synchronize with Neptune. Do not kill this process.
All 8 operations synced, thanks for waiting!
Explore the metadata in the Neptune app:
https://app.neptune.ai/ba-final/cwt-1/e/CWT1-563/metadata
https://app.neptune.ai/ba-final/cwt-1/e/CWT1-564
Split 2, loss train 0.06, score train 0.49, loss val 0.05 score val 0.54
Shutting down background jobs, please wait a moment...
Done!
Waiting for the remaining 14 operations to synchronize with Neptune. Do not kill this process.
All 14 operations synced, thanks for waiting!
Explore the metadata in the Neptune app:
https://app.neptune.ai/ba-final/cwt-1/e/CWT1-564/metadata
https://app.neptune.ai/ba-final/cwt-1/e/CWT1-565
Split 3, loss train 0.06, score train 0.49, loss val 0.04 score val 0.49
Shutting down background jobs, please wait a moment...
Done!
Waiting for the remaining 10 operations to synchronize with Neptune. Do not kill this process.
All 10 operations synced, thanks for waiting!
Explore the metadata in the Neptune app:
https://app.neptune.ai/ba-final/cwt-1/e/CWT1-565/metadata
https://app.neptune.ai/ba-final/cwt-1/e/CWT1-566
Split 4, loss train 0.05, score train 0.51, loss val 0.03 score val 0.60
Shutting down background jobs, please wait a moment...
Done!
Waiting for the remaining 14 operations to synchronize with Neptune. Do not kill this process.
All 14 operations synced, thanks for waiting!
Explore the metadata in the Neptune app:
https://app.neptune.ai/ba-final/cwt-1/e/CWT1-566/metadata
[32m[I 2023-09-10 07:31:51,522][0m Trial 100 finished with value: 0.0481981911557786 and parameters: {'b': 4.0, 'fc': 2.45, 'scale_min': 1.8, 'scale_max': 10, 'n_scales': 175, 'drop': 0.3211893889804105, 'optimizer': 'Adam', 'lr': 0.0006990136225640938, 'weight_decay': 0.0015717659165878292, 'batch_size': 32, 'epochs': 100}. Best is trial 85 with value: 0.04277383215883945.[0m
trial 100, loss train mean 0.05, score train mean 0.50, loss val mean 0.05, score val mean 0.53



End Time   : So 10. Sep 07:31:53 CEST 2023
Duration   : 12417.909792122 seconds

Start Time : So 10. Sep 07:31:54 CEST 2023
Job ID: 1158919
Node: cc1g01
Partition: gpu_normal_stud
CPU cores: 16
Memory: 98304
GPUs: 0
Python environment: khoa                  *  /home/phamanh/anaconda3/envs/khoa
Current work directory: /home/phamanh/Schreibtisch/bachelorarbeit/im_CNN

device: cuda


https://app.neptune.ai/ba-final/cwt-1/e/CWT1-567
Split 0, loss train 0.05, score train 0.51, loss val 0.07 score val 0.53
Shutting down background jobs, please wait a moment...
Done!
Waiting for the remaining 14 operations to synchronize with Neptune. Do not kill this process.
All 14 operations synced, thanks for waiting!
Explore the metadata in the Neptune app:
https://app.neptune.ai/ba-final/cwt-1/e/CWT1-567/metadata
https://app.neptune.ai/ba-final/cwt-1/e/CWT1-568
Split 1, loss train 0.05, score train 0.50, loss val 0.06 score val 0.48
Shutting down background jobs, please wait a moment...
Done!
Waiting for the remaining 14 operations to synchronize with Neptune. Do not kill this process.
All 14 operations synced, thanks for waiting!
Explore the metadata in the Neptune app:
https://app.neptune.ai/ba-final/cwt-1/e/CWT1-568/metadata
https://app.neptune.ai/ba-final/cwt-1/e/CWT1-569
Split 2, loss train 0.06, score train 0.48, loss val 0.04 score val 0.62
Shutting down background jobs, please wait a moment...
Done!
Waiting for the remaining 10 operations to synchronize with Neptune. Do not kill this process.
All 10 operations synced, thanks for waiting!
Explore the metadata in the Neptune app:
https://app.neptune.ai/ba-final/cwt-1/e/CWT1-569/metadata
https://app.neptune.ai/ba-final/cwt-1/e/CWT1-570
Split 3, loss train 0.06, score train 0.49, loss val 0.06 score val 0.56
Shutting down background jobs, please wait a moment...
Done!
Waiting for the remaining 10 operations to synchronize with Neptune. Do not kill this process.
All 10 operations synced, thanks for waiting!
Explore the metadata in the Neptune app:
https://app.neptune.ai/ba-final/cwt-1/e/CWT1-570/metadata
https://app.neptune.ai/ba-final/cwt-1/e/CWT1-571
Split 4, loss train 0.05, score train 0.51, loss val 0.03 score val 0.53
Shutting down background jobs, please wait a moment...
Done!
Waiting for the remaining 14 operations to synchronize with Neptune. Do not kill this process.
All 14 operations synced, thanks for waiting!
Explore the metadata in the Neptune app:
https://app.neptune.ai/ba-final/cwt-1/e/CWT1-571/metadata
