[32m[I 2023-09-15 02:40:53,635][0m Trial 87 finished with value: 0.024426141698309718 and parameters: {'b': 2.6500000000000004, 'fc': 2.4000000000000004, 'scale_min': 1.8, 'scale_max': 36, 'n_scales': 105, 'drop': 0.164821188176133, 'optimizer': 'Adam', 'lr': 0.0005876131164680409, 'weight_decay': 6.932278930131826e-05, 'batch_size': 32, 'epochs': 100}. Best is trial 71 with value: 0.022815226493997778.[0m
trial 87, loss train mean 0.02, score train mean 0.66, loss val mean 0.02, score val mean 0.66



End Time   : Fr 15. Sep 02:40:57 CEST 2023
Duration   : 15691.768675725 seconds

Start Time : Fr 15. Sep 02:40:58 CEST 2023
Job ID: 1164824
Node: cc1g02
Partition: gpu_normal_stud
CPU cores: 16
Memory: 98304
GPUs: 0
Python environment: khoa                  *  /home/phamanh/anaconda3/envs/khoa
Current work directory: /home/phamanh/Schreibtisch/bachelorarbeit/ts_im_CNN

device: cuda


https://app.neptune.ai/ba-final/cwt-2/e/CWT2-377
Split 0, loss train 0.02, score train 0.67, loss val 0.03 score val 0.58
Shutting down background jobs, please wait a moment...
Done!
Waiting for the remaining 10 operations to synchronize with Neptune. Do not kill this process.
All 10 operations synced, thanks for waiting!
Explore the metadata in the Neptune app:
https://app.neptune.ai/ba-final/cwt-2/e/CWT2-377/metadata
https://app.neptune.ai/ba-final/cwt-2/e/CWT2-378
Split 1, loss train 0.03, score train 0.61, loss val 0.04 score val 0.66
Shutting down background jobs, please wait a moment...
Done!
Waiting for the remaining 10 operations to synchronize with Neptune. Do not kill this process.
All 10 operations synced, thanks for waiting!
Explore the metadata in the Neptune app:
https://app.neptune.ai/ba-final/cwt-2/e/CWT2-378/metadata
https://app.neptune.ai/ba-final/cwt-2/e/CWT2-379
Split 2, loss train 0.02, score train 0.67, loss val 0.03 score val 0.60
Shutting down background jobs, please wait a moment...
Done!
Waiting for the remaining 10 operations to synchronize with Neptune. Do not kill this process.
All 10 operations synced, thanks for waiting!
Explore the metadata in the Neptune app:
https://app.neptune.ai/ba-final/cwt-2/e/CWT2-379/metadata
https://app.neptune.ai/ba-final/cwt-2/e/CWT2-380
Split 3, loss train 0.02, score train 0.68, loss val 0.04 score val 0.59
Shutting down background jobs, please wait a moment...
Done!
Waiting for the remaining 10 operations to synchronize with Neptune. Do not kill this process.
All 10 operations synced, thanks for waiting!
Explore the metadata in the Neptune app:
https://app.neptune.ai/ba-final/cwt-2/e/CWT2-380/metadata
https://app.neptune.ai/ba-final/cwt-2/e/CWT2-381
Split 4, loss train 0.02, score train 0.66, loss val 0.05 score val 0.37
Shutting down background jobs, please wait a moment...
Done!
Waiting for the remaining 10 operations to synchronize with Neptune. Do not kill this process.
All 10 operations synced, thanks for waiting!
Explore the metadata in the Neptune app:
https://app.neptune.ai/ba-final/cwt-2/e/CWT2-381/metadata
[32m[I 2023-09-15 06:57:15,000][0m Trial 88 finished with value: 0.03828810174414452 and parameters: {'b': 2.6500000000000004, 'fc': 2.1500000000000004, 'scale_min': 2.0, 'scale_max': 38, 'n_scales': 105, 'drop': 0.1506154422069102, 'optimizer': 'Adam', 'lr': 0.0009066781121112169, 'weight_decay': 5.293374704250215e-05, 'batch_size': 32, 'epochs': 100}. Best is trial 71 with value: 0.022815226493997778.[0m
trial 88, loss train mean 0.02, score train mean 0.66, loss val mean 0.04, score val mean 0.56



End Time   : Fr 15. Sep 06:57:18 CEST 2023
Duration   : 15379.244701789 seconds

Start Time : Fr 15. Sep 06:57:19 CEST 2023
Job ID: 1164825
Node: cc1g02
Partition: gpu_normal_stud
CPU cores: 16
Memory: 98304
GPUs: 0
Python environment: khoa                  *  /home/phamanh/anaconda3/envs/khoa
Current work directory: /home/phamanh/Schreibtisch/bachelorarbeit/ts_im_CNN

device: cuda


https://app.neptune.ai/ba-final/cwt-2/e/CWT2-382
Shutting down background jobs, please wait a moment...
Done!
Waiting for the remaining 3 operations to synchronize with Neptune. Do not kill this process.
All 3 operations synced, thanks for waiting!
Explore the metadata in the Neptune app:
https://app.neptune.ai/ba-final/cwt-2/e/CWT2-382/metadata
[32m[I 2023-09-15 08:09:15,406][0m Trial 89 pruned. [0m

End Time   : Fr 15. Sep 08:09:19 CEST 2023
Duration   : 4319.660848092 seconds

Start Time : Fr 15. Sep 08:31:33 CEST 2023
Job ID: 1166367
Node: cc1g02
Partition: gpu_normal_stud
CPU cores: 16
Memory: 98304
GPUs: 0
Python environment: khoa                  *  /home/phamanh/anaconda3/envs/khoa
Current work directory: /home/phamanh/Schreibtisch/bachelorarbeit/ts_im_CNN

device: cuda


https://app.neptune.ai/ba-final/cwt-2/e/CWT2-383
Split 0, loss train 0.02, score train 0.67, loss val 0.03 score val 0.52
Shutting down background jobs, please wait a moment...
Done!
Waiting for the remaining 10 operations to synchronize with Neptune. Do not kill this process.
All 10 operations synced, thanks for waiting!
Explore the metadata in the Neptune app:
https://app.neptune.ai/ba-final/cwt-2/e/CWT2-383/metadata
https://app.neptune.ai/ba-final/cwt-2/e/CWT2-384
Split 1, loss train 0.02, score train 0.66, loss val 0.22 score val 0.33
Shutting down background jobs, please wait a moment...
Done!
Waiting for the remaining 10 operations to synchronize with Neptune. Do not kill this process.
All 10 operations synced, thanks for waiting!
Explore the metadata in the Neptune app:
https://app.neptune.ai/ba-final/cwt-2/e/CWT2-384/metadata
https://app.neptune.ai/ba-final/cwt-2/e/CWT2-385
Split 2, loss train 0.02, score train 0.66, loss val 0.08 score val 0.30
Shutting down background jobs, please wait a moment...
Done!
Waiting for the remaining 10 operations to synchronize with Neptune. Do not kill this process.
All 10 operations synced, thanks for waiting!
Explore the metadata in the Neptune app:
https://app.neptune.ai/ba-final/cwt-2/e/CWT2-385/metadata
https://app.neptune.ai/ba-final/cwt-2/e/CWT2-386
Split 3, loss train 0.02, score train 0.65, loss val 0.05 score val 0.53
Shutting down background jobs, please wait a moment...
Done!
Waiting for the remaining 10 operations to synchronize with Neptune. Do not kill this process.
All 10 operations synced, thanks for waiting!
Explore the metadata in the Neptune app:
https://app.neptune.ai/ba-final/cwt-2/e/CWT2-386/metadata
https://app.neptune.ai/ba-final/cwt-2/e/CWT2-387
Split 4, loss train 0.02, score train 0.65, loss val 0.05 score val 0.62
Shutting down background jobs, please wait a moment...
Done!
Waiting for the remaining 10 operations to synchronize with Neptune. Do not kill this process.
All 10 operations synced, thanks for waiting!
Explore the metadata in the Neptune app:
https://app.neptune.ai/ba-final/cwt-2/e/CWT2-387/metadata
[32m[I 2023-09-15 12:49:58,014][0m Trial 90 finished with value: 0.08754457818700914 and parameters: {'b': 3.2, 'fc': 1.4500000000000002, 'scale_min': 2.0, 'scale_max': 36, 'n_scales': 105, 'drop': 0.17827557310954997, 'optimizer': 'Adam', 'lr': 0.0007619269999061349, 'weight_decay': 7.23621288691963e-05, 'batch_size': 32, 'epochs': 100}. Best is trial 71 with value: 0.022815226493997778.[0m
trial 90, loss train mean 0.02, score train mean 0.66, loss val mean 0.09, score val mean 0.46



End Time   : Fr 15. Sep 12:50:00 CEST 2023
Duration   : 15506.807133618 seconds

Start Time : Fr 15. Sep 12:53:56 CEST 2023
Job ID: 1166368
Node: cc1g04
Partition: gpu_normal_stud
CPU cores: 16
Memory: 98304
GPUs: 0
Python environment: khoa                  *  /home/phamanh/anaconda3/envs/khoa
Current work directory: /home/phamanh/Schreibtisch/bachelorarbeit/ts_im_CNN

device: cuda


https://app.neptune.ai/ba-final/cwt-2/e/CWT2-388
Split 0, loss train 0.02, score train 0.67, loss val 0.02 score val 0.62
Shutting down background jobs, please wait a moment...
Done!
Waiting for the remaining 14 operations to synchronize with Neptune. Do not kill this process.
All 14 operations synced, thanks for waiting!
Explore the metadata in the Neptune app:
https://app.neptune.ai/ba-final/cwt-2/e/CWT2-388/metadata
https://app.neptune.ai/ba-final/cwt-2/e/CWT2-389
Split 1, loss train 0.02, score train 0.68, loss val 0.06 score val 0.39
Shutting down background jobs, please wait a moment...
Done!
Waiting for the remaining 14 operations to synchronize with Neptune. Do not kill this process.
All 14 operations synced, thanks for waiting!
Explore the metadata in the Neptune app:
https://app.neptune.ai/ba-final/cwt-2/e/CWT2-389/metadata
https://app.neptune.ai/ba-final/cwt-2/e/CWT2-390
Split 2, loss train 0.02, score train 0.67, loss val 0.03 score val 0.68
Shutting down background jobs, please wait a moment...
Done!
Waiting for the remaining 10 operations to synchronize with Neptune. Do not kill this process.
All 10 operations synced, thanks for waiting!
Explore the metadata in the Neptune app:
https://app.neptune.ai/ba-final/cwt-2/e/CWT2-390/metadata
https://app.neptune.ai/ba-final/cwt-2/e/CWT2-391
Split 3, loss train 0.02, score train 0.67, loss val 0.06 score val 0.54
Shutting down background jobs, please wait a moment...
Done!
Waiting for the remaining 10 operations to synchronize with Neptune. Do not kill this process.
All 10 operations synced, thanks for waiting!
Explore the metadata in the Neptune app:
https://app.neptune.ai/ba-final/cwt-2/e/CWT2-391/metadata
https://app.neptune.ai/ba-final/cwt-2/e/CWT2-392
Split 4, loss train 0.02, score train 0.67, loss val 0.03 score val 0.60
Shutting down background jobs, please wait a moment...
Done!
Waiting for the remaining 10 operations to synchronize with Neptune. Do not kill this process.
All 10 operations synced, thanks for waiting!
Explore the metadata in the Neptune app:
https://app.neptune.ai/ba-final/cwt-2/e/CWT2-392/metadata
[32m[I 2023-09-15 17:16:56,443][0m Trial 91 finished with value: 0.039642522436507205 and parameters: {'b': 3.8500000000000005, 'fc': 2.3, 'scale_min': 2.5, 'scale_max': 42, 'n_scales': 115, 'drop': 0.164821188176133, 'optimizer': 'Adam', 'lr': 0.0009066781121112169, 'weight_decay': 4.218797601007024e-05, 'batch_size': 32, 'epochs': 100}. Best is trial 71 with value: 0.022815226493997778.[0m
trial 91, loss train mean 0.02, score train mean 0.67, loss val mean 0.04, score val mean 0.56



End Time   : Fr 15. Sep 17:16:58 CEST 2023
Duration   : 15781.186723525 seconds

Start Time : Fr 15. Sep 17:17:02 CEST 2023
Job ID: 1166369
Node: cc1g04
Partition: gpu_normal_stud
CPU cores: 16
Memory: 98304
GPUs: 0
Python environment: khoa                  *  /home/phamanh/anaconda3/envs/khoa
Current work directory: /home/phamanh/Schreibtisch/bachelorarbeit/ts_im_CNN

device: cuda


https://app.neptune.ai/ba-final/cwt-2/e/CWT2-393
Split 0, loss train 0.03, score train 0.63, loss val 0.03 score val 0.58
Shutting down background jobs, please wait a moment...
Done!
Waiting for the remaining 14 operations to synchronize with Neptune. Do not kill this process.
All 14 operations synced, thanks for waiting!
Explore the metadata in the Neptune app:
https://app.neptune.ai/ba-final/cwt-2/e/CWT2-393/metadata
https://app.neptune.ai/ba-final/cwt-2/e/CWT2-394
Split 1, loss train 0.02, score train 0.66, loss val 0.02 score val 0.72
Shutting down background jobs, please wait a moment...
Done!
Waiting for the remaining 10 operations to synchronize with Neptune. Do not kill this process.
All 10 operations synced, thanks for waiting!
Explore the metadata in the Neptune app:
https://app.neptune.ai/ba-final/cwt-2/e/CWT2-394/metadata
https://app.neptune.ai/ba-final/cwt-2/e/CWT2-395
Split 2, loss train 0.02, score train 0.65, loss val 0.04 score val 0.69
Shutting down background jobs, please wait a moment...
Done!
Waiting for the remaining 14 operations to synchronize with Neptune. Do not kill this process.
All 14 operations synced, thanks for waiting!
Explore the metadata in the Neptune app:
https://app.neptune.ai/ba-final/cwt-2/e/CWT2-395/metadata
https://app.neptune.ai/ba-final/cwt-2/e/CWT2-396
Split 3, loss train 0.03, score train 0.63, loss val 0.02 score val 0.72
Shutting down background jobs, please wait a moment...
Done!
Waiting for the remaining 10 operations to synchronize with Neptune. Do not kill this process.
All 10 operations synced, thanks for waiting!
Explore the metadata in the Neptune app:
https://app.neptune.ai/ba-final/cwt-2/e/CWT2-396/metadata
https://app.neptune.ai/ba-final/cwt-2/e/CWT2-397
Split 4, loss train 0.02, score train 0.67, loss val 0.02 score val 0.53
Shutting down background jobs, please wait a moment...
Done!
Waiting for the remaining 10 operations to synchronize with Neptune. Do not kill this process.
All 10 operations synced, thanks for waiting!
Explore the metadata in the Neptune app:
https://app.neptune.ai/ba-final/cwt-2/e/CWT2-397/metadata
[32m[I 2023-09-15 21:37:25,537][0m Trial 92 finished with value: 0.025457280747433926 and parameters: {'b': 3.25, 'fc': 2.4000000000000004, 'scale_min': 2.3, 'scale_max': 38, 'n_scales': 110, 'drop': 0.18507805334135252, 'optimizer': 'Adam', 'lr': 0.0005798855062358475, 'weight_decay': 0.00010991724472601231, 'batch_size': 32, 'epochs': 100}. Best is trial 71 with value: 0.022815226493997778.[0m
trial 92, loss train mean 0.02, score train mean 0.65, loss val mean 0.03, score val mean 0.65



End Time   : Fr 15. Sep 21:37:27 CEST 2023
Duration   : 15624.491687265 seconds

Start Time : Fr 15. Sep 21:37:28 CEST 2023
Job ID: 1166370
Node: cc1g01
Partition: gpu_normal_stud
CPU cores: 16
Memory: 98304
GPUs: 0
Python environment: khoa                  *  /home/phamanh/anaconda3/envs/khoa
Current work directory: /home/phamanh/Schreibtisch/bachelorarbeit/ts_im_CNN

device: cuda


https://app.neptune.ai/ba-final/cwt-2/e/CWT2-398
Split 0, loss train 0.03, score train 0.64, loss val 0.02 score val 0.67
Shutting down background jobs, please wait a moment...
Done!
Waiting for the remaining 14 operations to synchronize with Neptune. Do not kill this process.
All 14 operations synced, thanks for waiting!
Explore the metadata in the Neptune app:
https://app.neptune.ai/ba-final/cwt-2/e/CWT2-398/metadata
https://app.neptune.ai/ba-final/cwt-2/e/CWT2-399
Split 1, loss train 0.03, score train 0.63, loss val 0.03 score val 0.51
Shutting down background jobs, please wait a moment...
Done!
Waiting for the remaining 14 operations to synchronize with Neptune. Do not kill this process.
All 14 operations synced, thanks for waiting!
Explore the metadata in the Neptune app:
https://app.neptune.ai/ba-final/cwt-2/e/CWT2-399/metadata
https://app.neptune.ai/ba-final/cwt-2/e/CWT2-400
Split 2, loss train 0.02, score train 0.65, loss val 0.04 score val 0.60
Shutting down background jobs, please wait a moment...
Done!
Waiting for the remaining 14 operations to synchronize with Neptune. Do not kill this process.
All 14 operations synced, thanks for waiting!
Explore the metadata in the Neptune app:
https://app.neptune.ai/ba-final/cwt-2/e/CWT2-400/metadata
https://app.neptune.ai/ba-final/cwt-2/e/CWT2-401
Split 3, loss train 0.02, score train 0.65, loss val 0.05 score val 0.42
Shutting down background jobs, please wait a moment...
Done!
Waiting for the remaining 10 operations to synchronize with Neptune. Do not kill this process.
All 10 operations synced, thanks for waiting!
Explore the metadata in the Neptune app:
https://app.neptune.ai/ba-final/cwt-2/e/CWT2-401/metadata
https://app.neptune.ai/ba-final/cwt-2/e/CWT2-402
Split 4, loss train 0.02, score train 0.66, loss val 0.03 score val 0.59
Shutting down background jobs, please wait a moment...
Done!
Waiting for the remaining 10 operations to synchronize with Neptune. Do not kill this process.
All 10 operations synced, thanks for waiting!
Explore the metadata in the Neptune app:
https://app.neptune.ai/ba-final/cwt-2/e/CWT2-402/metadata
[32m[I 2023-09-16 01:46:13,598][0m Trial 93 finished with value: 0.033274251349428866 and parameters: {'b': 3.25, 'fc': 2.4000000000000004, 'scale_min': 2.3, 'scale_max': 38, 'n_scales': 100, 'drop': 0.18507805334135252, 'optimizer': 'Adam', 'lr': 0.0007358376579052057, 'weight_decay': 0.00010991724472601231, 'batch_size': 32, 'epochs': 100}. Best is trial 71 with value: 0.022815226493997778.[0m
trial 93, loss train mean 0.02, score train mean 0.65, loss val mean 0.03, score val mean 0.56



End Time   : Sa 16. Sep 01:46:15 CEST 2023
Duration   : 14926.767834313 seconds

Start Time : Sa 16. Sep 01:46:16 CEST 2023
Job ID: 1166371
Node: cc1g01
Partition: gpu_normal_stud
CPU cores: 16
Memory: 98304
GPUs: 0
Python environment: khoa                  *  /home/phamanh/anaconda3/envs/khoa
Current work directory: /home/phamanh/Schreibtisch/bachelorarbeit/ts_im_CNN

device: cuda


https://app.neptune.ai/ba-final/cwt-2/e/CWT2-403
Split 0, loss train 0.02, score train 0.66, loss val 0.04 score val 0.63
Shutting down background jobs, please wait a moment...
Done!
Waiting for the remaining 14 operations to synchronize with Neptune. Do not kill this process.
All 14 operations synced, thanks for waiting!
Explore the metadata in the Neptune app:
https://app.neptune.ai/ba-final/cwt-2/e/CWT2-403/metadata
https://app.neptune.ai/ba-final/cwt-2/e/CWT2-404
Split 1, loss train 0.03, score train 0.64, loss val 0.02 score val 0.67
Shutting down background jobs, please wait a moment...
Done!
Waiting for the remaining 10 operations to synchronize with Neptune. Do not kill this process.
All 10 operations synced, thanks for waiting!
Explore the metadata in the Neptune app:
https://app.neptune.ai/ba-final/cwt-2/e/CWT2-404/metadata
https://app.neptune.ai/ba-final/cwt-2/e/CWT2-405
Split 2, loss train 0.02, score train 0.66, loss val 0.03 score val 0.60
Shutting down background jobs, please wait a moment...
Done!
Waiting for the remaining 14 operations to synchronize with Neptune. Do not kill this process.
All 14 operations synced, thanks for waiting!
Explore the metadata in the Neptune app:
https://app.neptune.ai/ba-final/cwt-2/e/CWT2-405/metadata
https://app.neptune.ai/ba-final/cwt-2/e/CWT2-406
Split 3, loss train 0.03, score train 0.65, loss val 0.03 score val 0.50
Shutting down background jobs, please wait a moment...
Done!
Waiting for the remaining 10 operations to synchronize with Neptune. Do not kill this process.
All 10 operations synced, thanks for waiting!
Explore the metadata in the Neptune app:
https://app.neptune.ai/ba-final/cwt-2/e/CWT2-406/metadata
https://app.neptune.ai/ba-final/cwt-2/e/CWT2-407
Split 4, loss train 0.02, score train 0.67, loss val 0.04 score val 0.48
Shutting down background jobs, please wait a moment...
Done!
Waiting for the remaining 10 operations to synchronize with Neptune. Do not kill this process.
All 10 operations synced, thanks for waiting!
Explore the metadata in the Neptune app:
https://app.neptune.ai/ba-final/cwt-2/e/CWT2-407/metadata
[32m[I 2023-09-16 05:55:00,238][0m Trial 94 finished with value: 0.03083302061608497 and parameters: {'b': 2.8, 'fc': 2.25, 'scale_min': 2.3, 'scale_max': 36, 'n_scales': 105, 'drop': 0.19830681647394402, 'optimizer': 'Adam', 'lr': 0.0005798855062358475, 'weight_decay': 8.071888400507432e-05, 'batch_size': 32, 'epochs': 100}. Best is trial 71 with value: 0.022815226493997778.[0m
trial 94, loss train mean 0.02, score train mean 0.66, loss val mean 0.03, score val mean 0.58



End Time   : Sa 16. Sep 05:55:02 CEST 2023
Duration   : 14925.433035530 seconds

Start Time : Sa 16. Sep 05:55:03 CEST 2023
Job ID: 1166372
Node: cc1g07
Partition: gpu_normal_stud
CPU cores: 16
Memory: 98304
GPUs: 0
Python environment: khoa                  *  /home/phamanh/anaconda3/envs/khoa
Current work directory: /home/phamanh/Schreibtisch/bachelorarbeit/ts_im_CNN

device: cuda


https://app.neptune.ai/ba-final/cwt-2/e/CWT2-408
Split 0, loss train 0.03, score train 0.62, loss val 0.02 score val 0.60
Shutting down background jobs, please wait a moment...
Done!
Waiting for the remaining 10 operations to synchronize with Neptune. Do not kill this process.
All 10 operations synced, thanks for waiting!
Explore the metadata in the Neptune app:
https://app.neptune.ai/ba-final/cwt-2/e/CWT2-408/metadata
https://app.neptune.ai/ba-final/cwt-2/e/CWT2-409
Split 1, loss train 0.03, score train 0.64, loss val 0.04 score val 0.45
Shutting down background jobs, please wait a moment...
Done!
Waiting for the remaining 10 operations to synchronize with Neptune. Do not kill this process.
All 10 operations synced, thanks for waiting!
Explore the metadata in the Neptune app:
https://app.neptune.ai/ba-final/cwt-2/e/CWT2-409/metadata
https://app.neptune.ai/ba-final/cwt-2/e/CWT2-410
Split 2, loss train 0.03, score train 0.64, loss val 0.03 score val 0.61
Shutting down background jobs, please wait a moment...
Done!
Waiting for the remaining 10 operations to synchronize with Neptune. Do not kill this process.
All 10 operations synced, thanks for waiting!
Explore the metadata in the Neptune app:
https://app.neptune.ai/ba-final/cwt-2/e/CWT2-410/metadata
https://app.neptune.ai/ba-final/cwt-2/e/CWT2-411
Split 3, loss train 0.03, score train 0.63, loss val 0.02 score val 0.76
Shutting down background jobs, please wait a moment...
Done!
Waiting for the remaining 14 operations to synchronize with Neptune. Do not kill this process.
All 14 operations synced, thanks for waiting!
Explore the metadata in the Neptune app:
https://app.neptune.ai/ba-final/cwt-2/e/CWT2-411/metadata
https://app.neptune.ai/ba-final/cwt-2/e/CWT2-412
Split 4, loss train 0.03, score train 0.63, loss val 0.03 score val 0.66
Shutting down background jobs, please wait a moment...
Done!
Waiting for the remaining 10 operations to synchronize with Neptune. Do not kill this process.
All 10 operations synced, thanks for waiting!
Explore the metadata in the Neptune app:
https://app.neptune.ai/ba-final/cwt-2/e/CWT2-412/metadata
