[32m[I 2023-09-18 14:47:55,373][0m Trial 101 finished with value: 0.03683451439471955 and parameters: {'b': 3.5, 'fc': 2.25, 'scale_min': 1.4, 'scale_max': 44, 'n_scales': 110, 'drop': 0.15450148399243405, 'optimizer': 'Adam', 'lr': 0.0007358376849183389, 'weight_decay': 4.446627782663023e-05, 'batch_size': 32, 'epochs': 100}. Best is trial 71 with value: 0.022815226493997778.[0m
trial 101, loss train mean 0.02, score train mean 0.66, loss val mean 0.04, score val mean 0.59



End Time   : Mo 18. Sep 14:47:57 CEST 2023
Duration   : 15123.680188119 seconds

Start Time : Mo 18. Sep 17:36:18 CEST 2023
Job ID: 1169872
Node: cc1g02
Partition: gpu_long_stud
CPU cores: 16
Memory: 98304
GPUs: 0
Python environment: khoa                  *  /home/phamanh/anaconda3/envs/khoa
Current work directory: /home/phamanh/Schreibtisch/bachelorarbeit/ts_im_CNN

device: cuda


Study statistics: 
  Number of finished trials:  100
  Number of pruned trials:  17
  Number of complete trials:  83
  Value:  0.022815226493997778
  Params: 
    b: 2.9000000000000004
    batch_size: 32
    drop: 0.20656565281404576
    epochs: 100
    fc: 2.35
    lr: 0.0005060961726166585
    n_scales: 100
    optimizer: Adam
    scale_max: 40
    scale_min: 1.3
    weight_decay: 0.0001416436960097566
final test best model
https://app.neptune.ai/ba-final/cwt-2/e/CWT2-435
=====================================================================================
Layer (type:depth-idx)                                       Param #
=====================================================================================
ConcatModel                                                  --
├─EfficientNet: 1-1                                          --
│    └─Sequential: 2-1                                       --
│    │    └─Conv2dNormActivation: 3-1                        640
│    │    └─Sequential: 3-2                                  1,448
│    │    └─Sequential: 3-3                                  16,714
│    │    └─Sequential: 3-4                                  46,640
│    │    └─Sequential: 3-5                                  242,930
│    │    └─Sequential: 3-6                                  543,148
│    │    └─Sequential: 3-7                                  2,026,348
│    │    └─Sequential: 3-8                                  717,232
│    │    └─Conv2dNormActivation: 3-9                        412,160
│    └─AdaptiveAvgPool2d: 2-2                                --
│    └─Identity: 2-3                                         --
├─Conv1dNeuralNetwork: 1-2                                   --
│    └─Conv1DBlock_1: 2-4                                    --
│    │    └─Conv1d: 3-10                                     2,944
│    │    └─BatchNorm1d: 3-11                                256
│    │    └─ReLU: 3-12                                       --
│    └─Sequential: 2-5                                       --
│    │    └─Conv1DBlock_2: 3-13                              99,072
│    │    └─Conv1DBlock_2: 3-14                              99,072
│    └─Conv1DBlock_2: 2-6                                    --
│    │    └─Conv1d: 3-15                                     49,280
│    │    └─BatchNorm1d: 3-16                                256
│    │    └─ReLU: 3-17                                       --
│    │    └─Conv1d: 3-18                                     49,280
│    │    └─BatchNorm1d: 3-19                                256
│    │    └─ReLU: 3-20                                       --
│    │    └─MaxPool1d: 3-21                                  --
│    └─Conv2DBlock: 2-7                                      --
│    │    └─Conv2d: 3-22                                     4,736
│    │    └─BatchNorm2d: 3-23                                256
│    │    └─ReLU: 3-24                                       --
│    │    └─Conv2d: 3-25                                     147,584
│    │    └─BatchNorm2d: 3-26                                256
│    │    └─ReLU: 3-27                                       --
│    │    └─MaxPool2d: 3-28                                  --
│    └─Conv2DBlock: 2-8                                      --
│    │    └─Conv2d: 3-29                                     147,584
│    │    └─BatchNorm2d: 3-30                                256
│    │    └─ReLU: 3-31                                       --
│    │    └─Conv2d: 3-32                                     147,584
│    │    └─BatchNorm2d: 3-33                                256
│    │    └─ReLU: 3-34                                       --
│    │    └─MaxPool2d: 3-35                                  --
│    └─Conv2DBlock: 2-9                                      --
│    │    └─Conv2d: 3-36                                     147,584
│    │    └─BatchNorm2d: 3-37                                256
│    │    └─ReLU: 3-38                                       --
│    │    └─Conv2d: 3-39                                     147,584
│    │    └─BatchNorm2d: 3-40                                256
│    │    └─ReLU: 3-41                                       --
│    │    └─MaxPool2d: 3-42                                  --
│    └─Conv2DBlock: 2-10                                     --
│    │    └─Conv2d: 3-43                                     147,584
│    │    └─BatchNorm2d: 3-44                                256
│    │    └─ReLU: 3-45                                       --
│    │    └─Conv2d: 3-46                                     147,584
│    │    └─BatchNorm2d: 3-47                                256
│    │    └─ReLU: 3-48                                       --
│    │    └─MaxPool2d: 3-49                                  --
│    └─Flatten: 2-11                                         --
├─Dropout: 1-3                                               --
├─Linear: 1-4                                                2,561
=====================================================================================
Total params: 5,350,109
Trainable params: 5,350,109
Non-trainable params: 0
=====================================================================================
Warning: string series 'monitoring/da4c2a42/stdout' value was longer than 1000 characters and was truncated. This warning is printed only once per series.
Warning: string 'structure' value was longer than 16384 characters and was truncated. This warning is printed only once.
epoch 0, loss train 0.23, loss test 1.08, score train 0.29, score test 0.31, score final 0.15
epoch 1, loss train 0.14, loss test 0.37, score train 0.38, score test 0.35, score final 0.11
epoch 2, loss train 0.12, loss test 1.33, score train 0.41, score test 0.32, score final 0.03
epoch 3, loss train 0.11, loss test 0.17, score train 0.42, score test 0.35, score final 0.04
epoch 4, loss train 0.10, loss test 0.40, score train 0.43, score test 0.32, score final 0.06
epoch 5, loss train 0.09, loss test 0.30, score train 0.45, score test 0.31, score final 0.03
epoch 6, loss train 0.09, loss test 0.54, score train 0.44, score test 0.36, score final 0.05
epoch 7, loss train 0.07, loss test 1.14, score train 0.47, score test 0.33, score final 0.08
epoch 8, loss train 0.07, loss test 0.24, score train 0.47, score test 0.33, score final 0.07
epoch 9, loss train 0.07, loss test 0.41, score train 0.48, score test 0.35, score final 0.09
epoch 10, loss train 0.07, loss test 0.64, score train 0.47, score test 0.32, score final 0.03
epoch 11, loss train 0.06, loss test 0.31, score train 0.49, score test 0.30, score final 0.02
epoch 12, loss train 0.06, loss test 0.22, score train 0.50, score test 0.32, score final 0.08
epoch 13, loss train 0.06, loss test 0.17, score train 0.50, score test 0.35, score final 0.05
epoch 14, loss train 0.06, loss test 0.18, score train 0.50, score test 0.33, score final 0.07
epoch 15, loss train 0.05, loss test 0.18, score train 0.51, score test 0.32, score final 0.08
epoch 16, loss train 0.05, loss test 0.17, score train 0.50, score test 0.32, score final 0.13
epoch 17, loss train 0.05, loss test 0.17, score train 0.52, score test 0.33, score final 0.04
epoch 18, loss train 0.05, loss test 0.25, score train 0.52, score test 0.32, score final 0.03
epoch 19, loss train 0.04, loss test 0.17, score train 0.53, score test 0.33, score final 0.06
epoch 20, loss train 0.05, loss test 0.17, score train 0.52, score test 0.31, score final 0.06
epoch 21, loss train 0.04, loss test 0.20, score train 0.56, score test 0.32, score final 0.02
epoch 22, loss train 0.04, loss test 0.17, score train 0.54, score test 0.33, score final 0.05
epoch 23, loss train 0.04, loss test 0.16, score train 0.57, score test 0.34, score final 0.09
epoch 24, loss train 0.04, loss test 0.18, score train 0.58, score test 0.30, score final 0.04
epoch 25, loss train 0.03, loss test 0.21, score train 0.59, score test 0.27, score final 0.08
epoch 26, loss train 0.04, loss test 0.17, score train 0.56, score test 0.31, score final 0.10
epoch 27, loss train 0.03, loss test 0.19, score train 0.60, score test 0.29, score final 0.14
epoch 28, loss train 0.03, loss test 0.19, score train 0.59, score test 0.28, score final 0.21
epoch 29, loss train 0.03, loss test 0.16, score train 0.59, score test 0.33, score final 0.04
epoch 30, loss train 0.03, loss test 0.20, score train 0.61, score test 0.25, score final 0.26
epoch 31, loss train 0.03, loss test 0.17, score train 0.62, score test 0.32, score final 0.13
epoch 32, loss train 0.03, loss test 0.19, score train 0.61, score test 0.27, score final 0.11
epoch 33, loss train 0.04, loss test 0.19, score train 0.56, score test 0.28, score final 0.02
epoch 34, loss train 0.03, loss test 0.19, score train 0.61, score test 0.28, score final 0.05
epoch 35, loss train 0.03, loss test 0.18, score train 0.64, score test 0.30, score final 0.03
epoch 36, loss train 0.03, loss test 0.18, score train 0.64, score test 0.31, score final 0.05
epoch 37, loss train 0.02, loss test 0.19, score train 0.65, score test 0.27, score final 0.16
epoch 38, loss train 0.02, loss test 0.18, score train 0.66, score test 0.30, score final 0.05
epoch 39, loss train 0.02, loss test 0.20, score train 0.66, score test 0.26, score final 0.04
epoch 40, loss train 0.02, loss test 0.19, score train 0.67, score test 0.29, score final 0.12
epoch 41, loss train 0.02, loss test 0.19, score train 0.66, score test 0.28, score final 0.07
epoch 42, loss train 0.02, loss test 0.21, score train 0.67, score test 0.27, score final 0.10
epoch 43, loss train 0.02, loss test 0.20, score train 0.65, score test 0.27, score final 0.05
epoch 44, loss train 0.02, loss test 0.19, score train 0.67, score test 0.28, score final 0.10
epoch 45, loss train 0.02, loss test 0.20, score train 0.68, score test 0.28, score final 0.06
epoch 46, loss train 0.02, loss test 0.20, score train 0.68, score test 0.28, score final 0.11
epoch 47, loss train 0.02, loss test 0.20, score train 0.67, score test 0.26, score final 0.12
epoch 48, loss train 0.02, loss test 0.20, score train 0.67, score test 0.28, score final 0.06
epoch 49, loss train 0.02, loss test 0.20, score train 0.67, score test 0.28, score final 0.09
epoch 50, loss train 0.02, loss test 0.21, score train 0.67, score test 0.26, score final 0.13
epoch 51, loss train 0.02, loss test 0.20, score train 0.69, score test 0.27, score final 0.12
epoch 52, loss train 0.02, loss test 0.20, score train 0.68, score test 0.26, score final 0.10
epoch 53, loss train 0.02, loss test 0.20, score train 0.69, score test 0.28, score final 0.07
epoch 54, loss train 0.02, loss test 0.19, score train 0.69, score test 0.28, score final 0.10
epoch 55, loss train 0.02, loss test 0.20, score train 0.68, score test 0.28, score final 0.08
epoch 56, loss train 0.02, loss test 0.19, score train 0.70, score test 0.27, score final 0.08
epoch 57, loss train 0.02, loss test 0.20, score train 0.71, score test 0.27, score final 0.14
epoch 58, loss train 0.02, loss test 0.20, score train 0.71, score test 0.28, score final 0.09
epoch 59, loss train 0.02, loss test 0.20, score train 0.70, score test 0.27, score final 0.11
epoch 60, loss train 0.02, loss test 0.21, score train 0.71, score test 0.27, score final 0.11
epoch 61, loss train 0.02, loss test 0.19, score train 0.70, score test 0.29, score final 0.09
epoch 62, loss train 0.02, loss test 0.20, score train 0.70, score test 0.29, score final 0.17
epoch 63, loss train 0.02, loss test 0.19, score train 0.71, score test 0.28, score final 0.16
epoch 64, loss train 0.02, loss test 0.46, score train 0.70, score test 0.27, score final 0.15
epoch 65, loss train 0.02, loss test 0.19, score train 0.69, score test 0.28, score final 0.14
epoch 66, loss train 0.02, loss test 0.19, score train 0.71, score test 0.30, score final 0.12
epoch 67, loss train 0.02, loss test 0.18, score train 0.69, score test 0.29, score final 0.07
epoch 68, loss train 0.02, loss test 0.20, score train 0.71, score test 0.28, score final 0.10
epoch 69, loss train 0.02, loss test 0.20, score train 0.69, score test 0.29, score final 0.11
epoch 70, loss train 0.02, loss test 0.19, score train 0.71, score test 0.28, score final 0.07
epoch 71, loss train 0.02, loss test 0.19, score train 0.72, score test 0.29, score final 0.05
epoch 72, loss train 0.02, loss test 0.19, score train 0.72, score test 0.30, score final 0.10
epoch 73, loss train 0.01, loss test 0.19, score train 0.74, score test 0.29, score final 0.12
epoch 74, loss train 0.02, loss test 0.19, score train 0.74, score test 0.29, score final 0.11
epoch 75, loss train 0.02, loss test 0.19, score train 0.71, score test 0.29, score final 0.10
epoch 76, loss train 0.01, loss test 0.19, score train 0.74, score test 0.29, score final 0.12
epoch 77, loss train 0.02, loss test 0.20, score train 0.73, score test 0.28, score final 0.08
epoch 78, loss train 0.02, loss test 0.20, score train 0.74, score test 0.27, score final 0.12
epoch 79, loss train 0.02, loss test 0.20, score train 0.74, score test 0.27, score final 0.05
epoch 80, loss train 0.02, loss test 0.19, score train 0.74, score test 0.29, score final 0.09
epoch 81, loss train 0.02, loss test 0.18, score train 0.72, score test 0.30, score final 0.09
epoch 82, loss train 0.02, loss test 0.19, score train 0.73, score test 0.29, score final 0.08
epoch 83, loss train 0.02, loss test 0.18, score train 0.73, score test 0.31, score final 0.07
epoch 84, loss train 0.01, loss test 0.18, score train 0.75, score test 0.31, score final 0.10
epoch 85, loss train 0.01, loss test 0.18, score train 0.74, score test 0.30, score final 0.06
epoch 86, loss train 0.01, loss test 0.18, score train 0.74, score test 0.30, score final 0.05
epoch 87, loss train 0.02, loss test 0.18, score train 0.74, score test 0.30, score final 0.06
epoch 88, loss train 0.02, loss test 0.18, score train 0.72, score test 0.30, score final 0.11
epoch 89, loss train 0.01, loss test 0.18, score train 0.74, score test 0.30, score final 0.08
epoch 90, loss train 0.01, loss test 0.19, score train 0.75, score test 0.29, score final 0.09
epoch 91, loss train 0.02, loss test 0.19, score train 0.73, score test 0.30, score final 0.10
epoch 92, loss train 0.01, loss test 0.17, score train 0.74, score test 0.30, score final 0.12
epoch 93, loss train 0.01, loss test 0.18, score train 0.74, score test 0.30, score final 0.06
epoch 94, loss train 0.01, loss test 0.19, score train 0.74, score test 0.29, score final 0.08
epoch 95, loss train 0.01, loss test 0.19, score train 0.74, score test 0.29, score final 0.07
epoch 96, loss train 0.01, loss test 0.19, score train 0.74, score test 0.29, score final 0.07
epoch 97, loss train 0.01, loss test 0.19, score train 0.76, score test 0.28, score final 0.06
epoch 98, loss train 0.01, loss test 0.18, score train 0.75, score test 0.30, score final 0.09
epoch 99, loss train 0.01, loss test 0.19, score train 0.75, score test 0.29, score final 0.08
Shutting down background jobs, please wait a moment...
Done!
Waiting for the remaining 3 operations to synchronize with Neptune. Do not kill this process.
All 3 operations synced, thanks for waiting!
Explore the metadata in the Neptune app:
https://app.neptune.ai/ba-final/cwt-2/e/CWT2-435/metadata
https://app.neptune.ai/ba-final/cwt-2/e/CWT2-436
=====================================================================================
Layer (type:depth-idx)                                       Param #
=====================================================================================
ConcatModel                                                  --
├─EfficientNet: 1-1                                          --
│    └─Sequential: 2-1                                       --
│    │    └─Conv2dNormActivation: 3-1                        640
│    │    └─Sequential: 3-2                                  1,448
│    │    └─Sequential: 3-3                                  16,714
│    │    └─Sequential: 3-4                                  46,640
│    │    └─Sequential: 3-5                                  242,930
│    │    └─Sequential: 3-6                                  543,148
│    │    └─Sequential: 3-7                                  2,026,348
│    │    └─Sequential: 3-8                                  717,232
│    │    └─Conv2dNormActivation: 3-9                        412,160
│    └─AdaptiveAvgPool2d: 2-2                                --
│    └─Identity: 2-3                                         --
├─Conv1dNeuralNetwork: 1-2                                   --
│    └─Conv1DBlock_1: 2-4                                    --
│    │    └─Conv1d: 3-10                                     2,944
│    │    └─BatchNorm1d: 3-11                                256
│    │    └─ReLU: 3-12                                       --
│    └─Sequential: 2-5                                       --
│    │    └─Conv1DBlock_2: 3-13                              99,072
│    │    └─Conv1DBlock_2: 3-14                              99,072
│    └─Conv1DBlock_2: 2-6                                    --
│    │    └─Conv1d: 3-15                                     49,280
│    │    └─BatchNorm1d: 3-16                                256
│    │    └─ReLU: 3-17                                       --
│    │    └─Conv1d: 3-18                                     49,280
│    │    └─BatchNorm1d: 3-19                                256
│    │    └─ReLU: 3-20                                       --
│    │    └─MaxPool1d: 3-21                                  --
│    └─Conv2DBlock: 2-7                                      --
│    │    └─Conv2d: 3-22                                     4,736
│    │    └─BatchNorm2d: 3-23                                256
│    │    └─ReLU: 3-24                                       --
│    │    └─Conv2d: 3-25                                     147,584
│    │    └─BatchNorm2d: 3-26                                256
│    │    └─ReLU: 3-27                                       --
│    │    └─MaxPool2d: 3-28                                  --
│    └─Conv2DBlock: 2-8                                      --
│    │    └─Conv2d: 3-29                                     147,584
│    │    └─BatchNorm2d: 3-30                                256
│    │    └─ReLU: 3-31                                       --
│    │    └─Conv2d: 3-32                                     147,584
│    │    └─BatchNorm2d: 3-33                                256
│    │    └─ReLU: 3-34                                       --
│    │    └─MaxPool2d: 3-35                                  --
│    └─Conv2DBlock: 2-9                                      --
│    │    └─Conv2d: 3-36                                     147,584
│    │    └─BatchNorm2d: 3-37                                256
│    │    └─ReLU: 3-38                                       --
│    │    └─Conv2d: 3-39                                     147,584
│    │    └─BatchNorm2d: 3-40                                256
│    │    └─ReLU: 3-41                                       --
│    │    └─MaxPool2d: 3-42                                  --
│    └─Conv2DBlock: 2-10                                     --
│    │    └─Conv2d: 3-43                                     147,584
│    │    └─BatchNorm2d: 3-44                                256
│    │    └─ReLU: 3-45                                       --
│    │    └─Conv2d: 3-46                                     147,584
│    │    └─BatchNorm2d: 3-47                                256
│    │    └─ReLU: 3-48                                       --
│    │    └─MaxPool2d: 3-49                                  --
│    └─Flatten: 2-11                                         --
├─Dropout: 1-3                                               --
├─Linear: 1-4                                                2,561
=====================================================================================
Total params: 5,350,109
Trainable params: 5,350,109
Non-trainable params: 0
=====================================================================================
Warning: string series 'monitoring/da4c2a42/stdout' value was longer than 1000 characters and was truncated. This warning is printed only once per series.
Warning: string 'structure' value was longer than 16384 characters and was truncated. This warning is printed only once.
Tracking result from best trial in Cross Validation
loss test 0.16, score test 0.34
Bearing 13, RUL pred 4507, RUl true 5730
Bearing 14, RUL pred 1840, RUl true 2890
Bearing 15, RUL pred 5155, RUl true 1610
Bearing 16, RUL pred 2516, RUl true 1460
Bearing 17, RUL pred 3102, RUl true 7570
Bearing 23, RUL pred 11905, RUl true 7530
Bearing 24, RUL pred 4969, RUl true 1390
Bearing 25, RUL pred 7075, RUl true 3090
Bearing 26, RUL pred 2666, RUl true 1290
Bearing 27, RUL pred 1897, RUl true 580
Bearing 33, RUL pred 772, RUl true 820
score final 0.16
loss final 2365.55

Shutting down background jobs, please wait a moment...
Done!
Waiting for the remaining 13 operations to synchronize with Neptune. Do not kill this process.
All 13 operations