[32m[I 2023-09-02 19:52:25,726][0m Trial 20 finished with value: 96.11003045021218 and parameters: {'b': 2.4000000000000004, 'fc': 1.6, 'scale_min': 2.5, 'scale_max': 34, 'n_scales': 225, 'drop': 0.785857685591905, 'optimizer': 'Adam', 'lr': 0.12421906633558594, 'weight_decay': 1.4168848758594515e-05, 'batch_size': 32, 'epochs': 100}. Best is trial 19 with value: 0.17862944704421022.[0m
trial 20, loss train mean 0.34, score train mean 0.18, loss val mean 96.11, score val mean 0.19



End Time   : Sa 2. Sep 19:52:27 CEST 2023
Duration   : 18384.534531291 seconds

Start Time : Sa 2. Sep 19:52:28 CEST 2023
Job ID: 1154387
Node: cc1g05
Partition: gpu_normal_stud
CPU cores: 16
Memory: 98304
GPUs: 0
Python environment: khoa                  *  /home/phamanh/anaconda3/envs/khoa
Current work directory: /home/phamanh/Schreibtisch/bachelorarbeit/ts_im_CNN

device: cuda


https://app.neptune.ai/ba-final/cwt-2/e/CWT2-102
Shutting down background jobs, please wait a moment...
Done!
Waiting for the remaining 3 operations to synchronize with Neptune. Do not kill this process.
All 3 operations synced, thanks for waiting!
Explore the metadata in the Neptune app:
https://app.neptune.ai/ba-final/cwt-2/e/CWT2-102/metadata
[32m[I 2023-09-02 22:14:20,331][0m Trial 21 pruned. [0m

End Time   : Sa 2. Sep 22:14:22 CEST 2023
Duration   : 8514.602759714 seconds

Start Time : Sa 2. Sep 22:14:24 CEST 2023
Job ID: 1154388
Node: cc1g05
Partition: gpu_normal_stud
CPU cores: 16
Memory: 98304
GPUs: 0
Python environment: khoa                  *  /home/phamanh/anaconda3/envs/khoa
Current work directory: /home/phamanh/Schreibtisch/bachelorarbeit/ts_im_CNN

device: cuda


https://app.neptune.ai/ba-final/cwt-2/e/CWT2-103
Split 0, loss train 0.08, score train 0.41, loss val 0.08 score val 0.29
Shutting down background jobs, please wait a moment...
Done!
Waiting for the remaining 10 operations to synchronize with Neptune. Do not kill this process.
All 10 operations synced, thanks for waiting!
Explore the metadata in the Neptune app:
https://app.neptune.ai/ba-final/cwt-2/e/CWT2-103/metadata
https://app.neptune.ai/ba-final/cwt-2/e/CWT2-104
Split 1, loss train 0.08, score train 0.43, loss val 0.22 score val 0.27
Shutting down background jobs, please wait a moment...
Done!
Waiting for the remaining 14 operations to synchronize with Neptune. Do not kill this process.
All 14 operations synced, thanks for waiting!
Explore the metadata in the Neptune app:
https://app.neptune.ai/ba-final/cwt-2/e/CWT2-104/metadata
https://app.neptune.ai/ba-final/cwt-2/e/CWT2-105
Split 2, loss train 0.08, score train 0.42, loss val 0.23 score val 0.21
Shutting down background jobs, please wait a moment...
Done!
Waiting for the remaining 14 operations to synchronize with Neptune. Do not kill this process.
All 14 operations synced, thanks for waiting!
Explore the metadata in the Neptune app:
https://app.neptune.ai/ba-final/cwt-2/e/CWT2-105/metadata
https://app.neptune.ai/ba-final/cwt-2/e/CWT2-106
Split 3, loss train 0.07, score train 0.44, loss val 0.25 score val 0.11
Shutting down background jobs, please wait a moment...
Done!
Waiting for the remaining 10 operations to synchronize with Neptune. Do not kill this process.
All 10 operations synced, thanks for waiting!
Explore the metadata in the Neptune app:
https://app.neptune.ai/ba-final/cwt-2/e/CWT2-106/metadata
https://app.neptune.ai/ba-final/cwt-2/e/CWT2-107
Split 4, loss train 0.08, score train 0.43, loss val 0.15 score val 0.20
Shutting down background jobs, please wait a moment...
Done!
Waiting for the remaining 14 operations to synchronize with Neptune. Do not kill this process.
All 14 operations synced, thanks for waiting!
Explore the metadata in the Neptune app:
https://app.neptune.ai/ba-final/cwt-2/e/CWT2-107/metadata
[32m[I 2023-09-03 03:46:21,290][0m Trial 22 finished with value: 0.18613191361122944 and parameters: {'b': 1.75, 'fc': 0.9, 'scale_min': 3.0, 'scale_max': 26, 'n_scales': 300, 'drop': 0.26450003668752126, 'optimizer': 'Adam', 'lr': 0.01331236352178168, 'weight_decay': 7.765260416805091e-05, 'batch_size': 32, 'epochs': 100}. Best is trial 19 with value: 0.17862944704421022.[0m
trial 22, loss train mean 0.08, score train mean 0.42, loss val mean 0.19, score val mean 0.22



End Time   : So 3. Sep 03:46:22 CEST 2023
Duration   : 19918.796648933 seconds

Start Time : So 3. Sep 03:46:32 CEST 2023
Job ID: 1154389
Node: cc1g05
Partition: gpu_normal_stud
CPU cores: 16
Memory: 98304
GPUs: 0
Python environment: khoa                  *  /home/phamanh/anaconda3/envs/khoa
Current work directory: /home/phamanh/Schreibtisch/bachelorarbeit/ts_im_CNN

device: cuda


https://app.neptune.ai/ba-final/cwt-2/e/CWT2-108
Split 0, loss train 0.09, score train 0.40, loss val 0.19 score val 0.27
Shutting down background jobs, please wait a moment...
Done!
Waiting for the remaining 10 operations to synchronize with Neptune. Do not kill this process.
All 10 operations synced, thanks for waiting!
Explore the metadata in the Neptune app:
https://app.neptune.ai/ba-final/cwt-2/e/CWT2-108/metadata
https://app.neptune.ai/ba-final/cwt-2/e/CWT2-109
Split 1, loss train 0.08, score train 0.41, loss val 0.08 score val 0.50
Shutting down background jobs, please wait a moment...
Done!
Waiting for the remaining 14 operations to synchronize with Neptune. Do not kill this process.
All 14 operations synced, thanks for waiting!
Explore the metadata in the Neptune app:
https://app.neptune.ai/ba-final/cwt-2/e/CWT2-109/metadata
https://app.neptune.ai/ba-final/cwt-2/e/CWT2-110
Split 2, loss train 0.09, score train 0.41, loss val 0.14 score val 0.33
Shutting down background jobs, please wait a moment...
Done!
Waiting for the remaining 10 operations to synchronize with Neptune. Do not kill this process.
All 10 operations synced, thanks for waiting!
Explore the metadata in the Neptune app:
https://app.neptune.ai/ba-final/cwt-2/e/CWT2-110/metadata
https://app.neptune.ai/ba-final/cwt-2/e/CWT2-111
Split 3, loss train 0.08, score train 0.43, loss val 2.21 score val 0.03
Shutting down background jobs, please wait a moment...
Done!
Waiting for the remaining 10 operations to synchronize with Neptune. Do not kill this process.
All 10 operations synced, thanks for waiting!
Explore the metadata in the Neptune app:
https://app.neptune.ai/ba-final/cwt-2/e/CWT2-111/metadata
https://app.neptune.ai/ba-final/cwt-2/e/CWT2-112
Split 4, loss train 0.09, score train 0.41, loss val 0.24 score val 0.11
Shutting down background jobs, please wait a moment...
Done!
Waiting for the remaining 9 operations to synchronize with Neptune. Do not kill this process.
All 9 operations synced, thanks for waiting!
Explore the metadata in the Neptune app:
https://app.neptune.ai/ba-final/cwt-2/e/CWT2-112/metadata
[32m[I 2023-09-03 09:09:13,139][0m Trial 23 finished with value: 0.5717910310055347 and parameters: {'b': 1.75, 'fc': 0.8, 'scale_min': 2.2, 'scale_max': 26, 'n_scales': 280, 'drop': 0.33860743327516396, 'optimizer': 'Adam', 'lr': 0.01331236352178168, 'weight_decay': 0.0001700211474553736, 'batch_size': 32, 'epochs': 100}. Best is trial 19 with value: 0.17862944704421022.[0m
trial 23, loss train mean 0.08, score train mean 0.41, loss val mean 0.57, score val mean 0.25



End Time   : So 3. Sep 09:09:14 CEST 2023
Duration   : 19362.316912006 seconds

Start Time : So 3. Sep 09:09:16 CEST 2023
Job ID: 1154390
Node: cc1g05
Partition: gpu_normal_stud
CPU cores: 16
Memory: 98304
GPUs: 0
Python environment: khoa                  *  /home/phamanh/anaconda3/envs/khoa
Current work directory: /home/phamanh/Schreibtisch/bachelorarbeit/ts_im_CNN

device: cuda


https://app.neptune.ai/ba-final/cwt-2/e/CWT2-113
Split 0, loss train 0.07, score train 0.45, loss val 0.11 score val 0.42
Shutting down background jobs, please wait a moment...
Done!
Waiting for the remaining 10 operations to synchronize with Neptune. Do not kill this process.
All 10 operations synced, thanks for waiting!
Explore the metadata in the Neptune app:
https://app.neptune.ai/ba-final/cwt-2/e/CWT2-113/metadata
https://app.neptune.ai/ba-final/cwt-2/e/CWT2-114
Split 1, loss train 0.09, score train 0.41, loss val 0.17 score val 0.31
Shutting down background jobs, please wait a moment...
Done!
Waiting for the remaining 10 operations to synchronize with Neptune. Do not kill this process.
All 10 operations synced, thanks for waiting!
Explore the metadata in the Neptune app:
https://app.neptune.ai/ba-final/cwt-2/e/CWT2-114/metadata
https://app.neptune.ai/ba-final/cwt-2/e/CWT2-115
Split 2, loss train 0.09, score train 0.40, loss val 0.15 score val 0.30
Shutting down background jobs, please wait a moment...
Done!
Waiting for the remaining 10 operations to synchronize with Neptune. Do not kill this process.
All 10 operations synced, thanks for waiting!
Explore the metadata in the Neptune app:
https://app.neptune.ai/ba-final/cwt-2/e/CWT2-115/metadata
https://app.neptune.ai/ba-final/cwt-2/e/CWT2-116
Split 3, loss train 0.08, score train 0.41, loss val 0.11 score val 0.41
Shutting down background jobs, please wait a moment...
Done!
Waiting for the remaining 14 operations to synchronize with Neptune. Do not kill this process.
All 14 operations synced, thanks for waiting!
Explore the metadata in the Neptune app:
https://app.neptune.ai/ba-final/cwt-2/e/CWT2-116/metadata
https://app.neptune.ai/ba-final/cwt-2/e/CWT2-117
Split 4, loss train 0.08, score train 0.42, loss val 0.27 score val 0.06
Shutting down background jobs, please wait a moment...
Done!
Waiting for the remaining 14 operations to synchronize with Neptune. Do not kill this process.
All 14 operations synced, thanks for waiting!
Explore the metadata in the Neptune app:
https://app.neptune.ai/ba-final/cwt-2/e/CWT2-117/metadata
[32m[I 2023-09-03 14:22:25,026][0m Trial 24 finished with value: 0.1622922268319637 and parameters: {'b': 3.9000000000000004, 'fc': 1.25, 'scale_min': 3.1, 'scale_max': 36, 'n_scales': 235, 'drop': 0.22345500866877993, 'optimizer': 'Adam', 'lr': 0.020295048770543216, 'weight_decay': 3.7769534306362464e-05, 'batch_size': 32, 'epochs': 100}. Best is trial 24 with value: 0.1622922268319637.[0m
trial 24, loss train mean 0.08, score train mean 0.42, loss val mean 0.16, score val mean 0.30



End Time   : So 3. Sep 14:22:26 CEST 2023
Duration   : 18790.166420711 seconds

Start Time : So 3. Sep 19:04:46 CEST 2023
Job ID: 1154391
Node: hades
Partition: gpu_normal_stud
CPU cores: 16
Memory: 98304
GPUs: 0
Python environment: khoa                  *  /home/phamanh/anaconda3/envs/khoa
Current work directory: /home/phamanh/Schreibtisch/bachelorarbeit/ts_im_CNN

/home/phamanh/anaconda3/envs/khoa/lib/python3.10/site-packages/torch/cuda/__init__.py:107: UserWarning: CUDA initialization: CUDA driver initialization failed, you might not have a CUDA gpu. (Triggered internally at /opt/conda/conda-bld/pytorch_1682343995026/work/c10/cuda/CUDAFunctions.cpp:109.)
  return torch._C._cuda_getDeviceCount() > 0
device: cpu


https://app.neptune.ai/ba-final/cwt-2/e/CWT2-118
Shutting down background jobs, please wait a moment...
Done!
Waiting for the remaining 3 operations to synchronize with Neptune. Do not kill this process.
All 3 operations synced, thanks for waiting!
Explore the metadata in the Neptune app:
https://app.neptune.ai/ba-final/cwt-2/e/CWT2-118/metadata
[32m[I 2023-09-04 04:16:30,384][0m Trial 25 pruned. [0m

End Time   : Mo 4. Sep 04:16:33 CEST 2023
Duration   : 33107.285937983 seconds

Start Time : Mo 4. Sep 04:16:36 CEST 2023
Job ID: 1154392
Node: cc1g05
Partition: gpu_normal_stud
CPU cores: 16
Memory: 98304
GPUs: 0
Python environment: khoa                  *  /home/phamanh/anaconda3/envs/khoa
Current work directory: /home/phamanh/Schreibtisch/bachelorarbeit/ts_im_CNN

device: cuda


https://app.neptune.ai/ba-final/cwt-2/e/CWT2-119
Shutting down background jobs, please wait a moment...
Done!
Waiting for the remaining 3 operations to synchronize with Neptune. Do not kill this process.
All 3 operations synced, thanks for waiting!
Explore the metadata in the Neptune app:
https://app.neptune.ai/ba-final/cwt-2/e/CWT2-119/metadata
[32m[I 2023-09-04 06:03:35,352][0m Trial 26 pruned. [0m

End Time   : Mo 4. Sep 06:03:37 CEST 2023
Duration   : 6421.479724395 seconds

Start Time : Mo 4. Sep 06:03:39 CEST 2023
Job ID: 1154393
Node: cc1g07
Partition: gpu_normal_stud
CPU cores: 16
Memory: 98304
GPUs: 0
Python environment: khoa                  *  /home/phamanh/anaconda3/envs/khoa
Current work directory: /home/phamanh/Schreibtisch/bachelorarbeit/ts_im_CNN

device: cuda


https://app.neptune.ai/ba-final/cwt-2/e/CWT2-120
Shutting down background jobs, please wait a moment...
Done!
Waiting for the remaining 7 operations to synchronize with Neptune. Do not kill this process.
All 7 operations synced, thanks for waiting!
Explore the metadata in the Neptune app:
https://app.neptune.ai/ba-final/cwt-2/e/CWT2-120/metadata
[32m[I 2023-09-04 08:30:08,428][0m Trial 27 pruned. [0m

End Time   : Mo 4. Sep 08:30:11 CEST 2023
Duration   : 8792.054704202 seconds

Start Time : Mo 4. Sep 08:30:12 CEST 2023
Job ID: 1154394
Node: cc1g03
Partition: gpu_normal_stud
CPU cores: 16
Memory: 98304
GPUs: 0
Python environment: khoa                  *  /home/phamanh/anaconda3/envs/khoa
Current work directory: /home/phamanh/Schreibtisch/bachelorarbeit/ts_im_CNN

device: cuda


https://app.neptune.ai/ba-final/cwt-2/e/CWT2-121
Shutting down background jobs, please wait a moment...
Done!
Waiting for the remaining 7 operations to synchronize with Neptune. Do not kill this process.
All 7 operations synced, thanks for waiting!
Explore the metadata in the Neptune app:
https://app.neptune.ai/ba-final/cwt-2/e/CWT2-121/metadata
[32m[I 2023-09-04 10:33:40,561][0m Trial 28 pruned. [0m

End Time   : Mo 4. Sep 10:33:43 CEST 2023
Duration   : 7410.699427036 seconds

Start Time : Mo 4. Sep 10:33:45 CEST 2023
Job ID: 1154395
Node: cc1g01
Partition: gpu_normal_stud
CPU cores: 16
Memory: 98304
GPUs: 0
Python environment: khoa                  *  /home/phamanh/anaconda3/envs/khoa
Current work directory: /home/phamanh/Schreibtisch/bachelorarbeit/ts_im_CNN

device: cuda


https://app.neptune.ai/ba-final/cwt-2/e/CWT2-122
Shutting down background jobs, please wait a moment...
Done!
Waiting for the remaining 3 operations to synchronize with Neptune. Do not kill this process.
All 3 operations synced, thanks for waiting!
Explore the metadata in the Neptune app:
https://app.neptune.ai/ba-final/cwt-2/e/CWT2-122/metadata
[32m[I 2023-09-04 12:27:40,117][0m Trial 29 pruned. [0m

End Time   : Mo 4. Sep 12:27:44 CEST 2023
Duration   : 6838.803622447 seconds

Start Time : Mo 4. Sep 14:27:52 CEST 2023
Job ID: 1155891
Node: cc1g06
Partition: gpu_normal_stud
CPU cores: 16
Memory: 98304
GPUs: 0
Python environment: khoa                  *  /home/phamanh/anaconda3/envs/khoa
Current work directory: /home/phamanh/Schreibtisch/bachelorarbeit/ts_im_CNN

device: cuda


https://app.neptune.ai/ba-final/cwt-2/e/CWT2-123
Split 0, loss train 0.08, score train 0.43, loss val 0.12 score val 0.35
Shutting down background jobs, please wait a moment...
Done!
Waiting for the remaining 14 operations to synchronize with Neptune. Do not kill this process.
All 14 operations synced, thanks for waiting!
Explore the metadata in the Neptune app:
https://app.neptune.ai/ba-final/cwt-2/e/CWT2-123/metadata
https://app.neptune.ai/ba-final/cwt-2/e/CWT2-124
Split 1, loss train 0.08, score train 0.43, loss val 0.09 score val 0.32
Shutting down background jobs, please wait a moment...
Done!
Waiting for the remaining 10 operations to synchronize with Neptune. Do not kill this process.
All 10 operations synced, thanks for waiting!
Explore the metadata in the Neptune app:
https://app.neptune.ai/ba-final/cwt-2/e/CWT2-124/metadata
https://app.neptune.ai/ba-final/cwt-2/e/CWT2-125
Split 2, loss train 0.08, score train 0.42, loss val 0.14 score val 0.38
Shutting down background jobs, please wait a moment...
Done!
Waiting for the remaining 14 operations to synchronize with Neptune. Do not kill this process.
All 14 operations synced, thanks for waiting!
Explore the metadata in the Neptune app:
https://app.neptune.ai/ba-final/cwt-2/e/CWT2-125/metadata
https://app.neptune.ai/ba-final/cwt-2/e/CWT2-126
Split 3, loss train 0.08, score train 0.43, loss val 0.25 score val 0.11
Shutting down background jobs, please wait a moment...
Done!
Waiting for the remaining 10 operations to synchronize with Neptune. Do not kill this process.
All 10 operations synced, thanks for waiting!
Explore the metadata in the Neptune app:
https://app.neptune.ai/ba-final/cwt-2/e/CWT2-126/metadata
https://app.neptune.ai/ba-final/cwt-2/e/CWT2-127
Split 4, loss train 0.08, score train 0.43, loss val 0.36 score val 0.06
Shutting down background jobs, please wait a moment...
Done!
Waiting for the remaining 10 operations to synchronize with Neptune. Do not kill this process.
All 10 operations synced, thanks for waiting!
Explore the metadata in the Neptune app:
https://app.neptune.ai/ba-final/cwt-2/e/CWT2-127/metadata
[32m[I 2023-09-04 18:44:03,338][0m Trial 30 finished with value: 0.19176906220456386 and parameters: {'b': 1.35, 'fc': 1.6500000000000001, 'scale_min': 1.0, 'scale_max': 38, 'n_scales': 120, 'drop': 0.43510050671356715, 'optimizer': 'Adam', 'lr': 0.005473721423801845, 'weight_decay': 0.0014560484610622883, 'batch_size': 32, 'epochs': 100}. Best is trial 24 with value: 0.1622922268319637.[0m
trial 30, loss train mean 0.08, score train mean 0.43, loss val mean 0.19, score val mean 0.24



End Time   : Mo 4. Sep 18:44:05 CEST 2023
Duration   : 15373.253018399 seconds

Start Time : Mo 4. Sep 18:44:29 CEST 2023
Job ID: 1155892
Node: cc1g06
Partition: gpu_normal_stud
CPU cores: 16
Memory: 98304
GPUs: 0
Python environment: khoa                  *  /home/phamanh/anaconda3/envs/khoa
Current work directory: /home/phamanh/Schreibtisch/bachelorarbeit/ts_im_CNN

device: cuda


https://app.neptune.ai/ba-final/cwt-2/e/CWT2-128
Shutting down background jobs, please wait a moment...
Done!
Waiting for the remaining 7 operations to synchronize with Neptune. Do not kill this process.
All 7 operations synced, thanks for waiting!
Explore the metadata in the Neptune app:
https://app.neptune.ai/ba-final/cwt-2/e/CWT2-128/metadata
[32m[I 2023-09-04 21:00:04,235][0m Trial 31 pruned. [0m

End Time   : Mo 4. Sep 21:00:08 CEST 2023
Duration   : 8138.936706107 seconds

Start Time : Mo 4. Sep 21:00:20 CEST 2023
Job ID: 1155893
Node: cc1g06
Partition: gpu_normal_stud
CPU cores: 16
Memory: 98304
GPUs: 0
Python environment: khoa                  *  /home/phamanh/anaconda3/envs/khoa
Current work directory: /home/phamanh/Schreibtisch/bachelorarbeit/ts_im_CNN

device: cuda


https://app.neptune.ai/ba-final/cwt-2/e/CWT2-129
Split 0, loss train 0.07, score train 0.44, loss val 0.14 score val 0.13
Shutting down background jobs, please wait a moment...
Done!
Waiting for the remaining 10 operations to synchronize with Neptune. Do not kill this process.
All 10 operations synced, thanks for waiting!
Explore the metadata in the Neptune app:
https://app.neptune.ai/ba-final/cwt-2/e/CWT2-129/metadata
https://app.neptune.ai/ba-final/cwt-2/e/CWT2-130
Split 1, loss train 0.07, score train 0.45, loss val 0.17 score val 0.13
Shutting down background jobs, please wait a moment...
Done!
Waiting for the remaining 14 operations to synchronize with Neptune. Do not kill this process.
All 14 operations synced, thanks for waiting!
Explore the metadata in the Neptune app:
https://app.neptune.ai/ba-final/cwt-2/e/CWT2-130/metadata
https://app.neptune.ai/ba-final/cwt-2/e/CWT2-131
Split 2, loss train 0.07, score train 0.46, loss val 0.05 score val 0.49
Shutting down background jobs, please wait a moment...
Done!
Waiting for the remaining 10 operations to synchronize with Neptune. Do not kill this process.
All 10 operations synced, thanks for waiting!
Explore the metadata in the Neptune app:
https://app.neptune.ai/ba-final/cwt-2/e/CWT2-131/metadata
https://app.neptune.ai/ba-final/cwt-2/e/CWT2-132
Split 3, loss train 0.07, score train 0.45, loss val 0.06 score val 0.39
Shutting down background jobs, please wait a moment...
Done!
Waiting for the remaining 10 operations to synchronize with Neptune. Do not kill this process.
All 10 operations synced, thanks for waiting!
Explore the metadata in the Neptune app:
https://app.neptune.ai/ba-final/cwt-2/e/CWT2-132/metadata
https://app.neptune.ai/ba-final/cwt-2/e/CWT2-133
Split 4, loss train 0.07, score train 0.46, loss val 0.17 score val 0.24
Shutting down background jobs, please wait a moment...
Done!
Waiting for the remaining 10 operations to synchronize with Neptune. Do not kill this process.
All 10 operations synced, thanks for waiting!
Explore the metadata in the Neptune app:
https://app.neptune.ai/ba-final/cwt-2/e/CWT2-133/metadata
