[32m[I 2023-09-12 14:42:46,472][0m Trial 73 finished with value: 0.026218952523901107 and parameters: {'b': 2.95, 'fc': 2.35, 'scale_min': 1.4, 'scale_max': 42, 'n_scales': 100, 'drop': 0.20468662891048192, 'optimizer': 'Adam', 'lr': 0.0005038625364343089, 'weight_decay': 0.0001353458420250909, 'batch_size': 32, 'epochs': 100}. Best is trial 71 with value: 0.022815226493997778.[0m
trial 73, loss train mean 0.03, score train mean 0.64, loss val mean 0.03, score val mean 0.64



End Time   : Di 12. Sep 14:42:48 CEST 2023
Duration   : 15183.671998849 seconds

Start Time : Di 12. Sep 14:43:19 CEST 2023
Job ID: 1163015
Node: hades
Partition: gpu_normal_stud
CPU cores: 16
Memory: 98304
GPUs: 0
Python environment: khoa                  *  /home/phamanh/anaconda3/envs/khoa
Current work directory: /home/phamanh/Schreibtisch/bachelorarbeit/ts_im_CNN

device: cuda


https://app.neptune.ai/ba-final/cwt-2/e/CWT2-307
Split 0, loss train 0.03, score train 0.63, loss val 0.02 score val 0.72
Shutting down background jobs, please wait a moment...
Done!
Waiting for the remaining 14 operations to synchronize with Neptune. Do not kill this process.
All 14 operations synced, thanks for waiting!
Explore the metadata in the Neptune app:
https://app.neptune.ai/ba-final/cwt-2/e/CWT2-307/metadata
https://app.neptune.ai/ba-final/cwt-2/e/CWT2-308
Split 1, loss train 0.02, score train 0.66, loss val 0.03 score val 0.72
Shutting down background jobs, please wait a moment...
Done!
Waiting for the remaining 10 operations to synchronize with Neptune. Do not kill this process.
All 10 operations synced, thanks for waiting!
Explore the metadata in the Neptune app:
https://app.neptune.ai/ba-final/cwt-2/e/CWT2-308/metadata
https://app.neptune.ai/ba-final/cwt-2/e/CWT2-309
Split 2, loss train 0.02, score train 0.64, loss val 0.04 score val 0.66
Shutting down background jobs, please wait a moment...
Done!
Waiting for the remaining 10 operations to synchronize with Neptune. Do not kill this process.
All 10 operations synced, thanks for waiting!
Explore the metadata in the Neptune app:
https://app.neptune.ai/ba-final/cwt-2/e/CWT2-309/metadata
https://app.neptune.ai/ba-final/cwt-2/e/CWT2-310
Split 3, loss train 0.02, score train 0.68, loss val 0.02 score val 0.67
Shutting down background jobs, please wait a moment...
Done!
Waiting for the remaining 14 operations to synchronize with Neptune. Do not kill this process.
All 14 operations synced, thanks for waiting!
Explore the metadata in the Neptune app:
https://app.neptune.ai/ba-final/cwt-2/e/CWT2-310/metadata
https://app.neptune.ai/ba-final/cwt-2/e/CWT2-311
Split 4, loss train 0.03, score train 0.62, loss val 0.03 score val 0.53
Shutting down background jobs, please wait a moment...
Done!
Waiting for the remaining 10 operations to synchronize with Neptune. Do not kill this process.
All 10 operations synced, thanks for waiting!
Explore the metadata in the Neptune app:
https://app.neptune.ai/ba-final/cwt-2/e/CWT2-311/metadata
[32m[I 2023-09-12 19:05:07,162][0m Trial 74 finished with value: 0.02919169461473506 and parameters: {'b': 2.8500000000000005, 'fc': 2.35, 'scale_min': 1.4, 'scale_max': 42, 'n_scales': 100, 'drop': 0.2067554158388875, 'optimizer': 'Adam', 'lr': 0.0005038799061631325, 'weight_decay': 0.00015157704029062128, 'batch_size': 32, 'epochs': 100}. Best is trial 71 with value: 0.022815226493997778.[0m
trial 74, loss train mean 0.03, score train mean 0.65, loss val mean 0.03, score val mean 0.66



End Time   : Di 12. Sep 19:05:08 CEST 2023
Duration   : 15708.991695561 seconds

Start Time : Di 12. Sep 19:05:22 CEST 2023
Job ID: 1163016
Node: cc1g04
Partition: gpu_normal_stud
CPU cores: 16
Memory: 98304
GPUs: 0
Python environment: khoa                  *  /home/phamanh/anaconda3/envs/khoa
Current work directory: /home/phamanh/Schreibtisch/bachelorarbeit/ts_im_CNN

device: cuda


https://app.neptune.ai/ba-final/cwt-2/e/CWT2-312
Split 0, loss train 0.03, score train 0.64, loss val 0.02 score val 0.75
Shutting down background jobs, please wait a moment...
Done!
Waiting for the remaining 10 operations to synchronize with Neptune. Do not kill this process.
All 10 operations synced, thanks for waiting!
Explore the metadata in the Neptune app:
https://app.neptune.ai/ba-final/cwt-2/e/CWT2-312/metadata
https://app.neptune.ai/ba-final/cwt-2/e/CWT2-313
Split 1, loss train 0.02, score train 0.65, loss val 0.02 score val 0.67
Shutting down background jobs, please wait a moment...
Done!
Waiting for the remaining 10 operations to synchronize with Neptune. Do not kill this process.
All 10 operations synced, thanks for waiting!
Explore the metadata in the Neptune app:
https://app.neptune.ai/ba-final/cwt-2/e/CWT2-313/metadata
https://app.neptune.ai/ba-final/cwt-2/e/CWT2-314
Split 2, loss train 0.02, score train 0.65, loss val 0.03 score val 0.61
Shutting down background jobs, please wait a moment...
Done!
Waiting for the remaining 10 operations to synchronize with Neptune. Do not kill this process.
All 10 operations synced, thanks for waiting!
Explore the metadata in the Neptune app:
https://app.neptune.ai/ba-final/cwt-2/e/CWT2-314/metadata
https://app.neptune.ai/ba-final/cwt-2/e/CWT2-315
Split 3, loss train 0.02, score train 0.65, loss val 0.03 score val 0.64
Shutting down background jobs, please wait a moment...
Done!
Waiting for the remaining 10 operations to synchronize with Neptune. Do not kill this process.
All 10 operations synced, thanks for waiting!
Explore the metadata in the Neptune app:
https://app.neptune.ai/ba-final/cwt-2/e/CWT2-315/metadata
https://app.neptune.ai/ba-final/cwt-2/e/CWT2-316
Split 4, loss train 0.03, score train 0.62, loss val 0.04 score val 0.36
Shutting down background jobs, please wait a moment...
Done!
Waiting for the remaining 10 operations to synchronize with Neptune. Do not kill this process.
All 10 operations synced, thanks for waiting!
Explore the metadata in the Neptune app:
https://app.neptune.ai/ba-final/cwt-2/e/CWT2-316/metadata
[32m[I 2023-09-12 23:12:39,503][0m Trial 75 finished with value: 0.02965962734628231 and parameters: {'b': 3.0, 'fc': 2.35, 'scale_min': 1.7000000000000002, 'scale_max': 40, 'n_scales': 100, 'drop': 0.20469881239813295, 'optimizer': 'Adam', 'lr': 0.0005038843264119685, 'weight_decay': 0.00014008168118712539, 'batch_size': 32, 'epochs': 100}. Best is trial 71 with value: 0.022815226493997778.[0m
trial 75, loss train mean 0.03, score train mean 0.64, loss val mean 0.03, score val mean 0.61



End Time   : Di 12. Sep 23:12:41 CEST 2023
Duration   : 14839.163147531 seconds

Start Time : Di 12. Sep 23:12:56 CEST 2023
Job ID: 1163017
Node: cc1g04
Partition: gpu_normal_stud
CPU cores: 16
Memory: 98304
GPUs: 0
Python environment: khoa                  *  /home/phamanh/anaconda3/envs/khoa
Current work directory: /home/phamanh/Schreibtisch/bachelorarbeit/ts_im_CNN

device: cuda


https://app.neptune.ai/ba-final/cwt-2/e/CWT2-317
Split 0, loss train 0.03, score train 0.65, loss val 0.02 score val 0.72
Shutting down background jobs, please wait a moment...
Done!
Waiting for the remaining 14 operations to synchronize with Neptune. Do not kill this process.
All 14 operations synced, thanks for waiting!
Explore the metadata in the Neptune app:
https://app.neptune.ai/ba-final/cwt-2/e/CWT2-317/metadata
https://app.neptune.ai/ba-final/cwt-2/e/CWT2-318
Split 1, loss train 0.03, score train 0.63, loss val 0.03 score val 0.56
Shutting down background jobs, please wait a moment...
Done!
Waiting for the remaining 10 operations to synchronize with Neptune. Do not kill this process.
All 10 operations synced, thanks for waiting!
Explore the metadata in the Neptune app:
https://app.neptune.ai/ba-final/cwt-2/e/CWT2-318/metadata
https://app.neptune.ai/ba-final/cwt-2/e/CWT2-319
Split 2, loss train 0.03, score train 0.61, loss val 0.02 score val 0.66
Shutting down background jobs, please wait a moment...
Done!
Waiting for the remaining 10 operations to synchronize with Neptune. Do not kill this process.
All 10 operations synced, thanks for waiting!
Explore the metadata in the Neptune app:
https://app.neptune.ai/ba-final/cwt-2/e/CWT2-319/metadata
https://app.neptune.ai/ba-final/cwt-2/e/CWT2-320
Split 3, loss train 0.02, score train 0.65, loss val 0.03 score val 0.63
Shutting down background jobs, please wait a moment...
Done!
Waiting for the remaining 10 operations to synchronize with Neptune. Do not kill this process.
All 10 operations synced, thanks for waiting!
Explore the metadata in the Neptune app:
https://app.neptune.ai/ba-final/cwt-2/e/CWT2-320/metadata
https://app.neptune.ai/ba-final/cwt-2/e/CWT2-321
Split 4, loss train 0.02, score train 0.64, loss val 0.02 score val 0.55
Shutting down background jobs, please wait a moment...
Done!
Waiting for the remaining 10 operations to synchronize with Neptune. Do not kill this process.
All 10 operations synced, thanks for waiting!
Explore the metadata in the Neptune app:
https://app.neptune.ai/ba-final/cwt-2/e/CWT2-321/metadata
[32m[I 2023-09-13 03:19:55,419][0m Trial 76 finished with value: 0.024992367815464104 and parameters: {'b': 2.9000000000000004, 'fc': 2.35, 'scale_min': 1.7000000000000002, 'scale_max': 40, 'n_scales': 100, 'drop': 0.20487445931310486, 'optimizer': 'Adam', 'lr': 0.0007013566410894401, 'weight_decay': 0.00012767222578195244, 'batch_size': 32, 'epochs': 100}. Best is trial 71 with value: 0.022815226493997778.[0m
trial 76, loss train mean 0.03, score train mean 0.64, loss val mean 0.02, score val mean 0.62



End Time   : Mi 13. Sep 03:19:56 CEST 2023
Duration   : 14820.446407649 seconds

Start Time : Mi 13. Sep 03:19:58 CEST 2023
Job ID: 1163018
Node: cc1g03
Partition: gpu_normal_stud
CPU cores: 16
Memory: 98304
GPUs: 0
Python environment: khoa                  *  /home/phamanh/anaconda3/envs/khoa
Current work directory: /home/phamanh/Schreibtisch/bachelorarbeit/ts_im_CNN

device: cuda


https://app.neptune.ai/ba-final/cwt-2/e/CWT2-322
Split 0, loss train 0.03, score train 0.62, loss val 0.02 score val 0.74
Shutting down background jobs, please wait a moment...
Done!
Waiting for the remaining 10 operations to synchronize with Neptune. Do not kill this process.
All 10 operations synced, thanks for waiting!
Explore the metadata in the Neptune app:
https://app.neptune.ai/ba-final/cwt-2/e/CWT2-322/metadata
https://app.neptune.ai/ba-final/cwt-2/e/CWT2-323
Split 1, loss train 0.03, score train 0.64, loss val 0.03 score val 0.61
Shutting down background jobs, please wait a moment...
Done!
Waiting for the remaining 14 operations to synchronize with Neptune. Do not kill this process.
All 14 operations synced, thanks for waiting!
Explore the metadata in the Neptune app:
https://app.neptune.ai/ba-final/cwt-2/e/CWT2-323/metadata
https://app.neptune.ai/ba-final/cwt-2/e/CWT2-324
Split 2, loss train 0.03, score train 0.64, loss val 0.04 score val 0.49
Shutting down background jobs, please wait a moment...
Done!
Waiting for the remaining 14 operations to synchronize with Neptune. Do not kill this process.
All 14 operations synced, thanks for waiting!
Explore the metadata in the Neptune app:
https://app.neptune.ai/ba-final/cwt-2/e/CWT2-324/metadata
https://app.neptune.ai/ba-final/cwt-2/e/CWT2-325
Split 3, loss train 0.03, score train 0.64, loss val 0.02 score val 0.69
Shutting down background jobs, please wait a moment...
Done!
Waiting for the remaining 10 operations to synchronize with Neptune. Do not kill this process.
All 10 operations synced, thanks for waiting!
Explore the metadata in the Neptune app:
https://app.neptune.ai/ba-final/cwt-2/e/CWT2-325/metadata
https://app.neptune.ai/ba-final/cwt-2/e/CWT2-326
Split 4, loss train 0.03, score train 0.64, loss val 0.02 score val 0.70
Shutting down background jobs, please wait a moment...
Done!
Waiting for the remaining 10 operations to synchronize with Neptune. Do not kill this process.
All 10 operations synced, thanks for waiting!
Explore the metadata in the Neptune app:
https://app.neptune.ai/ba-final/cwt-2/e/CWT2-326/metadata
[32m[I 2023-09-13 07:28:38,711][0m Trial 77 finished with value: 0.026982096661912636 and parameters: {'b': 2.95, 'fc': 2.35, 'scale_min': 1.7000000000000002, 'scale_max': 42, 'n_scales': 100, 'drop': 0.20283913109368976, 'optimizer': 'Adam', 'lr': 0.0005038572211468677, 'weight_decay': 0.00014494109640124153, 'batch_size': 32, 'epochs': 100}. Best is trial 71 with value: 0.022815226493997778.[0m
trial 77, loss train mean 0.03, score train mean 0.64, loss val mean 0.03, score val mean 0.65



End Time   : Mi 13. Sep 07:28:41 CEST 2023
Duration   : 14922.742976403 seconds

Start Time : Mi 13. Sep 07:28:42 CEST 2023
Job ID: 1163019
Node: cc1g01
Partition: gpu_normal_stud
CPU cores: 16
Memory: 98304
GPUs: 0
Python environment: khoa                  *  /home/phamanh/anaconda3/envs/khoa
Current work directory: /home/phamanh/Schreibtisch/bachelorarbeit/ts_im_CNN

device: cuda


https://app.neptune.ai/ba-final/cwt-2/e/CWT2-327
Split 0, loss train 0.03, score train 0.64, loss val 0.02 score val 0.71
Shutting down background jobs, please wait a moment...
Done!
Waiting for the remaining 14 operations to synchronize with Neptune. Do not kill this process.
All 14 operations synced, thanks for waiting!
Explore the metadata in the Neptune app:
https://app.neptune.ai/ba-final/cwt-2/e/CWT2-327/metadata
https://app.neptune.ai/ba-final/cwt-2/e/CWT2-328
Split 1, loss train 0.02, score train 0.65, loss val 0.03 score val 0.64
Shutting down background jobs, please wait a moment...
Done!
Waiting for the remaining 10 operations to synchronize with Neptune. Do not kill this process.
All 10 operations synced, thanks for waiting!
Explore the metadata in the Neptune app:
https://app.neptune.ai/ba-final/cwt-2/e/CWT2-328/metadata
https://app.neptune.ai/ba-final/cwt-2/e/CWT2-329
Split 2, loss train 0.03, score train 0.63, loss val 0.03 score val 0.61
Shutting down background jobs, please wait a moment...
Done!
Waiting for the remaining 10 operations to synchronize with Neptune. Do not kill this process.
All 10 operations synced, thanks for waiting!
Explore the metadata in the Neptune app:
https://app.neptune.ai/ba-final/cwt-2/e/CWT2-329/metadata
https://app.neptune.ai/ba-final/cwt-2/e/CWT2-330
Split 3, loss train 0.02, score train 0.65, loss val 0.03 score val 0.65
Shutting down background jobs, please wait a moment...
Done!
Waiting for the remaining 10 operations to synchronize with Neptune. Do not kill this process.
All 10 operations synced, thanks for waiting!
Explore the metadata in the Neptune app:
https://app.neptune.ai/ba-final/cwt-2/e/CWT2-330/metadata
https://app.neptune.ai/ba-final/cwt-2/e/CWT2-331
Split 4, loss train 0.02, score train 0.65, loss val 0.02 score val 0.68
Shutting down background jobs, please wait a moment...
Done!
Waiting for the remaining 10 operations to synchronize with Neptune. Do not kill this process.
All 10 operations synced, thanks for waiting!
Explore the metadata in the Neptune app:
https://app.neptune.ai/ba-final/cwt-2/e/CWT2-331/metadata
[32m[I 2023-09-13 11:35:46,833][0m Trial 78 finished with value: 0.025568318367004395 and parameters: {'b': 3.3, 'fc': 2.4000000000000004, 'scale_min': 1.7000000000000002, 'scale_max': 40, 'n_scales': 100, 'drop': 0.20488664033408963, 'optimizer': 'Adam', 'lr': 0.0005038572662834657, 'weight_decay': 0.00010197124289947598, 'batch_size': 32, 'epochs': 100}. Best is trial 71 with value: 0.022815226493997778.[0m
trial 78, loss train mean 0.03, score train mean 0.65, loss val mean 0.03, score val mean 0.66



End Time   : Mi 13. Sep 11:35:48 CEST 2023
Duration   : 14826.373846049 seconds

Start Time : Mi 13. Sep 11:35:50 CEST 2023
Job ID: 1163020
Node: cc1g06
Partition: gpu_normal_stud
CPU cores: 16
Memory: 98304
GPUs: 0
Python environment: khoa                  *  /home/phamanh/anaconda3/envs/khoa
Current work directory: /home/phamanh/Schreibtisch/bachelorarbeit/ts_im_CNN

device: cuda


https://app.neptune.ai/ba-final/cwt-2/e/CWT2-332
Split 0, loss train 0.03, score train 0.63, loss val 0.02 score val 0.72
Shutting down background jobs, please wait a moment...
Done!
Waiting for the remaining 14 operations to synchronize with Neptune. Do not kill this process.
All 14 operations synced, thanks for waiting!
Explore the metadata in the Neptune app:
https://app.neptune.ai/ba-final/cwt-2/e/CWT2-332/metadata
https://app.neptune.ai/ba-final/cwt-2/e/CWT2-333
Split 1, loss train 0.02, score train 0.67, loss val 0.03 score val 0.51
Shutting down background jobs, please wait a moment...
Done!
Waiting for the remaining 10 operations to synchronize with Neptune. Do not kill this process.
All 10 operations synced, thanks for waiting!
Explore the metadata in the Neptune app:
https://app.neptune.ai/ba-final/cwt-2/e/CWT2-333/metadata
https://app.neptune.ai/ba-final/cwt-2/e/CWT2-334
Split 2, loss train 0.02, score train 0.65, loss val 0.03 score val 0.65
Shutting down background jobs, please wait a moment...
Done!
Waiting for the remaining 14 operations to synchronize with Neptune. Do not kill this process.
All 14 operations synced, thanks for waiting!
Explore the metadata in the Neptune app:
https://app.neptune.ai/ba-final/cwt-2/e/CWT2-334/metadata
https://app.neptune.ai/ba-final/cwt-2/e/CWT2-335
Split 3, loss train 0.02, score train 0.66, loss val 0.03 score val 0.65
Shutting down background jobs, please wait a moment...
Done!
Waiting for the remaining 14 operations to synchronize with Neptune. Do not kill this process.
All 14 operations synced, thanks for waiting!
Explore the metadata in the Neptune app:
https://app.neptune.ai/ba-final/cwt-2/e/CWT2-335/metadata
https://app.neptune.ai/ba-final/cwt-2/e/CWT2-336
Split 4, loss train 0.03, score train 0.60, loss val 0.02 score val 0.69
Shutting down background jobs, please wait a moment...
Done!
Waiting for the remaining 14 operations to synchronize with Neptune. Do not kill this process.
All 14 operations synced, thanks for waiting!
Explore the metadata in the Neptune app:
https://app.neptune.ai/ba-final/cwt-2/e/CWT2-336/metadata
[32m[I 2023-09-13 15:59:25,455][0m Trial 79 finished with value: 0.026636189602790995 and parameters: {'b': 3.3500000000000005, 'fc': 2.4000000000000004, 'scale_min': 2.3, 'scale_max': 40, 'n_scales': 100, 'drop': 0.19150447513615507, 'optimizer': 'Adam', 'lr': 0.0005812659459393298, 'weight_decay': 0.00010095456437505852, 'batch_size': 32, 'epochs': 100}. Best is trial 71 with value: 0.022815226493997778.[0m
trial 79, loss train mean 0.03, score train mean 0.64, loss val mean 0.03, score val mean 0.65



End Time   : Mi 13. Sep 15:59:27 CEST 2023
Duration   : 15817.424569013 seconds

Start Time : Mi 13. Sep 16:51:32 CEST 2023
Job ID: 1164816
Node: cc1g07
Partition: gpu_normal_stud
CPU cores: 16
Memory: 98304
GPUs: 0
Python environment: khoa                  *  /home/phamanh/anaconda3/envs/khoa
Current work directory: /home/phamanh/Schreibtisch/bachelorarbeit/ts_im_CNN

device: cuda


https://app.neptune.ai/ba-final/cwt-2/e/CWT2-337
Split 0, loss train 0.02, score train 0.65, loss val 0.03 score val 0.70
Shutting down background jobs, please wait a moment...
Done!
Waiting for the remaining 10 operations to synchronize with Neptune. Do not kill this process.
All 10 operations synced, thanks for waiting!
Explore the metadata in the Neptune app:
https://app.neptune.ai/ba-final/cwt-2/e/CWT2-337/metadata
https://app.neptune.ai/ba-final/cwt-2/e/CWT2-338
Split 1, loss train 0.02, score train 0.67, loss val 0.04 score val 0.60
Shutting down background jobs, please wait a moment...
Done!
Waiting for the remaining 14 operations to synchronize with Neptune. Do not kill this process.
All 14 operations synced, thanks for waiting!
Explore the metadata in the Neptune app:
https://app.neptune.ai/ba-final/cwt-2/e/CWT2-338/metadata
https://app.neptune.ai/ba-final/cwt-2/e/CWT2-339
Split 2, loss train 0.02, score train 0.67, loss val 0.04 score val 0.57
Shutting down background jobs, please wait a moment...
Done!
Waiting for the remaining 10 operations to synchronize with Neptune. Do not kill this process.
All 10 operations synced, thanks for waiting!
Explore the metadata in the Neptune app:
https://app.neptune.ai/ba-final/cwt-2/e/CWT2-339/metadata
https://app.neptune.ai/ba-final/cwt-2/e/CWT2-340
Split 3, loss train 0.03, score train 0.62, loss val 0.03 score val 0.71
Shutting down background jobs, please wait a moment...
Done!
Waiting for the remaining 14 operations to synchronize with Neptune. Do not kill this process.
All 14 operations synced, thanks for waiting!
Explore the metadata in the Neptune app:
https://app.neptune.ai/ba-final/cwt-2/e/CWT2-340/metadata
https://app.neptune.ai/ba-final/cwt-2/e/CWT2-341
Split 4, loss train 0.02, score train 0.66, loss val 0.02 score val 0.60
Shutting down background jobs, please wait a moment...
Done!
Waiting for the remaining 10 operations to synchronize with Neptune. Do not kill this process.
All 10 operations synced, thanks for waiting!
Explore the metadata in the Neptune app:
https://app.neptune.ai/ba-final/cwt-2/e/CWT2-341/metadata
