[32m[I 2023-09-16 10:06:44,306][0m Trial 95 finished with value: 0.02928381321278024 and parameters: {'b': 3.1000000000000005, 'fc': 2.45, 'scale_min': 2.1, 'scale_max': 38, 'n_scales': 115, 'drop': 0.18507805334135252, 'optimizer': 'Adam', 'lr': 0.0006409467691284983, 'weight_decay': 0.00018851449392102109, 'batch_size': 32, 'epochs': 100}. Best is trial 71 with value: 0.022815226493997778.[0m
trial 95, loss train mean 0.03, score train mean 0.63, loss val mean 0.03, score val mean 0.61



End Time   : Sa 16. Sep 10:06:46 CEST 2023
Duration   : 15102.461267144 seconds

Start Time : Sa 16. Sep 10:06:47 CEST 2023
Job ID: 1166373
Node: cc1g07
Partition: gpu_normal_stud
CPU cores: 16
Memory: 98304
GPUs: 0
Python environment: khoa                  *  /home/phamanh/anaconda3/envs/khoa
Current work directory: /home/phamanh/Schreibtisch/bachelorarbeit/ts_im_CNN

device: cuda


https://app.neptune.ai/ba-final/cwt-2/e/CWT2-413
Split 0, loss train 0.02, score train 0.66, loss val 0.02 score val 0.65
Shutting down background jobs, please wait a moment...
Done!
Waiting for the remaining 10 operations to synchronize with Neptune. Do not kill this process.
All 10 operations synced, thanks for waiting!
Explore the metadata in the Neptune app:
https://app.neptune.ai/ba-final/cwt-2/e/CWT2-413/metadata
https://app.neptune.ai/ba-final/cwt-2/e/CWT2-414
Split 1, loss train 0.02, score train 0.67, loss val 0.03 score val 0.65
Shutting down background jobs, please wait a moment...
Done!
Waiting for the remaining 9 operations to synchronize with Neptune. Do not kill this process.
All 9 operations synced, thanks for waiting!
Explore the metadata in the Neptune app:
https://app.neptune.ai/ba-final/cwt-2/e/CWT2-414/metadata
https://app.neptune.ai/ba-final/cwt-2/e/CWT2-415
Split 2, loss train 0.02, score train 0.65, loss val 0.03 score val 0.60
Shutting down background jobs, please wait a moment...
Done!
Waiting for the remaining 10 operations to synchronize with Neptune. Do not kill this process.
All 10 operations synced, thanks for waiting!
Explore the metadata in the Neptune app:
https://app.neptune.ai/ba-final/cwt-2/e/CWT2-415/metadata
https://app.neptune.ai/ba-final/cwt-2/e/CWT2-416
Split 3, loss train 0.02, score train 0.65, loss val 0.03 score val 0.64
Shutting down background jobs, please wait a moment...
Done!
Waiting for the remaining 10 operations to synchronize with Neptune. Do not kill this process.
All 10 operations synced, thanks for waiting!
Explore the metadata in the Neptune app:
https://app.neptune.ai/ba-final/cwt-2/e/CWT2-416/metadata
https://app.neptune.ai/ba-final/cwt-2/e/CWT2-417
Split 4, loss train 0.02, score train 0.67, loss val 0.02 score val 0.62
Shutting down background jobs, please wait a moment...
Done!
Waiting for the remaining 10 operations to synchronize with Neptune. Do not kill this process.
All 10 operations synced, thanks for waiting!
Explore the metadata in the Neptune app:
https://app.neptune.ai/ba-final/cwt-2/e/CWT2-417/metadata
[32m[I 2023-09-16 14:19:01,303][0m Trial 96 finished with value: 0.025644748261634338 and parameters: {'b': 3.55, 'fc': 2.3, 'scale_min': 1.6, 'scale_max': 40, 'n_scales': 110, 'drop': 0.2181569034728947, 'optimizer': 'Adam', 'lr': 0.0007358376579052057, 'weight_decay': 5.156218272582491e-05, 'batch_size': 32, 'epochs': 100}. Best is trial 71 with value: 0.022815226493997778.[0m
trial 96, loss train mean 0.02, score train mean 0.66, loss val mean 0.03, score val mean 0.63



End Time   : Sa 16. Sep 14:19:03 CEST 2023
Duration   : 15135.925240970 seconds

Start Time : Sa 16. Sep 14:19:04 CEST 2023
Job ID: 1166374
Node: erebos
Partition: gpu_normal_stud
CPU cores: 16
Memory: 98304
GPUs: 0
Python environment: khoa                  *  /home/phamanh/anaconda3/envs/khoa
Current work directory: /home/phamanh/Schreibtisch/bachelorarbeit/ts_im_CNN

device: cuda


https://app.neptune.ai/ba-final/cwt-2/e/CWT2-418
Split 0, loss train 0.02, score train 0.65, loss val 0.03 score val 0.53
Shutting down background jobs, please wait a moment...
Done!
Waiting for the remaining 10 operations to synchronize with Neptune. Do not kill this process.
All 10 operations synced, thanks for waiting!
Explore the metadata in the Neptune app:
https://app.neptune.ai/ba-final/cwt-2/e/CWT2-418/metadata
https://app.neptune.ai/ba-final/cwt-2/e/CWT2-419
Split 1, loss train 0.02, score train 0.67, loss val 0.03 score val 0.58
Shutting down background jobs, please wait a moment...
Done!
Waiting for the remaining 14 operations to synchronize with Neptune. Do not kill this process.
All 14 operations synced, thanks for waiting!
Explore the metadata in the Neptune app:
https://app.neptune.ai/ba-final/cwt-2/e/CWT2-419/metadata
https://app.neptune.ai/ba-final/cwt-2/e/CWT2-420
Split 2, loss train 0.02, score train 0.67, loss val 0.04 score val 0.68
Shutting down background jobs, please wait a moment...
Done!
Waiting for the remaining 10 operations to synchronize with Neptune. Do not kill this process.
All 10 operations synced, thanks for waiting!
Explore the metadata in the Neptune app:
https://app.neptune.ai/ba-final/cwt-2/e/CWT2-420/metadata
https://app.neptune.ai/ba-final/cwt-2/e/CWT2-421
Split 3, loss train 0.03, score train 0.64, loss val 0.02 score val 0.70
Shutting down background jobs, please wait a moment...
Done!
Waiting for the remaining 10 operations to synchronize with Neptune. Do not kill this process.
All 10 operations synced, thanks for waiting!
Explore the metadata in the Neptune app:
https://app.neptune.ai/ba-final/cwt-2/e/CWT2-421/metadata
https://app.neptune.ai/ba-final/cwt-2/e/CWT2-422
Split 4, loss train 0.02, score train 0.66, loss val 0.03 score val 0.65
Shutting down background jobs, please wait a moment...
Done!
Waiting for the remaining 10 operations to synchronize with Neptune. Do not kill this process.
All 10 operations synced, thanks for waiting!
Explore the metadata in the Neptune app:
https://app.neptune.ai/ba-final/cwt-2/e/CWT2-422/metadata
[32m[I 2023-09-16 17:34:52,568][0m Trial 97 finished with value: 0.028860095967637733 and parameters: {'b': 3.5, 'fc': 2.2, 'scale_min': 1.5, 'scale_max': 34, 'n_scales': 110, 'drop': 0.21464700010925877, 'optimizer': 'Adam', 'lr': 0.0007358376849183389, 'weight_decay': 5.3473959671919535e-05, 'batch_size': 32, 'epochs': 100}. Best is trial 71 with value: 0.022815226493997778.[0m
trial 97, loss train mean 0.02, score train mean 0.66, loss val mean 0.03, score val mean 0.63



End Time   : Sa 16. Sep 17:34:54 CEST 2023
Duration   : 11749.662720470 seconds

Start Time : Sa 16. Sep 17:34:56 CEST 2023
Job ID: 1166375
Node: cc1g06
Partition: gpu_normal_stud
CPU cores: 16
Memory: 98304
GPUs: 0
Python environment: khoa                  *  /home/phamanh/anaconda3/envs/khoa
Current work directory: /home/phamanh/Schreibtisch/bachelorarbeit/ts_im_CNN

device: cuda


https://app.neptune.ai/ba-final/cwt-2/e/CWT2-423
Shutting down background jobs, please wait a moment...
Done!
Waiting for the remaining 3 operations to synchronize with Neptune. Do not kill this process.
All 3 operations synced, thanks for waiting!
Explore the metadata in the Neptune app:
https://app.neptune.ai/ba-final/cwt-2/e/CWT2-423/metadata
[32m[I 2023-09-16 18:48:05,918][0m Trial 98 pruned. [0m

End Time   : Sa 16. Sep 18:48:08 CEST 2023
Duration   : 4391.961054461 seconds

Start Time : Sa 16. Sep 18:48:09 CEST 2023
Job ID: 1166376
Node: cc1g06
Partition: gpu_normal_stud
CPU cores: 16
Memory: 98304
GPUs: 0
Python environment: khoa                  *  /home/phamanh/anaconda3/envs/khoa
Current work directory: /home/phamanh/Schreibtisch/bachelorarbeit/ts_im_CNN

device: cuda


https://app.neptune.ai/ba-final/cwt-2/e/CWT2-424
Split 0, loss train 0.03, score train 0.63, loss val 0.02 score val 0.68
Shutting down background jobs, please wait a moment...
Done!
Waiting for the remaining 10 operations to synchronize with Neptune. Do not kill this process.
All 10 operations synced, thanks for waiting!
Explore the metadata in the Neptune app:
https://app.neptune.ai/ba-final/cwt-2/e/CWT2-424/metadata
https://app.neptune.ai/ba-final/cwt-2/e/CWT2-425
Split 1, loss train 0.02, score train 0.67, loss val 0.03 score val 0.73
Shutting down background jobs, please wait a moment...
Done!
Waiting for the remaining 10 operations to synchronize with Neptune. Do not kill this process.
All 10 operations synced, thanks for waiting!
Explore the metadata in the Neptune app:
https://app.neptune.ai/ba-final/cwt-2/e/CWT2-425/metadata
https://app.neptune.ai/ba-final/cwt-2/e/CWT2-426
Split 2, loss train 0.03, score train 0.64, loss val 0.04 score val 0.65
Shutting down background jobs, please wait a moment...
Done!
Waiting for the remaining 9 operations to synchronize with Neptune. Do not kill this process.
All 9 operations synced, thanks for waiting!
Explore the metadata in the Neptune app:
https://app.neptune.ai/ba-final/cwt-2/e/CWT2-426/metadata
https://app.neptune.ai/ba-final/cwt-2/e/CWT2-427
Split 3, loss train 0.03, score train 0.64, loss val 0.02 score val 0.63
Shutting down background jobs, please wait a moment...
Done!
Waiting for the remaining 10 operations to synchronize with Neptune. Do not kill this process.
All 10 operations synced, thanks for waiting!
Explore the metadata in the Neptune app:
https://app.neptune.ai/ba-final/cwt-2/e/CWT2-427/metadata
https://app.neptune.ai/ba-final/cwt-2/e/CWT2-428
Split 4, loss train 0.03, score train 0.64, loss val 0.04 score val 0.50
Shutting down background jobs, please wait a moment...
Done!
Waiting for the remaining 10 operations to synchronize with Neptune. Do not kill this process.
All 10 operations synced, thanks for waiting!
Explore the metadata in the Neptune app:
https://app.neptune.ai/ba-final/cwt-2/e/CWT2-428/metadata
[32m[I 2023-09-16 23:17:22,995][0m Trial 99 finished with value: 0.03080167009475383 and parameters: {'b': 3.3, 'fc': 2.5, 'scale_min': 1.6, 'scale_max': 38, 'n_scales': 120, 'drop': 0.22050499812546093, 'optimizer': 'Adam', 'lr': 0.0005798855062358475, 'weight_decay': 0.0001147805352933708, 'batch_size': 32, 'epochs': 100}. Best is trial 71 with value: 0.022815226493997778.[0m
trial 99, loss train mean 0.03, score train mean 0.65, loss val mean 0.03, score val mean 0.64



End Time   : Sa 16. Sep 23:17:24 CEST 2023
Duration   : 16155.146306556 seconds

Start Time : Mo 18. Sep 09:02:43 CEST 2023
Job ID: 1169114
Node: cc1g01
Partition: gpu_long_stud
CPU cores: 16
Memory: 98304
GPUs: 0
Python environment: khoa                  *  /home/phamanh/anaconda3/envs/khoa
Current work directory: /home/phamanh/Schreibtisch/bachelorarbeit/ts_im_CNN

device: cuda


https://app.neptune.ai/ba-final/cwt-2/e/CWT2-429
slurmstepd: error: *** JOB 1169114 ON cc1g01 CANCELLED AT 2023-09-18T10:32:41 ***

Start Time : Mo 18. Sep 10:35:53 CEST 2023
Job ID: 1169372
Node: cc1g02
Partition: gpu_long_stud
CPU cores: 16
Memory: 98304
GPUs: 0
Python environment: khoa                  *  /home/phamanh/anaconda3/envs/khoa
Current work directory: /home/phamanh/Schreibtisch/bachelorarbeit/ts_im_CNN

device: cuda


https://app.neptune.ai/ba-final/cwt-2/e/CWT2-430
Split 0, loss train 0.03, score train 0.63, loss val 0.02 score val 0.74
Shutting down background jobs, please wait a moment...
Done!
Waiting for the remaining 10 operations to synchronize with Neptune. Do not kill this process.
All 10 operations synced, thanks for waiting!
Explore the metadata in the Neptune app:
https://app.neptune.ai/ba-final/cwt-2/e/CWT2-430/metadata
https://app.neptune.ai/ba-final/cwt-2/e/CWT2-431
Split 1, loss train 0.02, score train 0.67, loss val 0.04 score val 0.64
Shutting down background jobs, please wait a moment...
Done!
Waiting for the remaining 14 operations to synchronize with Neptune. Do not kill this process.
All 14 operations synced, thanks for waiting!
Explore the metadata in the Neptune app:
https://app.neptune.ai/ba-final/cwt-2/e/CWT2-431/metadata
https://app.neptune.ai/ba-final/cwt-2/e/CWT2-432
Split 2, loss train 0.03, score train 0.64, loss val 0.05 score val 0.62
Shutting down background jobs, please wait a moment...
Done!
Waiting for the remaining 13 operations to synchronize with Neptune. Do not kill this process.
All 13 operations synced, thanks for waiting!
Explore the metadata in the Neptune app:
https://app.neptune.ai/ba-final/cwt-2/e/CWT2-432/metadata
https://app.neptune.ai/ba-final/cwt-2/e/CWT2-433
Split 3, loss train 0.02, score train 0.67, loss val 0.03 score val 0.52
Shutting down background jobs, please wait a moment...
Done!
Waiting for the remaining 10 operations to synchronize with Neptune. Do not kill this process.
All 10 operations synced, thanks for waiting!
Explore the metadata in the Neptune app:
https://app.neptune.ai/ba-final/cwt-2/e/CWT2-433/metadata
https://app.neptune.ai/ba-final/cwt-2/e/CWT2-434
Split 4, loss train 0.02, score train 0.67, loss val 0.04 score val 0.45
Shutting down background jobs, please wait a moment...
Done!
Waiting for the remaining 10 operations to synchronize with Neptune. Do not kill this process.
All 10 operations synced, thanks for waiting!
Explore the metadata in the Neptune app:
https://app.neptune.ai/ba-final/cwt-2/e/CWT2-434/metadata
