[32m[I 2023-08-31 16:41:05,813][0m Trial 14 finished with value: 10.544216683570374 and parameters: {'b': 4.95, 'fc': 0.55, 'scale_min': 3.9000000000000004, 'scale_max': 14, 'n_scales': 255, 'drop': 0.17048392104358034, 'optimizer': 'Adam', 'lr': 0.030517769836322088, 'weight_decay': 1.576551075596502e-05, 'batch_size': 32, 'epochs': 100}. Best is trial 12 with value: 0.23978646055180977.[0m
trial 14, loss train mean 0.11, score train mean 0.38, loss val mean 10.54, score val mean 0.08



End Time   : Do 31. Aug 16:41:08 CEST 2023
Duration   : 18271.543165678 seconds

Start Time : Do 31. Aug 16:43:23 CEST 2023
Job ID: 1153403
Node: cc1g03
Partition: gpu_normal_stud
CPU cores: 16
Memory: 98304
GPUs: 0
Python environment: khoa                  *  /home/phamanh/anaconda3/envs/khoa
Current work directory: /home/phamanh/Schreibtisch/bachelorarbeit/ts_im_CNN

device: cuda


https://app.neptune.ai/ba-final/cwt-2/e/CWT2-72
Split 0, loss train 0.59, score train 0.11, loss val 0.30 score val 0.21
Shutting down background jobs, please wait a moment...
Done!
Waiting for the remaining 10 operations to synchronize with Neptune. Do not kill this process.
All 10 operations synced, thanks for waiting!
Explore the metadata in the Neptune app:
https://app.neptune.ai/ba-final/cwt-2/e/CWT2-72/metadata
https://app.neptune.ai/ba-final/cwt-2/e/CWT2-73
Experiencing connection interruptions. Will try to reestablish communication with Neptune. Internal exception was: RequestsFutureAdapterConnectionError
Communication with Neptune restored!
Unexpected error occurred in Neptune background thread: Killing Neptune asynchronous thread. All data is safe on disk and can be later synced manually using `neptune sync` command.
Exception in thread NeptuneAsyncOpProcessor:
Traceback (most recent call last):
  File "/home/phamanh/anaconda3/envs/khoa/lib/python3.10/site-packages/neptune/internal/backends/swagger_client_wrapper.py", line 97, in __call__
    return FinishedApiResponseFuture(future.response())  # wait synchronously
  File "/home/phamanh/anaconda3/envs/khoa/lib/python3.10/site-packages/bravado/http_future.py", line 200, in response
    swagger_result = self._get_swagger_result(incoming_response)
  File "/home/phamanh/anaconda3/envs/khoa/lib/python3.10/site-packages/bravado/http_future.py", line 124, in wrapper
    return func(self, *args, **kwargs)
  File "/home/phamanh/anaconda3/envs/khoa/lib/python3.10/site-packages/bravado/http_future.py", line 300, in _get_swagger_result
    unmarshal_response(
  File "/home/phamanh/anaconda3/envs/khoa/lib/python3.10/site-packages/bravado/http_future.py", line 353, in unmarshal_response
    raise_on_expected(incoming_response)
  File "/home/phamanh/anaconda3/envs/khoa/lib/python3.10/site-packages/bravado/http_future.py", line 420, in raise_on_expected
    raise make_http_exception(
bravado.exception.HTTPUnauthorized: 401 

During handling of the above exception, another exception occurred:

Traceback (most recent call last):
  File "/home/phamanh/anaconda3/envs/khoa/lib/python3.10/threading.py", line 1016, in _bootstrap_inner
    self.run()
  File "/home/phamanh/anaconda3/envs/khoa/lib/python3.10/site-packages/neptune/internal/operation_processors/async_operation_processor.py", line 230, in run
    super().run()
  File "/home/phamanh/anaconda3/envs/khoa/lib/python3.10/site-packages/neptune/internal/threading/daemon.py", line 53, in run
    self.work()
  File "/home/phamanh/anaconda3/envs/khoa/lib/python3.10/site-packages/neptune/internal/operation_processors/async_operation_processor.py", line 246, in work
    self.process_batch([element.obj for element in batch], batch[-1].ver)
  File "/home/phamanh/anaconda3/envs/khoa/lib/python3.10/site-packages/neptune/internal/threading/daemon.py", line 76, in wrapper
    result = func(self_, *args, **kwargs)
  File "/home/phamanh/anaconda3/envs/khoa/lib/python3.10/site-packages/neptune/internal/operation_processors/async_operation_processor.py", line 259, in process_batch
    processed_count, errors = self._processor._backend.execute_operations(
  File "/home/phamanh/anaconda3/envs/khoa/lib/python3.10/site-packages/neptune/internal/backends/hosted_neptune_backend.py", line 484, in execute_operations
    self._execute_operations(
  File "/home/phamanh/anaconda3/envs/khoa/lib/python3.10/site-packages/neptune/common/backends/utils.py", line 65, in wrapper
    return func(*args, **kwargs)
  File "/home/phamanh/anaconda3/envs/khoa/lib/python3.10/site-packages/neptune/internal/backends/hosted_neptune_backend.py", line 642, in _execute_operations
    result = self.leaderboard_client.api.executeOperations(**kwargs).response().result
  File "/home/phamanh/anaconda3/envs/khoa/lib/python3.10/site-packages/neptune/internal/backends/swagger_client_wrapper.py", line 99, in __call__
    self.handle_neptune_http_errors(e.response, exception=e)
  File "/home/phamanh/anaconda3/envs/khoa/lib/python3.10/site-packages/neptune/internal/backends/swagger_client_wrapper.py", line 59, in handle_neptune_http_errors
    raise NeptuneAuthTokenExpired() from exception
  File "/home/phamanh/anaconda3/envs/khoa/lib/python3.10/site-packages/neptune/common/exceptions.py", line 219, in __init__
    super().__init__("Authorization token expired")
TypeError: Unauthorized.__init__() takes 1 positional argument but 2 were given
Split 1, loss train 0.67, score train 0.13, loss val 0.57 score val 0.03
Shutting down background jobs, please wait a moment...
Done!
Explore the metadata in the Neptune app:
https://app.neptune.ai/ba-final/cwt-2/e/CWT2-73/metadata
https://app.neptune.ai/ba-final/cwt-2/e/CWT2-74
Split 2, loss train 0.54, score train 0.10, loss val 0.75 score val 0.06
Shutting down background jobs, please wait a moment...
Done!
Waiting for the remaining 10 operations to synchronize with Neptune. Do not kill this process.
All 10 operations synced, thanks for waiting!
Explore the metadata in the Neptune app:
https://app.neptune.ai/ba-final/cwt-2/e/CWT2-74/metadata
https://app.neptune.ai/ba-final/cwt-2/e/CWT2-75
Split 3, loss train 0.70, score train 0.12, loss val 25.23 score val 0.05
Shutting down background jobs, please wait a moment...
Done!
Waiting for the remaining 10 operations to synchronize with Neptune. Do not kill this process.
All 10 operations synced, thanks for waiting!
Explore the metadata in the Neptune app:
https://app.neptune.ai/ba-final/cwt-2/e/CWT2-75/metadata
https://app.neptune.ai/ba-final/cwt-2/e/CWT2-76
Split 4, loss train 0.56, score train 0.13, loss val 1.42 score val 0.03
Shutting down background jobs, please wait a moment...
Done!
Waiting for the remaining 10 operations to synchronize with Neptune. Do not kill this process.
All 10 operations synced, thanks for waiting!
Explore the metadata in the Neptune app:
https://app.neptune.ai/ba-final/cwt-2/e/CWT2-76/metadata
[32m[I 2023-08-31 21:48:10,944][0m Trial 15 finished with value: 5.655345730071373 and parameters: {'b': 4.2, 'fc': 1.0, 'scale_min': 3.2, 'scale_max': 20, 'n_scales': 225, 'drop': 0.11387920456832605, 'optimizer': 'Adam', 'lr': 0.14044319428811644, 'weight_decay': 5.983380093446648e-05, 'batch_size': 32, 'epochs': 100}. Best is trial 12 with value: 0.23978646055180977.[0m
trial 15, loss train mean 0.61, score train mean 0.12, loss val mean 5.66, score val mean 0.08



End Time   : Do 31. Aug 21:48:13 CEST 2023
Duration   : 18289.943900149 seconds

Start Time : Do 31. Aug 23:49:21 CEST 2023
Job ID: 1153404
Node: hades
Partition: gpu_normal_stud
CPU cores: 16
Memory: 98304
GPUs: 0
Python environment: khoa                  *  /home/phamanh/anaconda3/envs/khoa
Current work directory: /home/phamanh/Schreibtisch/bachelorarbeit/ts_im_CNN

device: cuda


https://app.neptune.ai/ba-final/cwt-2/e/CWT2-77
Split 0, loss train 0.08, score train 0.41, loss val 0.14 score val 0.30
Shutting down background jobs, please wait a moment...
Done!
Waiting for the remaining 10 operations to synchronize with Neptune. Do not kill this process.
All 10 operations synced, thanks for waiting!
Explore the metadata in the Neptune app:
https://app.neptune.ai/ba-final/cwt-2/e/CWT2-77/metadata
https://app.neptune.ai/ba-final/cwt-2/e/CWT2-78
Split 1, loss train 0.08, score train 0.42, loss val 0.43 score val 0.06
Shutting down background jobs, please wait a moment...
Done!
Waiting for the remaining 10 operations to synchronize with Neptune. Do not kill this process.
All 10 operations synced, thanks for waiting!
Explore the metadata in the Neptune app:
https://app.neptune.ai/ba-final/cwt-2/e/CWT2-78/metadata
https://app.neptune.ai/ba-final/cwt-2/e/CWT2-79
Split 2, loss train 0.08, score train 0.43, loss val 0.10 score val 0.41
Shutting down background jobs, please wait a moment...
Done!
Waiting for the remaining 10 operations to synchronize with Neptune. Do not kill this process.
All 10 operations synced, thanks for waiting!
Explore the metadata in the Neptune app:
https://app.neptune.ai/ba-final/cwt-2/e/CWT2-79/metadata
https://app.neptune.ai/ba-final/cwt-2/e/CWT2-80
Split 3, loss train 0.08, score train 0.42, loss val 0.42 score val 0.05
Shutting down background jobs, please wait a moment...
Done!
Waiting for the remaining 14 operations to synchronize with Neptune. Do not kill this process.
All 14 operations synced, thanks for waiting!
Explore the metadata in the Neptune app:
https://app.neptune.ai/ba-final/cwt-2/e/CWT2-80/metadata
https://app.neptune.ai/ba-final/cwt-2/e/CWT2-81
Split 4, loss train 0.09, score train 0.41, loss val 0.12 score val 0.17
Shutting down background jobs, please wait a moment...
Done!
Waiting for the remaining 12 operations to synchronize with Neptune. Do not kill this process.
All 12 operations synced, thanks for waiting!
Explore the metadata in the Neptune app:
https://app.neptune.ai/ba-final/cwt-2/e/CWT2-81/metadata
[32m[I 2023-09-01 05:20:50,678][0m Trial 16 finished with value: 0.24071423550869558 and parameters: {'b': 1.6, 'fc': 1.0, 'scale_min': 3.2, 'scale_max': 26, 'n_scales': 300, 'drop': 0.26870252407408896, 'optimizer': 'Adam', 'lr': 0.01331236352178168, 'weight_decay': 7.516867798842085e-05, 'batch_size': 32, 'epochs': 100}. Best is trial 12 with value: 0.23978646055180977.[0m
trial 16, loss train mean 0.08, score train mean 0.42, loss val mean 0.24, score val mean 0.20



End Time   : Fr 1. Sep 05:20:52 CEST 2023
Duration   : 19891.389314168 seconds

Start Time : Fr 1. Sep 05:20:54 CEST 2023
Job ID: 1153405
Node: cc1g04
Partition: gpu_normal_stud
CPU cores: 16
Memory: 98304
GPUs: 0
Python environment: khoa                  *  /home/phamanh/anaconda3/envs/khoa
Current work directory: /home/phamanh/Schreibtisch/bachelorarbeit/ts_im_CNN

device: cuda


https://app.neptune.ai/ba-final/cwt-2/e/CWT2-82
Split 0, loss train 0.07, score train 0.46, loss val 0.10 score val 0.37
Shutting down background jobs, please wait a moment...
Done!
Waiting for the remaining 14 operations to synchronize with Neptune. Do not kill this process.
All 14 operations synced, thanks for waiting!
Explore the metadata in the Neptune app:
https://app.neptune.ai/ba-final/cwt-2/e/CWT2-82/metadata
https://app.neptune.ai/ba-final/cwt-2/e/CWT2-83
Split 1, loss train 0.07, score train 0.44, loss val 0.38 score val 0.11
Shutting down background jobs, please wait a moment...
Done!
Waiting for the remaining 10 operations to synchronize with Neptune. Do not kill this process.
All 10 operations synced, thanks for waiting!
Explore the metadata in the Neptune app:
https://app.neptune.ai/ba-final/cwt-2/e/CWT2-83/metadata
https://app.neptune.ai/ba-final/cwt-2/e/CWT2-84
Split 2, loss train 0.07, score train 0.43, loss val 0.15 score val 0.29
Shutting down background jobs, please wait a moment...
Done!
Waiting for the remaining 10 operations to synchronize with Neptune. Do not kill this process.
All 10 operations synced, thanks for waiting!
Explore the metadata in the Neptune app:
https://app.neptune.ai/ba-final/cwt-2/e/CWT2-84/metadata
https://app.neptune.ai/ba-final/cwt-2/e/CWT2-85
Split 3, loss train 0.07, score train 0.44, loss val 0.29 score val 0.11
Shutting down background jobs, please wait a moment...
Done!
Waiting for the remaining 10 operations to synchronize with Neptune. Do not kill this process.
All 10 operations synced, thanks for waiting!
Explore the metadata in the Neptune app:
https://app.neptune.ai/ba-final/cwt-2/e/CWT2-85/metadata
https://app.neptune.ai/ba-final/cwt-2/e/CWT2-86
Split 4, loss train 0.07, score train 0.45, loss val 0.30 score val 0.09
Shutting down background jobs, please wait a moment...
Done!
Waiting for the remaining 14 operations to synchronize with Neptune. Do not kill this process.
All 14 operations synced, thanks for waiting!
Explore the metadata in the Neptune app:
https://app.neptune.ai/ba-final/cwt-2/e/CWT2-86/metadata
[32m[I 2023-09-01 11:31:25,182][0m Trial 17 finished with value: 0.24250750643141722 and parameters: {'b': 0.8, 'fc': 1.25, 'scale_min': 4.6000000000000005, 'scale_max': 30, 'n_scales': 300, 'drop': 0.3311270811690166, 'optimizer': 'Adam', 'lr': 0.00900458996162868, 'weight_decay': 0.00011141255904571929, 'batch_size': 32, 'epochs': 100}. Best is trial 12 with value: 0.23978646055180977.[0m
trial 17, loss train mean 0.07, score train mean 0.44, loss val mean 0.24, score val mean 0.19



End Time   : Fr 1. Sep 11:31:26 CEST 2023
Duration   : 22232.664378970 seconds

Start Time : Fr 1. Sep 11:31:36 CEST 2023
Job ID: 1153406
Node: cc1g04
Partition: gpu_normal_stud
CPU cores: 16
Memory: 98304
GPUs: 0
Python environment: khoa                  *  /home/phamanh/anaconda3/envs/khoa
Current work directory: /home/phamanh/Schreibtisch/bachelorarbeit/ts_im_CNN

device: cuda


https://app.neptune.ai/ba-final/cwt-2/e/CWT2-87
Split 0, loss train 0.08, score train 0.45, loss val 0.11 score val 0.34
Shutting down background jobs, please wait a moment...
Done!
Waiting for the remaining 10 operations to synchronize with Neptune. Do not kill this process.
All 10 operations synced, thanks for waiting!
Explore the metadata in the Neptune app:
https://app.neptune.ai/ba-final/cwt-2/e/CWT2-87/metadata
https://app.neptune.ai/ba-final/cwt-2/e/CWT2-88
Split 1, loss train 0.07, score train 0.46, loss val 0.15 score val 0.35
Shutting down background jobs, please wait a moment...
Done!
Waiting for the remaining 10 operations to synchronize with Neptune. Do not kill this process.
All 10 operations synced, thanks for waiting!
Explore the metadata in the Neptune app:
https://app.neptune.ai/ba-final/cwt-2/e/CWT2-88/metadata
https://app.neptune.ai/ba-final/cwt-2/e/CWT2-89
Split 2, loss train 0.07, score train 0.45, loss val 0.05 score val 0.56
Shutting down background jobs, please wait a moment...
Done!
Waiting for the remaining 10 operations to synchronize with Neptune. Do not kill this process.
All 10 operations synced, thanks for waiting!
Explore the metadata in the Neptune app:
https://app.neptune.ai/ba-final/cwt-2/e/CWT2-89/metadata
https://app.neptune.ai/ba-final/cwt-2/e/CWT2-90
Split 3, loss train 0.08, score train 0.45, loss val 0.09 score val 0.24
Shutting down background jobs, please wait a moment...
Done!
Waiting for the remaining 14 operations to synchronize with Neptune. Do not kill this process.
All 14 operations synced, thanks for waiting!
Explore the metadata in the Neptune app:
https://app.neptune.ai/ba-final/cwt-2/e/CWT2-90/metadata
https://app.neptune.ai/ba-final/cwt-2/e/CWT2-91
Split 4, loss train 0.07, score train 0.46, loss val 0.99 score val 0.05
Shutting down background jobs, please wait a moment...
Done!
Waiting for the remaining 10 operations to synchronize with Neptune. Do not kill this process.
All 10 operations synced, thanks for waiting!
Explore the metadata in the Neptune app:
https://app.neptune.ai/ba-final/cwt-2/e/CWT2-91/metadata
[32m[I 2023-09-01 15:41:57,433][0m Trial 18 finished with value: 0.2792960065476438 and parameters: {'b': 1.25, 'fc': 1.55, 'scale_min': 2.5, 'scale_max': 26, 'n_scales': 120, 'drop': 0.28052335917985527, 'optimizer': 'Adam', 'lr': 0.0006859002170500671, 'weight_decay': 0.03486620076966801, 'batch_size': 32, 'epochs': 100}. Best is trial 12 with value: 0.23978646055180977.[0m
trial 18, loss train mean 0.07, score train mean 0.45, loss val mean 0.28, score val mean 0.31



End Time   : Fr 1. Sep 15:41:59 CEST 2023
Duration   : 15023.052721893 seconds

Start Time : Fr 1. Sep 15:55:32 CEST 2023
Job ID: 1153407
Node: cc1g07
Partition: gpu_normal_stud
CPU cores: 16
Memory: 98304
GPUs: 0
Python environment: khoa                  *  /home/phamanh/anaconda3/envs/khoa
Current work directory: /home/phamanh/Schreibtisch/bachelorarbeit/ts_im_CNN

device: cuda


https://app.neptune.ai/ba-final/cwt-2/e/CWT2-92
Split 0, loss train 0.10, score train 0.37, loss val 0.23 score val 0.17
Shutting down background jobs, please wait a moment...
Done!
Waiting for the remaining 14 operations to synchronize with Neptune. Do not kill this process.
All 14 operations synced, thanks for waiting!
Explore the metadata in the Neptune app:
https://app.neptune.ai/ba-final/cwt-2/e/CWT2-92/metadata
https://app.neptune.ai/ba-final/cwt-2/e/CWT2-93
Split 1, loss train 0.10, score train 0.38, loss val 0.08 score val 0.45
Shutting down background jobs, please wait a moment...
Done!
Waiting for the remaining 14 operations to synchronize with Neptune. Do not kill this process.
All 14 operations synced, thanks for waiting!
Explore the metadata in the Neptune app:
https://app.neptune.ai/ba-final/cwt-2/e/CWT2-93/metadata
https://app.neptune.ai/ba-final/cwt-2/e/CWT2-94
Split 2, loss train 0.11, score train 0.36, loss val 0.26 score val 0.15
Shutting down background jobs, please wait a moment...
Done!
Waiting for the remaining 10 operations to synchronize with Neptune. Do not kill this process.
All 10 operations synced, thanks for waiting!
Explore the metadata in the Neptune app:
https://app.neptune.ai/ba-final/cwt-2/e/CWT2-94/metadata
https://app.neptune.ai/ba-final/cwt-2/e/CWT2-95
Split 3, loss train 0.10, score train 0.37, loss val 0.19 score val 0.25
Shutting down background jobs, please wait a moment...
Done!
Waiting for the remaining 10 operations to synchronize with Neptune. Do not kill this process.
All 10 operations synced, thanks for waiting!
Explore the metadata in the Neptune app:
https://app.neptune.ai/ba-final/cwt-2/e/CWT2-95/metadata
https://app.neptune.ai/ba-final/cwt-2/e/CWT2-96
Split 4, loss train 0.10, score train 0.38, loss val 0.13 score val 0.34
Shutting down background jobs, please wait a moment...
Done!
Waiting for the remaining 14 operations to synchronize with Neptune. Do not kill this process.
All 14 operations synced, thanks for waiting!
Explore the metadata in the Neptune app:
https://app.neptune.ai/ba-final/cwt-2/e/CWT2-96/metadata
[32m[I 2023-09-02 01:11:42,756][0m Trial 19 finished with value: 0.17862944704421022 and parameters: {'b': 2.0, 'fc': 0.9, 'scale_min': 2.5, 'scale_max': 32, 'n_scales': 300, 'drop': 0.785857685591905, 'optimizer': 'Adam', 'lr': 0.01331236352178168, 'weight_decay': 0.00011141255904571929, 'batch_size': 32, 'epochs': 100}. Best is trial 19 with value: 0.17862944704421022.[0m
trial 19, loss train mean 0.10, score train mean 0.37, loss val mean 0.18, score val mean 0.27



End Time   : Sa 2. Sep 01:11:45 CEST 2023
Duration   : 33372.798263830 seconds

Start Time : Sa 2. Sep 14:46:02 CEST 2023
Job ID: 1154386
Node: cc1g05
Partition: gpu_normal_stud
CPU cores: 16
Memory: 98304
GPUs: 0
Python environment: khoa                  *  /home/phamanh/anaconda3/envs/khoa
Current work directory: /home/phamanh/Schreibtisch/bachelorarbeit/ts_im_CNN

device: cuda


https://app.neptune.ai/ba-final/cwt-2/e/CWT2-97
Split 0, loss train 0.34, score train 0.18, loss val 0.26 score val 0.21
Shutting down background jobs, please wait a moment...
Done!
Waiting for the remaining 10 operations to synchronize with Neptune. Do not kill this process.
All 10 operations synced, thanks for waiting!
Explore the metadata in the Neptune app:
https://app.neptune.ai/ba-final/cwt-2/e/CWT2-97/metadata
https://app.neptune.ai/ba-final/cwt-2/e/CWT2-98
Split 1, loss train 0.33, score train 0.18, loss val 479.47 score val 0.06
Shutting down background jobs, please wait a moment...
Done!
Waiting for the remaining 10 operations to synchronize with Neptune. Do not kill this process.
All 10 operations synced, thanks for waiting!
Explore the metadata in the Neptune app:
https://app.neptune.ai/ba-final/cwt-2/e/CWT2-98/metadata
https://app.neptune.ai/ba-final/cwt-2/e/CWT2-99
Split 2, loss train 0.34, score train 0.18, loss val 0.28 score val 0.23
Shutting down background jobs, please wait a moment...
Done!
Waiting for the remaining 10 operations to synchronize with Neptune. Do not kill this process.
All 10 operations synced, thanks for waiting!
Explore the metadata in the Neptune app:
https://app.neptune.ai/ba-final/cwt-2/e/CWT2-99/metadata
https://app.neptune.ai/ba-final/cwt-2/e/CWT2-100
Split 3, loss train 0.34, score train 0.18, loss val 0.30 score val 0.22
Shutting down background jobs, please wait a moment...
Done!
Waiting for the remaining 10 operations to synchronize with Neptune. Do not kill this process.
All 10 operations synced, thanks for waiting!
Explore the metadata in the Neptune app:
https://app.neptune.ai/ba-final/cwt-2/e/CWT2-100/metadata
https://app.neptune.ai/ba-final/cwt-2/e/CWT2-101
Split 4, loss train 0.36, score train 0.17, loss val 0.25 score val 0.22
Shutting down background jobs, please wait a moment...
Done!
Waiting for the remaining 10 operations to synchronize with Neptune. Do not kill this process.
All 10 operations synced, thanks for waiting!
Explore the metadata in the Neptune app:
https://app.neptune.ai/ba-final/cwt-2/e/CWT2-101/metadata
