Start Time : Mo 28. Aug 11:19:24 CEST 2023
Job ID: 1150794
Node: cc1g01
Partition: gpu_long_stud
CPU cores: 16
Memory: 98304
GPUs: 0
Python environment: khoa                  *  /home/phamanh/anaconda3/envs/khoa
Current work directory: /home/phamanh/Schreibtisch/bachelorarbeit/ts_im_CNN

device: cuda


[32m[I 2023-08-28 11:19:35,945][0m A new study created in RDB with name: CWT[0m
https://app.neptune.ai/ba-final/cwt-2/e/CWT2-1
Split 0, loss train 0.07, score train 0.56, loss val 0.25 score val 0.77
Shutting down background jobs, please wait a moment...
Done!
Waiting for the remaining 10 operations to synchronize with Neptune. Do not kill this process.
All 10 operations synced, thanks for waiting!
Explore the metadata in the Neptune app:
https://app.neptune.ai/ba-final/cwt-2/e/CWT2-1/metadata
https://app.neptune.ai/ba-final/cwt-2/e/CWT2-2
Split 1, loss train 0.07, score train 0.55, loss val 0.13 score val 0.74
Shutting down background jobs, please wait a moment...
Done!
Waiting for the remaining 10 operations to synchronize with Neptune. Do not kill this process.
All 10 operations synced, thanks for waiting!
Explore the metadata in the Neptune app:
https://app.neptune.ai/ba-final/cwt-2/e/CWT2-2/metadata
https://app.neptune.ai/ba-final/cwt-2/e/CWT2-3
Split 2, loss train 0.08, score train 0.55, loss val 0.70 score val 0.61
Shutting down background jobs, please wait a moment...
Done!
Waiting for the remaining 10 operations to synchronize with Neptune. Do not kill this process.
All 10 operations synced, thanks for waiting!
Explore the metadata in the Neptune app:
https://app.neptune.ai/ba-final/cwt-2/e/CWT2-3/metadata
https://app.neptune.ai/ba-final/cwt-2/e/CWT2-4
Split 3, loss train 0.08, score train 0.56, loss val 0.46 score val 0.36
Shutting down background jobs, please wait a moment...
Done!
Waiting for the remaining 9 operations to synchronize with Neptune. Do not kill this process.
All 9 operations synced, thanks for waiting!
Explore the metadata in the Neptune app:
https://app.neptune.ai/ba-final/cwt-2/e/CWT2-4/metadata
https://app.neptune.ai/ba-final/cwt-2/e/CWT2-5
Split 4, loss train 0.07, score train 0.58, loss val 0.13 score val 0.46
Shutting down background jobs, please wait a moment...
Done!
Waiting for the remaining 10 operations to synchronize with Neptune. Do not kill this process.
All 10 operations synced, thanks for waiting!
Explore the metadata in the Neptune app:
https://app.neptune.ai/ba-final/cwt-2/e/CWT2-5/metadata
[32m[I 2023-08-28 16:19:57,769][0m Trial 0 finished with value: 0.3361721606964761 and parameters: {'b': 3.1500000000000004, 'fc': 2.05, 'scale_min': 1.6, 'scale_max': 42, 'n_scales': 170, 'drop': 0.5241908601441085, 'optimizer': 'SGD', 'lr': 0.003077401349489438, 'weight_decay': 0.0005867534868260941, 'batch_size': 32, 'epochs': 100}. Best is trial 0 with value: 0.3361721606964761.[0m
trial 0, loss train mean 0.08, score train mean 0.56, loss val mean 0.34, score val mean 0.59



End Time   : Mo 28. Aug 16:20:00 CEST 2023
Duration   : 18035.775870101 seconds

Start Time : Mo 28. Aug 16:53:01 CEST 2023
Job ID: 1150795
Node: cc1g01
Partition: gpu_long_stud
CPU cores: 16
Memory: 98304
GPUs: 0
Python environment: khoa                  *  /home/phamanh/anaconda3/envs/khoa
Current work directory: /home/phamanh/Schreibtisch/bachelorarbeit/ts_im_CNN

device: cuda


https://app.neptune.ai/ba-final/cwt-2/e/CWT2-6
Split 0, loss train 0.07, score train 0.56, loss val 0.25 score val 0.77
Shutting down background jobs, please wait a moment...
Done!
Waiting for the remaining 10 operations to synchronize with Neptune. Do not kill this process.
All 10 operations synced, thanks for waiting!
Explore the metadata in the Neptune app:
https://app.neptune.ai/ba-final/cwt-2/e/CWT2-6/metadata
https://app.neptune.ai/ba-final/cwt-2/e/CWT2-7
Split 1, loss train 0.07, score train 0.55, loss val 0.13 score val 0.74
Shutting down background jobs, please wait a moment...
Done!
Waiting for the remaining 10 operations to synchronize with Neptune. Do not kill this process.
All 10 operations synced, thanks for waiting!
Explore the metadata in the Neptune app:
https://app.neptune.ai/ba-final/cwt-2/e/CWT2-7/metadata
https://app.neptune.ai/ba-final/cwt-2/e/CWT2-8
Split 2, loss train 0.08, score train 0.55, loss val 0.70 score val 0.61
Shutting down background jobs, please wait a moment...
Done!
Waiting for the remaining 10 operations to synchronize with Neptune. Do not kill this process.
All 10 operations synced, thanks for waiting!
Explore the metadata in the Neptune app:
https://app.neptune.ai/ba-final/cwt-2/e/CWT2-8/metadata
https://app.neptune.ai/ba-final/cwt-2/e/CWT2-9
Split 3, loss train 0.08, score train 0.56, loss val 0.46 score val 0.36
Shutting down background jobs, please wait a moment...
Done!
Waiting for the remaining 10 operations to synchronize with Neptune. Do not kill this process.
All 10 operations synced, thanks for waiting!
Explore the metadata in the Neptune app:
https://app.neptune.ai/ba-final/cwt-2/e/CWT2-9/metadata
https://app.neptune.ai/ba-final/cwt-2/e/CWT2-10
Split 4, loss train 0.07, score train 0.58, loss val 0.13 score val 0.46
Shutting down background jobs, please wait a moment...
Done!
Waiting for the remaining 10 operations to synchronize with Neptune. Do not kill this process.
All 10 operations synced, thanks for waiting!
Explore the metadata in the Neptune app:
https://app.neptune.ai/ba-final/cwt-2/e/CWT2-10/metadata
[32m[I 2023-08-28 21:36:45,880][0m Trial 1 finished with value: 0.3361721606964761 and parameters: {'b': 3.1500000000000004, 'fc': 2.05, 'scale_min': 1.6, 'scale_max': 42, 'n_scales': 170, 'drop': 0.5241908601441085, 'optimizer': 'SGD', 'lr': 0.003077401349489438, 'weight_decay': 0.0005867534868260941, 'batch_size': 32, 'epochs': 100}. Best is trial 0 with value: 0.3361721606964761.[0m
trial 1, loss train mean 0.08, score train mean 0.56, loss val mean 0.34, score val mean 0.59



End Time   : Mo 28. Aug 21:36:48 CEST 2023
Duration   : 17026.651956344 seconds

Start Time : Mo 28. Aug 21:36:50 CEST 2023
Job ID: 1150796
Node: cc1g01
Partition: gpu_long_stud
CPU cores: 16
Memory: 98304
GPUs: 0
Python environment: khoa                  *  /home/phamanh/anaconda3/envs/khoa
Current work directory: /home/phamanh/Schreibtisch/bachelorarbeit/ts_im_CNN

device: cuda


https://app.neptune.ai/ba-final/cwt-2/e/CWT2-11
Split 0, loss train 0.07, score train 0.56, loss val 0.25 score val 0.77
Shutting down background jobs, please wait a moment...
double free or corruption (!prev)
/var/spool/slurm/job1150796/slurm_script: line 29: 3971474 Aborted                 (core dumped) python3 cwt_cv.py

End Time   : Mo 28. Aug 23:48:03 CEST 2023
Duration   : 7873.501126272 seconds
/home/phamanh/anaconda3/envs/khoa/lib/python3.10/site-packages/joblib/externals/loky/backend/resource_tracker.py:318: UserWarning: resource_tracker: There appear to be 6 leaked semlock objects to clean up at shutdown
  warnings.warn('resource_tracker: There appear to be %d '
/home/phamanh/anaconda3/envs/khoa/lib/python3.10/site-packages/joblib/externals/loky/backend/resource_tracker.py:318: UserWarning: resource_tracker: There appear to be 1 leaked folder objects to clean up at shutdown
  warnings.warn('resource_tracker: There appear to be %d '

Start Time : Di 29. Aug 00:09:34 CEST 2023
Job ID: 1150797
Node: cc1g01
Partition: gpu_long_stud
CPU cores: 16
Memory: 98304
GPUs: 0
Python environment: khoa                  *  /home/phamanh/anaconda3/envs/khoa
Current work directory: /home/phamanh/Schreibtisch/bachelorarbeit/ts_im_CNN

device: cuda


https://app.neptune.ai/ba-final/cwt-2/e/CWT2-12
Split 0, loss train 0.07, score train 0.56, loss val 0.25 score val 0.77
Shutting down background jobs, please wait a moment...
Done!
Waiting for the remaining 10 operations to synchronize with Neptune. Do not kill this process.
All 10 operations synced, thanks for waiting!
Explore the metadata in the Neptune app:
https://app.neptune.ai/ba-final/cwt-2/e/CWT2-12/metadata
https://app.neptune.ai/ba-final/cwt-2/e/CWT2-13
Split 1, loss train 0.07, score train 0.55, loss val 0.13 score val 0.74
Shutting down background jobs, please wait a moment...
Done!
Waiting for the remaining 10 operations to synchronize with Neptune. Do not kill this process.
All 10 operations synced, thanks for waiting!
Explore the metadata in the Neptune app:
https://app.neptune.ai/ba-final/cwt-2/e/CWT2-13/metadata
https://app.neptune.ai/ba-final/cwt-2/e/CWT2-14
Split 2, loss train 0.08, score train 0.55, loss val 0.70 score val 0.61
Shutting down background jobs, please wait a moment...
Done!
Waiting for the remaining 10 operations to synchronize with Neptune. Do not kill this process.
All 10 operations synced, thanks for waiting!
Explore the metadata in the Neptune app:
https://app.neptune.ai/ba-final/cwt-2/e/CWT2-14/metadata
https://app.neptune.ai/ba-final/cwt-2/e/CWT2-15
Split 3, loss train 0.08, score train 0.56, loss val 0.46 score val 0.36
Shutting down background jobs, please wait a moment...
Done!
Waiting for the remaining 10 operations to synchronize with Neptune. Do not kill this process.
All 10 operations synced, thanks for waiting!
Explore the metadata in the Neptune app:
https://app.neptune.ai/ba-final/cwt-2/e/CWT2-15/metadata
https://app.neptune.ai/ba-final/cwt-2/e/CWT2-16
Split 4, loss train 0.07, score train 0.58, loss val 0.13 score val 0.46
Shutting down background jobs, please wait a moment...
Done!
Waiting for the remaining 10 operations to synchronize with Neptune. Do not kill this process.
All 10 operations synced, thanks for waiting!
Explore the metadata in the Neptune app:
https://app.neptune.ai/ba-final/cwt-2/e/CWT2-16/metadata
[32m[I 2023-08-29 04:50:39,512][0m Trial 3 finished with value: 0.3361721606964761 and parameters: {'b': 3.1500000000000004, 'fc': 2.05, 'scale_min': 1.6, 'scale_max': 42, 'n_scales': 170, 'drop': 0.5241908601441085, 'optimizer': 'SGD', 'lr': 0.003077401349489438, 'weight_decay': 0.0005867534868260941, 'batch_size': 32, 'epochs': 100}. Best is trial 0 with value: 0.3361721606964761.[0m
trial 3, loss train mean 0.08, score train mean 0.56, loss val mean 0.34, score val mean 0.59



End Time   : Di 29. Aug 04:50:41 CEST 2023
Duration   : 16866.812827014 seconds

Start Time : Di 29. Aug 04:50:51 CEST 2023
Job ID: 1150798
Node: cc1g01
Partition: gpu_long_stud
CPU cores: 16
Memory: 98304
GPUs: 0
Python environment: khoa                  *  /home/phamanh/anaconda3/envs/khoa
Current work directory: /home/phamanh/Schreibtisch/bachelorarbeit/ts_im_CNN

device: cuda


https://app.neptune.ai/ba-final/cwt-2/e/CWT2-17
Split 0, loss train 0.07, score train 0.56, loss val 0.25 score val 0.77
Shutting down background jobs, please wait a moment...
Done!
Waiting for the remaining 10 operations to synchronize with Neptune. Do not kill this process.
All 10 operations synced, thanks for waiting!
Explore the metadata in the Neptune app:
https://app.neptune.ai/ba-final/cwt-2/e/CWT2-17/metadata
https://app.neptune.ai/ba-final/cwt-2/e/CWT2-18
Split 1, loss train 0.07, score train 0.55, loss val 0.13 score val 0.74
Shutting down background jobs, please wait a moment...
Done!
Waiting for the remaining 14 operations to synchronize with Neptune. Do not kill this process.
All 14 operations synced, thanks for waiting!
Explore the metadata in the Neptune app:
https://app.neptune.ai/ba-final/cwt-2/e/CWT2-18/metadata
https://app.neptune.ai/ba-final/cwt-2/e/CWT2-19
Split 2, loss train 0.08, score train 0.55, loss val 0.70 score val 0.61
Shutting down background jobs, please wait a moment...
Done!
Waiting for the remaining 8 operations to synchronize with Neptune. Do not kill this process.
All 8 operations synced, thanks for waiting!
Explore the metadata in the Neptune app:
https://app.neptune.ai/ba-final/cwt-2/e/CWT2-19/metadata
https://app.neptune.ai/ba-final/cwt-2/e/CWT2-20
Split 3, loss train 0.08, score train 0.56, loss val 0.46 score val 0.36
Shutting down background jobs, please wait a moment...
Done!
Waiting for the remaining 10 operations to synchronize with Neptune. Do not kill this process.
All 10 operations synced, thanks for waiting!
Explore the metadata in the Neptune app:
https://app.neptune.ai/ba-final/cwt-2/e/CWT2-20/metadata
https://app.neptune.ai/ba-final/cwt-2/e/CWT2-21
Split 4, loss train 0.07, score train 0.58, loss val 0.13 score val 0.46
Shutting down background jobs, please wait a moment...
Done!
Waiting for the remaining 10 operations to synchronize with Neptune. Do not kill this process.
All 10 operations synced, thanks for waiting!
Explore the metadata in the Neptune app:
https://app.neptune.ai/ba-final/cwt-2/e/CWT2-21/metadata
[32m[I 2023-08-29 09:30:03,684][0m Trial 4 finished with value: 0.3361721606964761 and parameters: {'b': 3.1500000000000004, 'fc': 2.05, 'scale_min': 1.6, 'scale_max': 42, 'n_scales': 170, 'drop': 0.5241908601441085, 'optimizer': 'SGD', 'lr': 0.003077401349489438, 'weight_decay': 0.0005867534868260941, 'batch_size': 32, 'epochs': 100}. Best is trial 0 with value: 0.3361721606964761.[0m
trial 4, loss train mean 0.08, score train mean 0.56, loss val mean 0.34, score val mean 0.59



End Time   : Di 29. Aug 09:30:05 CEST 2023
Duration   : 16754.400764469 seconds

Start Time : Di 29. Aug 12:02:22 CEST 2023
Job ID: 1151399
Node: cc1g05
Partition: gpu_normal_stud
CPU cores: 16
Memory: 98304
GPUs: 0
Python environment: khoa                  *  /home/phamanh/anaconda3/envs/khoa
Current work directory: /home/phamanh/Schreibtisch/bachelorarbeit/ts_im_CNN

device: cuda


https://app.neptune.ai/ba-final/cwt-2/e/CWT2-22
Split 0, loss train 0.07, score train 0.56, loss val 0.25 score val 0.77
Shutting down background jobs, please wait a moment...
Done!
Waiting for the remaining 10 operations to synchronize with Neptune. Do not kill this process.
All 10 operations synced, thanks for waiting!
Explore the metadata in the Neptune app:
https://app.neptune.ai/ba-final/cwt-2/e/CWT2-22/metadata
https://app.neptune.ai/ba-final/cwt-2/e/CWT2-23
Split 1, loss train 0.07, score train 0.55, loss val 0.13 score val 0.74
Shutting down background jobs, please wait a moment...
Done!
Waiting for the remaining 10 operations to synchronize with Neptune. Do not kill this process.
All 10 operations synced, thanks for waiting!
Explore the metadata in the Neptune app:
https://app.neptune.ai/ba-final/cwt-2/e/CWT2-23/metadata
https://app.neptune.ai/ba-final/cwt-2/e/CWT2-24
Split 2, loss train 0.08, score train 0.55, loss val 0.70 score val 0.61
Shutting down background jobs, please wait a moment...
Done!
Waiting for the remaining 10 operations to synchronize with Neptune. Do not kill this process.
All 10 operations synced, thanks for waiting!
Explore the metadata in the Neptune app:
https://app.neptune.ai/ba-final/cwt-2/e/CWT2-24/metadata
https://app.neptune.ai/ba-final/cwt-2/e/CWT2-25
Split 3, loss train 0.08, score train 0.56, loss val 0.46 score val 0.36
Shutting down background jobs, please wait a moment...
Done!
Waiting for the remaining 10 operations to synchronize with Neptune. Do not kill this process.
All 10 operations synced, thanks for waiting!
Explore the metadata in the Neptune app:
https://app.neptune.ai/ba-final/cwt-2/e/CWT2-25/metadata
https://app.neptune.ai/ba-final/cwt-2/e/CWT2-26
Split 4, loss train 0.07, score train 0.58, loss val 0.13 score val 0.46
Shutting down background jobs, please wait a moment...
Done!
Waiting for the remaining 10 operations to synchronize with Neptune. Do not kill this process.
All 10 operations synced, thanks for waiting!
Explore the metadata in the Neptune app:
https://app.neptune.ai/ba-final/cwt-2/e/CWT2-26/metadata
[32m[I 2023-08-29 17:00:55,645][0m Trial 5 finished with value: 0.3361721606964761 and parameters: {'b': 3.1500000000000004, 'fc': 2.05, 'scale_min': 1.6, 'scale_max': 42, 'n_scales': 170, 'drop': 0.5241908601441085, 'optimizer': 'SGD', 'lr': 0.003077401349489438, 'weight_decay': 0.0005867534868260941, 'batch_size': 32, 'epochs': 100}. Best is trial 0 with value: 0.3361721606964761.[0m
trial 5, loss train mean 0.08, score train mean 0.56, loss val mean 0.34, score val mean 0.59



End Time   : Di 29. Aug 17:00:57 CEST 2023
Duration   : 17915.201642388 seconds

Start Time : Di 29. Aug 17:01:01 CEST 2023
Job ID: 1151400
Node: hades
Partition: gpu_normal_stud
CPU cores: 16
Memory: 98304
GPUs: 0
Python environment: khoa                  *  /home/phamanh/anaconda3/envs/khoa
Current work directory: /home/phamanh/Schreibtisch/bachelorarbeit/ts_im_CNN

device: cuda


https://app.neptune.ai/ba-final/cwt-2/e/CWT2-27
Split 0, loss train 0.07, score train 0.56, loss val 0.25 score val 0.77
Shutting down background jobs, please wait a moment...
Done!
Waiting for the remaining 10 operations to synchronize with Neptune. Do not kill this process.
All 10 operations synced, thanks for waiting!
Explore the metadata in the Neptune app:
https://app.neptune.ai/ba-final/cwt-2/e/CWT2-27/metadata
https://app.neptune.ai/ba-final/cwt-2/e/CWT2-28
Split 1, loss train 0.07, score train 0.55, loss val 0.13 score val 0.74
Shutting down background jobs, please wait a moment...
Done!
Waiting for the remaining 14 operations to synchronize with Neptune. Do not kill this process.
All 14 operations synced, thanks for waiting!
Explore the metadata in the Neptune app:
https://app.neptune.ai/ba-final/cwt-2/e/CWT2-28/metadata
https://app.neptune.ai/ba-final/cwt-2/e/CWT2-29
Split 2, loss train 0.08, score train 0.55, loss val 0.70 score val 0.61
Shutting down background jobs, please wait a moment...
Done!
Waiting for the remaining 14 operations to synchronize with Neptune. Do not kill this process.
All 14 operations synced, thanks for waiting!
Explore the metadata in the Neptune app:
https://app.neptune.ai/ba-final/cwt-2/e/CWT2-29/metadata
https://app.neptune.ai/ba-final/cwt-2/e/CWT2-30
Split 3, loss train 0.08, score train 0.56, loss val 0.46 score val 0.36
Shutting down background jobs, please wait a moment...
Done!
Waiting for the remaining 14 operations to synchronize with Neptune. Do not kill this process.
All 14 operations synced, thanks for waiting!
Explore the metadata in the Neptune app:
https://app.neptune.ai/ba-final/cwt-2/e/CWT2-30/metadata
https://app.neptune.ai/ba-final/cwt-2/e/CWT2-31
Split 4, loss train 0.07, score train 0.58, loss val 0.13 score val 0.46
Shutting down background jobs, please wait a moment...
Done!
Waiting for the remaining 10 operations to synchronize with Neptune. Do not kill this process.
All 10 operations synced, thanks for waiting!
Explore the metadata in the Neptune app:
https://app.neptune.ai/ba-final/cwt-2/e/CWT2-31/metadata
[32m[I 2023-08-29 21:55:12,291][0m Trial 6 finished with value: 0.3361721606964761 and parameters: {'b': 3.1500000000000004, 'fc': 2.05, 'scale_min': 1.6, 'scale_max': 42, 'n_scales': 170, 'drop': 0.5241908601441085, 'optimizer': 'SGD', 'lr': 0.003077401349489438, 'weight_decay': 0.0005867534868260941, 'batch_size': 32, 'epochs': 100}. Best is trial 0 with value: 0.3361721606964761.[0m
trial 6, loss train mean 0.08, score train mean 0.56, loss val mean 0.34, score val mean 0.59



End Time   : Di 29. Aug 21:55:13 CEST 2023
Duration   : 17652.362803563 seconds

Start Time : Di 29. Aug 21:55:15 CEST 2023
Job ID: 1151401
Node: hades
Partition: gpu_normal_stud
CPU cores: 16
Memory: 98304
GPUs: 0
Python environment: khoa                  *  /home/phamanh/anaconda3/envs/khoa
Current work directory: /home/phamanh/Schreibtisch/bachelorarbeit/ts_im_CNN

device: cuda


https://app.neptune.ai/ba-final/cwt-2/e/CWT2-32
Split 0, loss train 0.07, score train 0.56, loss val 0.25 score val 0.77
Shutting down background jobs, please wait a moment...
Done!
Waiting for the remaining 10 operations to synchronize with Neptune. Do not kill this process.
All 10 operations synced, thanks for waiting!
Explore the metadata in the Neptune app:
https://app.neptune.ai/ba-final/cwt-2/e/CWT2-32/metadata
https://app.neptune.ai/ba-final/cwt-2/e/CWT2-33
Split 1, loss train 0.07, score train 0.55, loss val 0.13 score val 0.74
Shutting down background jobs, please wait a moment...
Done!
Waiting for the remaining 14 operations to synchronize with Neptune. Do not kill this process.
All 14 operations synced, thanks for waiting!
Explore the metadata in the Neptune app:
https://app.neptune.ai/ba-final/cwt-2/e/CWT2-33/metadata
https://app.neptune.ai/ba-final/cwt-2/e/CWT2-34
Split 2, loss train 0.08, score train 0.55, loss val 0.70 score val 0.61
Shutting down background jobs, please wait a moment...
Done!
Waiting for the remaining 10 operations to synchronize with Neptune. Do not kill this process.
All 10 operations synced, thanks for waiting!
Explore the metadata in the Neptune app:
https://app.neptune.ai/ba-final/cwt-2/e/CWT2-34/metadata
https://app.neptune.ai/ba-final/cwt-2/e/CWT2-35
Split 3, loss train 0.08, score train 0.56, loss val 0.46 score val 0.36
Shutting down background jobs, please wait a moment...
Done!
Waiting for the remaining 10 operations to synchronize with Neptune. Do not kill this process.
All 10 operations synced, thanks for waiting!
Explore the metadata in the Neptune app:
https://app.neptune.ai/ba-final/cwt-2/e/CWT2-35/metadata
https://app.neptune.ai/ba-final/cwt-2/e/CWT2-36
Split 4, loss train 0.07, score train 0.58, loss val 0.13 score val 0.46
Shutting down background jobs, please wait a moment...
Done!
Waiting for the remaining 10 operations to synchronize with Neptune. Do not kill this process.
All 10 operations synced, thanks for waiting!
Explore the metadata in the Neptune app:
https://app.neptune.ai/ba-final/cwt-2/e/CWT2-36/metadata
