[32m[I 2023-09-13 21:06:08,551][0m Trial 80 finished with value: 0.030763060995872983 and parameters: {'b': 3.3500000000000005, 'fc': 2.4000000000000004, 'scale_min': 2.6, 'scale_max': 36, 'n_scales': 100, 'drop': 0.1916685155802465, 'optimizer': 'Adam', 'lr': 0.0005970226252426717, 'weight_decay': 9.629967321772349e-05, 'batch_size': 32, 'epochs': 100}. Best is trial 71 with value: 0.022815226493997778.[0m
trial 80, loss train mean 0.02, score train mean 0.65, loss val mean 0.03, score val mean 0.63



End Time   : Mi 13. Sep 21:06:11 CEST 2023
Duration   : 15278.390483602 seconds

Start Time : Mi 13. Sep 21:06:13 CEST 2023
Job ID: 1164817
Node: cc1g07
Partition: gpu_normal_stud
CPU cores: 16
Memory: 98304
GPUs: 0
Python environment: khoa                  *  /home/phamanh/anaconda3/envs/khoa
Current work directory: /home/phamanh/Schreibtisch/bachelorarbeit/ts_im_CNN

device: cuda


https://app.neptune.ai/ba-final/cwt-2/e/CWT2-342
Split 0, loss train 0.03, score train 0.62, loss val 0.04 score val 0.50
Shutting down background jobs, please wait a moment...
Done!
Waiting for the remaining 10 operations to synchronize with Neptune. Do not kill this process.
All 10 operations synced, thanks for waiting!
Explore the metadata in the Neptune app:
https://app.neptune.ai/ba-final/cwt-2/e/CWT2-342/metadata
https://app.neptune.ai/ba-final/cwt-2/e/CWT2-343
Split 1, loss train 0.02, score train 0.65, loss val 0.03 score val 0.68
Shutting down background jobs, please wait a moment...
Done!
Waiting for the remaining 14 operations to synchronize with Neptune. Do not kill this process.
All 14 operations synced, thanks for waiting!
Explore the metadata in the Neptune app:
https://app.neptune.ai/ba-final/cwt-2/e/CWT2-343/metadata
https://app.neptune.ai/ba-final/cwt-2/e/CWT2-344
Split 2, loss train 0.02, score train 0.65, loss val 0.03 score val 0.68
Shutting down background jobs, please wait a moment...
Done!
Waiting for the remaining 14 operations to synchronize with Neptune. Do not kill this process.
All 14 operations synced, thanks for waiting!
Explore the metadata in the Neptune app:
https://app.neptune.ai/ba-final/cwt-2/e/CWT2-344/metadata
https://app.neptune.ai/ba-final/cwt-2/e/CWT2-345
Split 3, loss train 0.02, score train 0.65, loss val 0.03 score val 0.60
Shutting down background jobs, please wait a moment...
Done!
Waiting for the remaining 13 operations to synchronize with Neptune. Do not kill this process.
All 13 operations synced, thanks for waiting!
Explore the metadata in the Neptune app:
https://app.neptune.ai/ba-final/cwt-2/e/CWT2-345/metadata
https://app.neptune.ai/ba-final/cwt-2/e/CWT2-346
Split 4, loss train 0.02, score train 0.67, loss val 0.04 score val 0.44
Shutting down background jobs, please wait a moment...
Done!
Waiting for the remaining 14 operations to synchronize with Neptune. Do not kill this process.
All 14 operations synced, thanks for waiting!
Explore the metadata in the Neptune app:
https://app.neptune.ai/ba-final/cwt-2/e/CWT2-346/metadata
[32m[I 2023-09-14 01:23:14,351][0m Trial 81 finished with value: 0.034078454464039905 and parameters: {'b': 3.3500000000000005, 'fc': 2.1, 'scale_min': 1.7000000000000002, 'scale_max': 34, 'n_scales': 105, 'drop': 0.18322815889019287, 'optimizer': 'Adam', 'lr': 0.0007834925954574327, 'weight_decay': 5.979379196314213e-05, 'batch_size': 32, 'epochs': 100}. Best is trial 71 with value: 0.022815226493997778.[0m
trial 81, loss train mean 0.02, score train mean 0.65, loss val mean 0.03, score val mean 0.58



End Time   : Do 14. Sep 01:23:17 CEST 2023
Duration   : 15423.113085875 seconds

Start Time : Do 14. Sep 01:23:18 CEST 2023
Job ID: 1164818
Node: cc1g04
Partition: gpu_normal_stud
CPU cores: 16
Memory: 98304
GPUs: 0
Python environment: khoa                  *  /home/phamanh/anaconda3/envs/khoa
Current work directory: /home/phamanh/Schreibtisch/bachelorarbeit/ts_im_CNN

device: cuda


https://app.neptune.ai/ba-final/cwt-2/e/CWT2-347
Split 0, loss train 0.03, score train 0.63, loss val 0.03 score val 0.63
Shutting down background jobs, please wait a moment...
Done!
Waiting for the remaining 14 operations to synchronize with Neptune. Do not kill this process.
All 14 operations synced, thanks for waiting!
Explore the metadata in the Neptune app:
https://app.neptune.ai/ba-final/cwt-2/e/CWT2-347/metadata
https://app.neptune.ai/ba-final/cwt-2/e/CWT2-348
Split 1, loss train 0.02, score train 0.66, loss val 0.03 score val 0.54
Shutting down background jobs, please wait a moment...
Done!
Waiting for the remaining 10 operations to synchronize with Neptune. Do not kill this process.
All 10 operations synced, thanks for waiting!
Explore the metadata in the Neptune app:
https://app.neptune.ai/ba-final/cwt-2/e/CWT2-348/metadata
https://app.neptune.ai/ba-final/cwt-2/e/CWT2-349
Split 2, loss train 0.02, score train 0.65, loss val 0.03 score val 0.52
Shutting down background jobs, please wait a moment...
Done!
Waiting for the remaining 10 operations to synchronize with Neptune. Do not kill this process.
All 10 operations synced, thanks for waiting!
Explore the metadata in the Neptune app:
https://app.neptune.ai/ba-final/cwt-2/e/CWT2-349/metadata
https://app.neptune.ai/ba-final/cwt-2/e/CWT2-350
Split 3, loss train 0.03, score train 0.62, loss val 0.03 score val 0.68
Shutting down background jobs, please wait a moment...
Done!
Waiting for the remaining 10 operations to synchronize with Neptune. Do not kill this process.
All 10 operations synced, thanks for waiting!
Explore the metadata in the Neptune app:
https://app.neptune.ai/ba-final/cwt-2/e/CWT2-350/metadata
https://app.neptune.ai/ba-final/cwt-2/e/CWT2-351
Split 4, loss train 0.03, score train 0.64, loss val 0.06 score val 0.33
Shutting down background jobs, please wait a moment...
Done!
Waiting for the remaining 10 operations to synchronize with Neptune. Do not kill this process.
All 10 operations synced, thanks for waiting!
Explore the metadata in the Neptune app:
https://app.neptune.ai/ba-final/cwt-2/e/CWT2-351/metadata
[32m[I 2023-09-14 05:35:36,462][0m Trial 82 finished with value: 0.034481896238124116 and parameters: {'b': 2.6, 'fc': 2.35, 'scale_min': 1.7000000000000002, 'scale_max': 40, 'n_scales': 100, 'drop': 0.21022377030151237, 'optimizer': 'Adam', 'lr': 0.0005734317989442025, 'weight_decay': 0.0001200561939839705, 'batch_size': 32, 'epochs': 100}. Best is trial 71 with value: 0.022815226493997778.[0m
trial 82, loss train mean 0.03, score train mean 0.64, loss val mean 0.03, score val mean 0.54



End Time   : Do 14. Sep 05:35:38 CEST 2023
Duration   : 15139.481731128 seconds

Start Time : Do 14. Sep 05:36:02 CEST 2023
Job ID: 1164819
Node: cc1g04
Partition: gpu_normal_stud
CPU cores: 16
Memory: 98304
GPUs: 0
Python environment: khoa                  *  /home/phamanh/anaconda3/envs/khoa
Current work directory: /home/phamanh/Schreibtisch/bachelorarbeit/ts_im_CNN

device: cuda


https://app.neptune.ai/ba-final/cwt-2/e/CWT2-352
Split 0, loss train 0.02, score train 0.66, loss val 0.03 score val 0.47
Shutting down background jobs, please wait a moment...
Done!
Waiting for the remaining 10 operations to synchronize with Neptune. Do not kill this process.
All 10 operations synced, thanks for waiting!
Explore the metadata in the Neptune app:
https://app.neptune.ai/ba-final/cwt-2/e/CWT2-352/metadata
https://app.neptune.ai/ba-final/cwt-2/e/CWT2-353
Split 1, loss train 0.02, score train 0.66, loss val 0.03 score val 0.64
Shutting down background jobs, please wait a moment...
Done!
Waiting for the remaining 10 operations to synchronize with Neptune. Do not kill this process.
All 10 operations synced, thanks for waiting!
Explore the metadata in the Neptune app:
https://app.neptune.ai/ba-final/cwt-2/e/CWT2-353/metadata
https://app.neptune.ai/ba-final/cwt-2/e/CWT2-354
Split 2, loss train 0.03, score train 0.64, loss val 0.02 score val 0.74
Shutting down background jobs, please wait a moment...
Done!
Waiting for the remaining 10 operations to synchronize with Neptune. Do not kill this process.
All 10 operations synced, thanks for waiting!
Explore the metadata in the Neptune app:
https://app.neptune.ai/ba-final/cwt-2/e/CWT2-354/metadata
https://app.neptune.ai/ba-final/cwt-2/e/CWT2-355
Split 3, loss train 0.03, score train 0.65, loss val 0.02 score val 0.56
Shutting down background jobs, please wait a moment...
Done!
Waiting for the remaining 10 operations to synchronize with Neptune. Do not kill this process.
All 10 operations synced, thanks for waiting!
Explore the metadata in the Neptune app:
https://app.neptune.ai/ba-final/cwt-2/e/CWT2-355/metadata
https://app.neptune.ai/ba-final/cwt-2/e/CWT2-356
Split 4, loss train 0.02, score train 0.67, loss val 0.03 score val 0.54
Shutting down background jobs, please wait a moment...
Done!
Waiting for the remaining 14 operations to synchronize with Neptune. Do not kill this process.
All 14 operations synced, thanks for waiting!
Explore the metadata in the Neptune app:
https://app.neptune.ai/ba-final/cwt-2/e/CWT2-356/metadata
[32m[I 2023-09-14 09:47:23,319][0m Trial 83 finished with value: 0.027181058741630394 and parameters: {'b': 3.0, 'fc': 2.4000000000000004, 'scale_min': 1.8, 'scale_max': 40, 'n_scales': 110, 'drop': 0.17259573909022977, 'optimizer': 'Adam', 'lr': 0.0005073405140371834, 'weight_decay': 9.912340689954038e-05, 'batch_size': 32, 'epochs': 100}. Best is trial 71 with value: 0.022815226493997778.[0m
trial 83, loss train mean 0.02, score train mean 0.66, loss val mean 0.03, score val mean 0.59



End Time   : Do 14. Sep 09:47:24 CEST 2023
Duration   : 15082.811486816 seconds

Start Time : Do 14. Sep 09:47:26 CEST 2023
Job ID: 1164820
Node: cc1g04
Partition: gpu_normal_stud
CPU cores: 16
Memory: 98304
GPUs: 0
Python environment: khoa                  *  /home/phamanh/anaconda3/envs/khoa
Current work directory: /home/phamanh/Schreibtisch/bachelorarbeit/ts_im_CNN

device: cuda


https://app.neptune.ai/ba-final/cwt-2/e/CWT2-357
Split 0, loss train 0.02, score train 0.66, loss val 0.02 score val 0.70
Shutting down background jobs, please wait a moment...
Done!
Waiting for the remaining 10 operations to synchronize with Neptune. Do not kill this process.
All 10 operations synced, thanks for waiting!
Explore the metadata in the Neptune app:
https://app.neptune.ai/ba-final/cwt-2/e/CWT2-357/metadata
https://app.neptune.ai/ba-final/cwt-2/e/CWT2-358
Split 1, loss train 0.02, score train 0.67, loss val 0.03 score val 0.59
Shutting down background jobs, please wait a moment...
Done!
Waiting for the remaining 10 operations to synchronize with Neptune. Do not kill this process.
All 10 operations synced, thanks for waiting!
Explore the metadata in the Neptune app:
https://app.neptune.ai/ba-final/cwt-2/e/CWT2-358/metadata
https://app.neptune.ai/ba-final/cwt-2/e/CWT2-359
Split 2, loss train 0.02, score train 0.65, loss val 0.03 score val 0.65
Shutting down background jobs, please wait a moment...
Done!
Waiting for the remaining 10 operations to synchronize with Neptune. Do not kill this process.
All 10 operations synced, thanks for waiting!
Explore the metadata in the Neptune app:
https://app.neptune.ai/ba-final/cwt-2/e/CWT2-359/metadata
https://app.neptune.ai/ba-final/cwt-2/e/CWT2-360
Split 3, loss train 0.02, score train 0.66, loss val 0.02 score val 0.65
Shutting down background jobs, please wait a moment...
Done!
Waiting for the remaining 10 operations to synchronize with Neptune. Do not kill this process.
All 10 operations synced, thanks for waiting!
Explore the metadata in the Neptune app:
https://app.neptune.ai/ba-final/cwt-2/e/CWT2-360/metadata
https://app.neptune.ai/ba-final/cwt-2/e/CWT2-361
Split 4, loss train 0.02, score train 0.67, loss val 0.03 score val 0.71
Shutting down background jobs, please wait a moment...
Done!
Waiting for the remaining 10 operations to synchronize with Neptune. Do not kill this process.
All 10 operations synced, thanks for waiting!
Explore the metadata in the Neptune app:
https://app.neptune.ai/ba-final/cwt-2/e/CWT2-361/metadata
[32m[I 2023-09-14 14:01:02,215][0m Trial 84 finished with value: 0.025415643225324913 and parameters: {'b': 3.3500000000000005, 'fc': 2.4000000000000004, 'scale_min': 2.0, 'scale_max': 42, 'n_scales': 110, 'drop': 0.17259573909022977, 'optimizer': 'Adam', 'lr': 0.0005876131164680409, 'weight_decay': 7.277831208442697e-05, 'batch_size': 32, 'epochs': 100}. Best is trial 71 with value: 0.022815226493997778.[0m
trial 84, loss train mean 0.02, score train mean 0.66, loss val mean 0.03, score val mean 0.66



End Time   : Do 14. Sep 14:01:04 CEST 2023
Duration   : 15217.865607387 seconds

Start Time : Do 14. Sep 14:01:05 CEST 2023
Job ID: 1164821
Node: cc1g04
Partition: gpu_normal_stud
CPU cores: 16
Memory: 98304
GPUs: 0
Python environment: khoa                  *  /home/phamanh/anaconda3/envs/khoa
Current work directory: /home/phamanh/Schreibtisch/bachelorarbeit/ts_im_CNN

device: cuda


https://app.neptune.ai/ba-final/cwt-2/e/CWT2-362
Split 0, loss train 0.02, score train 0.65, loss val 0.02 score val 0.64
Shutting down background jobs, please wait a moment...
Done!
Waiting for the remaining 14 operations to synchronize with Neptune. Do not kill this process.
All 14 operations synced, thanks for waiting!
Explore the metadata in the Neptune app:
https://app.neptune.ai/ba-final/cwt-2/e/CWT2-362/metadata
https://app.neptune.ai/ba-final/cwt-2/e/CWT2-363
Split 1, loss train 0.02, score train 0.67, loss val 0.04 score val 0.55
Shutting down background jobs, please wait a moment...
Done!
Waiting for the remaining 10 operations to synchronize with Neptune. Do not kill this process.
All 10 operations synced, thanks for waiting!
Explore the metadata in the Neptune app:
https://app.neptune.ai/ba-final/cwt-2/e/CWT2-363/metadata
https://app.neptune.ai/ba-final/cwt-2/e/CWT2-364
Split 2, loss train 0.02, score train 0.68, loss val 0.03 score val 0.72
Shutting down background jobs, please wait a moment...
Done!
Waiting for the remaining 10 operations to synchronize with Neptune. Do not kill this process.
All 10 operations synced, thanks for waiting!
Explore the metadata in the Neptune app:
https://app.neptune.ai/ba-final/cwt-2/e/CWT2-364/metadata
https://app.neptune.ai/ba-final/cwt-2/e/CWT2-365
Split 3, loss train 0.02, score train 0.66, loss val 0.03 score val 0.52
Shutting down background jobs, please wait a moment...
Done!
Waiting for the remaining 10 operations to synchronize with Neptune. Do not kill this process.
All 10 operations synced, thanks for waiting!
Explore the metadata in the Neptune app:
https://app.neptune.ai/ba-final/cwt-2/e/CWT2-365/metadata
https://app.neptune.ai/ba-final/cwt-2/e/CWT2-366
Split 4, loss train 0.02, score train 0.68, loss val 0.02 score val 0.72
Shutting down background jobs, please wait a moment...
Done!
Waiting for the remaining 10 operations to synchronize with Neptune. Do not kill this process.
All 10 operations synced, thanks for waiting!
Explore the metadata in the Neptune app:
https://app.neptune.ai/ba-final/cwt-2/e/CWT2-366/metadata
[32m[I 2023-09-14 18:11:24,401][0m Trial 85 finished with value: 0.027901087669616055 and parameters: {'b': 3.05, 'fc': 2.45, 'scale_min': 2.2, 'scale_max': 40, 'n_scales': 110, 'drop': 0.17123936613905988, 'optimizer': 'Adam', 'lr': 0.0006523785279718166, 'weight_decay': 7.647839850713226e-05, 'batch_size': 32, 'epochs': 100}. Best is trial 71 with value: 0.022815226493997778.[0m
trial 85, loss train mean 0.02, score train mean 0.67, loss val mean 0.03, score val mean 0.63



End Time   : Do 14. Sep 18:11:26 CEST 2023
Duration   : 15020.624644308 seconds

Start Time : Do 14. Sep 18:11:31 CEST 2023
Job ID: 1164822
Node: cc1g04
Partition: gpu_normal_stud
CPU cores: 16
Memory: 98304
GPUs: 0
Python environment: khoa                  *  /home/phamanh/anaconda3/envs/khoa
Current work directory: /home/phamanh/Schreibtisch/bachelorarbeit/ts_im_CNN

device: cuda


https://app.neptune.ai/ba-final/cwt-2/e/CWT2-367
Split 0, loss train 0.02, score train 0.64, loss val 0.02 score val 0.73
Shutting down background jobs, please wait a moment...
Done!
Waiting for the remaining 10 operations to synchronize with Neptune. Do not kill this process.
All 10 operations synced, thanks for waiting!
Explore the metadata in the Neptune app:
https://app.neptune.ai/ba-final/cwt-2/e/CWT2-367/metadata
https://app.neptune.ai/ba-final/cwt-2/e/CWT2-368
Split 1, loss train 0.03, score train 0.62, loss val 0.05 score val 0.62
Shutting down background jobs, please wait a moment...
Done!
Waiting for the remaining 14 operations to synchronize with Neptune. Do not kill this process.
All 14 operations synced, thanks for waiting!
Explore the metadata in the Neptune app:
https://app.neptune.ai/ba-final/cwt-2/e/CWT2-368/metadata
https://app.neptune.ai/ba-final/cwt-2/e/CWT2-369
Split 2, loss train 0.02, score train 0.66, loss val 0.04 score val 0.62
Shutting down background jobs, please wait a moment...
Done!
Waiting for the remaining 10 operations to synchronize with Neptune. Do not kill this process.
All 10 operations synced, thanks for waiting!
Explore the metadata in the Neptune app:
https://app.neptune.ai/ba-final/cwt-2/e/CWT2-369/metadata
https://app.neptune.ai/ba-final/cwt-2/e/CWT2-370
Split 3, loss train 0.02, score train 0.66, loss val 0.03 score val 0.60
Shutting down background jobs, please wait a moment...
Done!
Waiting for the remaining 10 operations to synchronize with Neptune. Do not kill this process.
All 10 operations synced, thanks for waiting!
Explore the metadata in the Neptune app:
https://app.neptune.ai/ba-final/cwt-2/e/CWT2-370/metadata
https://app.neptune.ai/ba-final/cwt-2/e/CWT2-371
Split 4, loss train 0.02, score train 0.65, loss val 0.05 score val 0.44
Shutting down background jobs, please wait a moment...
Done!
Waiting for the remaining 14 operations to synchronize with Neptune. Do not kill this process.
All 14 operations synced, thanks for waiting!
Explore the metadata in the Neptune app:
https://app.neptune.ai/ba-final/cwt-2/e/CWT2-371/metadata
[32m[I 2023-09-14 22:23:11,120][0m Trial 86 finished with value: 0.039517906371583325 and parameters: {'b': 3.5, 'fc': 2.25, 'scale_min': 2.2, 'scale_max': 42, 'n_scales': 110, 'drop': 0.19283201920461407, 'optimizer': 'Adam', 'lr': 0.0007619269999061349, 'weight_decay': 9.912340689954038e-05, 'batch_size': 32, 'epochs': 100}. Best is trial 71 with value: 0.022815226493997778.[0m
trial 86, loss train mean 0.02, score train mean 0.65, loss val mean 0.04, score val mean 0.60



End Time   : Do 14. Sep 22:23:12 CEST 2023
Duration   : 15101.344112469 seconds

Start Time : Do 14. Sep 22:19:25 CEST 2023
Job ID: 1164823
Node: cc1g02
Partition: gpu_normal_stud
CPU cores: 16
Memory: 98304
GPUs: 0
Python environment: khoa                  *  /home/phamanh/anaconda3/envs/khoa
Current work directory: /home/phamanh/Schreibtisch/bachelorarbeit/ts_im_CNN

device: cuda


https://app.neptune.ai/ba-final/cwt-2/e/CWT2-372
Split 0, loss train 0.02, score train 0.65, loss val 0.03 score val 0.66
Shutting down background jobs, please wait a moment...
Done!
Waiting for the remaining 14 operations to synchronize with Neptune. Do not kill this process.
All 14 operations synced, thanks for waiting!
Explore the metadata in the Neptune app:
https://app.neptune.ai/ba-final/cwt-2/e/CWT2-372/metadata
https://app.neptune.ai/ba-final/cwt-2/e/CWT2-373
Split 1, loss train 0.02, score train 0.66, loss val 0.02 score val 0.70
Shutting down background jobs, please wait a moment...
Done!
Waiting for the remaining 14 operations to synchronize with Neptune. Do not kill this process.
All 14 operations synced, thanks for waiting!
Explore the metadata in the Neptune app:
https://app.neptune.ai/ba-final/cwt-2/e/CWT2-373/metadata
https://app.neptune.ai/ba-final/cwt-2/e/CWT2-374
Split 2, loss train 0.02, score train 0.68, loss val 0.03 score val 0.67
Shutting down background jobs, please wait a moment...
Done!
Waiting for the remaining 13 operations to synchronize with Neptune. Do not kill this process.
All 13 operations synced, thanks for waiting!
Explore the metadata in the Neptune app:
https://app.neptune.ai/ba-final/cwt-2/e/CWT2-374/metadata
https://app.neptune.ai/ba-final/cwt-2/e/CWT2-375
Split 3, loss train 0.02, score train 0.65, loss val 0.03 score val 0.52
Shutting down background jobs, please wait a moment...
Done!
Waiting for the remaining 10 operations to synchronize with Neptune. Do not kill this process.
All 10 operations synced, thanks for waiting!
Explore the metadata in the Neptune app:
https://app.neptune.ai/ba-final/cwt-2/e/CWT2-375/metadata
https://app.neptune.ai/ba-final/cwt-2/e/CWT2-376
Split 4, loss train 0.02, score train 0.65, loss val 0.02 score val 0.73
Shutting down background jobs, please wait a moment...
Done!
Waiting for the remaining 14 operations to synchronize with Neptune. Do not kill this process.
All 14 operations synced, thanks for waiting!
Explore the metadata in the Neptune app:
https://app.neptune.ai/ba-final/cwt-2/e/CWT2-376/metadata
