[32m[I 2023-09-06 13:53:57,103][0m Trial 40 finished with value: 0.09102458548038564 and parameters: {'b': 0.8, 'fc': 2.3, 'scale_min': 1.1, 'scale_max': 50, 'n_scales': 140, 'drop': 0.2953569130789678, 'optimizer': 'SGD', 'lr': 0.0011268499779684125, 'weight_decay': 0.001593282638185701, 'batch_size': 32, 'epochs': 100}. Best is trial 39 with value: 0.059480871038233976.[0m
trial 40, loss train mean 0.06, score train mean 0.51, loss val mean 0.09, score val mean 0.63



End Time   : Mi 6. Sep 13:53:59 CEST 2023
Duration   : 19977.838343554 seconds

Start Time : Mi 6. Sep 13:54:00 CEST 2023
Job ID: 1157263
Node: cc1g07
Partition: gpu_normal_stud
CPU cores: 16
Memory: 98304
GPUs: 0
Python environment: khoa                  *  /home/phamanh/anaconda3/envs/khoa
Current work directory: /home/phamanh/Schreibtisch/bachelorarbeit/ts_im_CNN

device: cuda


https://app.neptune.ai/ba-final/cwt-2/e/CWT2-170
Split 0, loss train 0.06, score train 0.51, loss val 0.17 score val 0.70
Shutting down background jobs, please wait a moment...
Done!
Waiting for the remaining 10 operations to synchronize with Neptune. Do not kill this process.
All 10 operations synced, thanks for waiting!
Explore the metadata in the Neptune app:
https://app.neptune.ai/ba-final/cwt-2/e/CWT2-170/metadata
https://app.neptune.ai/ba-final/cwt-2/e/CWT2-171
Split 1, loss train 0.06, score train 0.51, loss val 0.07 score val 0.44
Shutting down background jobs, please wait a moment...
Done!
Waiting for the remaining 10 operations to synchronize with Neptune. Do not kill this process.
All 10 operations synced, thanks for waiting!
Explore the metadata in the Neptune app:
https://app.neptune.ai/ba-final/cwt-2/e/CWT2-171/metadata
https://app.neptune.ai/ba-final/cwt-2/e/CWT2-172
Split 2, loss train 0.07, score train 0.50, loss val 0.11 score val 0.68
Shutting down background jobs, please wait a moment...
Done!
Waiting for the remaining 14 operations to synchronize with Neptune. Do not kill this process.
All 14 operations synced, thanks for waiting!
Explore the metadata in the Neptune app:
https://app.neptune.ai/ba-final/cwt-2/e/CWT2-172/metadata
https://app.neptune.ai/ba-final/cwt-2/e/CWT2-173
Split 3, loss train 0.06, score train 0.52, loss val 0.07 score val 0.59
Shutting down background jobs, please wait a moment...
Done!
Waiting for the remaining 10 operations to synchronize with Neptune. Do not kill this process.
All 10 operations synced, thanks for waiting!
Explore the metadata in the Neptune app:
https://app.neptune.ai/ba-final/cwt-2/e/CWT2-173/metadata
https://app.neptune.ai/ba-final/cwt-2/e/CWT2-174
Split 4, loss train 0.06, score train 0.51, loss val 0.13 score val 0.31
Shutting down background jobs, please wait a moment...
Done!
Waiting for the remaining 10 operations to synchronize with Neptune. Do not kill this process.
All 10 operations synced, thanks for waiting!
Explore the metadata in the Neptune app:
https://app.neptune.ai/ba-final/cwt-2/e/CWT2-174/metadata
[32m[I 2023-09-06 18:33:22,379][0m Trial 41 finished with value: 0.10849587359326951 and parameters: {'b': 1.0, 'fc': 2.3, 'scale_min': 1.3, 'scale_max': 50, 'n_scales': 140, 'drop': 0.2953861336087173, 'optimizer': 'SGD', 'lr': 0.0011268499779684125, 'weight_decay': 0.0011974762587265893, 'batch_size': 32, 'epochs': 100}. Best is trial 39 with value: 0.059480871038233976.[0m
trial 41, loss train mean 0.06, score train mean 0.51, loss val mean 0.11, score val mean 0.54



End Time   : Mi 6. Sep 18:33:24 CEST 2023
Duration   : 16763.714838617 seconds

Start Time : Mi 6. Sep 18:33:26 CEST 2023
Job ID: 1157264
Node: cc1g06
Partition: gpu_normal_stud
CPU cores: 16
Memory: 98304
GPUs: 0
Python environment: khoa                  *  /home/phamanh/anaconda3/envs/khoa
Current work directory: /home/phamanh/Schreibtisch/bachelorarbeit/ts_im_CNN

device: cuda


https://app.neptune.ai/ba-final/cwt-2/e/CWT2-175
Split 0, loss train 0.06, score train 0.53, loss val 0.09 score val 0.65
Shutting down background jobs, please wait a moment...
Done!
Waiting for the remaining 10 operations to synchronize with Neptune. Do not kill this process.
All 10 operations synced, thanks for waiting!
Explore the metadata in the Neptune app:
https://app.neptune.ai/ba-final/cwt-2/e/CWT2-175/metadata
https://app.neptune.ai/ba-final/cwt-2/e/CWT2-176
Split 1, loss train 0.06, score train 0.51, loss val 0.07 score val 0.72
Shutting down background jobs, please wait a moment...
Done!
Waiting for the remaining 10 operations to synchronize with Neptune. Do not kill this process.
All 10 operations synced, thanks for waiting!
Explore the metadata in the Neptune app:
https://app.neptune.ai/ba-final/cwt-2/e/CWT2-176/metadata
https://app.neptune.ai/ba-final/cwt-2/e/CWT2-177
Split 2, loss train 0.06, score train 0.51, loss val 0.11 score val 0.70
Shutting down background jobs, please wait a moment...
Done!
Waiting for the remaining 14 operations to synchronize with Neptune. Do not kill this process.
All 14 operations synced, thanks for waiting!
Explore the metadata in the Neptune app:
https://app.neptune.ai/ba-final/cwt-2/e/CWT2-177/metadata
https://app.neptune.ai/ba-final/cwt-2/e/CWT2-178
Split 3, loss train 0.05, score train 0.55, loss val 0.11 score val 0.77
Shutting down background jobs, please wait a moment...
Done!
Waiting for the remaining 10 operations to synchronize with Neptune. Do not kill this process.
All 10 operations synced, thanks for waiting!
Explore the metadata in the Neptune app:
https://app.neptune.ai/ba-final/cwt-2/e/CWT2-178/metadata
https://app.neptune.ai/ba-final/cwt-2/e/CWT2-179
Split 4, loss train 0.06, score train 0.54, loss val 0.08 score val 0.36
Shutting down background jobs, please wait a moment...
Done!
Waiting for the remaining 10 operations to synchronize with Neptune. Do not kill this process.
All 10 operations synced, thanks for waiting!
Explore the metadata in the Neptune app:
https://app.neptune.ai/ba-final/cwt-2/e/CWT2-179/metadata
[32m[I 2023-09-06 23:32:23,694][0m Trial 42 finished with value: 0.09242456720230427 and parameters: {'b': 0.8, 'fc': 2.5, 'scale_min': 0.9, 'scale_max': 50, 'n_scales': 145, 'drop': 0.30341993561132935, 'optimizer': 'SGD', 'lr': 0.0016053919107579344, 'weight_decay': 0.0020480563714770075, 'batch_size': 32, 'epochs': 100}. Best is trial 39 with value: 0.059480871038233976.[0m
trial 42, loss train mean 0.06, score train mean 0.53, loss val mean 0.09, score val mean 0.64



End Time   : Mi 6. Sep 23:32:26 CEST 2023
Duration   : 17939.975042847 seconds

Start Time : Do 7. Sep 01:57:59 CEST 2023
Job ID: 1157265
Node: hades
Partition: gpu_normal_stud
CPU cores: 16
Memory: 98304
GPUs: 0
Python environment: khoa                  *  /home/phamanh/anaconda3/envs/khoa
Current work directory: /home/phamanh/Schreibtisch/bachelorarbeit/ts_im_CNN

device: cuda


https://app.neptune.ai/ba-final/cwt-2/e/CWT2-180
Split 0, loss train 0.06, score train 0.52, loss val 0.10 score val 0.70
Shutting down background jobs, please wait a moment...
Done!
Waiting for the remaining 14 operations to synchronize with Neptune. Do not kill this process.
All 14 operations synced, thanks for waiting!
Explore the metadata in the Neptune app:
https://app.neptune.ai/ba-final/cwt-2/e/CWT2-180/metadata
https://app.neptune.ai/ba-final/cwt-2/e/CWT2-181
Split 1, loss train 0.06, score train 0.51, loss val 0.03 score val 0.62
Shutting down background jobs, please wait a moment...
Done!
Waiting for the remaining 10 operations to synchronize with Neptune. Do not kill this process.
All 10 operations synced, thanks for waiting!
Explore the metadata in the Neptune app:
https://app.neptune.ai/ba-final/cwt-2/e/CWT2-181/metadata
https://app.neptune.ai/ba-final/cwt-2/e/CWT2-182
Split 2, loss train 0.06, score train 0.50, loss val 0.12 score val 0.62
Shutting down background jobs, please wait a moment...
Done!
Waiting for the remaining 14 operations to synchronize with Neptune. Do not kill this process.
All 14 operations synced, thanks for waiting!
Explore the metadata in the Neptune app:
https://app.neptune.ai/ba-final/cwt-2/e/CWT2-182/metadata
https://app.neptune.ai/ba-final/cwt-2/e/CWT2-183
Split 3, loss train 0.06, score train 0.51, loss val 0.11 score val 0.56
Shutting down background jobs, please wait a moment...
Done!
Waiting for the remaining 10 operations to synchronize with Neptune. Do not kill this process.
All 10 operations synced, thanks for waiting!
Explore the metadata in the Neptune app:
https://app.neptune.ai/ba-final/cwt-2/e/CWT2-183/metadata
https://app.neptune.ai/ba-final/cwt-2/e/CWT2-184
Split 4, loss train 0.06, score train 0.53, loss val 0.09 score val 0.24
Shutting down background jobs, please wait a moment...
Done!
Waiting for the remaining 10 operations to synchronize with Neptune. Do not kill this process.
All 10 operations synced, thanks for waiting!
Explore the metadata in the Neptune app:
https://app.neptune.ai/ba-final/cwt-2/e/CWT2-184/metadata
[32m[I 2023-09-07 05:43:01,061][0m Trial 43 finished with value: 0.09176382663402152 and parameters: {'b': 1.0, 'fc': 2.3, 'scale_min': 0.8, 'scale_max': 46, 'n_scales': 155, 'drop': 0.30341993561132935, 'optimizer': 'SGD', 'lr': 0.0010921943011131256, 'weight_decay': 0.002137559978660367, 'batch_size': 32, 'epochs': 100}. Best is trial 39 with value: 0.059480871038233976.[0m
trial 43, loss train mean 0.06, score train mean 0.51, loss val mean 0.09, score val mean 0.55



End Time   : Do 7. Sep 05:43:02 CEST 2023
Duration   : 13503.031732590 seconds

Start Time : Do 7. Sep 05:43:06 CEST 2023
Job ID: 1157266
Node: cc1g05
Partition: gpu_normal_stud
CPU cores: 16
Memory: 98304
GPUs: 0
Python environment: khoa                  *  /home/phamanh/anaconda3/envs/khoa
Current work directory: /home/phamanh/Schreibtisch/bachelorarbeit/ts_im_CNN

device: cuda


https://app.neptune.ai/ba-final/cwt-2/e/CWT2-185
Shutting down background jobs, please wait a moment...
Done!
Waiting for the remaining 7 operations to synchronize with Neptune. Do not kill this process.
All 7 operations synced, thanks for waiting!
Explore the metadata in the Neptune app:
https://app.neptune.ai/ba-final/cwt-2/e/CWT2-185/metadata
[32m[I 2023-09-07 07:11:01,137][0m Trial 44 pruned. [0m

End Time   : Do 7. Sep 07:11:04 CEST 2023
Duration   : 5278.860761375 seconds

Start Time : Do 7. Sep 07:11:06 CEST 2023
Job ID: 1157267
Node: cc1g03
Partition: gpu_normal_stud
CPU cores: 16
Memory: 98304
GPUs: 0
Python environment: khoa                  *  /home/phamanh/anaconda3/envs/khoa
Current work directory: /home/phamanh/Schreibtisch/bachelorarbeit/ts_im_CNN

device: cuda


https://app.neptune.ai/ba-final/cwt-2/e/CWT2-186
Shutting down background jobs, please wait a moment...
Done!
Waiting for the remaining 3 operations to synchronize with Neptune. Do not kill this process.
All 3 operations synced, thanks for waiting!
Explore the metadata in the Neptune app:
https://app.neptune.ai/ba-final/cwt-2/e/CWT2-186/metadata
[32m[I 2023-09-07 08:28:47,148][0m Trial 45 pruned. [0m

End Time   : Do 7. Sep 08:28:49 CEST 2023
Duration   : 4663.768059231 seconds

Start Time : Do 7. Sep 08:28:51 CEST 2023
Job ID: 1157268
Node: cc1g03
Partition: gpu_normal_stud
CPU cores: 16
Memory: 98304
GPUs: 0
Python environment: khoa                  *  /home/phamanh/anaconda3/envs/khoa
Current work directory: /home/phamanh/Schreibtisch/bachelorarbeit/ts_im_CNN

device: cuda


https://app.neptune.ai/ba-final/cwt-2/e/CWT2-187
Split 0, loss train 0.06, score train 0.52, loss val 0.09 score val 0.76
Shutting down background jobs, please wait a moment...
Done!
Waiting for the remaining 10 operations to synchronize with Neptune. Do not kill this process.
All 10 operations synced, thanks for waiting!
Explore the metadata in the Neptune app:
https://app.neptune.ai/ba-final/cwt-2/e/CWT2-187/metadata
https://app.neptune.ai/ba-final/cwt-2/e/CWT2-188
Split 1, loss train 0.06, score train 0.52, loss val 0.09 score val 0.65
Shutting down background jobs, please wait a moment...
Done!
Waiting for the remaining 14 operations to synchronize with Neptune. Do not kill this process.
All 14 operations synced, thanks for waiting!
Explore the metadata in the Neptune app:
https://app.neptune.ai/ba-final/cwt-2/e/CWT2-188/metadata
https://app.neptune.ai/ba-final/cwt-2/e/CWT2-189
Split 2, loss train 0.07, score train 0.51, loss val 0.16 score val 0.72
Shutting down background jobs, please wait a moment...
Done!
Waiting for the remaining 10 operations to synchronize with Neptune. Do not kill this process.
All 10 operations synced, thanks for waiting!
Explore the metadata in the Neptune app:
https://app.neptune.ai/ba-final/cwt-2/e/CWT2-189/metadata
https://app.neptune.ai/ba-final/cwt-2/e/CWT2-190
Split 3, loss train 0.06, score train 0.54, loss val 0.13 score val 0.64
Shutting down background jobs, please wait a moment...
Done!
Waiting for the remaining 10 operations to synchronize with Neptune. Do not kill this process.
All 10 operations synced, thanks for waiting!
Explore the metadata in the Neptune app:
https://app.neptune.ai/ba-final/cwt-2/e/CWT2-190/metadata
https://app.neptune.ai/ba-final/cwt-2/e/CWT2-191
Split 4, loss train 0.06, score train 0.52, loss val 0.15 score val 0.53
Shutting down background jobs, please wait a moment...
Done!
Waiting for the remaining 10 operations to synchronize with Neptune. Do not kill this process.
All 10 operations synced, thanks for waiting!
Explore the metadata in the Neptune app:
https://app.neptune.ai/ba-final/cwt-2/e/CWT2-191/metadata
[32m[I 2023-09-07 13:27:02,812][0m Trial 46 finished with value: 0.12317778607632253 and parameters: {'b': 1.25, 'fc': 2.2, 'scale_min': 1.2000000000000002, 'scale_max': 44, 'n_scales': 185, 'drop': 0.30341993561132935, 'optimizer': 'SGD', 'lr': 0.0015776226238318094, 'weight_decay': 0.0008361689874739454, 'batch_size': 32, 'epochs': 100}. Best is trial 39 with value: 0.059480871038233976.[0m
trial 46, loss train mean 0.06, score train mean 0.52, loss val mean 0.12, score val mean 0.66



End Time   : Do 7. Sep 13:27:04 CEST 2023
Duration   : 17893.673378284 seconds

Start Time : Do 7. Sep 13:27:05 CEST 2023
Job ID: 1157269
Node: cc1g03
Partition: gpu_normal_stud
CPU cores: 16
Memory: 98304
GPUs: 0
Python environment: khoa                  *  /home/phamanh/anaconda3/envs/khoa
Current work directory: /home/phamanh/Schreibtisch/bachelorarbeit/ts_im_CNN

device: cuda


https://app.neptune.ai/ba-final/cwt-2/e/CWT2-192
Split 0, loss train 0.06, score train 0.52, loss val 0.06 score val 0.75
Shutting down background jobs, please wait a moment...
Done!
Waiting for the remaining 10 operations to synchronize with Neptune. Do not kill this process.
All 10 operations synced, thanks for waiting!
Explore the metadata in the Neptune app:
https://app.neptune.ai/ba-final/cwt-2/e/CWT2-192/metadata
https://app.neptune.ai/ba-final/cwt-2/e/CWT2-193
Split 1, loss train 0.06, score train 0.51, loss val 0.03 score val 0.73
Shutting down background jobs, please wait a moment...
Done!
Waiting for the remaining 10 operations to synchronize with Neptune. Do not kill this process.
All 10 operations synced, thanks for waiting!
Explore the metadata in the Neptune app:
https://app.neptune.ai/ba-final/cwt-2/e/CWT2-193/metadata
https://app.neptune.ai/ba-final/cwt-2/e/CWT2-194
Split 2, loss train 0.06, score train 0.51, loss val 0.10 score val 0.70
Shutting down background jobs, please wait a moment...
Done!
Waiting for the remaining 10 operations to synchronize with Neptune. Do not kill this process.
All 10 operations synced, thanks for waiting!
Explore the metadata in the Neptune app:
https://app.neptune.ai/ba-final/cwt-2/e/CWT2-194/metadata
https://app.neptune.ai/ba-final/cwt-2/e/CWT2-195
Split 3, loss train 0.06, score train 0.51, loss val 0.08 score val 0.34
Shutting down background jobs, please wait a moment...
Done!
Waiting for the remaining 14 operations to synchronize with Neptune. Do not kill this process.
All 14 operations synced, thanks for waiting!
Explore the metadata in the Neptune app:
https://app.neptune.ai/ba-final/cwt-2/e/CWT2-195/metadata
https://app.neptune.ai/ba-final/cwt-2/e/CWT2-196
Split 4, loss train 0.06, score train 0.50, loss val 0.06 score val 0.43
Shutting down background jobs, please wait a moment...
Done!
Waiting for the remaining 10 operations to synchronize with Neptune. Do not kill this process.
All 10 operations synced, thanks for waiting!
Explore the metadata in the Neptune app:
https://app.neptune.ai/ba-final/cwt-2/e/CWT2-196/metadata
[32m[I 2023-09-07 17:55:57,962][0m Trial 47 finished with value: 0.06684907395788965 and parameters: {'b': 1.5, 'fc': 2.2, 'scale_min': 1.9000000000000001, 'scale_max': 48, 'n_scales': 125, 'drop': 0.27190404241794847, 'optimizer': 'SGD', 'lr': 0.0010921943011131256, 'weight_decay': 0.0003637723426757576, 'batch_size': 32, 'epochs': 100}. Best is trial 39 with value: 0.059480871038233976.[0m
trial 47, loss train mean 0.06, score train mean 0.51, loss val mean 0.07, score val mean 0.59



End Time   : Do 7. Sep 17:56:00 CEST 2023
Duration   : 16134.526598318 seconds

Start Time : Do 7. Sep 18:40:38 CEST 2023
Job ID: 1157270
Node: persephone
Partition: gpu_normal_stud
CPU cores: 16
Memory: 98304
GPUs: 0
Python environment: khoa                  *  /home/phamanh/anaconda3/envs/khoa
Current work directory: /home/phamanh/Schreibtisch/bachelorarbeit/ts_im_CNN

device: cuda


https://app.neptune.ai/ba-final/cwt-2/e/CWT2-197
Split 0, loss train 0.06, score train 0.54, loss val 0.10 score val 0.62
Shutting down background jobs, please wait a moment...
Done!
Waiting for the remaining 14 operations to synchronize with Neptune. Do not kill this process.
All 14 operations synced, thanks for waiting!
Explore the metadata in the Neptune app:
https://app.neptune.ai/ba-final/cwt-2/e/CWT2-197/metadata
https://app.neptune.ai/ba-final/cwt-2/e/CWT2-198
Split 1, loss train 0.06, score train 0.54, loss val 0.07 score val 0.40
Shutting down background jobs, please wait a moment...
Done!
Waiting for the remaining 10 operations to synchronize with Neptune. Do not kill this process.
All 10 operations synced, thanks for waiting!
Explore the metadata in the Neptune app:
https://app.neptune.ai/ba-final/cwt-2/e/CWT2-198/metadata
https://app.neptune.ai/ba-final/cwt-2/e/CWT2-199
Split 2, loss train 0.06, score train 0.53, loss val 0.11 score val 0.72
Shutting down background jobs, please wait a moment...
Done!
Waiting for the remaining 10 operations to synchronize with Neptune. Do not kill this process.
All 10 operations synced, thanks for waiting!
Explore the metadata in the Neptune app:
https://app.neptune.ai/ba-final/cwt-2/e/CWT2-199/metadata
https://app.neptune.ai/ba-final/cwt-2/e/CWT2-200
Split 3, loss train 0.05, score train 0.57, loss val 0.08 score val 0.49
Shutting down background jobs, please wait a moment...
Done!
Waiting for the remaining 10 operations to synchronize with Neptune. Do not kill this process.
All 10 operations synced, thanks for waiting!
Explore the metadata in the Neptune app:
https://app.neptune.ai/ba-final/cwt-2/e/CWT2-200/metadata
https://app.neptune.ai/ba-final/cwt-2/e/CWT2-201
Split 4, loss train 0.06, score train 0.56, loss val 0.10 score val 0.59
Shutting down background jobs, please wait a moment...
Done!
Waiting for the remaining 10 operations to synchronize with Neptune. Do not kill this process.
All 10 operations synced, thanks for waiting!
Explore the metadata in the Neptune app:
https://app.neptune.ai/ba-final/cwt-2/e/CWT2-201/metadata
