[32m[I 2023-09-08 02:20:44,247][0m Trial 48 finished with value: 0.09193211007625499 and parameters: {'b': 1.5, 'fc': 2.2, 'scale_min': 1.3, 'scale_max': 48, 'n_scales': 125, 'drop': 0.2590568275837348, 'optimizer': 'SGD', 'lr': 0.001980530640202352, 'weight_decay': 0.00038258541981200543, 'batch_size': 32, 'epochs': 100}. Best is trial 39 with value: 0.059480871038233976.[0m
trial 48, loss train mean 0.06, score train mean 0.55, loss val mean 0.09, score val mean 0.56



End Time   : Fr 8. Sep 02:20:46 CEST 2023
Duration   : 27607.803755851 seconds

Start Time : Fr 8. Sep 02:20:48 CEST 2023
Job ID: 1157271
Node: cc1g05
Partition: gpu_normal_stud
CPU cores: 16
Memory: 98304
GPUs: 0
Python environment: khoa                  *  /home/phamanh/anaconda3/envs/khoa
Current work directory: /home/phamanh/Schreibtisch/bachelorarbeit/ts_im_CNN

device: cuda


https://app.neptune.ai/ba-final/cwt-2/e/CWT2-202
Split 0, loss train 0.06, score train 0.55, loss val 0.28 score val 0.76
Shutting down background jobs, please wait a moment...
Done!
Waiting for the remaining 14 operations to synchronize with Neptune. Do not kill this process.
All 14 operations synced, thanks for waiting!
Explore the metadata in the Neptune app:
https://app.neptune.ai/ba-final/cwt-2/e/CWT2-202/metadata
https://app.neptune.ai/ba-final/cwt-2/e/CWT2-203
Split 1, loss train 0.05, score train 0.56, loss val 0.06 score val 0.67
Shutting down background jobs, please wait a moment...
Done!
Waiting for the remaining 10 operations to synchronize with Neptune. Do not kill this process.
All 10 operations synced, thanks for waiting!
Explore the metadata in the Neptune app:
https://app.neptune.ai/ba-final/cwt-2/e/CWT2-203/metadata
https://app.neptune.ai/ba-final/cwt-2/e/CWT2-204
Split 2, loss train 0.06, score train 0.55, loss val 0.08 score val 0.60
Shutting down background jobs, please wait a moment...
Done!
Waiting for the remaining 10 operations to synchronize with Neptune. Do not kill this process.
All 10 operations synced, thanks for waiting!
Explore the metadata in the Neptune app:
https://app.neptune.ai/ba-final/cwt-2/e/CWT2-204/metadata
https://app.neptune.ai/ba-final/cwt-2/e/CWT2-205
Split 3, loss train 0.06, score train 0.57, loss val 0.22 score val 0.47
Shutting down background jobs, please wait a moment...
Done!
Waiting for the remaining 10 operations to synchronize with Neptune. Do not kill this process.
All 10 operations synced, thanks for waiting!
Explore the metadata in the Neptune app:
https://app.neptune.ai/ba-final/cwt-2/e/CWT2-205/metadata
https://app.neptune.ai/ba-final/cwt-2/e/CWT2-206
Split 4, loss train 0.06, score train 0.55, loss val 0.23 score val 0.73
Shutting down background jobs, please wait a moment...
Done!
Waiting for the remaining 10 operations to synchronize with Neptune. Do not kill this process.
All 10 operations synced, thanks for waiting!
Explore the metadata in the Neptune app:
https://app.neptune.ai/ba-final/cwt-2/e/CWT2-206/metadata
[32m[I 2023-09-08 06:48:36,611][0m Trial 49 finished with value: 0.17280094978657173 and parameters: {'b': 1.05, 'fc': 2.4000000000000004, 'scale_min': 1.9000000000000001, 'scale_max': 44, 'n_scales': 135, 'drop': 0.27190404241794847, 'optimizer': 'SGD', 'lr': 0.002407428941923173, 'weight_decay': 0.00039319101110332327, 'batch_size': 32, 'epochs': 100}. Best is trial 39 with value: 0.059480871038233976.[0m
trial 49, loss train mean 0.06, score train mean 0.55, loss val mean 0.17, score val mean 0.65



End Time   : Fr 8. Sep 06:48:38 CEST 2023
Duration   : 16070.355415948 seconds

Start Time : Fr 8. Sep 07:41:53 CEST 2023
Job ID: 1158433
Node: cc1g04
Partition: gpu_normal_stud
CPU cores: 16
Memory: 98304
GPUs: 0
Python environment: khoa                  *  /home/phamanh/anaconda3/envs/khoa
Current work directory: /home/phamanh/Schreibtisch/bachelorarbeit/ts_im_CNN

device: cuda


https://app.neptune.ai/ba-final/cwt-2/e/CWT2-207
Shutting down background jobs, please wait a moment...
Done!
Waiting for the remaining 3 operations to synchronize with Neptune. Do not kill this process.
All 3 operations synced, thanks for waiting!
Explore the metadata in the Neptune app:
https://app.neptune.ai/ba-final/cwt-2/e/CWT2-207/metadata
[32m[I 2023-09-08 09:29:32,046][0m Trial 50 pruned. [0m

End Time   : Fr 8. Sep 09:29:37 CEST 2023
Duration   : 6464.446767422 seconds

Start Time : Fr 8. Sep 10:26:31 CEST 2023
Job ID: 1158434
Node: cc1g05
Partition: gpu_normal_stud
CPU cores: 16
Memory: 98304
GPUs: 0
Python environment: khoa                  *  /home/phamanh/anaconda3/envs/khoa
Current work directory: /home/phamanh/Schreibtisch/bachelorarbeit/ts_im_CNN

device: cuda


https://app.neptune.ai/ba-final/cwt-2/e/CWT2-208
Shutting down background jobs, please wait a moment...
Done!
Waiting for the remaining 3 operations to synchronize with Neptune. Do not kill this process.
All 3 operations synced, thanks for waiting!
Explore the metadata in the Neptune app:
https://app.neptune.ai/ba-final/cwt-2/e/CWT2-208/metadata
[32m[I 2023-09-08 11:38:57,533][0m Trial 51 pruned. [0m

End Time   : Fr 8. Sep 11:39:00 CEST 2023
Duration   : 4349.451947585 seconds

Start Time : Fr 8. Sep 11:39:19 CEST 2023
Job ID: 1158435
Node: cc1g05
Partition: gpu_normal_stud
CPU cores: 16
Memory: 98304
GPUs: 0
Python environment: khoa                  *  /home/phamanh/anaconda3/envs/khoa
Current work directory: /home/phamanh/Schreibtisch/bachelorarbeit/ts_im_CNN

device: cuda


https://app.neptune.ai/ba-final/cwt-2/e/CWT2-209
Split 0, loss train 0.05, score train 0.53, loss val 0.19 score val 0.76
Shutting down background jobs, please wait a moment...
Done!
Waiting for the remaining 18 operations to synchronize with Neptune. Do not kill this process.
All 18 operations synced, thanks for waiting!
Explore the metadata in the Neptune app:
https://app.neptune.ai/ba-final/cwt-2/e/CWT2-209/metadata
https://app.neptune.ai/ba-final/cwt-2/e/CWT2-210
Split 1, loss train 0.05, score train 0.55, loss val 0.04 score val 0.75
Shutting down background jobs, please wait a moment...
Done!
Waiting for the remaining 14 operations to synchronize with Neptune. Do not kill this process.
All 14 operations synced, thanks for waiting!
Explore the metadata in the Neptune app:
https://app.neptune.ai/ba-final/cwt-2/e/CWT2-210/metadata
https://app.neptune.ai/ba-final/cwt-2/e/CWT2-211
Split 2, loss train 0.06, score train 0.52, loss val 0.14 score val 0.75
Shutting down background jobs, please wait a moment...
Done!
Waiting for the remaining 10 operations to synchronize with Neptune. Do not kill this process.
All 10 operations synced, thanks for waiting!
Explore the metadata in the Neptune app:
https://app.neptune.ai/ba-final/cwt-2/e/CWT2-211/metadata
https://app.neptune.ai/ba-final/cwt-2/e/CWT2-212
Split 3, loss train 0.05, score train 0.53, loss val 0.11 score val 0.75
Shutting down background jobs, please wait a moment...
Done!
Waiting for the remaining 10 operations to synchronize with Neptune. Do not kill this process.
All 10 operations synced, thanks for waiting!
Explore the metadata in the Neptune app:
https://app.neptune.ai/ba-final/cwt-2/e/CWT2-212/metadata
https://app.neptune.ai/ba-final/cwt-2/e/CWT2-213
Split 4, loss train 0.05, score train 0.55, loss val 0.06 score val 0.48
Shutting down background jobs, please wait a moment...
Done!
Waiting for the remaining 10 operations to synchronize with Neptune. Do not kill this process.
All 10 operations synced, thanks for waiting!
Explore the metadata in the Neptune app:
https://app.neptune.ai/ba-final/cwt-2/e/CWT2-213/metadata
[32m[I 2023-09-08 16:22:47,005][0m Trial 52 finished with value: 0.10793928744945121 and parameters: {'b': 0.9500000000000001, 'fc': 2.4000000000000004, 'scale_min': 1.4, 'scale_max': 44, 'n_scales': 150, 'drop': 0.31024699890252394, 'optimizer': 'SGD', 'lr': 0.0014132308242471834, 'weight_decay': 0.00405073472352074, 'batch_size': 32, 'epochs': 100}. Best is trial 39 with value: 0.059480871038233976.[0m
trial 52, loss train mean 0.05, score train mean 0.54, loss val mean 0.11, score val mean 0.70



End Time   : Fr 8. Sep 16:22:48 CEST 2023
Duration   : 17009.559476757 seconds

Start Time : Fr 8. Sep 16:23:05 CEST 2023
Job ID: 1158436
Node: cc1g05
Partition: gpu_normal_stud
CPU cores: 16
Memory: 98304
GPUs: 0
Python environment: khoa                  *  /home/phamanh/anaconda3/envs/khoa
Current work directory: /home/phamanh/Schreibtisch/bachelorarbeit/ts_im_CNN

device: cuda


https://app.neptune.ai/ba-final/cwt-2/e/CWT2-214
Split 0, loss train 0.06, score train 0.52, loss val 0.06 score val 0.71
Shutting down background jobs, please wait a moment...
Done!
Waiting for the remaining 9 operations to synchronize with Neptune. Do not kill this process.
All 9 operations synced, thanks for waiting!
Explore the metadata in the Neptune app:
https://app.neptune.ai/ba-final/cwt-2/e/CWT2-214/metadata
https://app.neptune.ai/ba-final/cwt-2/e/CWT2-215
Split 1, loss train 0.06, score train 0.51, loss val 0.04 score val 0.73
Shutting down background jobs, please wait a moment...
Done!
Waiting for the remaining 10 operations to synchronize with Neptune. Do not kill this process.
All 10 operations synced, thanks for waiting!
Explore the metadata in the Neptune app:
https://app.neptune.ai/ba-final/cwt-2/e/CWT2-215/metadata
https://app.neptune.ai/ba-final/cwt-2/e/CWT2-216
Split 2, loss train 0.06, score train 0.51, loss val 0.05 score val 0.73
Shutting down background jobs, please wait a moment...
Done!
Waiting for the remaining 10 operations to synchronize with Neptune. Do not kill this process.
All 10 operations synced, thanks for waiting!
Explore the metadata in the Neptune app:
https://app.neptune.ai/ba-final/cwt-2/e/CWT2-216/metadata
https://app.neptune.ai/ba-final/cwt-2/e/CWT2-217
Split 3, loss train 0.06, score train 0.52, loss val 0.06 score val 0.50
Shutting down background jobs, please wait a moment...
Done!
Waiting for the remaining 10 operations to synchronize with Neptune. Do not kill this process.
All 10 operations synced, thanks for waiting!
Explore the metadata in the Neptune app:
https://app.neptune.ai/ba-final/cwt-2/e/CWT2-217/metadata
https://app.neptune.ai/ba-final/cwt-2/e/CWT2-218
Split 4, loss train 0.06, score train 0.51, loss val 0.11 score val 0.54
Shutting down background jobs, please wait a moment...
Done!
Waiting for the remaining 10 operations to synchronize with Neptune. Do not kill this process.
All 10 operations synced, thanks for waiting!
Explore the metadata in the Neptune app:
https://app.neptune.ai/ba-final/cwt-2/e/CWT2-218/metadata
[32m[I 2023-09-08 20:48:15,104][0m Trial 53 finished with value: 0.064926955040465 and parameters: {'b': 0.9500000000000001, 'fc': 2.3, 'scale_min': 0.9, 'scale_max': 48, 'n_scales': 115, 'drop': 0.2857917585936482, 'optimizer': 'SGD', 'lr': 0.0011515050389199824, 'weight_decay': 0.0014307943485821755, 'batch_size': 32, 'epochs': 100}. Best is trial 39 with value: 0.059480871038233976.[0m
trial 53, loss train mean 0.06, score train mean 0.51, loss val mean 0.06, score val mean 0.64



End Time   : Fr 8. Sep 20:48:16 CEST 2023
Duration   : 15911.451262429 seconds

Start Time : Fr 8. Sep 20:48:19 CEST 2023
Job ID: 1158437
Node: cc1g04
Partition: gpu_normal_stud
CPU cores: 16
Memory: 98304
GPUs: 0
Python environment: khoa                  *  /home/phamanh/anaconda3/envs/khoa
Current work directory: /home/phamanh/Schreibtisch/bachelorarbeit/ts_im_CNN

device: cuda


https://app.neptune.ai/ba-final/cwt-2/e/CWT2-219
Shutting down background jobs, please wait a moment...
Done!
Waiting for the remaining 7 operations to synchronize with Neptune. Do not kill this process.
All 7 operations synced, thanks for waiting!
Explore the metadata in the Neptune app:
https://app.neptune.ai/ba-final/cwt-2/e/CWT2-219/metadata
[32m[I 2023-09-08 21:51:06,861][0m Trial 54 pruned. [0m

End Time   : Fr 8. Sep 21:51:10 CEST 2023
Duration   : 3771.023325505 seconds

Start Time : Fr 8. Sep 21:51:11 CEST 2023
Job ID: 1158438
Node: cc1g04
Partition: gpu_normal_stud
CPU cores: 16
Memory: 98304
GPUs: 0
Python environment: khoa                  *  /home/phamanh/anaconda3/envs/khoa
Current work directory: /home/phamanh/Schreibtisch/bachelorarbeit/ts_im_CNN

device: cuda


https://app.neptune.ai/ba-final/cwt-2/e/CWT2-220
Split 0, loss train 0.06, score train 0.54, loss val 0.15 score val 0.55
Shutting down background jobs, please wait a moment...
Done!
Waiting for the remaining 14 operations to synchronize with Neptune. Do not kill this process.
All 14 operations synced, thanks for waiting!
Explore the metadata in the Neptune app:
https://app.neptune.ai/ba-final/cwt-2/e/CWT2-220/metadata
https://app.neptune.ai/ba-final/cwt-2/e/CWT2-221
Split 1, loss train 0.06, score train 0.54, loss val 0.05 score val 0.70
Shutting down background jobs, please wait a moment...
Done!
Waiting for the remaining 10 operations to synchronize with Neptune. Do not kill this process.
All 10 operations synced, thanks for waiting!
Explore the metadata in the Neptune app:
https://app.neptune.ai/ba-final/cwt-2/e/CWT2-221/metadata
https://app.neptune.ai/ba-final/cwt-2/e/CWT2-222
Split 2, loss train 0.07, score train 0.55, loss val 0.09 score val 0.73
Shutting down background jobs, please wait a moment...
Done!
Waiting for the remaining 10 operations to synchronize with Neptune. Do not kill this process.
All 10 operations synced, thanks for waiting!
Explore the metadata in the Neptune app:
https://app.neptune.ai/ba-final/cwt-2/e/CWT2-222/metadata
https://app.neptune.ai/ba-final/cwt-2/e/CWT2-223
Split 3, loss train 0.06, score train 0.56, loss val 0.31 score val 0.33
Shutting down background jobs, please wait a moment...
Done!
Waiting for the remaining 10 operations to synchronize with Neptune. Do not kill this process.
All 10 operations synced, thanks for waiting!
Explore the metadata in the Neptune app:
https://app.neptune.ai/ba-final/cwt-2/e/CWT2-223/metadata
https://app.neptune.ai/ba-final/cwt-2/e/CWT2-224
Split 4, loss train 0.06, score train 0.54, loss val 0.09 score val 0.68
Shutting down background jobs, please wait a moment...
Done!
Waiting for the remaining 10 operations to synchronize with Neptune. Do not kill this process.
All 10 operations synced, thanks for waiting!
Explore the metadata in the Neptune app:
https://app.neptune.ai/ba-final/cwt-2/e/CWT2-224/metadata
[32m[I 2023-09-09 03:02:38,019][0m Trial 55 finished with value: 0.1379123068870382 and parameters: {'b': 0.8, 'fc': 2.3, 'scale_min': 1.8, 'scale_max': 50, 'n_scales': 130, 'drop': 0.2717185289646032, 'optimizer': 'SGD', 'lr': 0.0022711170014123533, 'weight_decay': 0.00045621666984034797, 'batch_size': 32, 'epochs': 100}. Best is trial 39 with value: 0.059480871038233976.[0m
trial 55, loss train mean 0.06, score train mean 0.55, loss val mean 0.14, score val mean 0.60



End Time   : Sa 9. Sep 03:02:40 CEST 2023
Duration   : 18688.099786587 seconds

Start Time : Sa 9. Sep 03:02:41 CEST 2023
Job ID: 1158439
Node: cc1g04
Partition: gpu_normal_stud
CPU cores: 16
Memory: 98304
GPUs: 0
Python environment: khoa                  *  /home/phamanh/anaconda3/envs/khoa
Current work directory: /home/phamanh/Schreibtisch/bachelorarbeit/ts_im_CNN

device: cuda


https://app.neptune.ai/ba-final/cwt-2/e/CWT2-225
Shutting down background jobs, please wait a moment...
Done!
Waiting for the remaining 7 operations to synchronize with Neptune. Do not kill this process.
All 7 operations synced, thanks for waiting!
Explore the metadata in the Neptune app:
https://app.neptune.ai/ba-final/cwt-2/e/CWT2-225/metadata
[32m[I 2023-09-09 04:08:32,721][0m Trial 56 pruned. [0m

End Time   : Sa 9. Sep 04:08:35 CEST 2023
Duration   : 3953.906343532 seconds

Start Time : Sa 9. Sep 04:08:36 CEST 2023
Job ID: 1158440
Node: cc1g04
Partition: gpu_normal_stud
CPU cores: 16
Memory: 98304
GPUs: 0
Python environment: khoa                  *  /home/phamanh/anaconda3/envs/khoa
Current work directory: /home/phamanh/Schreibtisch/bachelorarbeit/ts_im_CNN

device: cuda


https://app.neptune.ai/ba-final/cwt-2/e/CWT2-226
Split 0, loss train 0.06, score train 0.51, loss val 0.12 score val 0.64
Shutting down background jobs, please wait a moment...
Done!
Waiting for the remaining 14 operations to synchronize with Neptune. Do not kill this process.
All 14 operations synced, thanks for waiting!
Explore the metadata in the Neptune app:
https://app.neptune.ai/ba-final/cwt-2/e/CWT2-226/metadata
https://app.neptune.ai/ba-final/cwt-2/e/CWT2-227
Split 1, loss train 0.06, score train 0.50, loss val 0.08 score val 0.66
Shutting down background jobs, please wait a moment...
Done!
Waiting for the remaining 10 operations to synchronize with Neptune. Do not kill this process.
All 10 operations synced, thanks for waiting!
Explore the metadata in the Neptune app:
https://app.neptune.ai/ba-final/cwt-2/e/CWT2-227/metadata
https://app.neptune.ai/ba-final/cwt-2/e/CWT2-228
Split 2, loss train 0.06, score train 0.49, loss val 0.07 score val 0.69
Shutting down background jobs, please wait a moment...
Done!
Waiting for the remaining 10 operations to synchronize with Neptune. Do not kill this process.
All 10 operations synced, thanks for waiting!
Explore the metadata in the Neptune app:
https://app.neptune.ai/ba-final/cwt-2/e/CWT2-228/metadata
https://app.neptune.ai/ba-final/cwt-2/e/CWT2-229
Split 3, loss train 0.06, score train 0.51, loss val 0.09 score val 0.30
Shutting down background jobs, please wait a moment...
Done!
Waiting for the remaining 10 operations to synchronize with Neptune. Do not kill this process.
All 10 operations synced, thanks for waiting!
Explore the metadata in the Neptune app:
https://app.neptune.ai/ba-final/cwt-2/e/CWT2-229/metadata
https://app.neptune.ai/ba-final/cwt-2/e/CWT2-230
Split 4, loss train 0.06, score train 0.50, loss val 0.09 score val 0.70
Shutting down background jobs, please wait a moment...
Done!
Waiting for the remaining 10 operations to synchronize with Neptune. Do not kill this process.
All 10 operations synced, thanks for waiting!
Explore the metadata in the Neptune app:
https://app.neptune.ai/ba-final/cwt-2/e/CWT2-230/metadata
[32m[I 2023-09-09 08:29:27,008][0m Trial 57 finished with value: 0.09111374388349817 and parameters: {'b': 1.2000000000000002, 'fc': 2.4000000000000004, 'scale_min': 1.1, 'scale_max': 40, 'n_scales': 130, 'drop': 0.28252190154553447, 'optimizer': 'SGD', 'lr': 0.0005934591038588191, 'weight_decay': 0.0006115608200921709, 'batch_size': 32, 'epochs': 100}. Best is trial 39 with value: 0.059480871038233976.[0m
trial 57, loss train mean 0.06, score train mean 0.50, loss val mean 0.09, score val mean 0.60



End Time   : Sa 9. Sep 08:29:29 CEST 2023
Duration   : 15652.601083005 seconds

Start Time : Sa 9. Sep 08:37:10 CEST 2023
Job ID: 1158441
Node: erebos
Partition: gpu_normal_stud
CPU cores: 16
Memory: 98304
GPUs: 0
Python environment: khoa                  *  /home/phamanh/anaconda3/envs/khoa
Current work directory: /home/phamanh/Schreibtisch/bachelorarbeit/ts_im_CNN

device: cuda


https://app.neptune.ai/ba-final/cwt-2/e/CWT2-231
Split 0, loss train 0.06, score train 0.51, loss val 0.13 score val 0.71
Shutting down background jobs, please wait a moment...
Done!
Waiting for the remaining 10 operations to synchronize with Neptune. Do not kill this process.
All 10 operations synced, thanks for waiting!
Explore the metadata in the Neptune app:
https://app.neptune.ai/ba-final/cwt-2/e/CWT2-231/metadata
https://app.neptune.ai/ba-final/cwt-2/e/CWT2-232
Split 1, loss train 0.06, score train 0.50, loss val 0.04 score val 0.72
Shutting down background jobs, please wait a moment...
Done!
Waiting for the remaining 14 operations to synchronize with Neptune. Do not kill this process.
All 14 operations synced, thanks for waiting!
Explore the metadata in the Neptune app:
https://app.neptune.ai/ba-final/cwt-2/e/CWT2-232/metadata
https://app.neptune.ai/ba-final/cwt-2/e/CWT2-233
Split 2, loss train 0.07, score train 0.49, loss val 0.07 score val 0.72
Shutting down background jobs, please wait a moment...
Done!
Waiting for the remaining 14 operations to synchronize with Neptune. Do not kill this process.
All 14 operations synced, thanks for waiting!
Explore the metadata in the Neptune app:
https://app.neptune.ai/ba-final/cwt-2/e/CWT2-233/metadata
https://app.neptune.ai/ba-final/cwt-2/e/CWT2-234
Split 3, loss train 0.06, score train 0.52, loss val 0.06 score val 0.59
Shutting down background jobs, please wait a moment...
Done!
Waiting for the remaining 14 operations to synchronize with Neptune. Do not kill this process.
All 14 operations synced, thanks for waiting!
Explore the metadata in the Neptune app:
https://app.neptune.ai/ba-final/cwt-2/e/CWT2-234/metadata
https://app.neptune.ai/ba-final/cwt-2/e/CWT2-235
Split 4, loss train 0.06, score train 0.50, loss val 0.10 score val 0.64
Shutting down background jobs, please wait a moment...
Done!
Waiting for the remaining 10 operations to synchronize with Neptune. Do not kill this process.
All 10 operations synced, thanks for waiting!
Explore the metadata in the Neptune app:
https://app.neptune.ai/ba-final/cwt-2/e/CWT2-235/metadata
