[32m[I 2023-09-05 01:26:05,017][0m Trial 32 finished with value: 0.11877031630658089 and parameters: {'b': 1.35, 'fc': 1.75, 'scale_min': 0.5, 'scale_max': 38, 'n_scales': 110, 'drop': 0.3826681350312213, 'optimizer': 'Adam', 'lr': 0.005673035571604818, 'weight_decay': 0.00025426794449821924, 'batch_size': 32, 'epochs': 100}. Best is trial 32 with value: 0.11877031630658089.[0m
trial 32, loss train mean 0.07, score train mean 0.45, loss val mean 0.12, score val mean 0.28



End Time   : Di 5. Sep 01:26:10 CEST 2023
Duration   : 15950.302129713 seconds

Start Time : Di 5. Sep 02:34:59 CEST 2023
Job ID: 1155894
Node: cc1g01
Partition: gpu_normal_stud
CPU cores: 16
Memory: 98304
GPUs: 0
Python environment: khoa                  *  /home/phamanh/anaconda3/envs/khoa
Current work directory: /home/phamanh/Schreibtisch/bachelorarbeit/ts_im_CNN

device: cuda


https://app.neptune.ai/ba-final/cwt-2/e/CWT2-134
Split 0, loss train 0.06, score train 0.47, loss val 0.08 score val 0.48
Shutting down background jobs, please wait a moment...
Done!
Waiting for the remaining 14 operations to synchronize with Neptune. Do not kill this process.
All 14 operations synced, thanks for waiting!
Explore the metadata in the Neptune app:
https://app.neptune.ai/ba-final/cwt-2/e/CWT2-134/metadata
https://app.neptune.ai/ba-final/cwt-2/e/CWT2-135
Split 1, loss train 0.06, score train 0.46, loss val 0.13 score val 0.30
Shutting down background jobs, please wait a moment...
Done!
Waiting for the remaining 14 operations to synchronize with Neptune. Do not kill this process.
All 14 operations synced, thanks for waiting!
Explore the metadata in the Neptune app:
https://app.neptune.ai/ba-final/cwt-2/e/CWT2-135/metadata
https://app.neptune.ai/ba-final/cwt-2/e/CWT2-136
Split 2, loss train 0.07, score train 0.45, loss val 0.11 score val 0.31
Shutting down background jobs, please wait a moment...
Done!
Waiting for the remaining 14 operations to synchronize with Neptune. Do not kill this process.
All 14 operations synced, thanks for waiting!
Explore the metadata in the Neptune app:
https://app.neptune.ai/ba-final/cwt-2/e/CWT2-136/metadata
https://app.neptune.ai/ba-final/cwt-2/e/CWT2-137
Split 3, loss train 0.06, score train 0.47, loss val 0.08 score val 0.38
Shutting down background jobs, please wait a moment...
Done!
Waiting for the remaining 10 operations to synchronize with Neptune. Do not kill this process.
All 10 operations synced, thanks for waiting!
Explore the metadata in the Neptune app:
https://app.neptune.ai/ba-final/cwt-2/e/CWT2-137/metadata
https://app.neptune.ai/ba-final/cwt-2/e/CWT2-138
Split 4, loss train 0.06, score train 0.46, loss val 0.10 score val 0.44
Shutting down background jobs, please wait a moment...
Done!
Waiting for the remaining 10 operations to synchronize with Neptune. Do not kill this process.
All 10 operations synced, thanks for waiting!
Explore the metadata in the Neptune app:
https://app.neptune.ai/ba-final/cwt-2/e/CWT2-138/metadata
[32m[I 2023-09-05 07:01:40,080][0m Trial 33 finished with value: 0.1005966916997382 and parameters: {'b': 2.1, 'fc': 1.85, 'scale_min': 1.1, 'scale_max': 32, 'n_scales': 150, 'drop': 0.3664784713261293, 'optimizer': 'Adam', 'lr': 0.005673035571604818, 'weight_decay': 0.00025426794449821924, 'batch_size': 32, 'epochs': 100}. Best is trial 33 with value: 0.1005966916997382.[0m
trial 33, loss train mean 0.06, score train mean 0.46, loss val mean 0.10, score val mean 0.38



End Time   : Di 5. Sep 07:01:42 CEST 2023
Duration   : 16002.253893273 seconds

Start Time : Di 5. Sep 07:01:43 CEST 2023
Job ID: 1155895
Node: cc1g07
Partition: gpu_normal_stud
CPU cores: 16
Memory: 98304
GPUs: 0
Python environment: khoa                  *  /home/phamanh/anaconda3/envs/khoa
Current work directory: /home/phamanh/Schreibtisch/bachelorarbeit/ts_im_CNN

device: cuda


https://app.neptune.ai/ba-final/cwt-2/e/CWT2-139
Split 0, loss train 0.07, score train 0.46, loss val 0.07 score val 0.33
Shutting down background jobs, please wait a moment...
Done!
Waiting for the remaining 10 operations to synchronize with Neptune. Do not kill this process.
All 10 operations synced, thanks for waiting!
Explore the metadata in the Neptune app:
https://app.neptune.ai/ba-final/cwt-2/e/CWT2-139/metadata
https://app.neptune.ai/ba-final/cwt-2/e/CWT2-140
Split 1, loss train 0.06, score train 0.47, loss val 0.24 score val 0.32
Shutting down background jobs, please wait a moment...
Done!
Waiting for the remaining 10 operations to synchronize with Neptune. Do not kill this process.
All 10 operations synced, thanks for waiting!
Explore the metadata in the Neptune app:
https://app.neptune.ai/ba-final/cwt-2/e/CWT2-140/metadata
https://app.neptune.ai/ba-final/cwt-2/e/CWT2-141
Split 2, loss train 0.07, score train 0.45, loss val 0.07 score val 0.48
Shutting down background jobs, please wait a moment...
Done!
Waiting for the remaining 10 operations to synchronize with Neptune. Do not kill this process.
All 10 operations synced, thanks for waiting!
Explore the metadata in the Neptune app:
https://app.neptune.ai/ba-final/cwt-2/e/CWT2-141/metadata
https://app.neptune.ai/ba-final/cwt-2/e/CWT2-142
Split 3, loss train 0.07, score train 0.45, loss val 0.04 score val 0.55
Shutting down background jobs, please wait a moment...
Done!
Waiting for the remaining 10 operations to synchronize with Neptune. Do not kill this process.
All 10 operations synced, thanks for waiting!
Explore the metadata in the Neptune app:
https://app.neptune.ai/ba-final/cwt-2/e/CWT2-142/metadata
https://app.neptune.ai/ba-final/cwt-2/e/CWT2-143
Split 4, loss train 0.07, score train 0.46, loss val 0.07 score val 0.49
Shutting down background jobs, please wait a moment...
Done!
Waiting for the remaining 10 operations to synchronize with Neptune. Do not kill this process.
All 10 operations synced, thanks for waiting!
Explore the metadata in the Neptune app:
https://app.neptune.ai/ba-final/cwt-2/e/CWT2-143/metadata
[32m[I 2023-09-05 11:20:24,188][0m Trial 34 finished with value: 0.09877052307128906 and parameters: {'b': 2.0, 'fc': 2.35, 'scale_min': 0.5, 'scale_max': 38, 'n_scales': 105, 'drop': 0.3684012241619727, 'optimizer': 'Adam', 'lr': 0.006347115598155884, 'weight_decay': 0.00020909833707515968, 'batch_size': 32, 'epochs': 100}. Best is trial 34 with value: 0.09877052307128906.[0m
trial 34, loss train mean 0.07, score train mean 0.46, loss val mean 0.10, score val mean 0.44



End Time   : Di 5. Sep 11:20:26 CEST 2023
Duration   : 15523.561843742 seconds

Start Time : Di 5. Sep 11:20:28 CEST 2023
Job ID: 1155896
Node: cc1g07
Partition: gpu_normal_stud
CPU cores: 16
Memory: 98304
GPUs: 0
Python environment: khoa                  *  /home/phamanh/anaconda3/envs/khoa
Current work directory: /home/phamanh/Schreibtisch/bachelorarbeit/ts_im_CNN

device: cuda


https://app.neptune.ai/ba-final/cwt-2/e/CWT2-144
Shutting down background jobs, please wait a moment...
Done!
Waiting for the remaining 7 operations to synchronize with Neptune. Do not kill this process.
All 7 operations synced, thanks for waiting!
Explore the metadata in the Neptune app:
https://app.neptune.ai/ba-final/cwt-2/e/CWT2-144/metadata
[32m[I 2023-09-05 12:21:48,529][0m Trial 35 pruned. [0m

End Time   : Di 5. Sep 12:21:51 CEST 2023
Duration   : 3683.806432069 seconds

Start Time : Di 5. Sep 12:21:53 CEST 2023
Job ID: 1155897
Node: cc1g07
Partition: gpu_normal_stud
CPU cores: 16
Memory: 98304
GPUs: 0
Python environment: khoa                  *  /home/phamanh/anaconda3/envs/khoa
Current work directory: /home/phamanh/Schreibtisch/bachelorarbeit/ts_im_CNN

device: cuda


https://app.neptune.ai/ba-final/cwt-2/e/CWT2-145
Split 0, loss train 0.05, score train 0.50, loss val 0.03 score val 0.66
Shutting down background jobs, please wait a moment...
Done!
Waiting for the remaining 10 operations to synchronize with Neptune. Do not kill this process.
All 10 operations synced, thanks for waiting!
Explore the metadata in the Neptune app:
https://app.neptune.ai/ba-final/cwt-2/e/CWT2-145/metadata
https://app.neptune.ai/ba-final/cwt-2/e/CWT2-146
Split 1, loss train 0.05, score train 0.52, loss val 0.08 score val 0.55
Shutting down background jobs, please wait a moment...
Done!
Waiting for the remaining 10 operations to synchronize with Neptune. Do not kill this process.
All 10 operations synced, thanks for waiting!
Explore the metadata in the Neptune app:
https://app.neptune.ai/ba-final/cwt-2/e/CWT2-146/metadata
https://app.neptune.ai/ba-final/cwt-2/e/CWT2-147
Split 2, loss train 0.06, score train 0.48, loss val 0.08 score val 0.47
Shutting down background jobs, please wait a moment...
Done!
Waiting for the remaining 14 operations to synchronize with Neptune. Do not kill this process.
All 14 operations synced, thanks for waiting!
Explore the metadata in the Neptune app:
https://app.neptune.ai/ba-final/cwt-2/e/CWT2-147/metadata
https://app.neptune.ai/ba-final/cwt-2/e/CWT2-148
Split 3, loss train 0.05, score train 0.50, loss val 0.08 score val 0.47
Shutting down background jobs, please wait a moment...
Done!
Waiting for the remaining 10 operations to synchronize with Neptune. Do not kill this process.
All 10 operations synced, thanks for waiting!
Explore the metadata in the Neptune app:
https://app.neptune.ai/ba-final/cwt-2/e/CWT2-148/metadata
https://app.neptune.ai/ba-final/cwt-2/e/CWT2-149
Split 4, loss train 0.05, score train 0.50, loss val 0.05 score val 0.53
Shutting down background jobs, please wait a moment...
Done!
Waiting for the remaining 10 operations to synchronize with Neptune. Do not kill this process.
All 10 operations synced, thanks for waiting!
Explore the metadata in the Neptune app:
https://app.neptune.ai/ba-final/cwt-2/e/CWT2-149/metadata
[32m[I 2023-09-05 16:48:50,433][0m Trial 36 finished with value: 0.06612708872937141 and parameters: {'b': 0.9500000000000001, 'fc': 2.5, 'scale_min': 1.1, 'scale_max': 38, 'n_scales': 135, 'drop': 0.360889589093309, 'optimizer': 'Adam', 'lr': 0.0013300938388980364, 'weight_decay': 0.0002483723354779094, 'batch_size': 32, 'epochs': 100}. Best is trial 36 with value: 0.06612708872937141.[0m
trial 36, loss train mean 0.05, score train mean 0.50, loss val mean 0.07, score val mean 0.54



End Time   : Di 5. Sep 16:48:53 CEST 2023
Duration   : 16020.201491261 seconds

Start Time : Di 5. Sep 16:48:55 CEST 2023
Job ID: 1155898
Node: cc1g07
Partition: gpu_normal_stud
CPU cores: 16
Memory: 98304
GPUs: 0
Python environment: khoa                  *  /home/phamanh/anaconda3/envs/khoa
Current work directory: /home/phamanh/Schreibtisch/bachelorarbeit/ts_im_CNN

device: cuda


https://app.neptune.ai/ba-final/cwt-2/e/CWT2-150
Split 0, loss train 0.04, score train 0.57, loss val 0.03 score val 0.60
Shutting down background jobs, please wait a moment...
Done!
Waiting for the remaining 14 operations to synchronize with Neptune. Do not kill this process.
All 14 operations synced, thanks for waiting!
Explore the metadata in the Neptune app:
https://app.neptune.ai/ba-final/cwt-2/e/CWT2-150/metadata
https://app.neptune.ai/ba-final/cwt-2/e/CWT2-151
Split 1, loss train 0.05, score train 0.50, loss val 0.09 score val 0.18
Shutting down background jobs, please wait a moment...
Done!
Waiting for the remaining 10 operations to synchronize with Neptune. Do not kill this process.
All 10 operations synced, thanks for waiting!
Explore the metadata in the Neptune app:
https://app.neptune.ai/ba-final/cwt-2/e/CWT2-151/metadata
https://app.neptune.ai/ba-final/cwt-2/e/CWT2-152
Split 2, loss train 0.06, score train 0.48, loss val 0.04 score val 0.49
Shutting down background jobs, please wait a moment...
Done!
Waiting for the remaining 10 operations to synchronize with Neptune. Do not kill this process.
All 10 operations synced, thanks for waiting!
Explore the metadata in the Neptune app:
https://app.neptune.ai/ba-final/cwt-2/e/CWT2-152/metadata
https://app.neptune.ai/ba-final/cwt-2/e/CWT2-153
Split 3, loss train 0.05, score train 0.50, loss val 0.11 score val 0.40
Shutting down background jobs, please wait a moment...
Done!
Waiting for the remaining 10 operations to synchronize with Neptune. Do not kill this process.
All 10 operations synced, thanks for waiting!
Explore the metadata in the Neptune app:
https://app.neptune.ai/ba-final/cwt-2/e/CWT2-153/metadata
https://app.neptune.ai/ba-final/cwt-2/e/CWT2-154
Split 4, loss train 0.05, score train 0.50, loss val 0.09 score val 0.47
Shutting down background jobs, please wait a moment...
Done!
Waiting for the remaining 14 operations to synchronize with Neptune. Do not kill this process.
All 14 operations synced, thanks for waiting!
Explore the metadata in the Neptune app:
https://app.neptune.ai/ba-final/cwt-2/e/CWT2-154/metadata
[32m[I 2023-09-05 21:20:24,821][0m Trial 37 finished with value: 0.07389607429504394 and parameters: {'b': 0.8500000000000001, 'fc': 2.5, 'scale_min': 1.1, 'scale_max': 46, 'n_scales': 145, 'drop': 0.36092497330529455, 'optimizer': 'Adam', 'lr': 0.001467693520457885, 'weight_decay': 0.0002709271800047424, 'batch_size': 32, 'epochs': 100}. Best is trial 36 with value: 0.06612708872937141.[0m
trial 37, loss train mean 0.05, score train mean 0.51, loss val mean 0.07, score val mean 0.43



End Time   : Di 5. Sep 21:20:27 CEST 2023
Duration   : 16292.220603772 seconds

Start Time : Di 5. Sep 21:20:28 CEST 2023
Job ID: 1155899
Node: cc1g04
Partition: gpu_normal_stud
CPU cores: 16
Memory: 98304
GPUs: 0
Python environment: khoa                  *  /home/phamanh/anaconda3/envs/khoa
Current work directory: /home/phamanh/Schreibtisch/bachelorarbeit/ts_im_CNN

device: cuda


https://app.neptune.ai/ba-final/cwt-2/e/CWT2-155
Split 0, loss train 0.05, score train 0.49, loss val 0.06 score val 0.55
Shutting down background jobs, please wait a moment...
Done!
Waiting for the remaining 10 operations to synchronize with Neptune. Do not kill this process.
All 10 operations synced, thanks for waiting!
Explore the metadata in the Neptune app:
https://app.neptune.ai/ba-final/cwt-2/e/CWT2-155/metadata
https://app.neptune.ai/ba-final/cwt-2/e/CWT2-156
Split 1, loss train 0.05, score train 0.50, loss val 0.12 score val 0.30
Shutting down background jobs, please wait a moment...
Done!
Waiting for the remaining 10 operations to synchronize with Neptune. Do not kill this process.
All 10 operations synced, thanks for waiting!
Explore the metadata in the Neptune app:
https://app.neptune.ai/ba-final/cwt-2/e/CWT2-156/metadata
https://app.neptune.ai/ba-final/cwt-2/e/CWT2-157
Split 2, loss train 0.06, score train 0.48, loss val 0.13 score val 0.25
Shutting down background jobs, please wait a moment...
Done!
Waiting for the remaining 10 operations to synchronize with Neptune. Do not kill this process.
All 10 operations synced, thanks for waiting!
Explore the metadata in the Neptune app:
https://app.neptune.ai/ba-final/cwt-2/e/CWT2-157/metadata
https://app.neptune.ai/ba-final/cwt-2/e/CWT2-158
Split 3, loss train 0.05, score train 0.50, loss val 0.10 score val 0.29
Shutting down background jobs, please wait a moment...
Done!
Waiting for the remaining 10 operations to synchronize with Neptune. Do not kill this process.
All 10 operations synced, thanks for waiting!
Explore the metadata in the Neptune app:
https://app.neptune.ai/ba-final/cwt-2/e/CWT2-158/metadata
https://app.neptune.ai/ba-final/cwt-2/e/CWT2-159
Split 4, loss train 0.06, score train 0.49, loss val 0.08 score val 0.33
Shutting down background jobs, please wait a moment...
Done!
Waiting for the remaining 14 operations to synchronize with Neptune. Do not kill this process.
All 14 operations synced, thanks for waiting!
Explore the metadata in the Neptune app:
https://app.neptune.ai/ba-final/cwt-2/e/CWT2-159/metadata
[32m[I 2023-09-06 02:19:55,251][0m Trial 38 finished with value: 0.09736769351553412 and parameters: {'b': 0.8, 'fc': 2.5, 'scale_min': 1.1, 'scale_max': 50, 'n_scales': 145, 'drop': 0.37573933177025165, 'optimizer': 'Adam', 'lr': 0.0018512878937620215, 'weight_decay': 0.00030362745632596817, 'batch_size': 32, 'epochs': 100}. Best is trial 36 with value: 0.06612708872937141.[0m
trial 38, loss train mean 0.05, score train mean 0.49, loss val mean 0.10, score val mean 0.34



End Time   : Mi 6. Sep 02:19:56 CEST 2023
Duration   : 17968.318280506 seconds

Start Time : Mi 6. Sep 02:19:59 CEST 2023
Job ID: 1155900
Node: cc1g04
Partition: gpu_normal_stud
CPU cores: 16
Memory: 98304
GPUs: 0
Python environment: khoa                  *  /home/phamanh/anaconda3/envs/khoa
Current work directory: /home/phamanh/Schreibtisch/bachelorarbeit/ts_im_CNN

device: cuda


https://app.neptune.ai/ba-final/cwt-2/e/CWT2-160
Split 0, loss train 0.06, score train 0.48, loss val 0.05 score val 0.57
Shutting down background jobs, please wait a moment...
Done!
Waiting for the remaining 10 operations to synchronize with Neptune. Do not kill this process.
All 10 operations synced, thanks for waiting!
Explore the metadata in the Neptune app:
https://app.neptune.ai/ba-final/cwt-2/e/CWT2-160/metadata
https://app.neptune.ai/ba-final/cwt-2/e/CWT2-161
Split 1, loss train 0.05, score train 0.49, loss val 0.07 score val 0.40
Shutting down background jobs, please wait a moment...
Done!
Waiting for the remaining 10 operations to synchronize with Neptune. Do not kill this process.
All 10 operations synced, thanks for waiting!
Explore the metadata in the Neptune app:
https://app.neptune.ai/ba-final/cwt-2/e/CWT2-161/metadata
https://app.neptune.ai/ba-final/cwt-2/e/CWT2-162
Split 2, loss train 0.06, score train 0.48, loss val 0.05 score val 0.49
Shutting down background jobs, please wait a moment...
Done!
Waiting for the remaining 10 operations to synchronize with Neptune. Do not kill this process.
All 10 operations synced, thanks for waiting!
Explore the metadata in the Neptune app:
https://app.neptune.ai/ba-final/cwt-2/e/CWT2-162/metadata
https://app.neptune.ai/ba-final/cwt-2/e/CWT2-163
Split 3, loss train 0.06, score train 0.50, loss val 0.07 score val 0.40
Shutting down background jobs, please wait a moment...
Done!
Waiting for the remaining 10 operations to synchronize with Neptune. Do not kill this process.
All 10 operations synced, thanks for waiting!
Explore the metadata in the Neptune app:
https://app.neptune.ai/ba-final/cwt-2/e/CWT2-163/metadata
https://app.neptune.ai/ba-final/cwt-2/e/CWT2-164
Split 4, loss train 0.06, score train 0.49, loss val 0.05 score val 0.48
Shutting down background jobs, please wait a moment...
Done!
Waiting for the remaining 10 operations to synchronize with Neptune. Do not kill this process.
All 10 operations synced, thanks for waiting!
Explore the metadata in the Neptune app:
https://app.neptune.ai/ba-final/cwt-2/e/CWT2-164/metadata
[32m[I 2023-09-06 07:19:03,432][0m Trial 39 finished with value: 0.059480871038233976 and parameters: {'b': 0.8, 'fc': 2.5, 'scale_min': 1.1, 'scale_max': 50, 'n_scales': 150, 'drop': 0.3001137032153256, 'optimizer': 'Adam', 'lr': 0.0012010182262625901, 'weight_decay': 0.0015191687725748938, 'batch_size': 32, 'epochs': 100}. Best is trial 39 with value: 0.059480871038233976.[0m
trial 39, loss train mean 0.06, score train mean 0.49, loss val mean 0.06, score val mean 0.47



End Time   : Mi 6. Sep 07:19:05 CEST 2023
Duration   : 17945.051612114 seconds

Start Time : Mi 6. Sep 08:21:01 CEST 2023
Job ID: 1157262
Node: cc1g07
Partition: gpu_normal_stud
CPU cores: 16
Memory: 98304
GPUs: 0
Python environment: khoa                  *  /home/phamanh/anaconda3/envs/khoa
Current work directory: /home/phamanh/Schreibtisch/bachelorarbeit/ts_im_CNN

device: cuda


https://app.neptune.ai/ba-final/cwt-2/e/CWT2-165
Split 0, loss train 0.06, score train 0.52, loss val 0.08 score val 0.74
Shutting down background jobs, please wait a moment...
Done!
Waiting for the remaining 10 operations to synchronize with Neptune. Do not kill this process.
All 10 operations synced, thanks for waiting!
Explore the metadata in the Neptune app:
https://app.neptune.ai/ba-final/cwt-2/e/CWT2-165/metadata
https://app.neptune.ai/ba-final/cwt-2/e/CWT2-166
Split 1, loss train 0.06, score train 0.51, loss val 0.08 score val 0.52
Shutting down background jobs, please wait a moment...
Done!
Waiting for the remaining 14 operations to synchronize with Neptune. Do not kill this process.
All 14 operations synced, thanks for waiting!
Explore the metadata in the Neptune app:
https://app.neptune.ai/ba-final/cwt-2/e/CWT2-166/metadata
https://app.neptune.ai/ba-final/cwt-2/e/CWT2-167
Split 2, loss train 0.07, score train 0.50, loss val 0.10 score val 0.68
Shutting down background jobs, please wait a moment...
Done!
All 0 operations synced, thanks for waiting!
Explore the metadata in the Neptune app:
https://app.neptune.ai/ba-final/cwt-2/e/CWT2-167/metadata
https://app.neptune.ai/ba-final/cwt-2/e/CWT2-168
Split 3, loss train 0.06, score train 0.53, loss val 0.10 score val 0.70
Shutting down background jobs, please wait a moment...
Done!
Waiting for the remaining 9 operations to synchronize with Neptune. Do not kill this process.
All 9 operations synced, thanks for waiting!
Explore the metadata in the Neptune app:
https://app.neptune.ai/ba-final/cwt-2/e/CWT2-168/metadata
https://app.neptune.ai/ba-final/cwt-2/e/CWT2-169
Split 4, loss train 0.06, score train 0.51, loss val 0.10 score val 0.52
Shutting down background jobs, please wait a moment...
Done!
Waiting for the remaining 10 operations to synchronize with Neptune. Do not kill this process.
All 10 operations synced, thanks for waiting!
Explore the metadata in the Neptune app:
https://app.neptune.ai/ba-final/cwt-2/e/CWT2-169/metadata
