[32m[I 2023-09-09 13:54:29,434][0m Trial 58 finished with value: 0.07951567984641866 and parameters: {'b': 0.9, 'fc': 2.25, 'scale_min': 0.7, 'scale_max': 48, 'n_scales': 180, 'drop': 0.2590568275837348, 'optimizer': 'SGD', 'lr': 0.0007831526467879552, 'weight_decay': 0.0013369065123821613, 'batch_size': 32, 'epochs': 100}. Best is trial 39 with value: 0.059480871038233976.[0m
trial 58, loss train mean 0.06, score train mean 0.50, loss val mean 0.08, score val mean 0.68



End Time   : Sa 9. Sep 13:54:31 CEST 2023
Duration   : 19040.457592810 seconds

Start Time : Sa 9. Sep 13:59:32 CEST 2023
Job ID: 1158442
Node: cc1g03
Partition: gpu_normal_stud
CPU cores: 16
Memory: 98304
GPUs: 0
Python environment: khoa                  *  /home/phamanh/anaconda3/envs/khoa
Current work directory: /home/phamanh/Schreibtisch/bachelorarbeit/ts_im_CNN

device: cuda


https://app.neptune.ai/ba-final/cwt-2/e/CWT2-236
Split 0, loss train 0.06, score train 0.50, loss val 0.05 score val 0.72
Shutting down background jobs, please wait a moment...
Done!
Waiting for the remaining 10 operations to synchronize with Neptune. Do not kill this process.
All 10 operations synced, thanks for waiting!
Explore the metadata in the Neptune app:
https://app.neptune.ai/ba-final/cwt-2/e/CWT2-236/metadata
https://app.neptune.ai/ba-final/cwt-2/e/CWT2-237
Split 1, loss train 0.06, score train 0.51, loss val 0.06 score val 0.69
Shutting down background jobs, please wait a moment...
Done!
Waiting for the remaining 10 operations to synchronize with Neptune. Do not kill this process.
All 10 operations synced, thanks for waiting!
Explore the metadata in the Neptune app:
https://app.neptune.ai/ba-final/cwt-2/e/CWT2-237/metadata
https://app.neptune.ai/ba-final/cwt-2/e/CWT2-238
Split 2, loss train 0.07, score train 0.49, loss val 0.07 score val 0.74
Shutting down background jobs, please wait a moment...
Done!
Waiting for the remaining 14 operations to synchronize with Neptune. Do not kill this process.
All 14 operations synced, thanks for waiting!
Explore the metadata in the Neptune app:
https://app.neptune.ai/ba-final/cwt-2/e/CWT2-238/metadata
https://app.neptune.ai/ba-final/cwt-2/e/CWT2-239
Split 3, loss train 0.06, score train 0.51, loss val 0.08 score val 0.65
Shutting down background jobs, please wait a moment...
Done!
Waiting for the remaining 14 operations to synchronize with Neptune. Do not kill this process.
All 14 operations synced, thanks for waiting!
Explore the metadata in the Neptune app:
https://app.neptune.ai/ba-final/cwt-2/e/CWT2-239/metadata
https://app.neptune.ai/ba-final/cwt-2/e/CWT2-240
Split 4, loss train 0.06, score train 0.50, loss val 0.12 score val 0.25
Shutting down background jobs, please wait a moment...
Done!
Waiting for the remaining 10 operations to synchronize with Neptune. Do not kill this process.
All 10 operations synced, thanks for waiting!
Explore the metadata in the Neptune app:
https://app.neptune.ai/ba-final/cwt-2/e/CWT2-240/metadata
[32m[I 2023-09-09 18:38:37,382][0m Trial 59 finished with value: 0.07724744715589157 and parameters: {'b': 1.6, 'fc': 2.0, 'scale_min': 0.8, 'scale_max': 48, 'n_scales': 160, 'drop': 0.2561037988242455, 'optimizer': 'SGD', 'lr': 0.0006301626608640679, 'weight_decay': 0.0012106551769888398, 'batch_size': 32, 'epochs': 100}. Best is trial 39 with value: 0.059480871038233976.[0m
trial 59, loss train mean 0.06, score train mean 0.50, loss val mean 0.08, score val mean 0.61



End Time   : Sa 9. Sep 18:38:39 CEST 2023
Duration   : 16746.837862836 seconds

Start Time : Sa 9. Sep 19:01:23 CEST 2023
Job ID: 1159305
Node: cc1g02
Partition: gpu_normal_stud
CPU cores: 16
Memory: 98304
GPUs: 0
Python environment: khoa                  *  /home/phamanh/anaconda3/envs/khoa
Current work directory: /home/phamanh/Schreibtisch/bachelorarbeit/ts_im_CNN

device: cuda


https://app.neptune.ai/ba-final/cwt-2/e/CWT2-241
Split 0, loss train 0.06, score train 0.51, loss val 0.09 score val 0.58
Shutting down background jobs, please wait a moment...
Done!
Waiting for the remaining 10 operations to synchronize with Neptune. Do not kill this process.
All 10 operations synced, thanks for waiting!
Explore the metadata in the Neptune app:
https://app.neptune.ai/ba-final/cwt-2/e/CWT2-241/metadata
https://app.neptune.ai/ba-final/cwt-2/e/CWT2-242
Split 1, loss train 0.06, score train 0.51, loss val 0.06 score val 0.67
Shutting down background jobs, please wait a moment...
Done!
Waiting for the remaining 10 operations to synchronize with Neptune. Do not kill this process.
All 10 operations synced, thanks for waiting!
Explore the metadata in the Neptune app:
https://app.neptune.ai/ba-final/cwt-2/e/CWT2-242/metadata
https://app.neptune.ai/ba-final/cwt-2/e/CWT2-243
Split 2, loss train 0.07, score train 0.49, loss val 0.10 score val 0.68
Shutting down background jobs, please wait a moment...
Done!
Waiting for the remaining 14 operations to synchronize with Neptune. Do not kill this process.
All 14 operations synced, thanks for waiting!
Explore the metadata in the Neptune app:
https://app.neptune.ai/ba-final/cwt-2/e/CWT2-243/metadata
https://app.neptune.ai/ba-final/cwt-2/e/CWT2-244
Split 3, loss train 0.06, score train 0.52, loss val 0.07 score val 0.64
Shutting down background jobs, please wait a moment...
Done!
Waiting for the remaining 14 operations to synchronize with Neptune. Do not kill this process.
All 14 operations synced, thanks for waiting!
Explore the metadata in the Neptune app:
https://app.neptune.ai/ba-final/cwt-2/e/CWT2-244/metadata
https://app.neptune.ai/ba-final/cwt-2/e/CWT2-245
Split 4, loss train 0.06, score train 0.50, loss val 0.07 score val 0.31
Shutting down background jobs, please wait a moment...
Done!
Waiting for the remaining 10 operations to synchronize with Neptune. Do not kill this process.
All 10 operations synced, thanks for waiting!
Explore the metadata in the Neptune app:
https://app.neptune.ai/ba-final/cwt-2/e/CWT2-245/metadata
[32m[I 2023-09-09 23:33:44,108][0m Trial 60 finished with value: 0.0775335281453234 and parameters: {'b': 1.6, 'fc': 2.0, 'scale_min': 1.5, 'scale_max': 40, 'n_scales': 160, 'drop': 0.19672661745290046, 'optimizer': 'SGD', 'lr': 0.0006301626608640679, 'weight_decay': 0.0007674242135243879, 'batch_size': 32, 'epochs': 100}. Best is trial 39 with value: 0.059480871038233976.[0m
trial 60, loss train mean 0.06, score train mean 0.51, loss val mean 0.08, score val mean 0.58



End Time   : Sa 9. Sep 23:33:46 CEST 2023
Duration   : 16342.632804825 seconds

Start Time : Sa 9. Sep 23:33:47 CEST 2023
Job ID: 1159306
Node: cc1g02
Partition: gpu_normal_stud
CPU cores: 16
Memory: 98304
GPUs: 0
Python environment: khoa                  *  /home/phamanh/anaconda3/envs/khoa
Current work directory: /home/phamanh/Schreibtisch/bachelorarbeit/ts_im_CNN

device: cuda


https://app.neptune.ai/ba-final/cwt-2/e/CWT2-246
Split 0, loss train 0.06, score train 0.50, loss val 0.07 score val 0.62
Shutting down background jobs, please wait a moment...
Done!
Waiting for the remaining 10 operations to synchronize with Neptune. Do not kill this process.
All 10 operations synced, thanks for waiting!
Explore the metadata in the Neptune app:
https://app.neptune.ai/ba-final/cwt-2/e/CWT2-246/metadata
https://app.neptune.ai/ba-final/cwt-2/e/CWT2-247
Split 1, loss train 0.06, score train 0.50, loss val 0.04 score val 0.60
Shutting down background jobs, please wait a moment...
Done!
Waiting for the remaining 14 operations to synchronize with Neptune. Do not kill this process.
All 14 operations synced, thanks for waiting!
Explore the metadata in the Neptune app:
https://app.neptune.ai/ba-final/cwt-2/e/CWT2-247/metadata
https://app.neptune.ai/ba-final/cwt-2/e/CWT2-248
Split 2, loss train 0.06, score train 0.49, loss val 0.05 score val 0.68
Shutting down background jobs, please wait a moment...
Done!
Waiting for the remaining 10 operations to synchronize with Neptune. Do not kill this process.
All 10 operations synced, thanks for waiting!
Explore the metadata in the Neptune app:
https://app.neptune.ai/ba-final/cwt-2/e/CWT2-248/metadata
https://app.neptune.ai/ba-final/cwt-2/e/CWT2-249
Split 3, loss train 0.06, score train 0.52, loss val 0.07 score val 0.31
Shutting down background jobs, please wait a moment...
Done!
Waiting for the remaining 10 operations to synchronize with Neptune. Do not kill this process.
All 10 operations synced, thanks for waiting!
Explore the metadata in the Neptune app:
https://app.neptune.ai/ba-final/cwt-2/e/CWT2-249/metadata
https://app.neptune.ai/ba-final/cwt-2/e/CWT2-250
Split 4, loss train 0.06, score train 0.51, loss val 0.07 score val 0.42
Shutting down background jobs, please wait a moment...
Done!
Waiting for the remaining 10 operations to synchronize with Neptune. Do not kill this process.
All 10 operations synced, thanks for waiting!
Explore the metadata in the Neptune app:
https://app.neptune.ai/ba-final/cwt-2/e/CWT2-250/metadata
[32m[I 2023-09-10 04:09:27,643][0m Trial 61 finished with value: 0.058497320844772015 and parameters: {'b': 1.1500000000000001, 'fc': 1.9000000000000001, 'scale_min': 0.9, 'scale_max': 46, 'n_scales': 160, 'drop': 0.23664837102034972, 'optimizer': 'SGD', 'lr': 0.0005152269291760316, 'weight_decay': 0.005153741121678894, 'batch_size': 32, 'epochs': 100}. Best is trial 61 with value: 0.058497320844772015.[0m
trial 61, loss train mean 0.06, score train mean 0.50, loss val mean 0.06, score val mean 0.53



End Time   : So 10. Sep 04:09:29 CEST 2023
Duration   : 16542.250645395 seconds

Start Time : So 10. Sep 04:13:01 CEST 2023
Job ID: 1159307
Node: cc1g07
Partition: gpu_normal_stud
CPU cores: 16
Memory: 98304
GPUs: 0
Python environment: khoa                  *  /home/phamanh/anaconda3/envs/khoa
Current work directory: /home/phamanh/Schreibtisch/bachelorarbeit/ts_im_CNN

device: cuda


https://app.neptune.ai/ba-final/cwt-2/e/CWT2-251
Split 0, loss train 0.06, score train 0.51, loss val 0.15 score val 0.68
Shutting down background jobs, please wait a moment...
Done!
Waiting for the remaining 14 operations to synchronize with Neptune. Do not kill this process.
All 14 operations synced, thanks for waiting!
Explore the metadata in the Neptune app:
https://app.neptune.ai/ba-final/cwt-2/e/CWT2-251/metadata
https://app.neptune.ai/ba-final/cwt-2/e/CWT2-252
Split 1, loss train 0.06, score train 0.52, loss val 0.04 score val 0.59
Shutting down background jobs, please wait a moment...
Done!
Waiting for the remaining 14 operations to synchronize with Neptune. Do not kill this process.
All 14 operations synced, thanks for waiting!
Explore the metadata in the Neptune app:
https://app.neptune.ai/ba-final/cwt-2/e/CWT2-252/metadata
https://app.neptune.ai/ba-final/cwt-2/e/CWT2-253
Split 2, loss train 0.06, score train 0.49, loss val 0.11 score val 0.65
Shutting down background jobs, please wait a moment...
Done!
Waiting for the remaining 10 operations to synchronize with Neptune. Do not kill this process.
All 10 operations synced, thanks for waiting!
Explore the metadata in the Neptune app:
https://app.neptune.ai/ba-final/cwt-2/e/CWT2-253/metadata
https://app.neptune.ai/ba-final/cwt-2/e/CWT2-254
Split 3, loss train 0.06, score train 0.52, loss val 0.06 score val 0.66
Shutting down background jobs, please wait a moment...
Done!
Waiting for the remaining 10 operations to synchronize with Neptune. Do not kill this process.
All 10 operations synced, thanks for waiting!
Explore the metadata in the Neptune app:
https://app.neptune.ai/ba-final/cwt-2/e/CWT2-254/metadata
https://app.neptune.ai/ba-final/cwt-2/e/CWT2-255
Split 4, loss train 0.06, score train 0.51, loss val 0.09 score val 0.60
Shutting down background jobs, please wait a moment...
Done!
Waiting for the remaining 10 operations to synchronize with Neptune. Do not kill this process.
All 10 operations synced, thanks for waiting!
Explore the metadata in the Neptune app:
https://app.neptune.ai/ba-final/cwt-2/e/CWT2-255/metadata
[32m[I 2023-09-10 09:04:08,807][0m Trial 62 finished with value: 0.09208164925270892 and parameters: {'b': 1.2000000000000002, 'fc': 2.1, 'scale_min': 0.9, 'scale_max': 46, 'n_scales': 165, 'drop': 0.23424743690625288, 'optimizer': 'SGD', 'lr': 0.0005163551418761591, 'weight_decay': 0.004471513524970769, 'batch_size': 32, 'epochs': 100}. Best is trial 61 with value: 0.058497320844772015.[0m
trial 62, loss train mean 0.06, score train mean 0.51, loss val mean 0.09, score val mean 0.64



End Time   : So 10. Sep 09:04:11 CEST 2023
Duration   : 17469.479501501 seconds

Start Time : So 10. Sep 09:04:12 CEST 2023
Job ID: 1159308
Node: cc1g07
Partition: gpu_normal_stud
CPU cores: 16
Memory: 98304
GPUs: 0
Python environment: khoa                  *  /home/phamanh/anaconda3/envs/khoa
Current work directory: /home/phamanh/Schreibtisch/bachelorarbeit/ts_im_CNN

device: cuda


https://app.neptune.ai/ba-final/cwt-2/e/CWT2-256
Split 0, loss train 0.06, score train 0.52, loss val 0.08 score val 0.69
Shutting down background jobs, please wait a moment...
Done!
Waiting for the remaining 10 operations to synchronize with Neptune. Do not kill this process.
All 10 operations synced, thanks for waiting!
Explore the metadata in the Neptune app:
https://app.neptune.ai/ba-final/cwt-2/e/CWT2-256/metadata
https://app.neptune.ai/ba-final/cwt-2/e/CWT2-257
Split 1, loss train 0.05, score train 0.52, loss val 0.06 score val 0.69
Shutting down background jobs, please wait a moment...
Done!
Waiting for the remaining 10 operations to synchronize with Neptune. Do not kill this process.
All 10 operations synced, thanks for waiting!
Explore the metadata in the Neptune app:
https://app.neptune.ai/ba-final/cwt-2/e/CWT2-257/metadata
https://app.neptune.ai/ba-final/cwt-2/e/CWT2-258
Split 2, loss train 0.06, score train 0.50, loss val 0.10 score val 0.69
Shutting down background jobs, please wait a moment...
Done!
Waiting for the remaining 10 operations to synchronize with Neptune. Do not kill this process.
All 10 operations synced, thanks for waiting!
Explore the metadata in the Neptune app:
https://app.neptune.ai/ba-final/cwt-2/e/CWT2-258/metadata
https://app.neptune.ai/ba-final/cwt-2/e/CWT2-259
Split 3, loss train 0.05, score train 0.52, loss val 0.17 score val 0.35
Shutting down background jobs, please wait a moment...
Done!
Waiting for the remaining 10 operations to synchronize with Neptune. Do not kill this process.
All 10 operations synced, thanks for waiting!
Explore the metadata in the Neptune app:
https://app.neptune.ai/ba-final/cwt-2/e/CWT2-259/metadata
https://app.neptune.ai/ba-final/cwt-2/e/CWT2-260
Split 4, loss train 0.06, score train 0.51, loss val 0.09 score val 0.39
Shutting down background jobs, please wait a moment...
Done!
Waiting for the remaining 14 operations to synchronize with Neptune. Do not kill this process.
All 14 operations synced, thanks for waiting!
Explore the metadata in the Neptune app:
https://app.neptune.ai/ba-final/cwt-2/e/CWT2-260/metadata
[32m[I 2023-09-10 13:47:09,356][0m Trial 63 finished with value: 0.09980403413163855 and parameters: {'b': 1.6500000000000001, 'fc': 2.45, 'scale_min': 0.7, 'scale_max': 44, 'n_scales': 165, 'drop': 0.24803403349010544, 'optimizer': 'SGD', 'lr': 0.000658635478004424, 'weight_decay': 0.007140658409223042, 'batch_size': 32, 'epochs': 100}. Best is trial 61 with value: 0.058497320844772015.[0m
trial 63, loss train mean 0.06, score train mean 0.51, loss val mean 0.10, score val mean 0.56



End Time   : So 10. Sep 13:47:11 CEST 2023
Duration   : 16978.990013768 seconds

Start Time : So 10. Sep 13:47:14 CEST 2023
Job ID: 1159309
Node: cc1g06
Partition: gpu_normal_stud
CPU cores: 16
Memory: 98304
GPUs: 0
Python environment: khoa                  *  /home/phamanh/anaconda3/envs/khoa
Current work directory: /home/phamanh/Schreibtisch/bachelorarbeit/ts_im_CNN

device: cuda


https://app.neptune.ai/ba-final/cwt-2/e/CWT2-261
Split 0, loss train 0.06, score train 0.50, loss val 0.09 score val 0.58
Shutting down background jobs, please wait a moment...
Done!
Waiting for the remaining 10 operations to synchronize with Neptune. Do not kill this process.
All 10 operations synced, thanks for waiting!
Explore the metadata in the Neptune app:
https://app.neptune.ai/ba-final/cwt-2/e/CWT2-261/metadata
https://app.neptune.ai/ba-final/cwt-2/e/CWT2-262
Split 1, loss train 0.06, score train 0.51, loss val 0.04 score val 0.72
Shutting down background jobs, please wait a moment...
Done!
Waiting for the remaining 14 operations to synchronize with Neptune. Do not kill this process.
All 14 operations synced, thanks for waiting!
Explore the metadata in the Neptune app:
https://app.neptune.ai/ba-final/cwt-2/e/CWT2-262/metadata
https://app.neptune.ai/ba-final/cwt-2/e/CWT2-263
Split 2, loss train 0.06, score train 0.50, loss val 0.05 score val 0.70
Shutting down background jobs, please wait a moment...
Done!
Waiting for the remaining 14 operations to synchronize with Neptune. Do not kill this process.
All 14 operations synced, thanks for waiting!
Explore the metadata in the Neptune app:
https://app.neptune.ai/ba-final/cwt-2/e/CWT2-263/metadata
https://app.neptune.ai/ba-final/cwt-2/e/CWT2-264
Split 3, loss train 0.06, score train 0.52, loss val 0.13 score val 0.39
Shutting down background jobs, please wait a moment...
Done!
Waiting for the remaining 10 operations to synchronize with Neptune. Do not kill this process.
All 10 operations synced, thanks for waiting!
Explore the metadata in the Neptune app:
https://app.neptune.ai/ba-final/cwt-2/e/CWT2-264/metadata
https://app.neptune.ai/ba-final/cwt-2/e/CWT2-265
Split 4, loss train 0.06, score train 0.51, loss val 0.09 score val 0.34
Shutting down background jobs, please wait a moment...
Done!
Waiting for the remaining 14 operations to synchronize with Neptune. Do not kill this process.
All 14 operations synced, thanks for waiting!
Explore the metadata in the Neptune app:
https://app.neptune.ai/ba-final/cwt-2/e/CWT2-265/metadata
[32m[I 2023-09-10 18:07:33,729][0m Trial 64 finished with value: 0.07932041198649305 and parameters: {'b': 1.85, 'fc': 1.85, 'scale_min': 1.0, 'scale_max': 48, 'n_scales': 120, 'drop': 0.2590568275837348, 'optimizer': 'SGD', 'lr': 0.0008366661814760017, 'weight_decay': 0.0010142656571161543, 'batch_size': 32, 'epochs': 100}. Best is trial 61 with value: 0.058497320844772015.[0m
trial 64, loss train mean 0.06, score train mean 0.51, loss val mean 0.08, score val mean 0.55



End Time   : So 10. Sep 18:07:36 CEST 2023
Duration   : 15622.072011907 seconds

Start Time : So 10. Sep 18:07:37 CEST 2023
Job ID: 1159310
Node: cc1g03
Partition: gpu_normal_stud
CPU cores: 16
Memory: 98304
GPUs: 0
Python environment: khoa                  *  /home/phamanh/anaconda3/envs/khoa
Current work directory: /home/phamanh/Schreibtisch/bachelorarbeit/ts_im_CNN

device: cuda


https://app.neptune.ai/ba-final/cwt-2/e/CWT2-266
Split 0, loss train 0.06, score train 0.50, loss val 0.11 score val 0.60
Shutting down background jobs, please wait a moment...
Done!
Waiting for the remaining 10 operations to synchronize with Neptune. Do not kill this process.
All 10 operations synced, thanks for waiting!
Explore the metadata in the Neptune app:
https://app.neptune.ai/ba-final/cwt-2/e/CWT2-266/metadata
https://app.neptune.ai/ba-final/cwt-2/e/CWT2-267
Split 1, loss train 0.06, score train 0.50, loss val 0.03 score val 0.64
Shutting down background jobs, please wait a moment...
Done!
Waiting for the remaining 10 operations to synchronize with Neptune. Do not kill this process.
All 10 operations synced, thanks for waiting!
Explore the metadata in the Neptune app:
https://app.neptune.ai/ba-final/cwt-2/e/CWT2-267/metadata
https://app.neptune.ai/ba-final/cwt-2/e/CWT2-268
Split 2, loss train 0.07, score train 0.49, loss val 0.07 score val 0.69
Shutting down background jobs, please wait a moment...
Done!
Waiting for the remaining 10 operations to synchronize with Neptune. Do not kill this process.
All 10 operations synced, thanks for waiting!
Explore the metadata in the Neptune app:
https://app.neptune.ai/ba-final/cwt-2/e/CWT2-268/metadata
https://app.neptune.ai/ba-final/cwt-2/e/CWT2-269
Split 3, loss train 0.06, score train 0.51, loss val 0.08 score val 0.65
Shutting down background jobs, please wait a moment...
Done!
Waiting for the remaining 10 operations to synchronize with Neptune. Do not kill this process.
All 10 operations synced, thanks for waiting!
Explore the metadata in the Neptune app:
https://app.neptune.ai/ba-final/cwt-2/e/CWT2-269/metadata
https://app.neptune.ai/ba-final/cwt-2/e/CWT2-270
Split 4, loss train 0.06, score train 0.51, loss val 0.13 score val 0.45
Shutting down background jobs, please wait a moment...
Done!
Waiting for the remaining 10 operations to synchronize with Neptune. Do not kill this process.
All 10 operations synced, thanks for waiting!
Explore the metadata in the Neptune app:
https://app.neptune.ai/ba-final/cwt-2/e/CWT2-270/metadata
