[32m[I 2023-08-30 02:49:11,706][0m Trial 7 finished with value: 0.3361721606964761 and parameters: {'b': 3.1500000000000004, 'fc': 2.05, 'scale_min': 1.6, 'scale_max': 42, 'n_scales': 170, 'drop': 0.5241908601441085, 'optimizer': 'SGD', 'lr': 0.003077401349489438, 'weight_decay': 0.0005867534868260941, 'batch_size': 32, 'epochs': 100}. Best is trial 0 with value: 0.3361721606964761.[0m
trial 7, loss train mean 0.08, score train mean 0.56, loss val mean 0.34, score val mean 0.59



End Time   : Mi 30. Aug 02:49:13 CEST 2023
Duration   : 17638.198709449 seconds

Start Time : Mi 30. Aug 02:49:40 CEST 2023
Job ID: 1151402
Node: erebos
Partition: gpu_normal_stud
CPU cores: 16
Memory: 98304
GPUs: 0
Python environment: khoa                  *  /home/phamanh/anaconda3/envs/khoa
Current work directory: /home/phamanh/Schreibtisch/bachelorarbeit/ts_im_CNN

device: cuda


https://app.neptune.ai/ba-final/cwt-2/e/CWT2-37
Split 0, loss train 0.07, score train 0.56, loss val 0.25 score val 0.77
Shutting down background jobs, please wait a moment...
Done!
Waiting for the remaining 10 operations to synchronize with Neptune. Do not kill this process.
All 10 operations synced, thanks for waiting!
Explore the metadata in the Neptune app:
https://app.neptune.ai/ba-final/cwt-2/e/CWT2-37/metadata
https://app.neptune.ai/ba-final/cwt-2/e/CWT2-38
Split 1, loss train 0.07, score train 0.55, loss val 0.13 score val 0.74
Shutting down background jobs, please wait a moment...
Done!
Waiting for the remaining 10 operations to synchronize with Neptune. Do not kill this process.
All 10 operations synced, thanks for waiting!
Explore the metadata in the Neptune app:
https://app.neptune.ai/ba-final/cwt-2/e/CWT2-38/metadata
https://app.neptune.ai/ba-final/cwt-2/e/CWT2-39
Split 2, loss train 0.08, score train 0.55, loss val 0.70 score val 0.61
Shutting down background jobs, please wait a moment...
Done!
Waiting for the remaining 14 operations to synchronize with Neptune. Do not kill this process.
All 14 operations synced, thanks for waiting!
Explore the metadata in the Neptune app:
https://app.neptune.ai/ba-final/cwt-2/e/CWT2-39/metadata
https://app.neptune.ai/ba-final/cwt-2/e/CWT2-40
Split 3, loss train 0.08, score train 0.56, loss val 0.46 score val 0.36
Shutting down background jobs, please wait a moment...
Done!
Waiting for the remaining 10 operations to synchronize with Neptune. Do not kill this process.
All 10 operations synced, thanks for waiting!
Explore the metadata in the Neptune app:
https://app.neptune.ai/ba-final/cwt-2/e/CWT2-40/metadata
https://app.neptune.ai/ba-final/cwt-2/e/CWT2-41
Split 4, loss train 0.07, score train 0.58, loss val 0.13 score val 0.46
Shutting down background jobs, please wait a moment...
Done!
Waiting for the remaining 14 operations to synchronize with Neptune. Do not kill this process.
All 14 operations synced, thanks for waiting!
Explore the metadata in the Neptune app:
https://app.neptune.ai/ba-final/cwt-2/e/CWT2-41/metadata
[32m[I 2023-08-30 07:48:15,829][0m Trial 8 finished with value: 0.3361721606964761 and parameters: {'b': 3.1500000000000004, 'fc': 2.05, 'scale_min': 1.6, 'scale_max': 42, 'n_scales': 170, 'drop': 0.5241908601441085, 'optimizer': 'SGD', 'lr': 0.003077401349489438, 'weight_decay': 0.0005867534868260941, 'batch_size': 32, 'epochs': 100}. Best is trial 0 with value: 0.3361721606964761.[0m
trial 8, loss train mean 0.08, score train mean 0.56, loss val mean 0.34, score val mean 0.59



End Time   : Mi 30. Aug 07:48:17 CEST 2023
Duration   : 17917.589458314 seconds

Start Time : Mi 30. Aug 07:48:19 CEST 2023
Job ID: 1151403
Node: cc1g05
Partition: gpu_normal_stud
CPU cores: 16
Memory: 98304
GPUs: 0
Python environment: khoa                  *  /home/phamanh/anaconda3/envs/khoa
Current work directory: /home/phamanh/Schreibtisch/bachelorarbeit/ts_im_CNN

device: cuda


https://app.neptune.ai/ba-final/cwt-2/e/CWT2-42
Split 0, loss train 0.07, score train 0.56, loss val 0.25 score val 0.77
Shutting down background jobs, please wait a moment...
Done!
Waiting for the remaining 10 operations to synchronize with Neptune. Do not kill this process.
All 10 operations synced, thanks for waiting!
Explore the metadata in the Neptune app:
https://app.neptune.ai/ba-final/cwt-2/e/CWT2-42/metadata
https://app.neptune.ai/ba-final/cwt-2/e/CWT2-43
Split 1, loss train 0.07, score train 0.55, loss val 0.13 score val 0.74
Shutting down background jobs, please wait a moment...
Done!
Waiting for the remaining 14 operations to synchronize with Neptune. Do not kill this process.
All 14 operations synced, thanks for waiting!
Explore the metadata in the Neptune app:
https://app.neptune.ai/ba-final/cwt-2/e/CWT2-43/metadata
https://app.neptune.ai/ba-final/cwt-2/e/CWT2-44
Split 2, loss train 0.08, score train 0.55, loss val 0.70 score val 0.61
Shutting down background jobs, please wait a moment...
Done!
Waiting for the remaining 14 operations to synchronize with Neptune. Do not kill this process.
All 14 operations synced, thanks for waiting!
Explore the metadata in the Neptune app:
https://app.neptune.ai/ba-final/cwt-2/e/CWT2-44/metadata
https://app.neptune.ai/ba-final/cwt-2/e/CWT2-45
Split 3, loss train 0.08, score train 0.56, loss val 0.46 score val 0.36
Shutting down background jobs, please wait a moment...
Done!
Waiting for the remaining 14 operations to synchronize with Neptune. Do not kill this process.
All 14 operations synced, thanks for waiting!
Explore the metadata in the Neptune app:
https://app.neptune.ai/ba-final/cwt-2/e/CWT2-45/metadata
https://app.neptune.ai/ba-final/cwt-2/e/CWT2-46
Split 4, loss train 0.07, score train 0.58, loss val 0.13 score val 0.46
Shutting down background jobs, please wait a moment...
Done!
Waiting for the remaining 10 operations to synchronize with Neptune. Do not kill this process.
All 10 operations synced, thanks for waiting!
Explore the metadata in the Neptune app:
https://app.neptune.ai/ba-final/cwt-2/e/CWT2-46/metadata
[32m[I 2023-08-30 12:31:56,390][0m Trial 9 finished with value: 0.3361721606964761 and parameters: {'b': 3.1500000000000004, 'fc': 2.05, 'scale_min': 1.6, 'scale_max': 42, 'n_scales': 170, 'drop': 0.5241908601441085, 'optimizer': 'SGD', 'lr': 0.003077401349489438, 'weight_decay': 0.0005867534868260941, 'batch_size': 32, 'epochs': 100}. Best is trial 0 with value: 0.3361721606964761.[0m
trial 9, loss train mean 0.08, score train mean 0.56, loss val mean 0.34, score val mean 0.59



End Time   : Mi 30. Aug 12:31:58 CEST 2023
Duration   : 17018.961760321 seconds

Start Time : Mi 30. Aug 15:27:03 CEST 2023
Job ID: 1152662
Node: hades
Partition: gpu_normal_stud
CPU cores: 16
Memory: 98304
GPUs: 0
Python environment: khoa                  *  /home/phamanh/anaconda3/envs/khoa
Current work directory: /home/phamanh/Schreibtisch/bachelorarbeit/ts_im_CNN

device: cuda


https://app.neptune.ai/ba-final/cwt-2/e/CWT2-47
Split 0, loss train 0.07, score train 0.56, loss val 0.25 score val 0.77
Shutting down background jobs, please wait a moment...
Done!
Waiting for the remaining 10 operations to synchronize with Neptune. Do not kill this process.
All 10 operations synced, thanks for waiting!
Explore the metadata in the Neptune app:
https://app.neptune.ai/ba-final/cwt-2/e/CWT2-47/metadata
https://app.neptune.ai/ba-final/cwt-2/e/CWT2-48
Split 1, loss train 0.07, score train 0.55, loss val 0.13 score val 0.74
Shutting down background jobs, please wait a moment...
Done!
Waiting for the remaining 14 operations to synchronize with Neptune. Do not kill this process.
All 14 operations synced, thanks for waiting!
Explore the metadata in the Neptune app:
https://app.neptune.ai/ba-final/cwt-2/e/CWT2-48/metadata
https://app.neptune.ai/ba-final/cwt-2/e/CWT2-49
Split 2, loss train 0.08, score train 0.55, loss val 0.70 score val 0.61
Shutting down background jobs, please wait a moment...
Done!
Waiting for the remaining 10 operations to synchronize with Neptune. Do not kill this process.
All 10 operations synced, thanks for waiting!
Explore the metadata in the Neptune app:
https://app.neptune.ai/ba-final/cwt-2/e/CWT2-49/metadata
https://app.neptune.ai/ba-final/cwt-2/e/CWT2-50
Split 3, loss train 0.08, score train 0.56, loss val 0.46 score val 0.36
Shutting down background jobs, please wait a moment...
Done!
Waiting for the remaining 10 operations to synchronize with Neptune. Do not kill this process.
All 10 operations synced, thanks for waiting!
Explore the metadata in the Neptune app:
https://app.neptune.ai/ba-final/cwt-2/e/CWT2-50/metadata
https://app.neptune.ai/ba-final/cwt-2/e/CWT2-51
Split 4, loss train 0.07, score train 0.58, loss val 0.13 score val 0.46
Shutting down background jobs, please wait a moment...
Done!
Waiting for the remaining 14 operations to synchronize with Neptune. Do not kill this process.
All 14 operations synced, thanks for waiting!
Explore the metadata in the Neptune app:
https://app.neptune.ai/ba-final/cwt-2/e/CWT2-51/metadata
[32m[I 2023-08-30 20:26:45,939][0m Trial 10 finished with value: 0.3361721606964761 and parameters: {'b': 3.1500000000000004, 'fc': 2.05, 'scale_min': 1.6, 'scale_max': 42, 'n_scales': 170, 'drop': 0.5241908601441085, 'optimizer': 'SGD', 'lr': 0.003077401349489438, 'weight_decay': 0.0005867534868260941, 'batch_size': 32, 'epochs': 100}. Best is trial 0 with value: 0.3361721606964761.[0m
trial 10, loss train mean 0.08, score train mean 0.56, loss val mean 0.34, score val mean 0.59



End Time   : Mi 30. Aug 20:26:47 CEST 2023
Duration   : 17984.625594152 seconds

Start Time : Mi 30. Aug 20:26:58 CEST 2023
Job ID: 1152663
Node: cc1g03
Partition: gpu_normal_stud
CPU cores: 16
Memory: 98304
GPUs: 0
Python environment: khoa                  *  /home/phamanh/anaconda3/envs/khoa
Current work directory: /home/phamanh/Schreibtisch/bachelorarbeit/ts_im_CNN

device: cuda


https://app.neptune.ai/ba-final/cwt-2/e/CWT2-52
Split 0, loss train 0.10, score train 0.39, loss val 0.27 score val 0.17
Shutting down background jobs, please wait a moment...
Done!
Waiting for the remaining 10 operations to synchronize with Neptune. Do not kill this process.
All 10 operations synced, thanks for waiting!
Explore the metadata in the Neptune app:
https://app.neptune.ai/ba-final/cwt-2/e/CWT2-52/metadata
https://app.neptune.ai/ba-final/cwt-2/e/CWT2-53
Split 1, loss train 0.12, score train 0.36, loss val 0.29 score val 0.22
Shutting down background jobs, please wait a moment...
Done!
Waiting for the remaining 10 operations to synchronize with Neptune. Do not kill this process.
All 10 operations synced, thanks for waiting!
Explore the metadata in the Neptune app:
https://app.neptune.ai/ba-final/cwt-2/e/CWT2-53/metadata
https://app.neptune.ai/ba-final/cwt-2/e/CWT2-54
Split 2, loss train 0.13, score train 0.33, loss val 0.33 score val 0.16
Shutting down background jobs, please wait a moment...
Done!
Waiting for the remaining 14 operations to synchronize with Neptune. Do not kill this process.
All 14 operations synced, thanks for waiting!
Explore the metadata in the Neptune app:
https://app.neptune.ai/ba-final/cwt-2/e/CWT2-54/metadata
https://app.neptune.ai/ba-final/cwt-2/e/CWT2-55
Split 3, loss train 0.11, score train 0.36, loss val 0.37 score val 0.05
Shutting down background jobs, please wait a moment...
Done!
Waiting for the remaining 9 operations to synchronize with Neptune. Do not kill this process.
All 9 operations synced, thanks for waiting!
Explore the metadata in the Neptune app:
https://app.neptune.ai/ba-final/cwt-2/e/CWT2-55/metadata
https://app.neptune.ai/ba-final/cwt-2/e/CWT2-56
Split 4, loss train 0.10, score train 0.39, loss val 0.34 score val 0.11
Shutting down background jobs, please wait a moment...
Done!
Waiting for the remaining 14 operations to synchronize with Neptune. Do not kill this process.
All 14 operations synced, thanks for waiting!
Explore the metadata in the Neptune app:
https://app.neptune.ai/ba-final/cwt-2/e/CWT2-56/metadata
[32m[I 2023-08-31 01:32:56,601][0m Trial 11 finished with value: 0.3203485570055373 and parameters: {'b': 4.55, 'fc': 0.75, 'scale_min': 3.6, 'scale_max': 18, 'n_scales': 260, 'drop': 0.20131820585891538, 'optimizer': 'Adam', 'lr': 0.030417347566973008, 'weight_decay': 3.5257921801498026e-05, 'batch_size': 32, 'epochs': 100}. Best is trial 11 with value: 0.3203485570055373.[0m
trial 11, loss train mean 0.11, score train mean 0.37, loss val mean 0.32, score val mean 0.14



End Time   : Do 31. Aug 01:32:58 CEST 2023
Duration   : 18360.384030422 seconds

Start Time : Do 31. Aug 01:33:00 CEST 2023
Job ID: 1152664
Node: cc1g03
Partition: gpu_normal_stud
CPU cores: 16
Memory: 98304
GPUs: 0
Python environment: khoa                  *  /home/phamanh/anaconda3/envs/khoa
Current work directory: /home/phamanh/Schreibtisch/bachelorarbeit/ts_im_CNN

device: cuda


https://app.neptune.ai/ba-final/cwt-2/e/CWT2-57
Split 0, loss train 0.11, score train 0.38, loss val 0.24 score val 0.22
Shutting down background jobs, please wait a moment...
Done!
Waiting for the remaining 14 operations to synchronize with Neptune. Do not kill this process.
All 14 operations synced, thanks for waiting!
Explore the metadata in the Neptune app:
https://app.neptune.ai/ba-final/cwt-2/e/CWT2-57/metadata
https://app.neptune.ai/ba-final/cwt-2/e/CWT2-58
Split 1, loss train 0.13, score train 0.34, loss val 0.20 score val 0.27
Shutting down background jobs, please wait a moment...
Done!
Waiting for the remaining 10 operations to synchronize with Neptune. Do not kill this process.
All 10 operations synced, thanks for waiting!
Explore the metadata in the Neptune app:
https://app.neptune.ai/ba-final/cwt-2/e/CWT2-58/metadata
https://app.neptune.ai/ba-final/cwt-2/e/CWT2-59
Split 2, loss train 0.10, score train 0.37, loss val 0.33 score val 0.18
Shutting down background jobs, please wait a moment...
Done!
Waiting for the remaining 14 operations to synchronize with Neptune. Do not kill this process.
All 14 operations synced, thanks for waiting!
Explore the metadata in the Neptune app:
https://app.neptune.ai/ba-final/cwt-2/e/CWT2-59/metadata
https://app.neptune.ai/ba-final/cwt-2/e/CWT2-60
Split 3, loss train 0.11, score train 0.38, loss val 0.24 score val 0.15
Shutting down background jobs, please wait a moment...
Done!
Waiting for the remaining 10 operations to synchronize with Neptune. Do not kill this process.
All 10 operations synced, thanks for waiting!
Explore the metadata in the Neptune app:
https://app.neptune.ai/ba-final/cwt-2/e/CWT2-60/metadata
https://app.neptune.ai/ba-final/cwt-2/e/CWT2-61
Split 4, loss train 0.11, score train 0.38, loss val 0.19 score val 0.30
Shutting down background jobs, please wait a moment...
Done!
Waiting for the remaining 10 operations to synchronize with Neptune. Do not kill this process.
All 10 operations synced, thanks for waiting!
Explore the metadata in the Neptune app:
https://app.neptune.ai/ba-final/cwt-2/e/CWT2-61/metadata
[32m[I 2023-08-31 06:35:07,513][0m Trial 12 finished with value: 0.23978646055180977 and parameters: {'b': 4.75, 'fc': 0.55, 'scale_min': 4.0, 'scale_max': 14, 'n_scales': 255, 'drop': 0.18150509442539475, 'optimizer': 'Adam', 'lr': 0.030475130573793575, 'weight_decay': 3.0364930019249295e-05, 'batch_size': 32, 'epochs': 100}. Best is trial 12 with value: 0.23978646055180977.[0m
trial 12, loss train mean 0.11, score train mean 0.37, loss val mean 0.24, score val mean 0.23



End Time   : Do 31. Aug 06:35:09 CEST 2023
Duration   : 18129.621007528 seconds

Start Time : Do 31. Aug 06:35:11 CEST 2023
Job ID: 1152665
Node: cc1g03
Partition: gpu_normal_stud
CPU cores: 16
Memory: 98304
GPUs: 0
Python environment: khoa                  *  /home/phamanh/anaconda3/envs/khoa
Current work directory: /home/phamanh/Schreibtisch/bachelorarbeit/ts_im_CNN

device: cuda


https://app.neptune.ai/ba-final/cwt-2/e/CWT2-62
Split 0, loss train 0.14, score train 0.33, loss val 0.16 score val 0.36
Shutting down background jobs, please wait a moment...
Done!
Waiting for the remaining 10 operations to synchronize with Neptune. Do not kill this process.
All 10 operations synced, thanks for waiting!
Explore the metadata in the Neptune app:
https://app.neptune.ai/ba-final/cwt-2/e/CWT2-62/metadata
https://app.neptune.ai/ba-final/cwt-2/e/CWT2-63
Split 1, loss train 0.13, score train 0.34, loss val 0.17 score val 0.32
Shutting down background jobs, please wait a moment...
Done!
Waiting for the remaining 10 operations to synchronize with Neptune. Do not kill this process.
All 10 operations synced, thanks for waiting!
Explore the metadata in the Neptune app:
https://app.neptune.ai/ba-final/cwt-2/e/CWT2-63/metadata
https://app.neptune.ai/ba-final/cwt-2/e/CWT2-64
Split 2, loss train 0.14, score train 0.33, loss val 0.12 score val 0.40
Shutting down background jobs, please wait a moment...
Done!
Waiting for the remaining 10 operations to synchronize with Neptune. Do not kill this process.
All 10 operations synced, thanks for waiting!
Explore the metadata in the Neptune app:
https://app.neptune.ai/ba-final/cwt-2/e/CWT2-64/metadata
https://app.neptune.ai/ba-final/cwt-2/e/CWT2-65
Split 3, loss train 0.21, score train 0.28, loss val 50.11 score val 0.03
Shutting down background jobs, please wait a moment...
Done!
Waiting for the remaining 14 operations to synchronize with Neptune. Do not kill this process.
All 14 operations synced, thanks for waiting!
Explore the metadata in the Neptune app:
https://app.neptune.ai/ba-final/cwt-2/e/CWT2-65/metadata
https://app.neptune.ai/ba-final/cwt-2/e/CWT2-66
Split 4, loss train 0.13, score train 0.35, loss val 0.22 score val 0.20
Shutting down background jobs, please wait a moment...
Done!
Waiting for the remaining 10 operations to synchronize with Neptune. Do not kill this process.
All 10 operations synced, thanks for waiting!
Explore the metadata in the Neptune app:
https://app.neptune.ai/ba-final/cwt-2/e/CWT2-66/metadata
[32m[I 2023-08-31 11:36:33,306][0m Trial 13 finished with value: 10.15482697588332 and parameters: {'b': 4.9, 'fc': 0.55, 'scale_min': 4.2, 'scale_max': 10, 'n_scales': 270, 'drop': 0.1632929472290923, 'optimizer': 'Adam', 'lr': 0.04832511238657842, 'weight_decay': 2.3230511545916364e-05, 'batch_size': 32, 'epochs': 100}. Best is trial 12 with value: 0.23978646055180977.[0m
trial 13, loss train mean 0.15, score train mean 0.33, loss val mean 10.15, score val mean 0.26



End Time   : Do 31. Aug 11:36:35 CEST 2023
Duration   : 18084.272727513 seconds

Start Time : Do 31. Aug 11:36:36 CEST 2023
Job ID: 1152666
Node: cc1g03
Partition: gpu_normal_stud
CPU cores: 16
Memory: 98304
GPUs: 0
Python environment: khoa                  *  /home/phamanh/anaconda3/envs/khoa
Current work directory: /home/phamanh/Schreibtisch/bachelorarbeit/ts_im_CNN

device: cuda


https://app.neptune.ai/ba-final/cwt-2/e/CWT2-67
Split 0, loss train 0.10, score train 0.39, loss val 0.40 score val 0.06
Shutting down background jobs, please wait a moment...
Done!
Waiting for the remaining 14 operations to synchronize with Neptune. Do not kill this process.
All 14 operations synced, thanks for waiting!
Explore the metadata in the Neptune app:
https://app.neptune.ai/ba-final/cwt-2/e/CWT2-67/metadata
https://app.neptune.ai/ba-final/cwt-2/e/CWT2-68
Split 1, loss train 0.10, score train 0.37, loss val 0.22 score val 0.11
Shutting down background jobs, please wait a moment...
Done!
Waiting for the remaining 14 operations to synchronize with Neptune. Do not kill this process.
All 14 operations synced, thanks for waiting!
Explore the metadata in the Neptune app:
https://app.neptune.ai/ba-final/cwt-2/e/CWT2-68/metadata
https://app.neptune.ai/ba-final/cwt-2/e/CWT2-69
Split 2, loss train 0.11, score train 0.38, loss val 0.26 score val 0.16
Shutting down background jobs, please wait a moment...
Done!
Waiting for the remaining 10 operations to synchronize with Neptune. Do not kill this process.
All 10 operations synced, thanks for waiting!
Explore the metadata in the Neptune app:
https://app.neptune.ai/ba-final/cwt-2/e/CWT2-69/metadata
https://app.neptune.ai/ba-final/cwt-2/e/CWT2-70
Split 3, loss train 0.10, score train 0.39, loss val 0.32 score val 0.07
Shutting down background jobs, please wait a moment...
Done!
Waiting for the remaining 14 operations to synchronize with Neptune. Do not kill this process.
All 14 operations synced, thanks for waiting!
Explore the metadata in the Neptune app:
https://app.neptune.ai/ba-final/cwt-2/e/CWT2-70/metadata
https://app.neptune.ai/ba-final/cwt-2/e/CWT2-71
Split 4, loss train 0.12, score train 0.37, loss val 51.52 score val 0.03
Shutting down background jobs, please wait a moment...
Done!
Waiting for the remaining 10 operations to synchronize with Neptune. Do not kill this process.
All 10 operations synced, thanks for waiting!
Explore the metadata in the Neptune app:
https://app.neptune.ai/ba-final/cwt-2/e/CWT2-71/metadata
