[32m[I 2023-09-10 22:32:57,607][0m Trial 65 finished with value: 0.08407041925065062 and parameters: {'b': 1.4000000000000001, 'fc': 2.1, 'scale_min': 0.5, 'scale_max': 42, 'n_scales': 140, 'drop': 0.31555604991101466, 'optimizer': 'SGD', 'lr': 0.0009659142703805955, 'weight_decay': 0.0005110436670745024, 'batch_size': 32, 'epochs': 100}. Best is trial 61 with value: 0.058497320844772015.[0m
trial 65, loss train mean 0.06, score train mean 0.50, loss val mean 0.08, score val mean 0.61



End Time   : So 10. Sep 22:32:59 CEST 2023
Duration   : 15922.222769670 seconds

Start Time : Mo 11. Sep 01:19:36 CEST 2023
Job ID: 1159311
Node: hades
Partition: gpu_normal_stud
CPU cores: 16
Memory: 98304
GPUs: 0
Python environment: khoa                  *  /home/phamanh/anaconda3/envs/khoa
Current work directory: /home/phamanh/Schreibtisch/bachelorarbeit/ts_im_CNN

device: cuda


https://app.neptune.ai/ba-final/cwt-2/e/CWT2-271
Split 0, loss train 0.05, score train 0.50, loss val 0.06 score val 0.47
Shutting down background jobs, please wait a moment...
Done!
Waiting for the remaining 14 operations to synchronize with Neptune. Do not kill this process.
All 14 operations synced, thanks for waiting!
Explore the metadata in the Neptune app:
https://app.neptune.ai/ba-final/cwt-2/e/CWT2-271/metadata
https://app.neptune.ai/ba-final/cwt-2/e/CWT2-272
Split 1, loss train 0.05, score train 0.50, loss val 0.09 score val 0.30
Shutting down background jobs, please wait a moment...
Done!
Waiting for the remaining 10 operations to synchronize with Neptune. Do not kill this process.
All 10 operations synced, thanks for waiting!
Explore the metadata in the Neptune app:
https://app.neptune.ai/ba-final/cwt-2/e/CWT2-272/metadata
https://app.neptune.ai/ba-final/cwt-2/e/CWT2-273
Split 2, loss train 0.06, score train 0.47, loss val 0.07 score val 0.54
Shutting down background jobs, please wait a moment...
Done!
Waiting for the remaining 10 operations to synchronize with Neptune. Do not kill this process.
All 10 operations synced, thanks for waiting!
Explore the metadata in the Neptune app:
https://app.neptune.ai/ba-final/cwt-2/e/CWT2-273/metadata
https://app.neptune.ai/ba-final/cwt-2/e/CWT2-274
Split 3, loss train 0.05, score train 0.50, loss val 0.08 score val 0.42
Shutting down background jobs, please wait a moment...
Done!
Waiting for the remaining 10 operations to synchronize with Neptune. Do not kill this process.
All 10 operations synced, thanks for waiting!
Explore the metadata in the Neptune app:
https://app.neptune.ai/ba-final/cwt-2/e/CWT2-274/metadata
https://app.neptune.ai/ba-final/cwt-2/e/CWT2-275
Split 4, loss train 0.06, score train 0.49, loss val 0.09 score val 0.54
Shutting down background jobs, please wait a moment...
Done!
Waiting for the remaining 10 operations to synchronize with Neptune. Do not kill this process.
All 10 operations synced, thanks for waiting!
Explore the metadata in the Neptune app:
https://app.neptune.ai/ba-final/cwt-2/e/CWT2-275/metadata
[32m[I 2023-09-11 06:08:08,916][0m Trial 66 finished with value: 0.07869100672133425 and parameters: {'b': 0.9500000000000001, 'fc': 2.45, 'scale_min': 1.5, 'scale_max': 46, 'n_scales': 155, 'drop': 0.2873527133926804, 'optimizer': 'Adam', 'lr': 0.0013166127992183267, 'weight_decay': 0.0006931919531715344, 'batch_size': 32, 'epochs': 100}. Best is trial 61 with value: 0.058497320844772015.[0m
trial 66, loss train mean 0.05, score train mean 0.49, loss val mean 0.08, score val mean 0.45



End Time   : Mo 11. Sep 06:08:10 CEST 2023
Duration   : 17314.191111107 seconds

Start Time : Mo 11. Sep 06:08:12 CEST 2023
Job ID: 1159312
Node: cc1g07
Partition: gpu_normal_stud
CPU cores: 16
Memory: 98304
GPUs: 0
Python environment: khoa                  *  /home/phamanh/anaconda3/envs/khoa
Current work directory: /home/phamanh/Schreibtisch/bachelorarbeit/ts_im_CNN

device: cuda


https://app.neptune.ai/ba-final/cwt-2/e/CWT2-276
Split 0, loss train 0.05, score train 0.50, loss val 0.04 score val 0.47
Shutting down background jobs, please wait a moment...
Done!
Waiting for the remaining 10 operations to synchronize with Neptune. Do not kill this process.
All 10 operations synced, thanks for waiting!
Explore the metadata in the Neptune app:
https://app.neptune.ai/ba-final/cwt-2/e/CWT2-276/metadata
https://app.neptune.ai/ba-final/cwt-2/e/CWT2-277
Split 1, loss train 0.04, score train 0.57, loss val 0.05 score val 0.50
Shutting down background jobs, please wait a moment...
Done!
Waiting for the remaining 10 operations to synchronize with Neptune. Do not kill this process.
All 10 operations synced, thanks for waiting!
Explore the metadata in the Neptune app:
https://app.neptune.ai/ba-final/cwt-2/e/CWT2-277/metadata
https://app.neptune.ai/ba-final/cwt-2/e/CWT2-278
Split 2, loss train 0.03, score train 0.59, loss val 0.05 score val 0.51
Shutting down background jobs, please wait a moment...
Done!
Waiting for the remaining 10 operations to synchronize with Neptune. Do not kill this process.
All 10 operations synced, thanks for waiting!
Explore the metadata in the Neptune app:
https://app.neptune.ai/ba-final/cwt-2/e/CWT2-278/metadata
https://app.neptune.ai/ba-final/cwt-2/e/CWT2-279
Split 3, loss train 0.03, score train 0.60, loss val 0.03 score val 0.64
Shutting down background jobs, please wait a moment...
Done!
Waiting for the remaining 10 operations to synchronize with Neptune. Do not kill this process.
All 10 operations synced, thanks for waiting!
Explore the metadata in the Neptune app:
https://app.neptune.ai/ba-final/cwt-2/e/CWT2-279/metadata
https://app.neptune.ai/ba-final/cwt-2/e/CWT2-280
Split 4, loss train 0.03, score train 0.62, loss val 0.05 score val 0.59
Shutting down background jobs, please wait a moment...
Done!
Waiting for the remaining 14 operations to synchronize with Neptune. Do not kill this process.
All 14 operations synced, thanks for waiting!
Explore the metadata in the Neptune app:
https://app.neptune.ai/ba-final/cwt-2/e/CWT2-280/metadata
[32m[I 2023-09-11 12:50:11,814][0m Trial 67 finished with value: 0.04415315009177999 and parameters: {'b': 1.2000000000000002, 'fc': 2.25, 'scale_min': 1.2000000000000002, 'scale_max': 50, 'n_scales': 175, 'drop': 0.23028795521774809, 'optimizer': 'Adam', 'lr': 0.000658635478004424, 'weight_decay': 0.0003114017461250377, 'batch_size': 32, 'epochs': 100}. Best is trial 67 with value: 0.04415315009177999.[0m
trial 67, loss train mean 0.04, score train mean 0.58, loss val mean 0.04, score val mean 0.54



End Time   : Mo 11. Sep 12:50:22 CEST 2023
Duration   : 24130.539072209 seconds

Start Time : Mo 11. Sep 12:50:24 CEST 2023
Job ID: 1159313
Node: cc1g07
Partition: gpu_normal_stud
CPU cores: 16
Memory: 98304
GPUs: 0
Python environment: khoa                  *  /home/phamanh/anaconda3/envs/khoa
Current work directory: /home/phamanh/Schreibtisch/bachelorarbeit/ts_im_CNN

device: cuda


https://app.neptune.ai/ba-final/cwt-2/e/CWT2-281
Shutting down background jobs, please wait a moment...
Done!
Waiting for the remaining 3 operations to synchronize with Neptune. Do not kill this process.
All 3 operations synced, thanks for waiting!
Explore the metadata in the Neptune app:
https://app.neptune.ai/ba-final/cwt-2/e/CWT2-281/metadata
[32m[I 2023-09-11 16:17:11,018][0m Trial 68 pruned. [0m

End Time   : Mo 11. Sep 16:17:15 CEST 2023
Duration   : 12411.117298119 seconds

Start Time : Mo 11. Sep 16:18:49 CEST 2023
Job ID: 1159314
Node: cc1g02
Partition: gpu_normal_stud
CPU cores: 16
Memory: 98304
GPUs: 0
Python environment: khoa                  *  /home/phamanh/anaconda3/envs/khoa
Current work directory: /home/phamanh/Schreibtisch/bachelorarbeit/ts_im_CNN

device: cuda


https://app.neptune.ai/ba-final/cwt-2/e/CWT2-282
Split 0, loss train 0.03, score train 0.59, loss val 0.02 score val 0.72
Shutting down background jobs, please wait a moment...
Done!
Waiting for the remaining 10 operations to synchronize with Neptune. Do not kill this process.
All 10 operations synced, thanks for waiting!
Explore the metadata in the Neptune app:
https://app.neptune.ai/ba-final/cwt-2/e/CWT2-282/metadata
https://app.neptune.ai/ba-final/cwt-2/e/CWT2-283
Split 1, loss train 0.03, score train 0.64, loss val 0.05 score val 0.54
Shutting down background jobs, please wait a moment...
Done!
Waiting for the remaining 14 operations to synchronize with Neptune. Do not kill this process.
All 14 operations synced, thanks for waiting!
Explore the metadata in the Neptune app:
https://app.neptune.ai/ba-final/cwt-2/e/CWT2-283/metadata
https://app.neptune.ai/ba-final/cwt-2/e/CWT2-284
Split 2, loss train 0.04, score train 0.58, loss val 0.05 score val 0.59
Shutting down background jobs, please wait a moment...
Done!
Waiting for the remaining 10 operations to synchronize with Neptune. Do not kill this process.
All 10 operations synced, thanks for waiting!
Explore the metadata in the Neptune app:
https://app.neptune.ai/ba-final/cwt-2/e/CWT2-284/metadata
https://app.neptune.ai/ba-final/cwt-2/e/CWT2-285
Split 3, loss train 0.03, score train 0.61, loss val 0.06 score val 0.59
Shutting down background jobs, please wait a moment...
Done!
Waiting for the remaining 10 operations to synchronize with Neptune. Do not kill this process.
All 10 operations synced, thanks for waiting!
Explore the metadata in the Neptune app:
https://app.neptune.ai/ba-final/cwt-2/e/CWT2-285/metadata
https://app.neptune.ai/ba-final/cwt-2/e/CWT2-286
Split 4, loss train 0.03, score train 0.58, loss val 0.03 score val 0.54
Shutting down background jobs, please wait a moment...
Done!
Waiting for the remaining 14 operations to synchronize with Neptune. Do not kill this process.
All 14 operations synced, thanks for waiting!
Explore the metadata in the Neptune app:
https://app.neptune.ai/ba-final/cwt-2/e/CWT2-286/metadata
[32m[I 2023-09-11 20:32:14,170][0m Trial 69 finished with value: 0.041918427132545635 and parameters: {'b': 2.8, 'fc': 2.35, 'scale_min': 1.2000000000000002, 'scale_max': 44, 'n_scales': 115, 'drop': 0.3267294522655111, 'optimizer': 'Adam', 'lr': 0.0007111508782090679, 'weight_decay': 0.0001554198936450183, 'batch_size': 32, 'epochs': 100}. Best is trial 69 with value: 0.041918427132545635.[0m
trial 69, loss train mean 0.03, score train mean 0.60, loss val mean 0.04, score val mean 0.60



End Time   : Mo 11. Sep 20:32:16 CEST 2023
Duration   : 15206.799057153 seconds

Start Time : Mo 11. Sep 21:51:40 CEST 2023
Job ID: 1163011
Node: cc1g03
Partition: gpu_normal_stud
CPU cores: 16
Memory: 98304
GPUs: 0
Python environment: khoa                  *  /home/phamanh/anaconda3/envs/khoa
Current work directory: /home/phamanh/Schreibtisch/bachelorarbeit/ts_im_CNN

device: cuda


https://app.neptune.ai/ba-final/cwt-2/e/CWT2-287
Split 0, loss train 0.03, score train 0.61, loss val 0.03 score val 0.63
Shutting down background jobs, please wait a moment...
Done!
Waiting for the remaining 10 operations to synchronize with Neptune. Do not kill this process.
All 10 operations synced, thanks for waiting!
Explore the metadata in the Neptune app:
https://app.neptune.ai/ba-final/cwt-2/e/CWT2-287/metadata
https://app.neptune.ai/ba-final/cwt-2/e/CWT2-288
Split 1, loss train 0.02, score train 0.66, loss val 0.04 score val 0.43
Shutting down background jobs, please wait a moment...
Done!
Waiting for the remaining 10 operations to synchronize with Neptune. Do not kill this process.
All 10 operations synced, thanks for waiting!
Explore the metadata in the Neptune app:
https://app.neptune.ai/ba-final/cwt-2/e/CWT2-288/metadata
https://app.neptune.ai/ba-final/cwt-2/e/CWT2-289
Split 2, loss train 0.03, score train 0.64, loss val 0.02 score val 0.74
Shutting down background jobs, please wait a moment...
Done!
Waiting for the remaining 10 operations to synchronize with Neptune. Do not kill this process.
All 10 operations synced, thanks for waiting!
Explore the metadata in the Neptune app:
https://app.neptune.ai/ba-final/cwt-2/e/CWT2-289/metadata
https://app.neptune.ai/ba-final/cwt-2/e/CWT2-290
Split 3, loss train 0.03, score train 0.64, loss val 0.04 score val 0.63
Shutting down background jobs, please wait a moment...
Done!
Waiting for the remaining 10 operations to synchronize with Neptune. Do not kill this process.
All 10 operations synced, thanks for waiting!
Explore the metadata in the Neptune app:
https://app.neptune.ai/ba-final/cwt-2/e/CWT2-290/metadata
https://app.neptune.ai/ba-final/cwt-2/e/CWT2-291
Split 4, loss train 0.03, score train 0.64, loss val 0.04 score val 0.49
Shutting down background jobs, please wait a moment...
Done!
Waiting for the remaining 10 operations to synchronize with Neptune. Do not kill this process.
All 10 operations synced, thanks for waiting!
Explore the metadata in the Neptune app:
https://app.neptune.ai/ba-final/cwt-2/e/CWT2-291/metadata
[32m[I 2023-09-12 02:09:00,594][0m Trial 70 finished with value: 0.03366648897211602 and parameters: {'b': 2.95, 'fc': 2.25, 'scale_min': 1.3, 'scale_max': 42, 'n_scales': 105, 'drop': 0.20864327765429588, 'optimizer': 'Adam', 'lr': 0.0005044001457185267, 'weight_decay': 0.0001416436960097566, 'batch_size': 32, 'epochs': 100}. Best is trial 70 with value: 0.03366648897211602.[0m
trial 70, loss train mean 0.03, score train mean 0.64, loss val mean 0.03, score val mean 0.58



End Time   : Di 12. Sep 02:09:02 CEST 2023
Duration   : 15442.646403770 seconds

Start Time : Di 12. Sep 02:09:03 CEST 2023
Job ID: 1163012
Node: cc1g03
Partition: gpu_normal_stud
CPU cores: 16
Memory: 98304
GPUs: 0
Python environment: khoa                  *  /home/phamanh/anaconda3/envs/khoa
Current work directory: /home/phamanh/Schreibtisch/bachelorarbeit/ts_im_CNN

device: cuda


https://app.neptune.ai/ba-final/cwt-2/e/CWT2-292
Split 0, loss train 0.03, score train 0.63, loss val 0.02 score val 0.69
Shutting down background jobs, please wait a moment...
Done!
Waiting for the remaining 14 operations to synchronize with Neptune. Do not kill this process.
All 14 operations synced, thanks for waiting!
Explore the metadata in the Neptune app:
https://app.neptune.ai/ba-final/cwt-2/e/CWT2-292/metadata
https://app.neptune.ai/ba-final/cwt-2/e/CWT2-293
Split 1, loss train 0.03, score train 0.64, loss val 0.03 score val 0.57
Shutting down background jobs, please wait a moment...
Done!
Waiting for the remaining 10 operations to synchronize with Neptune. Do not kill this process.
All 10 operations synced, thanks for waiting!
Explore the metadata in the Neptune app:
https://app.neptune.ai/ba-final/cwt-2/e/CWT2-293/metadata
https://app.neptune.ai/ba-final/cwt-2/e/CWT2-294
Split 2, loss train 0.03, score train 0.64, loss val 0.02 score val 0.75
Shutting down background jobs, please wait a moment...
Done!
Waiting for the remaining 10 operations to synchronize with Neptune. Do not kill this process.
All 10 operations synced, thanks for waiting!
Explore the metadata in the Neptune app:
https://app.neptune.ai/ba-final/cwt-2/e/CWT2-294/metadata
https://app.neptune.ai/ba-final/cwt-2/e/CWT2-295
Split 3, loss train 0.02, score train 0.67, loss val 0.03 score val 0.69
Shutting down background jobs, please wait a moment...
Done!
Waiting for the remaining 10 operations to synchronize with Neptune. Do not kill this process.
All 10 operations synced, thanks for waiting!
Explore the metadata in the Neptune app:
https://app.neptune.ai/ba-final/cwt-2/e/CWT2-295/metadata
https://app.neptune.ai/ba-final/cwt-2/e/CWT2-296
Split 4, loss train 0.03, score train 0.63, loss val 0.02 score val 0.68
Shutting down background jobs, please wait a moment...
Done!
Waiting for the remaining 10 operations to synchronize with Neptune. Do not kill this process.
All 10 operations synced, thanks for waiting!
Explore the metadata in the Neptune app:
https://app.neptune.ai/ba-final/cwt-2/e/CWT2-296/metadata
[32m[I 2023-09-12 06:17:13,678][0m Trial 71 finished with value: 0.022815226493997778 and parameters: {'b': 2.9000000000000004, 'fc': 2.35, 'scale_min': 1.3, 'scale_max': 40, 'n_scales': 100, 'drop': 0.20656565281404576, 'optimizer': 'Adam', 'lr': 0.0005060961726166585, 'weight_decay': 0.0001416436960097566, 'batch_size': 32, 'epochs': 100}. Best is trial 71 with value: 0.022815226493997778.[0m
trial 71, loss train mean 0.03, score train mean 0.64, loss val mean 0.02, score val mean 0.68



End Time   : Di 12. Sep 06:17:15 CEST 2023
Duration   : 14891.788029693 seconds

Start Time : Di 12. Sep 06:17:16 CEST 2023
Job ID: 1163013
Node: cc1g03
Partition: gpu_normal_stud
CPU cores: 16
Memory: 98304
GPUs: 0
Python environment: khoa                  *  /home/phamanh/anaconda3/envs/khoa
Current work directory: /home/phamanh/Schreibtisch/bachelorarbeit/ts_im_CNN

device: cuda


https://app.neptune.ai/ba-final/cwt-2/e/CWT2-297
Split 0, loss train 0.03, score train 0.63, loss val 0.02 score val 0.71
Shutting down background jobs, please wait a moment...
Done!
Waiting for the remaining 10 operations to synchronize with Neptune. Do not kill this process.
All 10 operations synced, thanks for waiting!
Explore the metadata in the Neptune app:
https://app.neptune.ai/ba-final/cwt-2/e/CWT2-297/metadata
https://app.neptune.ai/ba-final/cwt-2/e/CWT2-298
Split 1, loss train 0.02, score train 0.65, loss val 0.02 score val 0.70
Shutting down background jobs, please wait a moment...
Done!
Waiting for the remaining 10 operations to synchronize with Neptune. Do not kill this process.
All 10 operations synced, thanks for waiting!
Explore the metadata in the Neptune app:
https://app.neptune.ai/ba-final/cwt-2/e/CWT2-298/metadata
https://app.neptune.ai/ba-final/cwt-2/e/CWT2-299
Split 2, loss train 0.03, score train 0.64, loss val 0.02 score val 0.59
Shutting down background jobs, please wait a moment...
Done!
Waiting for the remaining 10 operations to synchronize with Neptune. Do not kill this process.
All 10 operations synced, thanks for waiting!
Explore the metadata in the Neptune app:
https://app.neptune.ai/ba-final/cwt-2/e/CWT2-299/metadata
https://app.neptune.ai/ba-final/cwt-2/e/CWT2-300
Split 3, loss train 0.03, score train 0.65, loss val 0.04 score val 0.58
Shutting down background jobs, please wait a moment...
Done!
Waiting for the remaining 10 operations to synchronize with Neptune. Do not kill this process.
All 10 operations synced, thanks for waiting!
Explore the metadata in the Neptune app:
https://app.neptune.ai/ba-final/cwt-2/e/CWT2-300/metadata
https://app.neptune.ai/ba-final/cwt-2/e/CWT2-301
Split 4, loss train 0.02, score train 0.65, loss val 0.02 score val 0.61
Shutting down background jobs, please wait a moment...
Done!
Waiting for the remaining 14 operations to synchronize with Neptune. Do not kill this process.
All 14 operations synced, thanks for waiting!
Explore the metadata in the Neptune app:
https://app.neptune.ai/ba-final/cwt-2/e/CWT2-301/metadata
[32m[I 2023-09-12 10:29:40,511][0m Trial 72 finished with value: 0.025410888296492556 and parameters: {'b': 2.8, 'fc': 2.35, 'scale_min': 1.4, 'scale_max': 42, 'n_scales': 100, 'drop': 0.20674310942097837, 'optimizer': 'Adam', 'lr': 0.0005065267901935891, 'weight_decay': 0.00014654450435287733, 'batch_size': 32, 'epochs': 100}. Best is trial 71 with value: 0.022815226493997778.[0m
trial 72, loss train mean 0.03, score train mean 0.64, loss val mean 0.03, score val mean 0.64



End Time   : Di 12. Sep 10:29:42 CEST 2023
Duration   : 15145.929455832 seconds

Start Time : Di 12. Sep 10:29:44 CEST 2023
Job ID: 1163014
Node: cc1g05
Partition: gpu_normal_stud
CPU cores: 16
Memory: 98304
GPUs: 0
Python environment: khoa                  *  /home/phamanh/anaconda3/envs/khoa
Current work directory: /home/phamanh/Schreibtisch/bachelorarbeit/ts_im_CNN

device: cuda


https://app.neptune.ai/ba-final/cwt-2/e/CWT2-302
Split 0, loss train 0.03, score train 0.64, loss val 0.02 score val 0.63
Shutting down background jobs, please wait a moment...
Done!
Waiting for the remaining 10 operations to synchronize with Neptune. Do not kill this process.
All 10 operations synced, thanks for waiting!
Explore the metadata in the Neptune app:
https://app.neptune.ai/ba-final/cwt-2/e/CWT2-302/metadata
https://app.neptune.ai/ba-final/cwt-2/e/CWT2-303
Split 1, loss train 0.03, score train 0.64, loss val 0.03 score val 0.66
Shutting down background jobs, please wait a moment...
Done!
Waiting for the remaining 14 operations to synchronize with Neptune. Do not kill this process.
All 14 operations synced, thanks for waiting!
Explore the metadata in the Neptune app:
https://app.neptune.ai/ba-final/cwt-2/e/CWT2-303/metadata
https://app.neptune.ai/ba-final/cwt-2/e/CWT2-304
Split 2, loss train 0.03, score train 0.64, loss val 0.02 score val 0.72
Shutting down background jobs, please wait a moment...
Done!
Waiting for the remaining 10 operations to synchronize with Neptune. Do not kill this process.
All 10 operations synced, thanks for waiting!
Explore the metadata in the Neptune app:
https://app.neptune.ai/ba-final/cwt-2/e/CWT2-304/metadata
https://app.neptune.ai/ba-final/cwt-2/e/CWT2-305
Split 3, loss train 0.03, score train 0.64, loss val 0.03 score val 0.68
Shutting down background jobs, please wait a moment...
Done!
Waiting for the remaining 10 operations to synchronize with Neptune. Do not kill this process.
All 10 operations synced, thanks for waiting!
Explore the metadata in the Neptune app:
https://app.neptune.ai/ba-final/cwt-2/e/CWT2-305/metadata
https://app.neptune.ai/ba-final/cwt-2/e/CWT2-306
Split 4, loss train 0.02, score train 0.65, loss val 0.03 score val 0.53
Shutting down background jobs, please wait a moment...
Done!
Waiting for the remaining 10 operations to synchronize with Neptune. Do not kill this process.
All 10 operations synced, thanks for waiting!
Explore the metadata in the Neptune app:
https://app.neptune.ai/ba-final/cwt-2/e/CWT2-306/metadata
